version,sme_nr,mbie_nr,level,type,label_local,multiplicity,multiplicity_SME,class_term,sequence,identifier,property_term,representation_term,code_list,attribute,associated_class,definition_local,UNID,acronym,DEN,definition,short_name,name,element,xpath
v4/v4.3,1,0,0,C,統合仕入明細（検収）書,,－,SME_ Consolidated Self Invoice,0,,,,,,,発注者が受注者に交付する統合仕入明細（検収）文書（メッセージ）,,MA,SME_ Consolidated Self Invoice,,,SMEConsolidatedSelfInvoice,SMEConsolidatedSelfInvoice,/SMEConsolidatedSelfInvoice
v1,2,3448,1,C,取引設定クラス,,0..1,CI_ Exchanged Document_ Context,0,,,,,,,メッセージの設定内容に関する情報からなるクラス,UN01005479,ASMA,CI_ Exchanged Document_ Context. Details,"The scenario or setting of a Cross Industry (CI) exchanged document, such as its business process application context.",CI Document Context,SMEConsolidatedSelfInvoiceExchangedDocumentContextDetails,CIExchangedDocumentContext,/SMEConsolidatedSelfInvoice/CIExchangedDocumentContext
v1,3,3449,2,A,取引ID,0..1,0..1,CI_ Exchanged Document_ Context,1,,Specified_ Transaction,Identifier,,,,メッセージがやり取りされる取引識別番号,UN01005480,BBIE,CI_ Exchanged Document_ Context. Specified_ Transaction. Identifier,The identifier of a specified transaction in this CI exchanged document context.,Transaction ID,ExchangedDocumentContextTransactionID,SpecifiedTransactionID,/SMEConsolidatedSelfInvoice/CIExchangedDocumentContext/SpecifiedTransactionID
v1/v2,4,3450,2,A,処理日時,0..1,0..1,CI_ Exchanged Document_ Context,2,,Processing_ Transaction,Date Time,,,,メッセージがやり取りされる日時,UN01012746,BBIE,CI_ Exchanged Document_ Context. Processing_ Transaction. Date Time,"The date, time, date time, or other date time value of the processing of a transaction for this CI exchanged document context.",Transaction Processing Date Time,ExchangedDocumentContextTransactionDateTime,ProcessingTransactionDateTime,/SMEConsolidatedSelfInvoice/CIExchangedDocumentContext/ProcessingTransactionDateTime
v1,5,3452,2,C,取引設定内容/取引プロセスグループ,0..n,1..1,CI_ Exchanged Document_ Context,1,,Business Process_ Specified,,,,CI_ Document Context_ Parameter,取引設定内容の取引プロセスに関する情報,UN01005481,ASBIE,CI_ Exchanged Document_ Context. Business Process_ Specified. CI_ Document Context_ Parameter,A business process CI document context parameter specified for this CI exchanged document context.,Business Process,ExchangedDocumentContextBusinessProcessDocumentContextParameter,BusinessProcessSpecifiedCIDocumentContextParameter,/SMEConsolidatedSelfInvoice/CIExchangedDocumentContext/BusinessProcessSpecifiedCIDocumentContextParameter
v1,7,3424,3,A,取引プロセスID,0..1,0..1,CI_ Document Context_ Parameter,1,,Identification,Identifier,JECxxxx,,,"取引プロセスの識別番号
共通EDIプロバイダがプロセスをセットする",UN01005472,BBIE,CI_ Document Context_ Parameter. Identification. Identifier,The unique identifier of this CI document context parameter.,ID,ExchangedBusinessProcessDocumentContextParameterID,ID,/SMEConsolidatedSelfInvoice/CIExchangedDocumentContext/BusinessProcessSpecifiedCIDocumentContextParameter/ID
v1,8,3425,3,A,取引プロセス名,0..1,0..1,CI_ Document Context_ Parameter,2,,Value,Text,,,,取引プロセスの名称,UN01005473,BBIE,CI_ Document Context_ Parameter. Value. Text,"The value, expressed as text, of this CI document context parameter.",Value Text,ExchangedBusinessProcessDocumentContextParameterValueText,Value,/SMEConsolidatedSelfInvoice/CIExchangedDocumentContext/BusinessProcessSpecifiedCIDocumentContextParameter/Value
v1,9,3426,3,C,取引プロセス/バージョングループ,0..1,1..1,CI_ Document Context_ Parameter,1,,Specified,,,,CI_ Document_ Version,取引プロセスのバージョンに関する情報,UN01005474,ASBIE,CI_ Document Context_ Parameter. Specified. CI_ Document_ Version,The CI document version specified for this CI document context parameter.,Version,ExchangedBusinessProcessDocumentContextParameterDocumentVersion,SpecifiedCIDocumentVersion,/SMEConsolidatedSelfInvoice/CIExchangedDocumentContext/BusinessProcessSpecifiedCIDocumentContextParameter/SpecifiedCIDocumentVersion
v1,11,3445,4,A,バージョンID,0..1,0..1,CI_ Document_ Version,1,,Identification,Identifier,,,,取引プロセスのバージョン識別番号,UN01005476,BBIE,CI_ Document_ Version. Identification. Identifier,The unique identifier for this CI document version.,ID,BusinessProcessContextParameterDocumentVersionID,ID,/SMEConsolidatedSelfInvoice/CIExchangedDocumentContext/BusinessProcessSpecifiedCIDocumentContextParameter/SpecifiedCIDocumentVersion/ID
v1,12,3447,4,A,バージョン発行日,0..1,0..1,CI_ Document_ Version,3,,Issue,Date Time,,,,取引プロセスのバージョン発行日,UN01005478,BBIE,CI_ Document_ Version. Issue. Date Time,"The date, time, date time or other date time value of issue of this CI document version.",Issue Date Time,BusinessProcessContextParameterDocumentVersionIssueDateTime,IssueDateTime,/SMEConsolidatedSelfInvoice/CIExchangedDocumentContext/BusinessProcessSpecifiedCIDocumentContextParameter/SpecifiedCIDocumentVersion/IssueDateTime
v1,13,3454,2,C,取引設定内容/取引シナリオグループ,0..n,0..1,CI_ Exchanged Document_ Context,3,,Scenario_ Specified,,,,CI_ Document Context_ Parameter,取引設定内容の取引シナリオに関する情報,UN01005483,ASBIE,CI_ Exchanged Document_ Context. Scenario_ Specified. CI_ Document Context_ Parameter,A scenario CI document context parameter specified for this CI exchanged document context.,Scenario,ExchangedDocumentContextScenarioDocumentContextParameter,ScenarioSpecifiedCIDocumentContextParameter,/SMEConsolidatedSelfInvoice/CIExchangedDocumentContext/ScenarioSpecifiedCIDocumentContextParameter
v1,15,3424,3,A,取引シナリオID,0..1,0..1,CI_ Document Context_ Parameter,1,,Identification,Identifier,,,,取引シナリオの識別番号,UN01005472,BBIE,CI_ Document Context_ Parameter. Identification. Identifier,The unique identifier of this CI document context parameter.,ID,ExchangedScenarioDocumentContextParameterID,ID,/SMEConsolidatedSelfInvoice/CIExchangedDocumentContext/ScenarioSpecifiedCIDocumentContextParameter/ID
v1,16,3425,3,A,取引シナリオ名,0..1,0..1,CI_ Document Context_ Parameter,2,,Value,Text,,,,取引シナリオの名称,UN01005473,BBIE,CI_ Document Context_ Parameter. Value. Text,"The value, expressed as text, of this CI document context parameter.",Value Text,ExchangedScenarioDocumentContextParameterValueText,Value,/SMEConsolidatedSelfInvoice/CIExchangedDocumentContext/ScenarioSpecifiedCIDocumentContextParameter/Value
v1,17,3455,2,C,取引設定内容/アプリケーショングループ,0..n,0..1,CI_ Exchanged Document_ Context,4,,Application_ Specified,,,,CI_ Document Context_ Parameter,取引設定内容のアプリケーションに関する情報,UN01005484,ASBIE,CI_ Exchanged Document_ Context. Application_ Specified. CI_ Document Context_ Parameter,An application CI document context parameter specified for this CI exchanged document context.,Application,ExchangedDocumentContextApplicationDocumentContextParameter,ApplicationSpecifiedCIDocumentContextParameter,/SMEConsolidatedSelfInvoice/CIExchangedDocumentContext/ApplicationSpecifiedCIDocumentContextParameter
v1,19,3424,3,A,アプリケーションID,0..1,0..1,CI_ Document Context_ Parameter,1,,Identification,Identifier,,,,"業務アプリケーションが実装する業界・業種識別番号
標準仕様書３．１．２項、および１１．３節を参照",UN01005472,BBIE,CI_ Document Context_ Parameter. Identification. Identifier,The unique identifier of this CI document context parameter.,ID,ExchangedApplicationDocumentContextParameterID,ID,/SMEConsolidatedSelfInvoice/CIExchangedDocumentContext/ApplicationSpecifiedCIDocumentContextParameter/ID
v1,20,3425,3,A,アプリケーション名,0..1,0..1,CI_ Document Context_ Parameter,2,,Value,Text,,,,業務アプリケーションが実装する業界・業種名称,UN01005473,BBIE,CI_ Document Context_ Parameter. Value. Text,"The value, expressed as text, of this CI document context parameter.",Value Text,ExchangedApplicationDocumentContextParameterValueText,Value,/SMEConsolidatedSelfInvoice/CIExchangedDocumentContext/ApplicationSpecifiedCIDocumentContextParameter/Value
v1,21,3457,2,C,取引設定内容/ドメイングループ,0..n,1..1,CI_ Exchanged Document_ Context,6,,Subset_ Specified,,,,CI_ Document Context_ Parameter,取引設定内容のドメインの情報に関する情報,UN01005486,ASBIE,CI_ Exchanged Document_ Context. Subset_ Specified. CI_ Document Context_ Parameter,A subset CI document context parameter specified for this CI exchanged document context.,Subset,ExchangedDocumentContextSubsetDocumentContextParameter,SubsetSpecifiedCIDocumentContextParameter,/SMEConsolidatedSelfInvoice/CIExchangedDocumentContext/SubsetSpecifiedCIDocumentContextParameter
v1,23,3424,3,A,ドメインID,0..1,0..1,CI_ Document Context_ Parameter,1,,Identification,Identifier,JECxxxx,,,"SIPSが付与したメッセージドメイン識別番号
中小企業共通EDIドメイン＝JPSSMED",UN01005472,BBIE,CI_ Document Context_ Parameter. Identification. Identifier,The unique identifier of this CI document context parameter.,ID,ExchangedSubsetDocumentContextParameterID,ID,/SMEConsolidatedSelfInvoice/CIExchangedDocumentContext/SubsetSpecifiedCIDocumentContextParameter/ID
v1,24,3425,3,A,ドメイン名,0..1,0..1,CI_ Document Context_ Parameter,2,,Value,Text,,,,SIPSが付与したメッセージドメイン名称,UN01005473,BBIE,CI_ Document Context_ Parameter. Value. Text,"The value, expressed as text, of this CI document context parameter.",Value Text,ExchangedSubsetDocumentContextParameterValueText,Value,/SMEConsolidatedSelfInvoice/CIExchangedDocumentContext/SubsetSpecifiedCIDocumentContextParameter/Value
v1,25,3426,3,C,ドメイン/バージョングループ,0..1,0..1,CI_ Document Context_ Parameter,1,,Specified,,,,CI_ Document_ Version,ドメインのバージョンに関する情報,UN01005474,ASBIE,CI_ Document Context_ Parameter. Specified. CI_ Document_ Version,The CI document version specified for this CI document context parameter.,Version,ExchangedSubsetDocumentContextParameterDocumentVersion,SpecifiedCIDocumentVersion,/SMEConsolidatedSelfInvoice/CIExchangedDocumentContext/SubsetSpecifiedCIDocumentContextParameter/SpecifiedCIDocumentVersion
v1,27,3445,4,A,バージョンID,0..1,0..1,CI_ Document_ Version,1,,Identification,Identifier,,,,ドメインのバージョン識別番号,UN01005476,BBIE,CI_ Document_ Version. Identification. Identifier,The unique identifier for this CI document version.,ID,SubsetContextParameterDocumentVersionID,ID,/SMEConsolidatedSelfInvoice/CIExchangedDocumentContext/SubsetSpecifiedCIDocumentContextParameter/SpecifiedCIDocumentVersion/ID
v1,28,3447,4,A,バージョン発行日,0..1,0..1,CI_ Document_ Version,3,,Issue,Date Time,,,,ドメインのバージョン発行日,UN01005478,BBIE,CI_ Document_ Version. Issue. Date Time,"The date, time, date time or other date time value of issue of this CI document version.",Issue Date Time,SubsetContextParameterDocumentVersionIssueDateTime,IssueDateTime,/SMEConsolidatedSelfInvoice/CIExchangedDocumentContext/SubsetSpecifiedCIDocumentContextParameter/SpecifiedCIDocumentVersion/IssueDateTime
v1,29,2179,1,C,インボイス文書クラス,,1..1,CIIH_ Exchanged_ Document,0,,,,,,,インボイス文書に関する情報項目のクラス,UN01005861,ASMA,CIIH_ Exchanged_ Document. Details,"A collection of data for a Cross Industry Invoice Header (CIIH) that is exchanged between two or more parties in written, printed or electronic form.",CIIH Exchanged Document,SMEConsolidatedSelfInvoiceExchangedDocumentDetails,CIIHExchangedDocument,/SMEConsolidatedSelfInvoice/CIIHExchangedDocument
v1/v3,30,2180,2,A,インボイス文書ID,1..1,1..1,CIIH_ Exchanged_ Document,1,PK,Identification,Identifier,,,,インボイス文書を識別する文書ID,UN01005862,BBIE,CIIH_ Exchanged_ Document. Identification. Identifier,The unique identifier of this CIIH exchanged document.,ID,ExchangedDocumentID,ID,/SMEConsolidatedSelfInvoice/CIIHExchangedDocument/ID
v1,31,2181,2,A,インボイス文書名,0..n,0..1,CIIH_ Exchanged_ Document,2,,Name,Text,,,,インボイス文書の文書名称,UN01005863,BBIE,CIIH_ Exchanged_ Document. Name. Text,"A name, expressed as text, of this CIIH exchanged document.",Name,ExchangedDocumentName,Name,/SMEConsolidatedSelfInvoice/CIIHExchangedDocument/Name
v1,32,2182,2,A,インボイス文書タイプコード,0..1,0..1,CIIH_ Exchanged_ Document,3,,Type,Code,UNCL1001,,,"インボイス文書のタイプを識別するコード
デフォルトは「統合請求書」",UN01005864,BBIE,CIIH_ Exchanged_ Document. Type. Code,The code specifying the type of CIIH exchanged document.,Type Code,ExchangedDocumentTypeCode,TypeCode,/SMEConsolidatedSelfInvoice/CIIHExchangedDocument/TypeCode
v1/v3,33,2183,2,A,インボイス文書発効日,1..1,1..1,CIIH_ Exchanged_ Document,4,,Issue,Date Time,日時様式 ISO8601,,,インボイス文書の発行日付，またはインボイス文書の書面上の発行日付。,UN01005865,BBIE,CIIH_ Exchanged_ Document. Issue. Date Time,"The date, time, date time or other date time value for the issuance of this CIIH exchanged document.",Issue Date Time,ExchangedDocumentIssueDateTime,IssueDateTime,/SMEConsolidatedSelfInvoice/CIIHExchangedDocument/IssueDateTime
v4.3,34,2186,2,A,インボイス文書言語ID,0..n,0..1,CIIH_ Exchanged_ Document,7,,Language,Identifier,"言語コード
ISO639",,,インボイス文書が使用する言語のID,UN01005868,BBIE,CIIH_ Exchanged_ Document. Language. Identifier,A unique identifier for a language used in this CIIH exchanged document.,Language Code,ExchangedDocumentLanguageID,LanguageID,/SMEConsolidatedSelfInvoice/CIIHExchangedDocument/LanguageID
v2,35,2187,2,A,インボイス文書目的コード,0..1,0..1,CIIH_ Exchanged_ Document,8,,Purpose,Code,UNCL1225,,,請求者が請求書の目的（新規、変更、取消、打切り）を管理するために付番したコード,UN01005869,BBIE,CIIH_ Exchanged_ Document. Purpose. Code,"The code specifying the purpose of this CIIH exchanged document, such as request or reminder.",Purpose Code,ExchangedDocumentPurposeCode,PurposeCode,/SMEConsolidatedSelfInvoice/CIIHExchangedDocument/PurposeCode
v4,36,2192,2,A,インボイス文書履歴ID,0..1,0..1,CIIH_ Exchanged_ Document,13,,Previous Revision_ Identification,Identifier,,,,インボイス文書の変更履歴を管理するID。文書変更時に文書IDを変更しない運用を行う場合に利用する（電帳法対応）,UN01005874,BBIE,CIIH_ Exchanged_ Document. Previous Revision_ Identification. Identifier,The unique identifier of the previous revision of this CIIH exchanged document.,Previous Revision ID,ExchangedDocumentPreviousRevisionID,PreviousRevisionID,/SMEConsolidatedSelfInvoice/CIIHExchangedDocument/PreviousRevisionID
v4,37,2193,2,A,インボイス文書類型コード,0..1,0..1,CIIH_ Exchanged_ Document,14,,Category,Code,JECxxxx,,,"インボイス文書の類型（日本円取引、外貨建て取引等）を識別するコード
デフォルトは「日本円取引」",UN01005875,BBIE,CIIH_ Exchanged_ Document. Category. Code,The code specifying the category for this CIIH exchanged document.,Category Code,ExchangedDocumentCategoryCode,CategoryCode,/SMEConsolidatedSelfInvoice/CIIHExchangedDocument/CategoryCode
v4,38,2196,2,A,インボイス文書サブタイプコード,0..1,0..1,CIIH_ Exchanged_ Document,17,,Subtype,Code,JECxxxx,,,"地域固有の文書のタイプを識別するコード
デフォルトは「統合請求書」",UN01014636,BBIE,CIIH_ Exchanged_ Document. Subtype. Code,The code specifying the subtype of this CIIH exchanged document.,Subtype Code,ExchangedDocumentSubtypeCode,SubtypeCode,/SMEConsolidatedSelfInvoice/CIIHExchangedDocument/SubtypeCode
v1,39,2198,2,C,インボイス文書／注釈グループ,0..n,0..n,CIIH_ Exchanged_ Document,1,,Included,,,,CI_ Note,インボイス文書に含まれる注釈。,UN01005876,ASBIE,CIIH_ Exchanged_ Document. Included. CI_ Note,A note included in this CIIH exchanged document.,Note,ExchangedDocumentNote,IncludedCINote,/SMEConsolidatedSelfInvoice/CIIHExchangedDocument/IncludedCINote
v1,41,3579,3,A,インボイス文書注釈表題,0..1,0..1,CI_ Note,1,,Subject,Text,,,,注釈内容の表題を示す。,UN01005558,BBIE,CI_ Note. Subject. Text,"The subject, expressed as text, of this CI note.",Subject Text,ExchangedDocumentNoteSubjectText,Subject,/SMEConsolidatedSelfInvoice/CIIHExchangedDocument/IncludedCINote/Subject
v1,42,3581,3,A,インボイス文書注釈内容,0..n,0..1,CI_ Note,3,,Content,Text,,,,注釈項目毎の内容情報を入力するフリースペース。,UN01005560,BBIE,CI_ Note. Content. Text,"Content, expressed as text, of this CI note.",Content Text,ExchangedDocumentNoteContentText,Content,/SMEConsolidatedSelfInvoice/CIIHExchangedDocument/IncludedCINote/Content
v1,43,3583,3,A,インボイス文書注釈ID,0..1,0..1,CI_ Note,5,,Identification,Identifier,,,,注釈の識別ID,UN01005562,BBIE,CI_ Note. Identification. Identifier,The unique identifier for this CI note.,ID,ExchangedDocumentNoteID,ID,/SMEConsolidatedSelfInvoice/CIIHExchangedDocument/IncludedCINote/ID
v4,44,2201,2,C,インボイス文書／参照文書グループ,0..n,0..n,CIIH_ Exchanged_ Document,4,,Reference,,,,CI_ Referenced_ Document,インボイス文書が参照する文書のグループ,UN01012702,ASBIE,CIIH_ Exchanged_ Document. Reference. CI_ Referenced_ Document,Other documents referenced by this CIIH exchanged document.,Other Referenced Documents,ExchangedDocumentReferenceDocument,ReferenceCIReferencedDocument,/SMEConsolidatedSelfInvoice/CIIHExchangedDocument/ReferenceCIReferencedDocument
v4,46,3615,3,A,（鑑ヘッダ参照）文書ID,0..1,1..1,CI_ Referenced_ Document,1,PK,Issuer Assigned_ Identification,Identifier,,,,インボイス文書が参照する参照文書のID,UN01005580,BBIE,CI_ Referenced_ Document. Issuer Assigned_ Identification. Identifier,The issuer assigned identifier for this CI referenced document.,Issuer Assigned ID,ExchangedReferenceDocumentIssuerAssignedID,IssuerAssignedID,/SMEConsolidatedSelfInvoice/CIIHExchangedDocument/ReferenceCIReferencedDocument/IssuerAssignedID
v4.2,47,3616,3,A,（鑑ヘッダ参照）文書URL_ID,0..1,0..1,CI_ Referenced_ Document,2,,URI_ Identification,Identifier,,,,インボイス文書が参照する文書が所在するURL_ID,UN01005581,BBIE,CI_ Referenced_ Document. URI_ Identification. Identifier,The unique Uniform Resource Identifier (URI) for this CI referenced document.,URI,ExchangedReferenceDocumentURIID,URIID,/SMEConsolidatedSelfInvoice/CIIHExchangedDocument/ReferenceCIReferencedDocument/URIID
v4,48,3617,3,A,（鑑ヘッダ参照）文書発行日,0..1,0..1,CI_ Referenced_ Document,3,,Issue,Date Time,,,,インボイス文書が参照する参照文書の発行日,UN01005582,BBIE,CI_ Referenced_ Document. Issue. Date Time,The date or date time for the issuance of this CI referenced document.,Issue Date Time,ExchangedReferenceDocumentIssueDateTime,IssueDateTime,/SMEConsolidatedSelfInvoice/CIIHExchangedDocument/ReferenceCIReferencedDocument/IssueDateTime
v4.1,49,3621,3,A,（鑑ヘッダ参照）文書参照タイプコード,0..1,0..1,CI_ Referenced_ Document,7,,Reference_ Type,Code,UNCL1153,,,この調整で参照するインボイス文書の参照タイプを指定するコード,UN01005586,BBIE,CI_ Referenced_ Document. Reference_ Type. Code,The code specifying the reference type of this CI referenced document.,Reference Type Code,ExchangedReferencedDocumentReferenceTypeCode,ReferenceTypeCode,/SMEConsolidatedSelfInvoice/CIIHExchangedDocument/ReferenceCIReferencedDocument/ReferenceTypeCode
v4,50,3623,3,A,（鑑ヘッダ参照）文書履歴ID,0..1,0..1,CI_ Referenced_ Document,9,,Revision_ Identification,Identifier,,,,インボイス文書が参照する文書の変更履歴を管理するID。,UN01005588,BBIE,CI_ Referenced_ Document. Revision_ Identification. Identifier,The unique identifier for a revision of this CI referenced document.,Revision ID,ExchangedReferenceDocumentRevisionID,RevisionID,/SMEConsolidatedSelfInvoice/CIIHExchangedDocument/ReferenceCIReferencedDocument/RevisionID
v4.2,51,3625,3,A,（鑑ヘッダ参照）文書情報,0..n,0..1,CI_ Referenced_ Document,11,,Information,Text,,,,インボイス文書が参照する参照文書に記載の情報,UN01006415,BBIE,CI_ Referenced_ Document. Information. Text,"Information, expressed as text, for this CI referenced document.",Information,ExchangedReferenceDocumentInformationText,Information,/SMEConsolidatedSelfInvoice/CIIHExchangedDocument/ReferenceCIReferencedDocument/Information
v4,52,3628,3,A,（鑑ヘッダ参照）文書タイプコード,0..1,0..1,CI_ Referenced_ Document,14,,Type,Code,UNCL1001,,,インボイス文書が参照する参照文書の文書タイプを識別するコード,UN01009672,BBIE,CI_ Referenced_ Document. Type. Code,The code specifying the type of CI referenced document.,Type Code,ExchangedReferenceDocumentTypeCode,TypeCode,/SMEConsolidatedSelfInvoice/CIIHExchangedDocument/ReferenceCIReferencedDocument/TypeCode
v4,53,3629,3,A,（鑑ヘッダ参照）文書添付ファイル,0..n,0..1,CI_ Referenced_ Document,15,,Attachment,Binary Object,JECxxxx,,,"この参照文書に紐付く添付バイナリファイルの有無を指定
ありの場合は紐付ける「添付バイナリファイルID（UN01006015）」をBASE64で入力",UN01011455,BBIE,CI_ Referenced_ Document. Attachment. Binary Object,A binary object that is attached or otherwise appended to this CI referenced document.,Attached Binary Object,ExchangedReferenceDocumentAttachmentBinaryObject,AttachmentBinaryObject,/SMEConsolidatedSelfInvoice/CIIHExchangedDocument/ReferenceCIReferencedDocument/AttachmentBinaryObject
v4,54,3636,3,A,（鑑ヘッダ参照）文書サブタイプコード,0..n,0..1,CI_ Referenced_ Document,22,,Subtype,Code,JECxxxx,,,インボイス文書が参照する参照文書の文書サブタイプを識別するコード,UN01014899,BBIE,CI_ Referenced_ Document. Subtype. Code,A code specifying a subtype of this CI referenced document.,Subtype Code,ExchangedReferenceDocumentSubtypeCode,SubtypeCode,/SMEConsolidatedSelfInvoice/CIIHExchangedDocument/ReferenceCIReferencedDocument/SubtypeCode
v4.0.1,55,2202,2,C,付加文書／添付ファイルグループ,0..n,0..n,CIIH_ Exchanged_ Document,5,,Attached,,,,Specified_ Binary File,参照文書の添付バイナリファイルに関するグループ,UN01015490,ASBIE,CIIH_ Exchanged_ Document. Attached. Specified_ Binary File,A binary file attached to this CIIH exchanged document.,Attached Binary File,ExchangedDocumentAttachedBinaryFile,AttachedSpecifiedBinaryFile,/SMEConsolidatedSelfInvoice/CIIHExchangedDocument/AttachedSpecifiedBinaryFile
v4,57,7145,3,A,添付バイナリファイルID,0..n,1..1,Specified_ Binary File,1,PK,Identification,Identifier,,,,添付バイナリファイルのID,UN01006015,BBIE,Specified_ Binary File. Identification. Identifier,A unique identifier for this specified binary file.,ID,ExchangedDocumentAttachedBinaryFileID,ID,/SMEConsolidatedSelfInvoice/CIIHExchangedDocument/AttachedSpecifiedBinaryFile/ID
v4,58,7149,3,A,添付バイナリファイル名,0..1,0..1,Specified_ Binary File,5,,File Name,Text,,,,添付バイナリファイルの名称,UN01006019,BBIE,Specified_ Binary File. File Name. Text,"The file name, expressed as text, of this specified binary file.",Name,ExchangedDocumentAttachedBinaryFileFileName,FileName,/SMEConsolidatedSelfInvoice/CIIHExchangedDocument/AttachedSpecifiedBinaryFile/FileName
v4,59,7150,3,A,添付バイナリファイルURI ID,0..1,0..1,Specified_ Binary File,6,,URI,Identifier,,,,添付バイナリファイルの保管URIID,UN01006020,BBIE,Specified_ Binary File. URI. Identifier,The unique Uniform Resource Identifier (URI) for this specified binary file.,URI,ExchangedDocumentAttachedBinaryFileURIID,URIID,/SMEConsolidatedSelfInvoice/CIIHExchangedDocument/AttachedSpecifiedBinaryFile/URIID
v4,60,7151,3,A,添付バイナリファイルのMIMEコード,0..1,1..1,Specified_ Binary File,7,,MIME,Code,RFC1341,,,添付バイナリファイルのMIMEコード,UN01006021,BBIE,Specified_ Binary File. MIME. Code,The code specifying the Multipurpose Internet Mail Extensions (MIME) type for this specified binary file.,MIME Code,ExchangedDocumentAttachedBinaryFileMIMECode,MIMECode,/SMEConsolidatedSelfInvoice/CIIHExchangedDocument/AttachedSpecifiedBinaryFile/MIMECode
v4,61,7156,3,A,添付バイナリファイルの説明文,0..n,0..1,Specified_ Binary File,12,,Description,Text,,,,添付バイナリファイルの説明文,UN01006026,BBIE,Specified_ Binary File. Description. Text,A textual description of this specified binary file.,Description,ExchangedDocumentAttachedBinaryFileDescriptionText,Description,/SMEConsolidatedSelfInvoice/CIIHExchangedDocument/AttachedSpecifiedBinaryFile/Description
v1,62,2288,1,C,インボイス文書取引内容クラス,,1..1,CIIH_ Supply Chain_ Trade Transaction,0,,,,,,,インボイス文書情報で伝達される取引内容に関する情報からなるクラス。,UN01005936,ASMA,CIIH_ Supply Chain_ Trade Transaction. Details,"The trade line items, trade agreement, trade delivery and trade settlement details included in this Cross Industry Invoice Header (CIIH).",CIIH Trade Transaction,SMEConsolidatedSelfInvoiceTransactionDetails,CIIHSupplyChainTradeTransaction,/SMEConsolidatedSelfInvoice/CIIHSupplyChainTradeTransaction
