version,sme_nr,mbie_nr,level,type,label_local,multiplicity,multiplicity_SME,class_term,sequence,identifier,property_term,representation_term,code_list,attribute,associated_class,definition_local,UNID,acronym,DEN,definition,short_name,name,element,xpath
v4,371,2356,4,C,明細文書／注釈グループ,0..n,0..n,CIIL_ Document Line_ Document,1,,Included,,,,CI_ Note,明細文書に関する注釈のグループ,UN01005957,ASBIE,CIIL_ Document Line_ Document. Included. CI_ Note,A Cross Industry (CI) note included in this CIIL document line.,Note,ItemAssociatedDocumentLineDocumentNote,IncludedCINote,/SMEConsolidatedSelfInvoice/CIIHSupplyChainTradeTransaction/IncludedCIILSupplyChainTradeLineItem/AssociatedCIILDocumentLineDocument/IncludedCINote
v4,373,3579,5,A,明細文書注釈表題,0..1,0..1,CI_ Note,1,,Subject,Text,,,,"明細文書の注釈内容の表題を示す。
一部に利用制限あり。標準仕様書３．３．５項参照。",UN01005558,BBIE,CI_ Note. Subject. Text,"The subject, expressed as text, of this CI note.",Subject Text,ItemAssociatedDocumentLineNoteSubjectText,Subject,/SMEConsolidatedSelfInvoice/CIIHSupplyChainTradeTransaction/IncludedCIILSupplyChainTradeLineItem/AssociatedCIILDocumentLineDocument/IncludedCINote/Subject
v4,374,3581,5,A,明細文書注釈内容,0..n,0..1,CI_ Note,3,,Content,Text,,,,"明細文書の注釈表題毎の内容情報を入力するフリースペース。
一部に利用制限あり。標準仕様書３．３．５項参照",UN01005560,BBIE,CI_ Note. Content. Text,"Content, expressed as text, of this CI note.",Content Text,ItemAssociatedDocumentLineNoteContentText,Content,/SMEConsolidatedSelfInvoice/CIIHSupplyChainTradeTransaction/IncludedCIILSupplyChainTradeLineItem/AssociatedCIILDocumentLineDocument/IncludedCINote/Content
v4,375,3583,5,A,明細文書注釈ID,0..1,0..1,CI_ Note,5,,Identification,Identifier,,,,"明細文書注釈の識別ID
共通EDIプロバイダがシリアル番号をセット。標準仕様書３．３．５項参照",UN01005562,BBIE,CI_ Note. Identification. Identifier,The unique identifier for this CI note.,ID,ItemAssociatedDocumentLineNoteID,ID,/SMEConsolidatedSelfInvoice/CIIHSupplyChainTradeTransaction/IncludedCIILSupplyChainTradeLineItem/AssociatedCIILDocumentLineDocument/IncludedCINote/ID
v4,376,2357,4,C,明細文書／組込み文書グループ,0..n,0..1,CIIL_ Document Line_ Document,2,,Reference,,,,CI_ Referenced_ Document,この明細文書の組込み文書に関するグループ。,UN01014895,ASBIE,CIIL_ Document Line_ Document. Reference. CI_ Referenced_ Document,A document referenced from this CIIL document line.,Reference Document,ItemAssociatedDocumentLineDocumentReferenceDocument,ReferenceCIReferencedDocument,/SMEConsolidatedSelfInvoice/CIIHSupplyChainTradeTransaction/IncludedCIILSupplyChainTradeLineItem/AssociatedCIILDocumentLineDocument/ReferenceCIReferencedDocument
v4,378,3615,5,A,明細文書組込み文書ID,0..1,1..1,CI_ Referenced_ Document,1,PK,Issuer Assigned_ Identification,Identifier,,,,この明細文書に組込んだ文書のID,UN01005580,BBIE,CI_ Referenced_ Document. Issuer Assigned_ Identification. Identifier,The issuer assigned identifier for this CI referenced document.,Issuer Assigned ID,ItemAssociatedLineReferenceDocumentIssuerAssignedID,IssuerAssignedID,/SMEConsolidatedSelfInvoice/CIIHSupplyChainTradeTransaction/IncludedCIILSupplyChainTradeLineItem/AssociatedCIILDocumentLineDocument/ReferenceCIReferencedDocument/IssuerAssignedID
v4,379,3617,5,A,明細文書組込み文書発行日,0..1,0..1,CI_ Referenced_ Document,3,,Issue,Date Time,,,,この明細文書に組込んだ文書の発行日,UN01005582,BBIE,CI_ Referenced_ Document. Issue. Date Time,The date or date time for the issuance of this CI referenced document.,Issue Date Time,ItemAssociatedLineReferenceDocumentIssueDateTime,IssueDateTime,/SMEConsolidatedSelfInvoice/CIIHSupplyChainTradeTransaction/IncludedCIILSupplyChainTradeLineItem/AssociatedCIILDocumentLineDocument/ReferenceCIReferencedDocument/IssueDateTime
v4,380,3623,5,A,明細文書組込み文書履歴ID,0..1,0..1,CI_ Referenced_ Document,9,,Revision_ Identification,Identifier,,,,この明細文書に組込んだ文書の変更履歴を管理するID。,UN01005588,BBIE,CI_ Referenced_ Document. Revision_ Identification. Identifier,The unique identifier for a revision of this CI referenced document.,Revision ID,ItemAssociatedLineReferenceDocumentRevisionID,RevisionID,/SMEConsolidatedSelfInvoice/CIIHSupplyChainTradeTransaction/IncludedCIILSupplyChainTradeLineItem/AssociatedCIILDocumentLineDocument/ReferenceCIReferencedDocument/RevisionID
v4,381,3628,5,A,明細文書組込み文書タイプコード,0..1,0..1,CI_ Referenced_ Document,14,,Type,Code,UNCL1001,,,この明細文書に組込んだ文書の文書タイプを識別するコード,UN01009672,BBIE,CI_ Referenced_ Document. Type. Code,The code specifying the type of CI referenced document.,Type Code,ItemAssociatedLineReferenceDocumentTypeCode,TypeCode,/SMEConsolidatedSelfInvoice/CIIHSupplyChainTradeTransaction/IncludedCIILSupplyChainTradeLineItem/AssociatedCIILDocumentLineDocument/ReferenceCIReferencedDocument/TypeCode
v4,382,3636,5,A,明細文書組込み文書サブタイプコード,0..n,0..1,CI_ Referenced_ Document,22,,Subtype,Code,JECxxxx,,,この明細文書に組込んだ文書の文書サブタイプを識別するコード,UN01014899,BBIE,CI_ Referenced_ Document. Subtype. Code,A code specifying a subtype of this CI referenced document.,Subtype Code,ItemAssociatedLineReferenceDocumentSubtypeCode,SubtypeCode,/SMEConsolidatedSelfInvoice/CIIHSupplyChainTradeTransaction/IncludedCIILSupplyChainTradeLineItem/AssociatedCIILDocumentLineDocument/ReferenceCIReferencedDocument/SubtypeCode
v4,383,2404,3,C,明細文書ヘッダ／契約グループ,0..1,0..1,CIIL_ Supply Chain_ Trade Line Item,2,,Specified,,,,CIIL_ Supply Chain_ Trade Agreement,明細文書ヘッダの契約に関するグループ。,UN01005990,ASBIE,CIIL_ Supply Chain_ Trade Line Item. Specified. CIIL_ Supply Chain_ Trade Agreement,The CIIL supply chain trade agreement specified for this CIIL supply chain trade line item.,Trade Agreement,TransactionDocument,SpecifiedCIILSupplyChainTradeAgreement,/SMEConsolidatedSelfInvoice/CIIHSupplyChainTradeTransaction/IncludedCIILSupplyChainTradeLineItem/SpecifiedCIILSupplyChainTradeAgreement
v4,385,2361,4,C,明細文書ヘッダ契約／参照受注書グループ,0..1,0..1,CIIL_ Supply Chain_ Trade Agreement,2,,Seller Order_ Referenced,,,,CI_ Referenced_ Document,明細文書ヘッダが参照する受注書に関するグループ。,UN01005960,ASBIE,CIIL_ Supply Chain_ Trade Agreement. Seller Order_ Referenced. CI_ Referenced_ Document,The Cross Industry (CI) seller order document referenced from a line item in this CIIL supply chain trade agreement.,Seller Order Document,DocumentSellerOrderReferencedReferencedDocument,SellerOrderReferencedCIReferencedDocument,/SMEConsolidatedSelfInvoice/CIIHSupplyChainTradeTransaction/IncludedCIILSupplyChainTradeLineItem/SpecifiedCIILSupplyChainTradeAgreement/SellerOrderReferencedCIReferencedDocument
v4,387,3615,5,A,（明細文書ヘッダ参照）受注書ID,0..1,1..1,CI_ Referenced_ Document,1,PK,Issuer Assigned_ Identification,Identifier,,,,この明細文書ヘッダが参照する受注書に記載の文書ID,UN01005580,BBIE,CI_ Referenced_ Document. Issuer Assigned_ Identification. Identifier,The issuer assigned identifier for this CI referenced document.,Issuer Assigned ID,DocumentSellerOrderReferencedDocumentIssuerAssignedID,IssuerAssignedID,/SMEConsolidatedSelfInvoice/CIIHSupplyChainTradeTransaction/IncludedCIILSupplyChainTradeLineItem/SpecifiedCIILSupplyChainTradeAgreement/SellerOrderReferencedCIReferencedDocument/IssuerAssignedID
v4.3,388,3616,5,A,（明細文書ヘッダ参照）文書URL_ID,0..1,0..1,CI_ Referenced_ Document,2,,URI_ Identification,Identifier,,,,この明細文書ヘッダが参照する文書が所在するURL_ID,UN01005581,BBIE,CI_ Referenced_ Document. URI_ Identification. Identifier,The unique Uniform Resource Identifier (URI) for this CI referenced document.,URI,DocumentSellerOrderReferencedDocumentURIID,URIID,/SMEConsolidatedSelfInvoice/CIIHSupplyChainTradeTransaction/IncludedCIILSupplyChainTradeLineItem/SpecifiedCIILSupplyChainTradeAgreement/SellerOrderReferencedCIReferencedDocument/URIID
v4.3,389,3617,5,A,（明細文書ヘッダ参照）文書発行日,0..1,0..1,CI_ Referenced_ Document,3,,Issue,Date Time,,,,この明細文書ヘッダが参照する文書に記載の発行日付,UN01005582,BBIE,CI_ Referenced_ Document. Issue. Date Time,The date or date time for the issuance of this CI referenced document.,Issue Date Time,DocumentSellerOrderReferencedDocumentIssueDateTime,IssueDateTime,/SMEConsolidatedSelfInvoice/CIIHSupplyChainTradeTransaction/IncludedCIILSupplyChainTradeLineItem/SpecifiedCIILSupplyChainTradeAgreement/SellerOrderReferencedCIReferencedDocument/IssueDateTime
v4,390,3623,5,A,（明細文書ヘッダ参照）受注書履歴ID,0..1,0..1,CI_ Referenced_ Document,9,,Revision_ Identification,Identifier,,,,この明細文書ヘッダが参照する受注書の変更履歴を管理するID。,UN01005588,BBIE,CI_ Referenced_ Document. Revision_ Identification. Identifier,The unique identifier for a revision of this CI referenced document.,Revision ID,DocumentSellerOrderReferencedDocumentRevisionID,RevisionID,/SMEConsolidatedSelfInvoice/CIIHSupplyChainTradeTransaction/IncludedCIILSupplyChainTradeLineItem/SpecifiedCIILSupplyChainTradeAgreement/SellerOrderReferencedCIReferencedDocument/RevisionID
v4,391,2362,4,C,明細文書ヘッダ契約／参照注文書グループ,0..1,0..1,CIIL_ Supply Chain_ Trade Agreement,3,,Buyer Order_ Referenced,,,,CI_ Referenced_ Document,明細文書ヘッダが参照する注文書に関するグループ。,UN01005961,ASBIE,CIIL_ Supply Chain_ Trade Agreement. Buyer Order_ Referenced. CI_ Referenced_ Document,The Cross Industry (CI) buyer order document referenced from a line item in this CIIL supply chain trade agreement.,Buyer Order Document,DocumentBuyerOrderReferencedReferencedDocument,BuyerOrderReferencedCIReferencedDocument,/SMEConsolidatedSelfInvoice/CIIHSupplyChainTradeTransaction/IncludedCIILSupplyChainTradeLineItem/SpecifiedCIILSupplyChainTradeAgreement/BuyerOrderReferencedCIReferencedDocument
v4,393,3615,5,A,（明細文書ヘッダ参照）注文書ID,0..1,1..1,CI_ Referenced_ Document,1,PK,Issuer Assigned_ Identification,Identifier,,,,この明細文書ヘッダが参照する注文書に記載の文書ID。,UN01005580,BBIE,CI_ Referenced_ Document. Issuer Assigned_ Identification. Identifier,The issuer assigned identifier for this CI referenced document.,Issuer Assigned ID,DocumentBuyerOrderReferencedDocumentIssuerAssignedID,IssuerAssignedID,/SMEConsolidatedSelfInvoice/CIIHSupplyChainTradeTransaction/IncludedCIILSupplyChainTradeLineItem/SpecifiedCIILSupplyChainTradeAgreement/BuyerOrderReferencedCIReferencedDocument/IssuerAssignedID
v4.3,394,3616,5,A,（明細文書ヘッダ参照）文書URL_ID,0..1,0..1,CI_ Referenced_ Document,2,,URI_ Identification,Identifier,,,,この明細文書ヘッダが参照する文書が所在するURL_ID,UN01005581,BBIE,CI_ Referenced_ Document. URI_ Identification. Identifier,The unique Uniform Resource Identifier (URI) for this CI referenced document.,URI,DocumentBuyerOrderReferencedDocumentURIID,URIID,/SMEConsolidatedSelfInvoice/CIIHSupplyChainTradeTransaction/IncludedCIILSupplyChainTradeLineItem/SpecifiedCIILSupplyChainTradeAgreement/BuyerOrderReferencedCIReferencedDocument/URIID
v4.3,395,3617,5,A,（明細文書ヘッダ参照）文書発行日,0..1,0..1,CI_ Referenced_ Document,3,,Issue,Date Time,,,,この明細文書ヘッダが参照する文書に記載の発行日付,UN01005582,BBIE,CI_ Referenced_ Document. Issue. Date Time,The date or date time for the issuance of this CI referenced document.,Issue Date Time,DocumentBuyerOrderReferencedDocumentIssueDateTime,IssueDateTime,/SMEConsolidatedSelfInvoice/CIIHSupplyChainTradeTransaction/IncludedCIILSupplyChainTradeLineItem/SpecifiedCIILSupplyChainTradeAgreement/BuyerOrderReferencedCIReferencedDocument/IssueDateTime
v4,396,3623,5,A,（明細文書ヘッダ参照）注文書履歴ID,0..1,0..1,CI_ Referenced_ Document,9,,Revision_ Identification,Identifier,,,,この明細文書ヘッダが参照する注文書の変更履歴を管理するID。,UN01005588,BBIE,CI_ Referenced_ Document. Revision_ Identification. Identifier,The unique identifier for a revision of this CI referenced document.,Revision ID,DocumentBuyerOrderReferencedDocumentRevisionID,RevisionID,/SMEConsolidatedSelfInvoice/CIIHSupplyChainTradeTransaction/IncludedCIILSupplyChainTradeLineItem/SpecifiedCIILSupplyChainTradeAgreement/BuyerOrderReferencedCIReferencedDocument/RevisionID
v4,397,2364,4,C,明細文書ヘッダ契約／参照契約書グループ,0..1,0..1,CIIL_ Supply Chain_ Trade Agreement,5,,Contract_ Referenced,,,,CI_ Referenced_ Document,明細文書ヘッダが参照する契約書に関するグループ。,UN01005963,ASBIE,CIIL_ Supply Chain_ Trade Agreement. Contract_ Referenced. CI_ Referenced_ Document,The Cross Industry (CI) contract document referenced from a line item in this CIIL supply chain trade agreement.,Contract Document,DocumentContractReferencedReferencedDocument,ContractReferencedCIReferencedDocument,/SMEConsolidatedSelfInvoice/CIIHSupplyChainTradeTransaction/IncludedCIILSupplyChainTradeLineItem/SpecifiedCIILSupplyChainTradeAgreement/ContractReferencedCIReferencedDocument
v4,399,3615,5,A,（明細文書ヘッダ参照）契約文書ID,0..1,1..1,CI_ Referenced_ Document,1,PK,Issuer Assigned_ Identification,Identifier,,,,この明細文書ヘッダが参照する契約書に記載の文書ID,UN01005580,BBIE,CI_ Referenced_ Document. Issuer Assigned_ Identification. Identifier,The issuer assigned identifier for this CI referenced document.,Issuer Assigned ID,DocumentContractReferencedDocumentIssuerAssignedID,IssuerAssignedID,/SMEConsolidatedSelfInvoice/CIIHSupplyChainTradeTransaction/IncludedCIILSupplyChainTradeLineItem/SpecifiedCIILSupplyChainTradeAgreement/ContractReferencedCIReferencedDocument/IssuerAssignedID
v4.3,400,3616,5,A,（明細文書ヘッダ参照）文書URL_ID,0..1,0..1,CI_ Referenced_ Document,2,,URI_ Identification,Identifier,,,,この明細文書ヘッダが参照する文書が所在するURL_ID,UN01005581,BBIE,CI_ Referenced_ Document. URI_ Identification. Identifier,The unique Uniform Resource Identifier (URI) for this CI referenced document.,URI,DocumentContractReferencedDocumentURIID,URIID,/SMEConsolidatedSelfInvoice/CIIHSupplyChainTradeTransaction/IncludedCIILSupplyChainTradeLineItem/SpecifiedCIILSupplyChainTradeAgreement/ContractReferencedCIReferencedDocument/URIID
v4.3,401,3617,5,A,（明細文書ヘッダ参照）文書発行日,0..1,0..1,CI_ Referenced_ Document,3,,Issue,Date Time,,,,この明細文書ヘッダが参照する文書に記載の発行日付,UN01005582,BBIE,CI_ Referenced_ Document. Issue. Date Time,The date or date time for the issuance of this CI referenced document.,Issue Date Time,DocumentContractReferencedDocumentIssueDateTime,IssueDateTime,/SMEConsolidatedSelfInvoice/CIIHSupplyChainTradeTransaction/IncludedCIILSupplyChainTradeLineItem/SpecifiedCIILSupplyChainTradeAgreement/ContractReferencedCIReferencedDocument/IssueDateTime
v4,402,3623,5,A,（明細文書ヘッダ参照）契約書履歴ID,0..1,0..1,CI_ Referenced_ Document,9,,Revision_ Identification,Identifier,,,,この明細文書が参照する契約書の変更履歴を管理するID。,UN01005588,BBIE,CI_ Referenced_ Document. Revision_ Identification. Identifier,The unique identifier for a revision of this CI referenced document.,Revision ID,DocumentContractReferencedDocumentRevisionID,RevisionID,/SMEConsolidatedSelfInvoice/CIIHSupplyChainTradeTransaction/IncludedCIILSupplyChainTradeLineItem/SpecifiedCIILSupplyChainTradeAgreement/ContractReferencedCIReferencedDocument/RevisionID
v1,403,2405,3,C,明細文書ヘッダ／配送グループ,0..1,0..1,CIIL_ Supply Chain_ Trade Line Item,3,,Specified,,,,CIIL_ Supply Chain_ Trade Delivery,明細文書ヘッダの配送に関する情報からなるグループ。,UN01005991,ASBIE,CIIL_ Supply Chain_ Trade Line Item. Specified. CIIL_ Supply Chain_ Trade Delivery,The CIIL supply chain trade delivery specified for this CIIL supply chain trade line item.,Trade Delivery,TransactionDocumentDelivery,SpecifiedCIILSupplyChainTradeDelivery,/SMEConsolidatedSelfInvoice/CIIHSupplyChainTradeTransaction/IncludedCIILSupplyChainTradeLineItem/SpecifiedCIILSupplyChainTradeDelivery
v1,405,2389,4,C,明細文書ヘッダ配送／納入先グループ,0..1,0..1,CIIL_ Supply Chain_ Trade Delivery,4,,Ship To,,,,CI_ Trade_ Party,この明細文書ヘッダの納入先に関するグループ,UN01005980,ASBIE,CIIL_ Supply Chain_ Trade Delivery. Ship To. CI_ Trade_ Party,The Cross Industry (CI) trade party who is the ship to party for a line item in this CIIL supply chain trade delivery.,Ship To Party,DocumentDeliveryShipTo,ShipToCITradeParty,/SMEConsolidatedSelfInvoice/CIIHSupplyChainTradeTransaction/IncludedCIILSupplyChainTradeLineItem/SpecifiedCIILSupplyChainTradeDelivery/ShipToCITradeParty
v1,407,3910,5,A,納入先ID,0..n,0..1,CI_ Trade_ Party,1,,Identification,Identifier,,,,納入先の企業/工場・事業所・事業部門等を表す発注者が付与したID。,UN01005757,BBIE,CI_ Trade_ Party. Identification. Identifier,A unique identifier of this CI trade party.,ID,DocumentDeliveryShipToID,ID,/SMEConsolidatedSelfInvoice/CIIHSupplyChainTradeTransaction/IncludedCIILSupplyChainTradeLineItem/SpecifiedCIILSupplyChainTradeDelivery/ShipToCITradeParty/ID
v1,408,3911,5,A,納入先国際企業ID,0..n,0..1,CI_ Trade_ Party,2,,Global_ Identification,Identifier,ISO6523,,,納入先企業を表す国際企業ID。,UN01005758,BBIE,CI_ Trade_ Party. Global_ Identification. Identifier,A globally unique identifier of this CI trade party.,Global ID,DocumentDeliveryShipToGlobalID,GlobalID,/SMEConsolidatedSelfInvoice/CIIHSupplyChainTradeTransaction/IncludedCIILSupplyChainTradeLineItem/SpecifiedCIILSupplyChainTradeDelivery/ShipToCITradeParty/GlobalID
v1,409,3912,5,A,納入先名称,0..1,0..1,CI_ Trade_ Party,3,,Name,Text,,,,納入先の企業/工場・事業所・事業部門等の名称,UN01005759,BBIE,CI_ Trade_ Party. Name. Text,"The name, expressed as text, for this CI trade party.",Name,DocumentDeliveryShipToName,Name,/SMEConsolidatedSelfInvoice/CIIHSupplyChainTradeTransaction/IncludedCIILSupplyChainTradeLineItem/SpecifiedCIILSupplyChainTradeDelivery/ShipToCITradeParty/Name
v4,410,3920,5,C,納入先／住所グループ,0..1,0..1,CI_ Trade_ Party,3,,Postal,,,,CI_ Trade_ Address,納入先企業の住所情報に関するグループ。,UN01005762,ASBIE,CI_ Trade_ Party. Postal. CI_ Trade_ Address,The postal address for this CI trade party.,Postal Address,DocumentDeliveryShipToPostalAddress,PostalCITradeAddress,/SMEConsolidatedSelfInvoice/CIIHSupplyChainTradeTransaction/IncludedCIILSupplyChainTradeLineItem/SpecifiedCIILSupplyChainTradeDelivery/ShipToCITradeParty/PostalCITradeAddress
v4,412,3828,6,A,納入先郵便番号,0..1,0..1,CI_ Trade_ Address,2,,Postcode,Code,,,,納入先の郵便番号,UN01005689,BBIE,CI_ Trade_ Address. Postcode. Code,The postcode of this CI trade address.,Postcode,DocumentDeliveryShipToPostalAddressPostcodeCode,PostcodeCode,/SMEConsolidatedSelfInvoice/CIIHSupplyChainTradeTransaction/IncludedCIILSupplyChainTradeLineItem/SpecifiedCIILSupplyChainTradeDelivery/ShipToCITradeParty/PostalCITradeAddress/PostcodeCode
v4,413,3831,6,A,納入先住所1,0..1,0..1,CI_ Trade_ Address,5,,Line One,Text,,,,納入先の住所1行目,UN01005692,BBIE,CI_ Trade_ Address. Line One. Text,"The first free form line, expressed as text, of this CI trade address.",Line One,ItemDeliveryShipToPostalAddressLineOneText,LineOne,/SMEConsolidatedSelfInvoice/CIIHSupplyChainTradeTransaction/IncludedCIILSupplyChainTradeLineItem/SpecifiedCIILSupplyChainTradeDelivery/ShipToCITradeParty/PostalCITradeAddress/LineOne
v4,414,3832,6,A,納入先住所2,0..1,0..1,CI_ Trade_ Address,6,,Line Two,Text,,,,納入先の住所2行目。,UN01005693,BBIE,CI_ Trade_ Address. Line Two. Text,"The second free form line, expressed as text, of this CI trade address.",Line Two,ItemDeliveryShipToPostalAddressLineTwoText,LineTwo,/SMEConsolidatedSelfInvoice/CIIHSupplyChainTradeTransaction/IncludedCIILSupplyChainTradeLineItem/SpecifiedCIILSupplyChainTradeDelivery/ShipToCITradeParty/PostalCITradeAddress/LineTwo
v4,415,3833,6,A,納入先住所3,0..1,0..1,CI_ Trade_ Address,7,,Line Three,Text,,,,納入先の住所3行目。,UN01005694,BBIE,CI_ Trade_ Address. Line Three. Text,"The third free form line, expressed as text, of this CI trade address.",Line Three,ItemDeliveryShipToPostalAddressLineThreeText,LineThree,/SMEConsolidatedSelfInvoice/CIIHSupplyChainTradeTransaction/IncludedCIILSupplyChainTradeLineItem/SpecifiedCIILSupplyChainTradeDelivery/ShipToCITradeParty/PostalCITradeAddress/LineThree
v4,416,3839,6,A,納入先国ID,0..1,0..1,CI_ Trade_ Address,13,,Country,Identifier,ISO3166-1:Alpha2,,,納入先の国ID。デフォルトは「JP」,UN01005700,BBIE,CI_ Trade_ Address. Country. Identifier,The unique identifier of the country for this CI trade address.,Country Code,DocumentDeliveryShipToPostalAddressCountryID,CountryID,/SMEConsolidatedSelfInvoice/CIIHSupplyChainTradeTransaction/IncludedCIILSupplyChainTradeLineItem/SpecifiedCIILSupplyChainTradeDelivery/ShipToCITradeParty/PostalCITradeAddress/CountryID
v4,417,2395,4,C,明細文書ヘッダ配送／イベントグループ,0..1,0..1,CIIL_ Supply Chain_ Trade Delivery,10,,Actual_ Delivery,,,,CI_ Supply Chain_ Event,この明細文書ヘッダの発送イベントのグループ,UN01005986,ASBIE,CIIL_ Supply Chain_ Trade Delivery. Actual_ Delivery. CI_ Supply Chain_ Event,The Cross Industry (CI) actual supply chain delivery event for a line item in this CIIL supply chain trade delivery.,Actual Delivery Event,DocumentDeliveryActualDeliveryEvent,ActualDeliveryCISupplyChainEvent,/SMEConsolidatedSelfInvoice/CIIHSupplyChainTradeTransaction/IncludedCIILSupplyChainTradeLineItem/SpecifiedCIILSupplyChainTradeDelivery/ActualDeliveryCISupplyChainEvent
v4,419,3726,5,A,配送日,0..1,0..1,CI_ Supply Chain_ Event,2,,Occurrence,Date Time,,,,納入先へ発送した日時,UN01005628,BBIE,CI_ Supply Chain_ Event. Occurrence. Date Time,"The date, time, date time, or other date time value of an occurrence of this CI supply chain event.",Occurrence Date Time,DocumentActualDeliveryEventOccurrenceDateTime,OccurrenceDateTime,/SMEConsolidatedSelfInvoice/CIIHSupplyChainTradeTransaction/IncludedCIILSupplyChainTradeLineItem/SpecifiedCIILSupplyChainTradeDelivery/ActualDeliveryCISupplyChainEvent/OccurrenceDateTime
v1,420,2397,4,C,明細文書ヘッダ配送／参照出荷案内書グループ,0..1,0..n,CIIL_ Supply Chain_ Trade Delivery,12,,Despatch Advice_ Referenced,,,,CI_ Referenced_ Document,この明細文書ヘッダが参照する出荷案内書（納品書、送り状等）のグループ,UN01006039,ASBIE,CIIL_ Supply Chain_ Trade Delivery. Despatch Advice_ Referenced. CI_ Referenced_ Document,The Cross Industry (CI) despatch advice document referenced from this CIIL supply chain trade delivery.,Despatch Advice Document,DocumentDeliveryDespatchAdviceReferencedReferencedDocument,DespatchAdviceReferencedCIReferencedDocument,/SMEConsolidatedSelfInvoice/CIIHSupplyChainTradeTransaction/IncludedCIILSupplyChainTradeLineItem/SpecifiedCIILSupplyChainTradeDelivery/DespatchAdviceReferencedCIReferencedDocument
v1,422,3615,5,A,（明細文書ヘッダ参照）出荷案内書ID,0..1,1..1,CI_ Referenced_ Document,1,PK,Issuer Assigned_ Identification,Identifier,,,,この明細文書ヘッダが参照する受注者が付番した出荷案内書ID,UN01005580,BBIE,CI_ Referenced_ Document. Issuer Assigned_ Identification. Identifier,The issuer assigned identifier for this CI referenced document.,Issuer Assigned ID,DocumentDeliveryDespatchAdviceReferencedDocumentIssuerAssignedID,IssuerAssignedID,/SMEConsolidatedSelfInvoice/CIIHSupplyChainTradeTransaction/IncludedCIILSupplyChainTradeLineItem/SpecifiedCIILSupplyChainTradeDelivery/DespatchAdviceReferencedCIReferencedDocument/IssuerAssignedID
v4.3,423,3616,5,A,（明細文書ヘッダ参照）文書URL_ID,0..1,0..1,CI_ Referenced_ Document,2,,URI_ Identification,Identifier,,,,この寧歳文書ヘッダが参照する文書が所在するURL_ID,UN01005581,BBIE,CI_ Referenced_ Document. URI_ Identification. Identifier,The unique Uniform Resource Identifier (URI) for this CI referenced document.,URI,DocumentDeliveryDespatchAdviceReferencedDocumentURIID,URIID,/SMEConsolidatedSelfInvoice/CIIHSupplyChainTradeTransaction/IncludedCIILSupplyChainTradeLineItem/SpecifiedCIILSupplyChainTradeDelivery/DespatchAdviceReferencedCIReferencedDocument/URIID
v4.3,424,3617,5,A,（明細文書ヘッダ参照）文書発行日,0..1,0..1,CI_ Referenced_ Document,3,,Issue,Date Time,,,,この明細文書ヘッダが参照する文書に記載の発行日付,UN01005582,BBIE,CI_ Referenced_ Document. Issue. Date Time,The date or date time for the issuance of this CI referenced document.,Issue Date Time,DocumentDeliveryDespatchAdviceReferencedDocumentIssueDateTime,IssueDateTime,/SMEConsolidatedSelfInvoice/CIIHSupplyChainTradeTransaction/IncludedCIILSupplyChainTradeLineItem/SpecifiedCIILSupplyChainTradeDelivery/DespatchAdviceReferencedCIReferencedDocument/IssueDateTime
