version,sequence,level,type,identifier,UNID,acronym,label_local,multiplicity,seq,class_term,property_term,representation_term,associated_class,definition_local,code_list,attribute,DEN,definition,short_name,name,element,xpath
v4,293,6,A,,UN01013318,BBIE,（明細行参照）文書類型コード,0..1,3633,CI_ Referenced_ Document,I,_,,この明細行が参照する文書の類型タイプを識別するコード。,JECxxxx,,CI_ Referenced_ Document. Category. Code,The code specifying the category of this CI referenced document.,Category Code,IIReferencedDocumentCategoryCode,I,/SMECoreSelfInvoice/CIIHSupplyChainTradeTransaction/II/II/II/II/I
v4,294,6,A,,UN01014899,BBIE,（明細行参照）文書サブタイプコード,0..1,3635,CI_ Referenced_ Document,I,_,,この明細行が参照する文書の文書サブタイプを識別するコード。,JECxxxx,,CI_ Referenced_ Document. Subtype. Code,A code specifying a subtype of this CI referenced document.,Subtype Code,IIReferencedDocumentSubtypeCode,I,/SMECoreSelfInvoice/CIIHSupplyChainTradeTransaction/II/II/II/II/I
v1,295,5,C,,UN01009658,ASBIE,明細行契約／契約単価グループ,1..1,2331,CIILB_ Supply Chain_ Trade Agreement,I,,I,明細行の契約単価に関するグループ。,,,CIILB_ Supply Chain_ Trade Agreement. Net Price_ Product. CI_ Trade_ Price,A net product price in this CIILB supply chain trade agreement.,Product Net Price,IINetPriceProductPrice,II,/SMECoreSelfInvoice/CIIHSupplyChainTradeTransaction/II/II/II/II
v1/v3,297,6,A,,UN01005792,BBIE,契約単価,1..1,3956,CI_ Trade_ Price,I,_,,"発注者と受注者が合意した明細発注品の単価。単価基準数量と単価基準数量単位の指定に従う。
税込み、税抜きの識別はヘッダ部の「UN01013096：税計算方式」で指定（指定がない場合（デフォルト）は税抜き）。",,,CI_ Trade_ Price. Charge. Amount,A monetary value of this CI trade price charge.,Charge Amount,IIPriceChargeAmount,I,/SMECoreSelfInvoice/CIIHSupplyChainTradeTransaction/II/II/II/II/I
v4,298,6,A,,UN01005793,BBIE,単価基準数量,0..1,3957,CI_ Trade_ Price,I,_,,"✔定貫品目の場合：空欄（デフォルト）、または単価基準数量=１
✔不定貫品目、ハイブリッド品目の場合：単価基準数量=単価の基準となる重量・容量","数量単位コード
UNECE Rec20",,CI_ Trade_ Price. Basis. Quantity,The quantity on which this CI trade price is based.,Basis Quantity,IIPriceBasisQuantity,I,/SMECoreSelfInvoice/CIIHSupplyChainTradeTransaction/II/II/II/II/I
v1,300,4,C,,UN01009650,ASBIE,明細行／配送グループ,1..1,2323,CIILB_ Subordinate_ Trade Line Item,I,,I,明細行の配送に関するグループ,,,CIILB_ Subordinate_ Trade Line Item. Specified. CIILB_ Supply Chain_ Trade Delivery,The supply chain trade delivery specified for this CIILB subordinate trade line item.,Trade Delivery,IISubordinateDocumentDelivery,II,/SMECoreSelfInvoice/CIIHSupplyChainTradeTransaction/II/II/II
v４,302,5,A,,UN01009661,BBIE,配送バラ数量,0..1,2334,CIILB_ Supply Chain_ Trade Delivery,I,I,,"配送数量がセット数量単位属性を指定の場合に利用する。
配送バラ数量=配送数量（属性：セット）×セット単位数量（入り数）（属性：個、または不定貫品目量）",,,CIILB_ Supply Chain_ Trade Delivery. Product_ Unit. Quantity,The number of product units in this CIILB supply chain trade delivery.,Product Unit Quantity,IIDeliveryProductUnitQuantity,II,/SMECoreSelfInvoice/CIIHSupplyChainTradeTransaction/II/II/II/II
v3/v4,304,5,A,,UN01009662,BBIE,配送セット単位数量(入り数）,0..1,2335,CIILB_ Supply Chain_ Trade Delivery,I,I,,"✔ 配送数量の数量単位指定が定貫品目（セット）の場合：1セット当たりのバラ数量を入力。
✔配送数量がハイブリッド品目（セット）の場合：配送数量で指定したセット数量の1単位当たりの重量・容量（個数でカウントできない不定貫品目の数量単位属性）を入力
✔配送数量の 数量単位指定が定貫品目（個）の場合：利用しない
✔ 配送数量の数量単位指定が不定貫品目の場合：利用しない。",,,CIILB_ Supply Chain_ Trade Delivery. Per Package_ Unit. Quantity,The number of units per package in this CIILB supply chain trade delivery.,Per Package Unit Quantity,IIDeliveryPerPackageUnitQuantity,II,/SMECoreSelfInvoice/CIIHSupplyChainTradeTransaction/II/II/II/II
v1,306,5,A,,UN01014639,BBIE,配送数量,1..1,2336,CIILB_ Supply Chain_ Trade Delivery,I,I,,"この情報項目はずべての品目の配送数量の指定に利用する。
この項目の数量単位属性は次のいずれかを選択：「個」、「セット」、「不定貫数量単位」",,,CIILB_ Supply Chain_ Trade Delivery. Billed. Quantity,The billed quantity of this CIILB supply chain trade delivery.,Billed Quantity,IIDeliveryBilledQuantity,II,/SMECoreSelfInvoice/CIIHSupplyChainTradeTransaction/II/II/II/II
v1,308,4,C,,UN01009651,ASBIE,明細行／決裁グループ,1..1,2324,CIILB_ Subordinate_ Trade Line Item,I,,I,明細行の決済に関するグループ,,,CIILB_ Subordinate_ Trade Line Item. Specified. CIILB_ Supply Chain_ Trade Settlement,The supply chain trade settlement specified for this CIILB subordinate trade line item.,Trade Settlement,IISubordinateDocument,II,/SMECoreSelfInvoice/CIIHSupplyChainTradeTransaction/II/II/II
v４,310,5,A,,UN01014641,BBIE,明細行取引方向コード,0..1,2340,CIILB_ Supply Chain_ Trade Settlement,I,I,,"明細行の取引方向を識別するコード
デフォルトは「プラス」
明細行取引類型コードが「調整」を指定場合に利用する。
金額の「プラス」「マイナス」表示を許容する場合は実装しない。",JECxxxx,,CIILB_ Supply Chain_ Trade Settlement. Direction. Code,The code specifying whether this CIILB supply chain trade settlement is an addition or a subtraction.,Direction Code,IIDirectionCode,II,/SMECoreSelfInvoice/CIIHSupplyChainTradeTransaction/II/II/II/II
v1,311,5,C,,UN01009665,ASBIE,明細行決済／明細行税グループ,1..1,2341,CIILB_ Supply Chain_ Trade Settlement,I,,I,明細行決済の税に関するグループ,,,CIILB_ Supply Chain_ Trade Settlement. Applicable. CI_ Trade_ Tax,The trade tax applicable to this CIILB supply chain trade settlement.,Tax,IITax,II,/SMECoreSelfInvoice/CIIHSupplyChainTradeTransaction/II/II/II/II
v1/v2,313,6,A,,UN01005834,BBIE,明細行税タイプコード,0..1,4044,CI_ Trade_ Tax,I,_,,税の種類を識別するコード。デフォルトは消費税；VAT,UNCL5153,,CI_ Trade_ Tax. Type. Code,"The code specifying the type of CI trade related tax, levy or duty, such as a code for a Value Added Tax (VAT).",Type Code,IITaxTypeCode,I,/SMECoreSelfInvoice/CIIHSupplyChainTradeTransaction/II/II/II/II/I
v2,314,6,A,,UN01005839,BBIE,明細行譲渡資産金額（税抜き）,0..1,4049,CI_ Trade_ Tax,I,_,,"この明細行の税抜き譲渡資産金額（契約単価×配送数量）
契約単価×数量で指定できない場合は金額",,,CI_ Trade_ Tax. Basis. Amount,"A monetary value used as the basis on which this CI trade related tax, levy or duty is calculated.",Basis Amount,IITaxBasisAmount,I,/SMECoreSelfInvoice/CIIHSupplyChainTradeTransaction/II/II/II/II/I
v1/v2,315,6,A,,UN01005841,BBIE,明細行課税分類コード,1..1,4051,CI_ Trade_ Tax,I,_,,この明細行の消費税の課税分類（標準税率、軽減税率、不課税、非課税、免税等）を識別するコード,UNCL5305,,CI_ Trade_ Tax. Category. Code,"The code specifying the category to which this CI trade related tax, levy or duty applies, such as codes for ""Exempt from Tax"", ""Standard Rate"", ""Free Export Item - Tax Not Charged"" .",Category Code,IITaxCategoryCode,I,/SMECoreSelfInvoice/CIIHSupplyChainTradeTransaction/II/II/II/II/I
v2,316,6,A,,UN01005850,BBIE,明細行課税分類名,0..1,4060,CI_ Trade_ Tax,I,_,,消費税の計算属性(標準税率、軽減税率など)を識別するための分類名。または軽減税率対象品目に添付する※などの記号を表示,,,CI_ Trade_ Tax. Category Name. Text,"A category name, expressed as text, of this CI trade related tax, levy or duty.",Category Name,IITaxCategoryName,I,/SMECoreSelfInvoice/CIIHSupplyChainTradeTransaction/II/II/II/II/I
v1/v2,317,6,A,,UN01007174,BBIE,明細行税率,0..1,4062,CI_ Trade_ Tax,I,_,,"課税分類に対応する消費税率のパーセント表示
2014年度税制の場合は、明細行課税分類コードと組み合わせて利用する。",,,CI_ Trade_ Tax. Rate_ Applicable. Percent,"The applicable rate of CI trade tax, expressed as a percentage.",Applicable Rate Percent,IITaxRatePercent,I,/SMECoreSelfInvoice/CIIHSupplyChainTradeTransaction/II/II/II/II/I
v2,318,6,A,,UN01013040,BBIE,明細行譲渡資産金額(税込み),0..1,4063,CI_ Trade_ Tax,I,_,,この明細行の税額を含む譲渡資産金額（税込み）,,,CI_ Trade_ Tax. Grand Total. Amount,The monetary value of the grand total of the basis plus tax for this CI trade tax.,Grand Total Amount,IITaxGrandTotalAmount,I,/SMECoreSelfInvoice/CIIHSupplyChainTradeTransaction/II/II/II/II/I
v4,319,6,A,,UN01014650,BBIE,明細行適用税制ID,0..1,4065,CI_ Trade_ Tax,I,_,,"この明細行取引の税制年度を識別するID
デフォルトは「2019」（2019年度税制）",JECxxxx,,CI_ Trade_ Tax. Local Tax System. Identifier,The identifier of the local tax system for this CI trade tax.,Local Tax System ID,IITaxLocalTaxSystemID,I,/SMECoreSelfInvoice/CIIHSupplyChainTradeTransaction/II/II/II/II/I
v4.3,320,5,C,,UN01014643,ASBIE,明細行決済／調整（修正差額調整）グループ,0..1,2343,CIILB_ Supply Chain_ Trade Settlement,I,,I,明細行決済の調整（修正差額調整）に関するグループ,,,CIILB_ Supply Chain_ Trade Settlement. Specified. CI_ Financial_ Adjustment,A financial adjustment specified for this CIILB supply chain trade settlement.,Specified Financial Adjustment,IIFinancialAdjustment,II,/SMECoreSelfInvoice/CIIHSupplyChainTradeTransaction/II/II/II/II
v4.3,322,6,A,,UN01005488,BBIE,明細行調整理由コード（修正差額調整）,0..1,3460,CI_ Financial_ Adjustment,I,_,,"この明細行の調整理由を示す識別コード
62(修正差額調整)",UNCL4465,,CI_ Financial_ Adjustment. Reason. Code,The code specifying a reason for this CI financial adjustment.,Reason Code,IIFinancialAdjustmentReasonCode,I,/SMECoreSelfInvoice/CIIHSupplyChainTradeTransaction/II/II/II/II/I
v4.3,323,6,A,,UN01005489,BBIE,明細行調整理由,0..1,3461,CI_ Financial_ Adjustment,I,_,,この明細行の調整理由を文字で表現した内容,,,CI_ Financial_ Adjustment. Reason. Text,"A reason, expressed as text, for this CI financial adjustment.",Reason Text,IIFinancialAdjustmentReasonText,I,/SMECoreSelfInvoice/CIIHSupplyChainTradeTransaction/II/II/II/II/I
v4.3,324,6,A,,UN01005490,BBIE,明細行調整金額,0..1,3462,CI_ Financial_ Adjustment,I,_,,"この明細行の調整金額
＜調整理由コード=62＞
修正差額調整金額",,,CI_ Financial_ Adjustment. Actual. Amount,An actual monetary value added or subtracted as a result of this CI financial adjustment.,Actual Amount,IIFinancialAdjustmentActualAmount,I,/SMECoreSelfInvoice/CIIHSupplyChainTradeTransaction/II/II/II/II/I
v4.3,325,6,C,,UN01014897,ASBIE,明細行調整／調整税グループ,0..1,3468,CI_ Financial_ Adjustment,I,,_,調整明細行の税率別税クラスに関するグループ,,,CI_ Financial_ Adjustment. Related. CI_ Trade_ Tax,A trade tax related to this CI financial adjustment.,Related Tax,IIFinancialAdjustmentRelatedTax,I,/SMECoreSelfInvoice/CIIHSupplyChainTradeTransaction/II/II/II/II/I
v4.3,327,7,A,,UN01005841,BBIE,明細行調整課税分類コード,0..1,4051,CI_ Trade_ Tax,I,_,,調整明細行の課税分類コード,UNCL5305,,CI_ Trade_ Tax. Category. Code,"The code specifying the category to which this CI trade related tax, levy or duty applies, such as codes for ""Exempt from Tax"", ""Standard Rate"", ""Free Export Item - Tax Not Charged"" .",Category Code,IITaxCategoryCode,I,/SMECoreSelfInvoice/CIIHSupplyChainTradeTransaction/II/II/II/II/I/I
v4.3,328,7,A,,UN01007174,BBIE,明細行調整税率,0..1,4062,CI_ Trade_ Tax,I,_,,調整明細行の税率,,,CI_ Trade_ Tax. Rate_ Applicable. Percent,"The applicable rate of CI trade tax, expressed as a percentage.",Applicable Rate Percent,IITaxRatePercent,I,/SMECoreSelfInvoice/CIIHSupplyChainTradeTransaction/II/II/II/II/I/I
v4.3,329,5,C,,UN01014643,ASBIE,明細行決済／調整グループ,0..1,2343,CIILB_ Supply Chain_ Trade Settlement,I,,I,明細行決済の調整に関するグループ,,,CIILB_ Supply Chain_ Trade Settlement. Specified. CI_ Financial_ Adjustment,A financial adjustment specified for this CIILB supply chain trade settlement.,Specified Financial Adjustment,IIFinancialAdjustment,II,/SMECoreSelfInvoice/CIIHSupplyChainTradeTransaction/II/II/II/II
v4.3,331,6,A,,UN01005488,BBIE,明細行調整理由コード(源泉所得税),0..1,3460,CI_ Financial_ Adjustment,I,_,,"この明細行の調整理由を示す識別コード
26(源泉所得税)",UNCL4465,,CI_ Financial_ Adjustment. Reason. Code,The code specifying a reason for this CI financial adjustment.,Reason Code,IIFinancialAdjustmentReasonCode,I,/SMECoreSelfInvoice/CIIHSupplyChainTradeTransaction/II/II/II/II/I
v4.3,332,6,A,,UN01005489,BBIE,明細行調整理由,0..1,3461,CI_ Financial_ Adjustment,I,_,,この明細行の調整理由を文字で表現した内容,,,CI_ Financial_ Adjustment. Reason. Text,"A reason, expressed as text, for this CI financial adjustment.",Reason Text,IIFinancialAdjustmentReasonText,I,/SMECoreSelfInvoice/CIIHSupplyChainTradeTransaction/II/II/II/II/I
v4.3,333,6,A,,UN01005490,BBIE,明細行調整金額,0..1,3462,CI_ Financial_ Adjustment,I,_,,"この明細行の調整金額（鑑ヘッダ調整金額で相殺処理）
＜調整理由コード=26＞
源泉所得税",,,CI_ Financial_ Adjustment. Actual. Amount,An actual monetary value added or subtracted as a result of this CI financial adjustment.,Actual Amount,IIFinancialAdjustmentActualAmount,I,/SMECoreSelfInvoice/CIIHSupplyChainTradeTransaction/II/II/II/II/I
v4.3,334,6,C,,UN01014897,ASBIE,明細行調整／調整税グループ,0..1,3468,CI_ Financial_ Adjustment,I,,_,調整明細行の税率別税クラスに関するグループ,,,CI_ Financial_ Adjustment. Related. CI_ Trade_ Tax,A trade tax related to this CI financial adjustment.,Related Tax,IIFinancialAdjustmentRelatedTax,I,/SMECoreSelfInvoice/CIIHSupplyChainTradeTransaction/II/II/II/II/I
v4.3,336,7,A,,UN01005834,BBIE,明細行調整税タイプコード,0..1,4044,CI_ Trade_ Tax,I,_,,"税の種類を識別するコード
SWT(源泉所得税 )",UNCL5153,,CI_ Trade_ Tax. Type. Code,"The code specifying the type of CI trade related tax, levy or duty, such as a code for a Value Added Tax (VAT).",Type Code,IITaxTypeCode,I,/SMECoreSelfInvoice/CIIHSupplyChainTradeTransaction/II/II/II/II/I/I
v4.3,337,7,A,,UN01007174,BBIE,明細行調整税率,0..1,4062,CI_ Trade_ Tax,I,_,,調整明細行の税率,,,CI_ Trade_ Tax. Rate_ Applicable. Percent,"The applicable rate of CI trade tax, expressed as a percentage.",Applicable Rate Percent,IITaxRatePercent,I,/SMECoreSelfInvoice/CIIHSupplyChainTradeTransaction/II/II/II/II/I/I
v4.3,338,5,C,,UN01014643,ASBIE,明細行決済／調整グループ,0..n,2343,CIILB_ Supply Chain_ Trade Settlement,I,,I,明細行決済の調整に関するグループ,,,CIILB_ Supply Chain_ Trade Settlement. Specified. CI_ Financial_ Adjustment,A financial adjustment specified for this CIILB supply chain trade settlement.,Specified Financial Adjustment,IIFinancialAdjustment,II,/SMECoreSelfInvoice/CIIHSupplyChainTradeTransaction/II/II/II/II
v4.3,340,6,A,,UN01005488,BBIE,明細行調整理由コード,0..1,3460,CI_ Financial_ Adjustment,I,_,,30の場合（入金）,UNCL4465,,CI_ Financial_ Adjustment. Reason. Code,The code specifying a reason for this CI financial adjustment.,Reason Code,IIFinancialAdjustmentReasonCode,I,/SMECoreSelfInvoice/CIIHSupplyChainTradeTransaction/II/II/II/II/I
v4.3,341,6,A,,UN01005489,BBIE,明細行調整理由,0..1,3461,CI_ Financial_ Adjustment,I,_,,この明細行の調整理由を文字で表現した内容,,,CI_ Financial_ Adjustment. Reason. Text,"A reason, expressed as text, for this CI financial adjustment.",Reason Text,IIFinancialAdjustmentReasonText,I,/SMECoreSelfInvoice/CIIHSupplyChainTradeTransaction/II/II/II/II/I
v4.3,342,6,A,,UN01005490,BBIE,明細行調整金額,0..1,3462,CI_ Financial_ Adjustment,I,_,,"この明細行の調整金額30の場合＞
入金",,,CI_ Financial_ Adjustment. Actual. Amount,An actual monetary value added or subtracted as a result of this CI financial adjustment.,Actual Amount,IIFinancialAdjustmentActualAmount,I,/SMECoreSelfInvoice/CIIHSupplyChainTradeTransaction/II/II/II/II/I
v4,343,5,C,,UN01014644,ASBIE,明細行決裁／返金グループ,0..n,2344,CIILB_ Supply Chain_ Trade Settlement,I,,I,明細行の返金に関するグループ,,,CIILB_ Supply Chain_ Trade Settlement. Specified. CI_ Trade_ Allowance Charge,An allowance or charge specified for this CIILB supply chain trade settlement.,Specified Allowance Charge,IIAllowanceCharge,II,/SMECoreSelfInvoice/CIIHSupplyChainTradeTransaction/II/II/II/II
v4,345,6,A,,UN01005707,BBIE,"明細行返金・追加請求判別子
    =返金（Allowance）",1..1,3848,CI_ Trade_ Allowance Charge,I,_,,"明細行返金・追加請求判別子
false (Allowance）",JECxxxx,,CI_ Trade_ Allowance Charge. Charge. Indicator,The indication of whether or not this CI trade allowance charge is a charge.,Charge Indicator,IIAllowanceChargeChargeIndicator,I,/SMECoreSelfInvoice/CIIHSupplyChainTradeTransaction/II/II/II/II/I
v4,346,6,A,,UN01005713,BBIE,明細行返金金額,0..1,3854,CI_ Trade_ Allowance Charge,I,_,,この明細行に紐付く返金金額,,,CI_ Trade_ Allowance Charge. Actual. Amount,An actual monetary value of this CI trade allowance charge.,Actual Amount,IIAllowanceChargeActualAmount,I,/SMECoreSelfInvoice/CIIHSupplyChainTradeTransaction/II/II/II/II/I
v4,347,6,A,,UN01005714,BBIE,明細行返金理由コード,0..1,3855,CI_ Trade_ Allowance Charge,I,_,,この明細行の返金理由を識別するコード,UNCL4465,,CI_ Trade_ Allowance Charge. Reason. Code,The code specifying the reason for this CI trade allowance charge.,Reason Code,IIAllowanceChargeReasonCode,I,/SMECoreSelfInvoice/CIIHSupplyChainTradeTransaction/II/II/II/II/I
v4,348,6,A,,UN01005715,BBIE,明細行返金理由,0..1,3856,CI_ Trade_ Allowance Charge,I,_,,"この明細行の返金理由（内容）の説明
軽減税率対象の場合は軽減符号を付記",,,CI_ Trade_ Allowance Charge. Reason. Text,"The reason, expressed as text, for this CI trade allowance charge.",Reason Text,IIAllowanceChargeReasonText,I,/SMECoreSelfInvoice/CIIHSupplyChainTradeTransaction/II/II/II/II/I
v4,349,6,C,,UN01005716,ASBIE,明細行返金／明細行返金税グループ,0..1,3860,CI_ Trade_ Allowance Charge,I,,_,明細行返金の税に関するグループ,,,CI_ Trade_ Allowance Charge. Category. CI_ Trade_ Tax,A tax category of this CI trade allowance charge.,Tax Category,IIAllowanceChargeCategoryTax,I,/SMECoreSelfInvoice/CIIHSupplyChainTradeTransaction/II/II/II/II/I
v4,351,7,A,,UN01005841,BBIE,明細行返金課税分類コード,1..1,4051,CI_ Trade_ Tax,I,_,,明細行返金の課税分類コード,UNCL5305,,CI_ Trade_ Tax. Category. Code,"The code specifying the category to which this CI trade related tax, levy or duty applies, such as codes for ""Exempt from Tax"", ""Standard Rate"", ""Free Export Item - Tax Not Charged"" .",Category Code,IITaxCategoryCode,I,/SMECoreSelfInvoice/CIIHSupplyChainTradeTransaction/II/II/II/II/I/I
v4,352,7,A,,UN01007174,BBIE,明細行返金税率,0..1,4062,CI_ Trade_ Tax,I,_,,明細行返金の税率,,,CI_ Trade_ Tax. Rate_ Applicable. Percent,"The applicable rate of CI trade tax, expressed as a percentage.",Applicable Rate Percent,IITaxRatePercent,I,/SMECoreSelfInvoice/CIIHSupplyChainTradeTransaction/II/II/II/II/I/I
v4.1,353,5,C,,UN01014644,ASBIE,明細行決裁／追加請求グループ,0..n,2344,CIILB_ Supply Chain_ Trade Settlement,I,,I,明細行決裁／追加請求グループ,,,CIILB_ Supply Chain_ Trade Settlement. Specified. CI_ Trade_ Allowance Charge,An allowance or charge specified for this CIILB supply chain trade settlement.,Specified Allowance Charge,IIAllowanceCharge,II,/SMECoreSelfInvoice/CIIHSupplyChainTradeTransaction/II/II/II/II
v4.1,355,6,A,,UN01005707,BBIE,"明細行返金・追加請求判別子
    =追加請求（Charge）",1..1,3848,CI_ Trade_ Allowance Charge,I,_,,"明細行返金・追加請求判別子
true (Charge)",JECxxxx,,CI_ Trade_ Allowance Charge. Charge. Indicator,The indication of whether or not this CI trade allowance charge is a charge.,Charge Indicator,IIAllowanceChargeChargeIndicator,I,/SMECoreSelfInvoice/CIIHSupplyChainTradeTransaction/II/II/II/II/I
v4.1,356,6,A,,UN01005713,BBIE,明細行追加請求金額,0..1,3854,CI_ Trade_ Allowance Charge,I,_,,この明細行に紐付く追加請求金額。,,,CI_ Trade_ Allowance Charge. Actual. Amount,An actual monetary value of this CI trade allowance charge.,Actual Amount,IIAllowanceChargeActualAmount,I,/SMECoreSelfInvoice/CIIHSupplyChainTradeTransaction/II/II/II/II/I
v4.1,357,6,A,,UN01005714,BBIE,明細行追加請求理由コード,0..1,3855,CI_ Trade_ Allowance Charge,I,_,,この明細行の追加請求理由を識別するコード,UNCL4465,,CI_ Trade_ Allowance Charge. Reason. Code,The code specifying the reason for this CI trade allowance charge.,Reason Code,IIAllowanceChargeReasonCode,I,/SMECoreSelfInvoice/CIIHSupplyChainTradeTransaction/II/II/II/II/I
v4.1,358,6,A,,UN01005715,BBIE,明細行追加請求理由,0..1,3856,CI_ Trade_ Allowance Charge,I,_,,"この明細行の追加請求理由（内容）の説明
軽減税率対象の場合は軽減符号を付記",,,CI_ Trade_ Allowance Charge. Reason. Text,"The reason, expressed as text, for this CI trade allowance charge.",Reason Text,IIAllowanceChargeReasonText,I,/SMECoreSelfInvoice/CIIHSupplyChainTradeTransaction/II/II/II/II/I
v4,359,6,C,,UN01005716,ASBIE,明細行追加請求／明細行追加請求税グループ,0.1,3860,CI_ Trade_ Allowance Charge,I,,_,明細行追加請求の税に関するグループ,,,CI_ Trade_ Allowance Charge. Category. CI_ Trade_ Tax,A tax category of this CI trade allowance charge.,Tax Category,IIAllowanceChargeCategoryTax,I,/SMECoreSelfInvoice/CIIHSupplyChainTradeTransaction/II/II/II/II/I
v4,361,7,A,,UN01005841,BBIE,明細行追加請求課税分類コード,1..1,4051,CI_ Trade_ Tax,I,_,,明細行追加請求の課税分類コード,UNCL5305,,CI_ Trade_ Tax. Category. Code,"The code specifying the category to which this CI trade related tax, levy or duty applies, such as codes for ""Exempt from Tax"", ""Standard Rate"", ""Free Export Item - Tax Not Charged"" .",Category Code,IITaxCategoryCode,I,/SMECoreSelfInvoice/CIIHSupplyChainTradeTransaction/II/II/II/II/I/I
v4,362,7,A,,UN01007174,BBIE,明細行追加請求税率,0..1,4062,CI_ Trade_ Tax,I,_,,明細行追加請求の税率,,,CI_ Trade_ Tax. Rate_ Applicable. Percent,"The applicable rate of CI trade tax, expressed as a percentage.",Applicable Rate Percent,IITaxRatePercent,I,/SMECoreSelfInvoice/CIIHSupplyChainTradeTransaction/II/II/II/II/I/I
v4,363,5,C,,UN01014894,ASBIE,明細行／取引期間グループ,1..1,2345,CIILB_ Supply Chain_ Trade Settlement,I,,I,"明細行の取引期間に関する情報からなるグループ
明細文書ヘッダ、または明細行のいずれかの取引期間グループが法的必須
明細文書ヘッダ取引期間グループにデータ入力した場合は明細行取引期間グループのデータ入力は省略することができる",,,CIILB_ Supply Chain_ Trade Settlement. Billing. CI_ Specified_ Period,The billing period specified for this CIILB supply chain trade settlement.,Billing Period,IIBillingPeriod,II,/SMECoreSelfInvoice/CIIHSupplyChainTradeTransaction/II/II/II/II
v4,365,6,A,,UN01005612,BBIE,明細行取引開始日,0..1,3677,CI_ Specified_ Period,I,_,,この明細行の取引開始日,,,CI_ Specified_ Period. Start. Date Time,"The date, time, date time or other date time value for the start of this CI specified period of time.",Start Date Time,IIPeriodStartDateTime,I,/SMECoreSelfInvoice/CIIHSupplyChainTradeTransaction/II/II/II/II/I
v4,366,6,A,,UN01005613,BBIE,明細行取引終了日,0..1,3678,CI_ Specified_ Period,I,_,,この明細行の取引終了日,,,CI_ Specified_ Period. End. Date Time,"The date, time, date time or other date time value for the end of this CI specified period of time.",End Date Time,IIPeriodEndDateTime,I,/SMECoreSelfInvoice/CIIHSupplyChainTradeTransaction/II/II/II/II/I
v4.3,367,5,C,,JPSxxxxxxxx,ASBIE,明細行／会計アカウントグループ,0..1,0,CIILB_ Supply Chain_ Trade Settlement,I,,I,この明細行の会計アカウントに関するグループ,,,CIILB_ Supply Chain_ Trade Settlement. Receivable_ Specified. CI_ Trade_ Accounting Account,,,IIReceivableAccountingAccount,II,/SMECoreSelfInvoice/CIIHSupplyChainTradeTransaction/II/II/II/II
v4.3,369,6,A,,UN01005681,BBIE,明細行会計アカウントID,1..1,3818,CI_ Trade_ Accounting Account,I,_,,明細行会計アカウントのID,,,CI_ Trade_ Accounting Account. Identification. Identifier,The unique identifier for this CI trade accounting account.,ID,IIAccountingAccountID,I,/SMECoreSelfInvoice/CIIHSupplyChainTradeTransaction/II/II/II/II/I
