version,sme_nr,mbie_nr,level,UNID,acronym,label_local,multiplicity,multiplicity_SME,property_type,class_term,sequence,identifier,property_term,representation_term,associated_class,definition_local,code_list,attribute,DEN,definition,short_name,name,element,xpath
v4,326,2272,2,UN01005930,ASBIE,インボイス文書決済／インボイス文書合計金額グループ,0..1,0..1,Composition,CIIH_ Supply Chain_ Trade Settlement,15,,Specified,,CIIH_ Trade Settlement_ Monetary Summation,インボイス文書の合計金額に関するグループ,,,CIIH_ Supply Chain_ Trade Settlement. Specified. CIIH_ Trade Settlement_ Monetary Summation,The CIIH trade settlement monetary summation specified for this CIIH supply chain trade settlement.,Monetary Summation,TransactionMonetarySummation,SpecifiedCIIHTradeSettlementMonetarySummation,/SMEConsolidatedSelfInvoice/CIIHSupplyChainTradeTransaction/ApplicableCIIHSupplyChainTradeSettlement/SpecifiedCIIHTradeSettlementMonetarySummation
v4,336,2273,2,UN01005931,ASBIE,"インボイス文書決済／鑑ヘッダ調整グループ
（修正差額調整）",0..n,0..1,Composition,CIIH_ Supply Chain_ Trade Settlement,16,,Specified,,CI_ Financial_ Adjustment,インボイス文書の鑑ヘッダ調整に関するグループ,,,CIIH_ Supply Chain_ Trade Settlement. Specified. CI_ Financial_ Adjustment,A Cross Industry (CI) financial adjustment specified for this CIIH supply chain trade settlement.,Financial Adjustment,TransactionFinancialAdjustment,SpecifiedCIFinancialAdjustment,/SMEConsolidatedSelfInvoice/CIIHSupplyChainTradeTransaction/ApplicableCIIHSupplyChainTradeSettlement/SpecifiedCIFinancialAdjustment
v4,349,2286,2,UN01015492,ASBIE,インボイス文書決済／未決済合計金額グループ,0..1,0..1,Composition,CIIH_ Supply Chain_ Trade Settlement,29,,Outstanding_ Specified,,CIIH_ Trade Settlement_ Monetary Summation,未決済合計金額に関するグループ,,,CIIH_ Supply Chain_ Trade Settlement. Outstanding_ Specified. CIIH_ Trade Settlement_ Monetary Summation,The monetary summation totals outstanding for this CIIH supply chain trade settlement.,Outstanding Monetary Summation,TransactionOutstandingMonetarySummation,OutstandingSpecifiedCIIHTradeSettlementMonetarySummation,/SMEConsolidatedSelfInvoice/CIIHSupplyChainTradeTransaction/ApplicableCIIHSupplyChainTradeSettlement/OutstandingSpecifiedCIIHTradeSettlementMonetarySummation
v4.3,354,2287,2,UN01015598,ASBIE,インボイス文書決済／前払グループ,0..n,0..n,Composition,CIIH_ Supply Chain_ Trade Settlement,30,,Specified,,CI_ Advance_ Payment,前払に関するグループ,,,CIIH_ Supply Chain_ Trade Settlement. Specified. CI_ Advance_ Payment,An advance payment specified for this CIIH supply chain trade settlement.,Advance Payment,TransactionAdvancePayment,SpecifiedCIAdvancePayment,/SMEConsolidatedSelfInvoice/CIIHSupplyChainTradeTransaction/ApplicableCIIHSupplyChainTradeSettlement/SpecifiedCIAdvancePayment
v4,278,3889,1,UN01005738,ABIE,支払為替クラス,,,Class,CI_ Trade_ Currency Exchange,0,,,,,支払為替に関する情報からなるクラス,,,CI_ Trade_ Currency Exchange. Details,The conversion of one currency to another for Cross Industry (CI) trade purposes.,CI Currency Exchange,TransactionCurrencyExchangeDetails,CITradeCurrencyExchange,
v4,279,3890,2,UN01005739,BBIE,為替交換元通貨コード,1..1,0..1,Attribute,CI_ Trade_ Currency Exchange,1,,Source Currency,Code,,為替における交換元通貨を表すコード,"通貨コード
ISO4217",,CI_ Trade_ Currency Exchange. Source Currency. Code,The code specifying the source currency of a CI trade currency conversion.,Source Currency Code,PaymentCurrencyExchangeSourceCurrencyCode,SourceCurrencyCode,/SMEConsolidatedSelfInvoice/CIIHSupplyChainTradeTransaction/ApplicableCIIHSupplyChainTradeSettlement/PaymentApplicableCITradeCurrencyExchange/SourceCurrencyCode
v4,280,3892,2,UN01005741,BBIE,為替交換先通貨コード,1..1,0..1,Attribute,CI_ Trade_ Currency Exchange,3,,Target Currency,Code,,為替における交換先通貨を表すコード,"通貨コード
ISO4217",,CI_ Trade_ Currency Exchange. Target Currency. Code,The code specifying the target currency of a CI trade currency conversion.,Target Currency Code,PaymentCurrencyExchangeTargetCurrencyCode,TargetCurrencyCode,/SMEConsolidatedSelfInvoice/CIIHSupplyChainTradeTransaction/ApplicableCIIHSupplyChainTradeSettlement/PaymentApplicableCITradeCurrencyExchange/TargetCurrencyCode
v4,281,3895,2,UN01005744,BBIE,為替レート,1..1,0..1,Attribute,CI_ Trade_ Currency Exchange,6,,Conversion,Rate,,為替交換のレート,,,CI_ Trade_ Currency Exchange. Conversion. Rate,The rate used for conversion from the source currency to the target currency for CI trade purposes.,Conversion Rate,PaymentCurrencyExchangeConversionRate,ConversionRate,/SMEConsolidatedSelfInvoice/CIIHSupplyChainTradeTransaction/ApplicableCIIHSupplyChainTradeSettlement/PaymentApplicableCITradeCurrencyExchange/ConversionRate
v4,282,3896,2,UN01005745,BBIE,為替レート日時,0..1,0..1,Attribute,CI_ Trade_ Currency Exchange,7,,Conversion Rate,Date Time,,為替交換レートの適用日。,,,CI_ Trade_ Currency Exchange. Conversion Rate. Date Time,"The date, time, date time or other date time value of the conversion rate for this CI trade currency exchange.",Conversion Rate Date Time,PaymentCurrencyExchangeConversionRateDateTime,ConversionRateDateTime,/SMEConsolidatedSelfInvoice/CIIHSupplyChainTradeTransaction/ApplicableCIIHSupplyChainTradeSettlement/PaymentApplicableCITradeCurrencyExchange/ConversionRateDateTime
v4,284,3805,1,UN01005670,ABIE,支払手段クラス,,,Class,CI_ Trade Settlement_ Payment Means,0,,,,,取引決済の目的で支払が行われる、あるいは行われた手段のクラス,,,CI_ Trade Settlement_ Payment Means. Details,The means by which a payment will be or has been made for Cross Industry (CI) trade settlement purposes.,CI Trade Settlement Payment Means,TransactionPaymentMeansDetails,CITradeSettlementPaymentMeans,
v4,285,3807,2,UN01005672,BBIE,支払手段タイプコード,0..1,0..1,Attribute,CI_ Trade Settlement_ Payment Means,2,,Type,Code,,取引決済手段のタイプを識別するコード,UNCL4461,,CI_ Trade Settlement_ Payment Means. Type. Code,"The code specifying the type of CI trade settlement payment means, such as cash or cheque.",Type Code,PaymentMeansTypeCode,TypeCode,/SMEConsolidatedSelfInvoice/CIIHSupplyChainTradeTransaction/ApplicableCIIHSupplyChainTradeSettlement/SpecifiedCITradeSettlementPaymentMeans/TypeCode
v4,286,3811,2,UN01011456,BBIE,支払手段情報,0..n,0..1,Attribute,CI_ Trade Settlement_ Payment Means,6,,Information,Text,,取引決済手段に関する情報,,,CI_ Trade Settlement_ Payment Means. Information. Text,"Information, expressed as text, for this CI trade settlement payment means.",Information,PaymentMeansInformationText,InformationText,/SMEConsolidatedSelfInvoice/CIIHSupplyChainTradeTransaction/ApplicableCIIHSupplyChainTradeSettlement/SpecifiedCITradeSettlementPaymentMeans/Information
v4.0.1,287,3812,2,UN01015504,BBIE,支払金額,0..1,0..1,Attribute,CI_ Trade Settlement_ Payment Means,7,,Paid,Amount,,取引決済手段で支払う金額,,,CI_ Trade Settlement_ Payment Means. Paid. Amount,The monetary value paid or to be paid by this CI trade settlement payment means.,Paid Amount,PaymentMeansPaidAmount,PaidAmount,/SMEConsolidatedSelfInvoice/CIIHSupplyChainTradeTransaction/ApplicableCIIHSupplyChainTradeSettlement/SpecifiedCITradeSettlementPaymentMeans/PaidAmount
v1,288,3814,2,UN01005677,ASBIE,支払手段／金融口座グループ,0..1,0..n,Composition,CI_ Trade Settlement_ Payment Means,2,,Payee_ Party,,CI_ Creditor_ Financial Account,取引決済の支払手段に関する受取人である当事者の債権者金融口座のグループ,,,CI_ Trade Settlement_ Payment Means. Payee_ Party. CI_ Creditor_ Financial Account,The creditor financial account of the payee party for this CI trade settlement payment means.,Payee Creditor Financial Account,PaymentMeansPayeeCreditorFinancialAccount,PayeePartyCICreditorFinancialAccount,/SMEConsolidatedSelfInvoice/CIIHSupplyChainTradeTransaction/ApplicableCIIHSupplyChainTradeSettlement/SpecifiedCITradeSettlementPaymentMeans/PayeePartyCICreditorFinancialAccount
v1,293,3816,2,UN01005679,ASBIE,支払手段／金融機関グループ,0..1,0..n,Composition,CI_ Trade Settlement_ Payment Means,4,,Payee_ Specified,,CI_ Creditor_ Financial Institution,取引決済の支払手段に対して特定された受取人である当事者の債権者金融機関のグループ,,,CI_ Trade Settlement_ Payment Means. Payee_ Specified. CI_ Creditor_ Financial Institution,The creditor financial institution of the payee party specified for this CI trade settlement payment means.,Payee Creditor Financial Institution,PaymentMeansPayeeCreditorFinancialInstitution,PayeeSpecifiedCICreditorFinancialInstitution,/SMEConsolidatedSelfInvoice/CIIHSupplyChainTradeTransaction/ApplicableCIIHSupplyChainTradeSettlement/SpecifiedCITradeSettlementPaymentMeans/PayeeSpecifiedCICreditorFinancialInstitution
v4,301,3817,2,UN01006057,ASBIE,支払手段／金融カードグループ,0..1,0..1,Composition,CI_ Trade Settlement_ Payment Means,5,,Applicable,,Trade Settlement_ Financial Card,支払手段の金融カードに関するグループ,,,CI_ Trade Settlement_ Payment Means. Applicable. Trade Settlement_ Financial Card,The trade settlement financial card applicable to this CI trade settlement payment means.,Financial Card,PaymentMeansFinancialCard,ApplicableTradeSettlementFinancialCard,/SMEConsolidatedSelfInvoice/CIIHSupplyChainTradeTransaction/ApplicableCIIHSupplyChainTradeSettlement/SpecifiedCITradeSettlementPaymentMeans/ApplicableTradeSettlementFinancialCard
v1,289,3316,1,UN01005398,ABIE,金融口座クラス,,,Class,CI_ Creditor_ Financial Account,0,,,,,債権者の銀行口座のクラス,,,CI_ Creditor_ Financial Account. Details,A specific Cross Industry (CI) business arrangement whereby credits arising from transactions are recorded.,CI Creditor Financial Account,PaymentMeansCreditorFinancialAccountDetails,CICreditorFinancialAccount,
v1,290,3318,2,UN01005400,BBIE,口座名義,0..1,0..1,Attribute,CI_ Creditor_ Financial Account,2,,Account Name,Text,,"債権者金融口座の、文字で表現された口座名。
半角カナ（日本の場合）",,,CI_ Creditor_ Financial Account. Account Name. Text,"The account name, expressed as text, of this CI creditor financial account.",Name,PaymentMeansPayeeCreditorFinancialAccountAccountName,AccountName,/SMEConsolidatedSelfInvoice/CIIHSupplyChainTradeTransaction/ApplicableCIIHSupplyChainTradeSettlement/SpecifiedCITradeSettlementPaymentMeans/PayeePartyCICreditorFinancialAccount/AccountName
v1,291,3319,2,UN01005401,BBIE,口座番号,0..1,0..1,Attribute,CI_ Creditor_ Financial Account,3,,Proprietary_ Identification,Identifier,,債権者金融口座の一意の所有者ID。,,,CI_ Creditor_ Financial Account. Proprietary_ Identification. Identifier,The unique proprietary identifier for this CI creditor financial account.,Proprietary ID,PaymentMeansPayeeCreditorFinancialAccountProprietaryID,ProprietaryID,/SMEConsolidatedSelfInvoice/CIIHSupplyChainTradeTransaction/ApplicableCIIHSupplyChainTradeSettlement/SpecifiedCITradeSettlementPaymentMeans/PayeePartyCICreditorFinancialAccount/ProprietaryID
v4,292,3320,2,UN01012127,BBIE,口座種別コード,0..1,0..1,Attribute,CI_ Creditor_ Financial Account,4,,Type,Code,,債権者金融口座種別のコード。,預金項目コード,,CI_ Creditor_ Financial Account. Type. Code,The code specifying the type of financial account for this CI creditor.,Type Code,PaymentMeansPayeeCreditorFinancialAccountTypeCode,TypeCode,/SMEConsolidatedSelfInvoice/CIIHSupplyChainTradeTransaction/ApplicableCIIHSupplyChainTradeSettlement/SpecifiedCITradeSettlementPaymentMeans/PayeePartyCICreditorFinancialAccount/TypeCode
v1,294,3321,1,UN01005402,ABIE,金融機関クラス,,,Class,CI_ Creditor_ Financial Institution,0,,,,,金額を受け取る当事者の銀行、住宅金融組合、信用金庫、証券会社、あるいはそれと類似の事業機関。,,,CI_ Creditor_ Financial Institution. Details,"A bank, building society, credit union, stock brokerage, or similar business of the Cross Industry (CI) party that receives money.",CI Creditor Financial Institution,PaymentMeansCreditorFinancialInstitutionDetails,CICreditorFinancialInstitution,
v1,295,3345,2,UN01005426,BBIE,金融機関名,0..1,0..1,Attribute,CI_ Creditor_ Financial Institution,24,,Name,Text,,債権者金融機関の、文字で表現された名前。,,,CI_ Creditor_ Financial Institution. Name. Text,"The name, expressed as text, for this CI creditor financial institution.",Name,PaymentMeansPayeeCreditorFinancialInstitutionName,Name,/SMEConsolidatedSelfInvoice/CIIHSupplyChainTradeTransaction/ApplicableCIIHSupplyChainTradeSettlement/SpecifiedCITradeSettlementPaymentMeans/PayeeSpecifiedCICreditorFinancialInstitution/Name
v1,296,3346,2,UN01011521,BBIE,金融機関番号,0..1,0..1,Attribute,CI_ Creditor_ Financial Institution,25,,Japan Financial Institution Common_ Identification,Identifier,,債権者の金融機関番号（日本の場合）,,,CI_ Creditor_ Financial Institution. Japan Financial Institution Common_ Identification. Identifier,The Japan Financial Institution Common identifier as assigned by the Japanese Bankers Association for this CI creditor financial institution.,Japan Financial Institution Common ID,PaymentMeansPayeeCreditorFinancialInstitutionJapanFinancialInstitutionCommonID,JapanFinancialInstitutionCommonID,/SMEConsolidatedSelfInvoice/CIIHSupplyChainTradeTransaction/ApplicableCIIHSupplyChainTradeSettlement/SpecifiedCITradeSettlementPaymentMeans/PayeeSpecifiedCICreditorFinancialInstitution/JapanFinancialInstitutionCommonID
v1,297,3348,2,UN01005428,ASBIE,金融機関／金融機関支店グループ,0..1,0..1,Composition,CI_ Creditor_ Financial Institution,2,,Sub-Division,,Branch_ Financial Institution,債権者金融機関の支店金融機関グループ,,,CI_ Creditor_ Financial Institution. Sub-Division. Branch_ Financial Institution,The sub-division (branch) financial institution for this CI creditor financial institution.,Branch,PaymentMeansPayeeCreditorFinancialInstitutionSub-DivisionBranchFinancialInstitution,Sub-DivisionBranchFinancialInstitution,/SMEConsolidatedSelfInvoice/CIIHSupplyChainTradeTransaction/ApplicableCIIHSupplyChainTradeSettlement/SpecifiedCITradeSettlementPaymentMeans/PayeeSpecifiedCICreditorFinancialInstitution/Sub-DivisionBranchFinancialInstitution
v1,298,1799,1,UN01003138,ABIE,金融機関支店クラス,,,Class,Branch_ Financial Institution,0,,,,,銀行、住宅金融組合、信用金庫、証券会社、あるいはそれと類似の事業の部門のクラス。主に金融サービスと金融取引を提供するために設立された機関の支店。,,,Branch_ Financial Institution. Details,"A sub-division of a bank, building society, credit union, stock brokerage, or similar business; established primarily to provide financial services and financial transactions.",Branch Financial Institution,PaymentMeansPayeeCreditorBranchFinancialInstitutionDetails,BranchFinancialInstitution,
v1,299,1800,2,UN01003139,BBIE,金融機関支店番号,0..1,0..1,Attribute,Branch_ Financial Institution,1,,Identification,Identifier,,金融機関のこの支店の一意ID,,,Branch_ Financial Institution. Identification. Identifier,The unique identifier for this branch of a financial institution.,ID,PaymentMeansPayeeCreditorSub-DivisionBranchFinancialInstitutionID,ID,/SMEConsolidatedSelfInvoice/CIIHSupplyChainTradeTransaction/ApplicableCIIHSupplyChainTradeSettlement/SpecifiedCITradeSettlementPaymentMeans/PayeeSpecifiedCICreditorFinancialInstitution/Sub-DivisionBranchFinancialInstitution/ID
v1,300,1801,2,UN01003140,BBIE,金融機関支店名,0..1,0..1,Attribute,Branch_ Financial Institution,2,,Name,Text,,金融機関のこの支店の、文字で表現された名前,,,Branch_ Financial Institution. Name. Text,"The name, expressed as text, for this branch of a financial institution.",Name,PaymentMeansPayeeCreditorSub-DivisionBranchFinancialInstitutionName,Name,/SMEConsolidatedSelfInvoice/CIIHSupplyChainTradeTransaction/ApplicableCIIHSupplyChainTradeSettlement/SpecifiedCITradeSettlementPaymentMeans/PayeeSpecifiedCICreditorFinancialInstitution/Sub-DivisionBranchFinancialInstitution/Name
v4,302,7922,1,UN01004493,ABIE,金融カードクラス,,,Class,Trade Settlement_ Financial Card,0,,,,,支払人の金融カードのクラス,,,Trade Settlement_ Financial Card. Details,A card used to represent a financial account for a trade settlement.,Trade Settlement Financial Card,PaymentMeansFinancialCardDetails,TradeSettlementFinancialCard,
v4,303,7924,2,UN01004495,BBIE,金融カード番号,0..1,1..1,Attribute,Trade Settlement_ Financial Card,2,PK,Identification,Identifier,,支払人の金融カード番号,,,Trade Settlement_ Financial Card. Identification. Identifier,"The unique identifier, commonly known as the card number, of this trade settlement financial card.",ID,PaymentMeansFinancialCardID,ID,/SMEConsolidatedSelfInvoice/CIIHSupplyChainTradeTransaction/ApplicableCIIHSupplyChainTradeSettlement/SpecifiedCITradeSettlementPaymentMeans/ApplicableTradeSettlementFinancialCard/ID
v4,304,7925,2,UN01004496,BBIE,金融カードタイプ,0..1,0..1,Attribute,Trade Settlement_ Financial Card,3,,Type,Code,,金融カードのタイプ,,,Trade Settlement_ Financial Card. Type. Code,"The code specifying the type of this trade settlement financial card, such as debit or credit.",Type Code,PaymentMeansFinancialCardTypeCode,TypeCode,/SMEConsolidatedSelfInvoice/CIIHSupplyChainTradeTransaction/ApplicableCIIHSupplyChainTradeSettlement/SpecifiedCITradeSettlementPaymentMeans/ApplicableTradeSettlementFinancialCard/TypeCode
v4,305,7926,2,UN01004497,BBIE,金融カード名義人名,0..1,0..1,Attribute,Trade Settlement_ Financial Card,4,,Cardholder Name,Text,,支払人の金融カード名義人名,,,Trade Settlement_ Financial Card. Cardholder Name. Text,The cardholder name as it appears on this trade settlement financial card. This may include both an individual authorized to use the card as well as the organization that owns the card.,Cardholder Name,PaymentMeansFinancialCardCardholderName,CardholderName,/SMEConsolidatedSelfInvoice/CIIHSupplyChainTradeTransaction/ApplicableCIIHSupplyChainTradeSettlement/SpecifiedCITradeSettlementPaymentMeans/ApplicableTradeSettlementFinancialCard/CardholderName
v4,306,7933,2,UN01009966,BBIE,金融カード発行企業名,0..n,0..1,Attribute,Trade Settlement_ Financial Card,11,,Issuing Company Name,Text,,金融カードの発行企業名,,,Trade Settlement_ Financial Card. Issuing Company Name. Text,"An issuing company name, expressed as text, for this trade settlement financial card.",Issuing Company Name,PaymentMeansFinancialCardIssuingCompanyName,IssuingCompanyName,/SMEConsolidatedSelfInvoice/CIIHSupplyChainTradeTransaction/ApplicableCIIHSupplyChainTradeSettlement/SpecifiedCITradeSettlementPaymentMeans/ApplicableTradeSettlementFinancialCard/IssuingCompanyName
v4,671,4043,1,UN01005832,ABIE,明細行追加請求税クラス,,,Class,CI_ Trade_ Tax,0,,,,,明細行追加請求の税クラス,,,CI_ Trade_ Tax. Details,"A Cross Industry (CI) trade related fiscal tax, duty or levy.",CI Trade Tax,SubordinateDocumentAllowanceChargeTaxDetails,CITradeTax,
v4,672,4052,2,UN01005841,BBIE,明細行追加請求課税分類コード,0..1,1..1,Attribute,CI_ Trade_ Tax,9,,Category,Code,,明細行追加請求の課税分類コード,UNCL5305,,CI_ Trade_ Tax. Category. Code,"The code specifying the category to which this CI trade related tax, levy or duty applies, such as codes for ""Exempt from Tax"", ""Standard Rate"", ""Free Export Item - Tax Not Charged"" .",Category Code,SubordinateDocumentAllowanceChargeTaxCategoryCode,CategoryCode,/SMEConsolidatedSelfInvoice/CIIHSupplyChainTradeTransaction/IncludedCIILSupplyChainTradeLineItem/SubordinateCIILBSubordinateTradeLineItem/SpecifiedCIILBSupplyChainTradeSettlement/SpecifiedCITradeAllowanceCharge/CategoryCITradeTax/CategoryCode
v4,673,4063,2,UN01007174,BBIE,明細行追加請求税率,0..1,0..1,Attribute,CI_ Trade_ Tax,20,,Rate_ Applicable,Percent,,明細行追加請求の税率,,,CI_ Trade_ Tax. Rate_ Applicable. Percent,"The applicable rate of CI trade tax, expressed as a percentage.",Applicable Rate Percent,SubordinateDocumentAllowanceChargeTaxRatePercent,RateApplicablePercent,/SMEConsolidatedSelfInvoice/CIIHSupplyChainTradeTransaction/IncludedCIILSupplyChainTradeLineItem/SubordinateCIILBSubordinateTradeLineItem/SpecifiedCIILBSupplyChainTradeSettlement/SpecifiedCITradeAllowanceCharge/CategoryCITradeTax/RateApplicablePercent
v4,675,3674,1,UN01005608,ABIE,明細行取引期間クラス,,,Class,CI_ Specified_ Period,0,,,,,明細行の取引期間に関する情報からなるクラス,,,CI_ Specified_ Period. Details,An interval of time specified for Cross Industry (CI) purposes.,CI Specified Period,SubordinateDocumentPeriodDetails,CISpecifiedPeriod,
v4,676,3678,2,UN01005612,BBIE,明細行取引開始日,0..1,0..1,Attribute,CI_ Specified_ Period,4,,Start,Date Time,,この明細行の取引開始日,,,CI_ Specified_ Period. Start. Date Time,"The date, time, date time or other date time value for the start of this CI specified period of time.",Start Date Time,SubordinateDocumentBillingPeriodStartDateTime,StartDateTime,/SMEConsolidatedSelfInvoice/CIIHSupplyChainTradeTransaction/IncludedCIILSupplyChainTradeLineItem/SubordinateCIILBSubordinateTradeLineItem/SpecifiedCIILBSupplyChainTradeSettlement/BillingCISpecifiedPeriod/StartDateTime
v4,677,3679,2,UN01005613,BBIE,明細行取引終了日,0..1,0..1,Attribute,CI_ Specified_ Period,5,,End,Date Time,,この明細行の取引終了日,,,CI_ Specified_ Period. End. Date Time,"The date, time, date time or other date time value for the end of this CI specified period of time.",End Date Time,SubordinateDocumentBillingPeriodEndDateTime,EndDateTime,/SMEConsolidatedSelfInvoice/CIIHSupplyChainTradeTransaction/IncludedCIILSupplyChainTradeLineItem/SubordinateCIILBSubordinateTradeLineItem/SpecifiedCIILBSupplyChainTradeSettlement/BillingCISpecifiedPeriod/EndDateTime
v4.1,363,3938,1,UN01005779,ABIE,前払支払条件クラス,,,Class,CI_ Trade_ Payment Terms,0,,,,,前払い支払条件のクラス,,,CI_ Trade_ Payment Terms. Details,Conditions by which payment has been or will be made for Cross Industry (CI) trade purposes.,CI Payment Terms,AdvancePaymentTermsDetails,CITradePaymentTerms,
v4.1,364,3948,2,UN01008502,BBIE,前払条件タイプコード,0..1,0..1,Attribute,CI_ Trade_ Payment Terms,10,,Type,Code,,前払い支払条件のタイプを指定するコード,UNCL4279,,CI_ Trade_ Payment Terms. Type. Code,The code specifying the type of these CI trade payment terms.,Type Code,AdvanceIdentifiedPaymentTermsTypeCode,TypeCode,/SMEConsolidatedSelfInvoice/CIIHSupplyChainTradeTransaction/ApplicableCIIHSupplyChainTradeSettlement/SpecifiedCIAdvancePayment/IdentifiedCITradePaymentTerms/TypeCode
v4,350,2293,1,UN01005941,ABIE,未決済合計金額クラス,,,Class,CIIH_ Trade Settlement_ Monetary Summation,0,,,,,未決済合計金額に関する情報からなるクラス,,,CIIH_ Trade Settlement_ Monetary Summation. Details,A collection of trade settlement monetary totals specified for this Cross Industry Invoice Header (CIIH).,CIIH Monetary Summation,TransactionMonetarySummationDetails,CIIHTradeSettlementMonetarySummation,
v4,351,2300,2,UN01005948,BBIE,前回インボイス総合計金額（税込み）,0..n,0..1,Attribute,CIIH_ Trade Settlement_ Monetary Summation,7,,Grand Total,Amount,,前回インボイス文書の総合計金額（税込み）,,,CIIH_ Trade Settlement_ Monetary Summation. Grand Total. Amount,"A monetary value of the grand total of this CIIH trade settlement monetary summation, including taxes and allowances and charges.",Grand Total Amount,OutstandingMonetarySummationGrandTotalAmount,GrandTotalAmount,/SMEConsolidatedSelfInvoice/CIIHSupplyChainTradeTransaction/ApplicableCIIHSupplyChainTradeSettlement/OutstandingSpecifiedCIIHTradeSettlementMonetarySummation/GrandTotalAmount
v4,352,2302,2,UN01005950,BBIE,入金済金額（前回インボイス分）,0..n,0..1,Attribute,CIIH_ Trade Settlement_ Monetary Summation,9,,Total Prepaid,Amount,,前回インボイス文書総合計金額のうち、入金済合計金額,,,CIIH_ Trade Settlement_ Monetary Summation. Total Prepaid. Amount,A monetary value of a prepaid total reported in this CIIH trade settlement monetary summation.,Total Prepaid Amount,OutstandingMonetarySummationTotalPrepaidAmount,TotalPrepaidAmount,/SMEConsolidatedSelfInvoice/CIIHSupplyChainTradeTransaction/ApplicableCIIHSupplyChainTradeSettlement/OutstandingSpecifiedCIIHTradeSettlementMonetarySummation/TotalPrepaidAmount
v4,353,2305,2,UN01008445,BBIE,未決済請求金額,0..n,0..1,Attribute,CIIH_ Trade Settlement_ Monetary Summation,12,,Due Payable,Amount,,"未決済請求金額＝
前回インボイス総合計金額（税込み）ー入金済金額(前回インボイス分)",,,CIIH_ Trade Settlement_ Monetary Summation. Due Payable. Amount,"A monetary value that is an amount due and payable for this CIIH trade settlement monetary summation, such as the amount due to the creditor.",Due Payable Amount,OutstandingMonetarySummationDuePayableAmount,DuePayableAmount,/SMEConsolidatedSelfInvoice/CIIHSupplyChainTradeTransaction/ApplicableCIIHSupplyChainTradeSettlement/OutstandingSpecifiedCIIHTradeSettlementMonetarySummation/DuePayableAmount
