version,sme_nr,mbie_nr,level,type,label_local,multiplicity,multiplicity_SME,class_term,sequence,identifier,property_term,representation_term,code_list,attribute,associated_class,definition_local,UNID,acronym,DEN,definition,short_name,name,element,xpath
v4,513,3628,5,A,（明細文書ヘッダ参照）文書タイプコード,0..1,0..1,CI_ Referenced_ Document,14,,Type,Code,UNCL1001,,,"この明細文書ヘッダ参照文書の文書タイプを識別するコード
＝「758」(Tender：入札書)
　　→JP-PINT[IBT-017]へマッピング",UN01009672,BBIE,CI_ Referenced_ Document. Type. Code,The code specifying the type of CI referenced document.,Type Code,DocumentReferencedDocumentTypeCode,TypeCode,/SMEConsolidatedSelfInvoice/CIIHSupplyChainTradeTransaction/IncludedCIILSupplyChainTradeLineItem/SpecifiedCIILSupplyChainTradeSettlement/AdditionalReferencedCIReferencedDocument/TypeCode
v4,514,3629,5,A,（明細文書ヘッダ参照）文書添付ファイル,0..n,0..1,CI_ Referenced_ Document,15,,Attachment,Binary Object,JECxxxx,,,"この参照文書に紐付く添付バイナリファイルの有無を指定
ありの場合は紐付ける「添付バイナリファイルID（UN01006015）」をBASE64で入力",UN01011455,BBIE,CI_ Referenced_ Document. Attachment. Binary Object,A binary object that is attached or otherwise appended to this CI referenced document.,Attached Binary Object,DocumentReferencedDocumentAttachmentBinaryObject,AttachmentBinaryObject,/SMEConsolidatedSelfInvoice/CIIHSupplyChainTradeTransaction/IncludedCIILSupplyChainTradeLineItem/SpecifiedCIILSupplyChainTradeSettlement/AdditionalReferencedCIReferencedDocument/AttachmentBinaryObject
v4,515,3636,5,A,（文書ヘッ参照）文書サブタイプコード,0..n,0..1,CI_ Referenced_ Document,22,,Subtype,Code,JECxxxx,,,この明細文書ヘッダ参照文書の文書サブタイプを識別するコード,UN01014899,BBIE,CI_ Referenced_ Document. Subtype. Code,A code specifying a subtype of this CI referenced document.,Subtype Code,DocumentReferencedDocumentSubtypeCode,SubtypeCode,/SMEConsolidatedSelfInvoice/CIIHSupplyChainTradeTransaction/IncludedCIILSupplyChainTradeLineItem/SpecifiedCIILSupplyChainTradeSettlement/AdditionalReferencedCIReferencedDocument/SubtypeCode
v4.1,516,2423,4,C,明細文書ヘッダ決済／参照文書グループ,0..n,0..n,CIIL_ Supply Chain_ Trade Settlement,10,,Additional_ Referenced,,,,CI_ Referenced_ Document,明細文書ヘッダ決済の参照文書に関するグループ,UN01006005,ASBIE,CIIL_ Supply Chain_ Trade Settlement. Additional_ Referenced. CI_ Referenced_ Document,An additional Cross Industry (CI) document referenced from this CIIL supply chain trade settlement.,Additional Document,DocumentReferencedReferencedDocument,AdditionalReferencedCIReferencedDocument,/SMEConsolidatedSelfInvoice/CIIHSupplyChainTradeTransaction/IncludedCIILSupplyChainTradeLineItem/SpecifiedCIILSupplyChainTradeSettlement/AdditionalReferencedCIReferencedDocument
v4.1,518,3615,5,A,（明細文書ヘッダ参照）文書ID,0..1,1..1,CI_ Referenced_ Document,1,PK,Issuer Assigned_ Identification,Identifier,,,,この明細文書ヘッダが参照する文書のID,UN01005580,BBIE,CI_ Referenced_ Document. Issuer Assigned_ Identification. Identifier,The issuer assigned identifier for this CI referenced document.,Issuer Assigned ID,DocumentReferencedDocumentIssuerAssignedID,IssuerAssignedID,/SMEConsolidatedSelfInvoice/CIIHSupplyChainTradeTransaction/IncludedCIILSupplyChainTradeLineItem/SpecifiedCIILSupplyChainTradeSettlement/AdditionalReferencedCIReferencedDocument/IssuerAssignedID
v4.3,519,3616,5,A,（明細文書ヘッダ参照）文書URL_ID,0..1,0..1,CI_ Referenced_ Document,2,,URI_ Identification,Identifier,,,,この文書が参照する文書が所在するURL_ID,UN01005581,BBIE,CI_ Referenced_ Document. URI_ Identification. Identifier,The unique Uniform Resource Identifier (URI) for this CI referenced document.,URI,DocumentReferencedDocumentURIID,URIID,/SMEConsolidatedSelfInvoice/CIIHSupplyChainTradeTransaction/IncludedCIILSupplyChainTradeLineItem/SpecifiedCIILSupplyChainTradeSettlement/AdditionalReferencedCIReferencedDocument/URIID
v4.1,520,3617,5,A,（明細文書ヘッダ参照）文書発行日,0..1,0..1,CI_ Referenced_ Document,3,,Issue,Date Time,,,,この明細文書ヘッダが参照する文書に記載の発行日付,UN01005582,BBIE,CI_ Referenced_ Document. Issue. Date Time,The date or date time for the issuance of this CI referenced document.,Issue Date Time,DocumentReferencedDocumentIssueDateTime,IssueDateTime,/SMEConsolidatedSelfInvoice/CIIHSupplyChainTradeTransaction/IncludedCIILSupplyChainTradeLineItem/SpecifiedCIILSupplyChainTradeSettlement/AdditionalReferencedCIReferencedDocument/IssueDateTime
v4.1,521,3621,5,A,（明細文書ヘッダ参照）文書参照タイプコード,0..1,0..1,CI_ Referenced_ Document,7,,Reference_ Type,Code,UNCL1153,,,この明細文書ヘッダが参照する文書の参照タイプを識別するコード。,UN01005586,BBIE,CI_ Referenced_ Document. Reference_ Type. Code,The code specifying the reference type of this CI referenced document.,Reference Type Code,DocumentReferencedDocumentReferenceTypeCode,ReferenceTypeCode,/SMEConsolidatedSelfInvoice/CIIHSupplyChainTradeTransaction/IncludedCIILSupplyChainTradeLineItem/SpecifiedCIILSupplyChainTradeSettlement/AdditionalReferencedCIReferencedDocument/ReferenceTypeCode
v4.1,522,3623,5,A,（明細文書ヘッダ参照）文書履歴ID,0..1,0..1,CI_ Referenced_ Document,9,,Revision_ Identification,Identifier,,,,この明細文書ヘッダの参照文書の変更履歴を管理するID。,UN01005588,BBIE,CI_ Referenced_ Document. Revision_ Identification. Identifier,The unique identifier for a revision of this CI referenced document.,Revision ID,DocumentReferencedDocumentRevisionID,RevisionID,/SMEConsolidatedSelfInvoice/CIIHSupplyChainTradeTransaction/IncludedCIILSupplyChainTradeLineItem/SpecifiedCIILSupplyChainTradeSettlement/AdditionalReferencedCIReferencedDocument/RevisionID
v4.1,523,3625,5,A,（明細文書ヘッダ参照）文書説明,0..n,0..n,CI_ Referenced_ Document,11,,Information,Text,,,,この明細文書ヘッダの参照文書の説明,UN01006415,BBIE,CI_ Referenced_ Document. Information. Text,"Information, expressed as text, for this CI referenced document.",Information,DocumentReferencedDocumentInformationText,Information,/SMEConsolidatedSelfInvoice/CIIHSupplyChainTradeTransaction/IncludedCIILSupplyChainTradeLineItem/SpecifiedCIILSupplyChainTradeSettlement/AdditionalReferencedCIReferencedDocument/Information
v4.1,524,3628,5,A,（明細文書ヘッダ参照）文書タイプコード,0..1,0..1,CI_ Referenced_ Document,14,,Type,Code,UNCL1001,,,この明細文書ヘッダの参照文書の文書タイプを識別するコード,UN01009672,BBIE,CI_ Referenced_ Document. Type. Code,The code specifying the type of CI referenced document.,Type Code,DocumentReferencedDocumentTypeCode,TypeCode,/SMEConsolidatedSelfInvoice/CIIHSupplyChainTradeTransaction/IncludedCIILSupplyChainTradeLineItem/SpecifiedCIILSupplyChainTradeSettlement/AdditionalReferencedCIReferencedDocument/TypeCode
v4.1,525,3629,5,A,（明細文書ヘッダ参照）文書添付ファイル,0..n,0..1,CI_ Referenced_ Document,15,,Attachment,Binary Object,JECxxxx,,,"この参照文書に紐付く添付バイナリファイルの有無を指定
ありの場合は紐付ける「添付バイナリファイルID（UN01006015）」をBASE64で入力",UN01011455,BBIE,CI_ Referenced_ Document. Attachment. Binary Object,A binary object that is attached or otherwise appended to this CI referenced document.,Attached Binary Object,DocumentReferencedDocumentAttachmentBinaryObject,AttachmentBinaryObject,/SMEConsolidatedSelfInvoice/CIIHSupplyChainTradeTransaction/IncludedCIILSupplyChainTradeLineItem/SpecifiedCIILSupplyChainTradeSettlement/AdditionalReferencedCIReferencedDocument/AttachmentBinaryObject
v4.3,526,3634,5,A,（明細文書ヘッダ参照）文書類型コード,0..1,0..1,CI_ Referenced_ Document,20,,Category,Code,JECxxxx,,,明細文書ヘッダが参照する参照文書の類型を識別するコード,UN01013318,BBIE,CI_ Referenced_ Document. Category. Code,The code specifying the category of this CI referenced document.,Category Code,DocumentReferencedDocumentCategoryCode,CategoryCode,/SMEConsolidatedSelfInvoice/CIIHSupplyChainTradeTransaction/IncludedCIILSupplyChainTradeLineItem/SpecifiedCIILSupplyChainTradeSettlement/AdditionalReferencedCIReferencedDocument/CategoryCode
v4.1,527,3636,5,A,（明細文書ヘッダ参照）文書サブタイプコード,0..n,0..1,CI_ Referenced_ Document,22,,Subtype,Code,JECxxxx,,,この明細文書ヘッダの参照文書の文書サブタイプを識別するコード,UN01014899,BBIE,CI_ Referenced_ Document. Subtype. Code,A code specifying a subtype of this CI referenced document.,Subtype Code,DocumentReferencedDocumentSubtypeCode,SubtypeCode,/SMEConsolidatedSelfInvoice/CIIHSupplyChainTradeTransaction/IncludedCIILSupplyChainTradeLineItem/SpecifiedCIILSupplyChainTradeSettlement/AdditionalReferencedCIReferencedDocument/SubtypeCode
v4.1,528,2426,4,C,明細文書ヘッダ決済／会計アカウントグループ,0..n,0..1,CIIL_ Supply Chain_ Trade Settlement,13,,Receivable_ Specified,,,,CI_ Trade_ Accounting Account,この明細文書ヘッダの会計アカウントに関するグループ,UN01006079,ASBIE,CIIL_ Supply Chain_ Trade Settlement. Receivable_ Specified. CI_ Trade_ Accounting Account,A receivable Cross Industry (CI) accounting account specified for this CIIL supply chain trade settlement.,Accounts Receivable,DocumentReceivableAccountingAccount,ReceivableSpecifiedCITradeAccountingAccount,/SMEConsolidatedSelfInvoice/CIIHSupplyChainTradeTransaction/IncludedCIILSupplyChainTradeLineItem/SpecifiedCIILSupplyChainTradeSettlement/ReceivableSpecifiedCITradeAccountingAccount
v4.3,530,3819,5,A,明細文書ヘッダ会計アカウントID,1..1,1..1,CI_ Trade_ Accounting Account,1,PK,Identification,Identifier,,,,明細文書ヘッダ会計アカウントのID,UN01005681,BBIE,CI_ Trade_ Accounting Account. Identification. Identifier,The unique identifier for this CI trade accounting account.,ID,DocumentReceivableAccountingAccountID,ID,/SMEConsolidatedSelfInvoice/CIIHSupplyChainTradeTransaction/IncludedCIILSupplyChainTradeLineItem/SpecifiedCIILSupplyChainTradeSettlement/ReceivableSpecifiedCITradeAccountingAccount/ID
v4.1,531,3821,5,A,明細文書ヘッダ会計アカウントタイプコード,0..1,1..1,CI_ Trade_ Accounting Account,3,,Type,Code,,,,明細文書ヘッダ会計アカウントのタイプコード,UN01005683,BBIE,CI_ Trade_ Accounting Account. Type. Code,"The code specifying the type of CI trade accounting account, such as general (main), secondary, cost accounting or budget account.",Type Code,DocumentReceivableAccountingAccountTypeCode,TypeCode,/SMEConsolidatedSelfInvoice/CIIHSupplyChainTradeTransaction/IncludedCIILSupplyChainTradeLineItem/SpecifiedCIILSupplyChainTradeSettlement/ReceivableSpecifiedCITradeAccountingAccount/TypeCode
v4.1,532,3823,5,A,明細文書ヘッダ会計アカウント名,0..1,0..1,CI_ Trade_ Accounting Account,5,,Name,Text,,,,明細文書ヘッダ会計アカウントの名称,UN01005685,BBIE,CI_ Trade_ Accounting Account. Name. Text,"The name, expressed as text, of this CI trade accounting account.",Name,DocumentReceivableAccountingAccountName,Name,/SMEConsolidatedSelfInvoice/CIIHSupplyChainTradeTransaction/IncludedCIILSupplyChainTradeLineItem/SpecifiedCIILSupplyChainTradeSettlement/ReceivableSpecifiedCITradeAccountingAccount/Name
v1,533,2408,3,C,請求文書ヘッダ／明細行グループ,0..n,1..n,CIIL_ Supply Chain_ Trade Line Item,6,,Subordinate,,,,CIILB_ Subordinate_ Trade Line Item,請求文書ヘッダの明細行に関するグループ。,UN01009669,ASBIE,CIIL_ Supply Chain_ Trade Line Item. Subordinate. CIILB_ Subordinate_ Trade Line Item,A CIILB trade line item subordinate to this supply chain trade line item.,Subordinate Trade Line Item,TransactionDocumentSubordinateSubordinateDocument,SubordinateCIILBSubordinateTradeLineItem,/SMEConsolidatedSelfInvoice/CIIHSupplyChainTradeTransaction/IncludedCIILSupplyChainTradeLineItem/SubordinateCIILBSubordinateTradeLineItem
v1,535,2317,4,A,明細行ID,0..n,1..1,CIILB_ Subordinate_ Trade Line Item,1,PK,Identification,Identifier,,,,この文書の明細行に関する情報を特定するために付与した行ID。明細行をユニークに識別するために付番する場合は文書IDとの複合キーで明細行を特定する。,UN01009648,BBIE,CIILB_ Subordinate_ Trade Line Item. Identification. Identifier,An identifier for this CIILB subordinate trade line item.,ID,SubordinateDocumentID,ID,/SMEConsolidatedSelfInvoice/CIIHSupplyChainTradeTransaction/IncludedCIILSupplyChainTradeLineItem/SubordinateCIILBSubordinateTradeLineItem/ID
v4,536,2318,4,A,明細行類型コード,0..1,0..1,CIILB_ Subordinate_ Trade Line Item,2,,Category,Code,JECxxxx,,,"この明細行の取引類型（資産譲渡、返金・追加請求、調整等）を識別するコード。
デフォルトは「資産譲渡」",UN01014637,BBIE,CIILB_ Subordinate_ Trade Line Item. Category. Code,The code specifying the category of this CIILB subordinate trade line item.,Category Code,SubordinateDocumentCategoryCode,CategoryCode,/SMEConsolidatedSelfInvoice/CIIHSupplyChainTradeTransaction/IncludedCIILSupplyChainTradeLineItem/SubordinateCIILBSubordinateTradeLineItem/CategoryCode
v4.2,537,2326,4,C,明細行／注釈グループ,0..n,0..n,CIILB_ Subordinate_ Trade Line Item,6,,Included,,,,CI_ Note,明細行の注釈に関するグループ,UN01015533,ASBIE,CIILB_ Subordinate_ Trade Line Item. Included. CI_ Note,A note included in this CIILB subordinate trade line item.,Included Note,SubordinateDocumentNote,IncludedCINote,/SMEConsolidatedSelfInvoice/CIIHSupplyChainTradeTransaction/IncludedCIILSupplyChainTradeLineItem/SubordinateCIILBSubordinateTradeLineItem/IncludedCINote
v4.1,539,3579,5,A,明細行注釈表題,0..1,0..1,CI_ Note,1,,Subject,Text,,,,"明細行の注釈内容の表題を示す。
一部に利用制限あり。標準仕様書３．３．５項参照",UN01005558,BBIE,CI_ Note. Subject. Text,"The subject, expressed as text, of this CI note.",Subject Text,SubordinateDocumentNoteSubjectText,Subject,/SMEConsolidatedSelfInvoice/CIIHSupplyChainTradeTransaction/IncludedCIILSupplyChainTradeLineItem/SubordinateCIILBSubordinateTradeLineItem/IncludedCINote/Subject
v4.1,540,3581,5,A,明細行注釈内容,0..n,0..1,CI_ Note,3,,Content,Text,,,,"明細行の注釈表題毎の内容情報を入力するフリースペース。
一部に利用制限あり。標準仕様書３．３．５項参照",UN01005560,BBIE,CI_ Note. Content. Text,"Content, expressed as text, of this CI note.",Content Text,SubordinateDocumentNoteContentText,Content,/SMEConsolidatedSelfInvoice/CIIHSupplyChainTradeTransaction/IncludedCIILSupplyChainTradeLineItem/SubordinateCIILBSubordinateTradeLineItem/IncludedCINote/Content
v4.1,541,3583,5,A,明細行注釈ID,0..1,0..1,CI_ Note,5,,Identification,Identifier,,,,"明細行注釈の識別ID
共通EDIプロバイダがシリアル番号をセット。標準仕様書３．３．５項参照",UN01005562,BBIE,CI_ Note. Identification. Identifier,The unique identifier for this CI note.,ID,SubordinateDocumentNoteID,ID,/SMEConsolidatedSelfInvoice/CIIHSupplyChainTradeTransaction/IncludedCIILSupplyChainTradeLineItem/SubordinateCIILBSubordinateTradeLineItem/IncludedCINote/ID
v1,542,2323,4,C,明細行／取引契約グループ,0..1,1..1,CIILB_ Subordinate_ Trade Line Item,3,,Specified,,,,CIILB_ Supply Chain_ Trade Agreement,明細行の取引契約に関するグループ,UN01009649,ASBIE,CIILB_ Subordinate_ Trade Line Item. Specified. CIILB_ Supply Chain_ Trade Agreement,The supply chain trade agreement specified for this CIILB subordinate trade line item.,Trade Agreement,SubordinateDocument,SpecifiedCIILBSupplyChainTradeAgreement,/SMEConsolidatedSelfInvoice/CIIHSupplyChainTradeTransaction/IncludedCIILSupplyChainTradeLineItem/SubordinateCIILBSubordinateTradeLineItem/SpecifiedCIILBSupplyChainTradeAgreement
v1,544,2328,5,C,明細行契約／明細行参照受注書グループ,0..1,0..1,CIILB_ Supply Chain_ Trade Agreement,1,,Seller Order_ Referenced,,,,CI_ Referenced_ Document,取引契約と明細行参照受注書に関するグループ,UN01009654,ASBIE,CIILB_ Supply Chain_ Trade Agreement. Seller Order_ Referenced. CI_ Referenced_ Document,The seller order document referenced in this CIILB supply chain trade agreement.,Seller Order Document,SubordinateDocumentSellerOrderReferencedReferencedDocument,SellerOrderReferencedCIReferencedDocument,/SMEConsolidatedSelfInvoice/CIIHSupplyChainTradeTransaction/IncludedCIILSupplyChainTradeLineItem/SubordinateCIILBSubordinateTradeLineItem/SpecifiedCIILBSupplyChainTradeAgreement/SellerOrderReferencedCIReferencedDocument
v1,546,3615,6,A,（明細行参照）受注書ID,0..1,1..1,CI_ Referenced_ Document,1,PK,Issuer Assigned_ Identification,Identifier,,,,この明細行が参照する受注書に記載の文書ID,UN01005580,BBIE,CI_ Referenced_ Document. Issuer Assigned_ Identification. Identifier,The issuer assigned identifier for this CI referenced document.,Issuer Assigned ID,SubordinateDocumentSellerOrderReferencedDocumentIssuerAssignedID,IssuerAssignedID,/SMEConsolidatedSelfInvoice/CIIHSupplyChainTradeTransaction/IncludedCIILSupplyChainTradeLineItem/SubordinateCIILBSubordinateTradeLineItem/SpecifiedCIILBSupplyChainTradeAgreement/SellerOrderReferencedCIReferencedDocument/IssuerAssignedID
v4.3,547,3616,6,A,（明細行参照）文書URI,0..1,0..1,CI_ Referenced_ Document,2,,URI_ Identification,Identifier,,,,この明細行が参照する文書が所在するURL_ID,UN01005581,BBIE,CI_ Referenced_ Document. URI_ Identification. Identifier,The unique Uniform Resource Identifier (URI) for this CI referenced document.,URI,SubordinateDocumentSellerOrderReferencedDocumentURIID,URIID,/SMEConsolidatedSelfInvoice/CIIHSupplyChainTradeTransaction/IncludedCIILSupplyChainTradeLineItem/SubordinateCIILBSubordinateTradeLineItem/SpecifiedCIILBSupplyChainTradeAgreement/SellerOrderReferencedCIReferencedDocument/URIID
v4.3,548,3617,6,A,（明細行参照）文書発行日,0..1,0..1,CI_ Referenced_ Document,3,,Issue,Date Time,,,,この明細行が参照する文書に記載の発行日付,UN01005582,BBIE,CI_ Referenced_ Document. Issue. Date Time,The date or date time for the issuance of this CI referenced document.,Issue Date Time,SubordinateDocumentSellerOrderReferencedDocumentIssueDateTime,IssueDateTime,/SMEConsolidatedSelfInvoice/CIIHSupplyChainTradeTransaction/IncludedCIILSupplyChainTradeLineItem/SubordinateCIILBSubordinateTradeLineItem/SpecifiedCIILBSupplyChainTradeAgreement/SellerOrderReferencedCIReferencedDocument/IssueDateTime
v1,549,3620,6,A,（明細行参照）受注書明細行ID,0..1,1..1,CI_ Referenced_ Document,6,PK,Line,Identifier,,,,この明細行が参照する受注書に記載の明細行ID,UN01005585,BBIE,CI_ Referenced_ Document. Line. Identifier,The unique identifier of a line in this CI referenced document.,Line ID,SubordinateItemSellerOrderReferencedDocumentLineID,LineID,/SMEConsolidatedSelfInvoice/CIIHSupplyChainTradeTransaction/IncludedCIILSupplyChainTradeLineItem/SubordinateCIILBSubordinateTradeLineItem/SpecifiedCIILBSupplyChainTradeAgreement/SellerOrderReferencedCIReferencedDocument/LineID
v4,550,3623,6,A,（明細行参照）受注書履歴ID,0..1,0..1,CI_ Referenced_ Document,9,,Revision_ Identification,Identifier,,,,この明細行が参照する受注書の変更履歴を管理するID。,UN01005588,BBIE,CI_ Referenced_ Document. Revision_ Identification. Identifier,The unique identifier for a revision of this CI referenced document.,Revision ID,SubordinateDocumentSellerOrderReferencedDocumentRevisionID,RevisionID,/SMEConsolidatedSelfInvoice/CIIHSupplyChainTradeTransaction/IncludedCIILSupplyChainTradeLineItem/SubordinateCIILBSubordinateTradeLineItem/SpecifiedCIILBSupplyChainTradeAgreement/SellerOrderReferencedCIReferencedDocument/RevisionID
v1,551,2329,5,C,明細行契約／明細行参照注文書グループ,0..1,0..1,CIILB_ Supply Chain_ Trade Agreement,2,,Buyer Order_ Referenced,,,,CI_ Referenced_ Document,取引契約と明細行参照注文書に関するグループ,UN01009655,ASBIE,CIILB_ Supply Chain_ Trade Agreement. Buyer Order_ Referenced. CI_ Referenced_ Document,The buyer order document referenced in this CIILB supply chain trade agreement.,Buyer Order Document,SubordinateDocumentBuyerOrderReferencedReferencedDocument,BuyerOrderReferencedCIReferencedDocument,/SMEConsolidatedSelfInvoice/CIIHSupplyChainTradeTransaction/IncludedCIILSupplyChainTradeLineItem/SubordinateCIILBSubordinateTradeLineItem/SpecifiedCIILBSupplyChainTradeAgreement/BuyerOrderReferencedCIReferencedDocument
v1,553,3615,6,A,（明細行参照）注文書ID,0..1,1..1,CI_ Referenced_ Document,1,PK,Issuer Assigned_ Identification,Identifier,,,,この明細行が参照する注文書に記載の文書ID,UN01005580,BBIE,CI_ Referenced_ Document. Issuer Assigned_ Identification. Identifier,The issuer assigned identifier for this CI referenced document.,Issuer Assigned ID,SubordinateDocumentBuyerOrderReferencedDocumentIssuerAssignedID,IssuerAssignedID,/SMEConsolidatedSelfInvoice/CIIHSupplyChainTradeTransaction/IncludedCIILSupplyChainTradeLineItem/SubordinateCIILBSubordinateTradeLineItem/SpecifiedCIILBSupplyChainTradeAgreement/BuyerOrderReferencedCIReferencedDocument/IssuerAssignedID
v4.3,554,3616,6,A,（明細行参照）文書URI,0..1,0..1,CI_ Referenced_ Document,2,,URI_ Identification,Identifier,,,,この明細行が参照する文書が所在するURL_ID,UN01005581,BBIE,CI_ Referenced_ Document. URI_ Identification. Identifier,The unique Uniform Resource Identifier (URI) for this CI referenced document.,URI,SubordinateDocumentBuyerOrderReferencedDocumentURIID,URIID,/SMEConsolidatedSelfInvoice/CIIHSupplyChainTradeTransaction/IncludedCIILSupplyChainTradeLineItem/SubordinateCIILBSubordinateTradeLineItem/SpecifiedCIILBSupplyChainTradeAgreement/BuyerOrderReferencedCIReferencedDocument/URIID
v4.3,555,3617,6,A,（明細行参照）文書発行日,0..1,0..1,CI_ Referenced_ Document,3,,Issue,Date Time,,,,この明細行が参照する文書に記載の発行日付,UN01005582,BBIE,CI_ Referenced_ Document. Issue. Date Time,The date or date time for the issuance of this CI referenced document.,Issue Date Time,SubordinateDocumentBuyerOrderReferencedDocumentIssueDateTime,IssueDateTime,/SMEConsolidatedSelfInvoice/CIIHSupplyChainTradeTransaction/IncludedCIILSupplyChainTradeLineItem/SubordinateCIILBSubordinateTradeLineItem/SpecifiedCIILBSupplyChainTradeAgreement/BuyerOrderReferencedCIReferencedDocument/IssueDateTime
v1,556,3620,6,A,（明細行参照）注文書明細行ID,0..1,1..1,CI_ Referenced_ Document,6,PK,Line,Identifier,,,,この明細行が参照する注文書に記載の明細行ID,UN01005585,BBIE,CI_ Referenced_ Document. Line. Identifier,The unique identifier of a line in this CI referenced document.,Line ID,SubordinateItemBuyerOrderReferencedDocumentLineID,LineID,/SMEConsolidatedSelfInvoice/CIIHSupplyChainTradeTransaction/IncludedCIILSupplyChainTradeLineItem/SubordinateCIILBSubordinateTradeLineItem/SpecifiedCIILBSupplyChainTradeAgreement/BuyerOrderReferencedCIReferencedDocument/LineID
v4,557,3623,6,A,（明細行参照）注文書履歴ID,0..1,0..1,CI_ Referenced_ Document,9,,Revision_ Identification,Identifier,,,,この明細行が参照する注文書の変更履歴を管理するID。,UN01005588,BBIE,CI_ Referenced_ Document. Revision_ Identification. Identifier,The unique identifier for a revision of this CI referenced document.,Revision ID,SubordinateDocumentBuyerOrderReferencedDocumentRevisionID,RevisionID,/SMEConsolidatedSelfInvoice/CIIHSupplyChainTradeTransaction/IncludedCIILSupplyChainTradeLineItem/SubordinateCIILBSubordinateTradeLineItem/SpecifiedCIILBSupplyChainTradeAgreement/BuyerOrderReferencedCIReferencedDocument/RevisionID
v1,558,2330,5,C,明細行契約／明細行出荷案内書グループ,0..n,0..1,CIILB_ Supply Chain_ Trade Agreement,3,,Additional_ Referenced,,,,CI_ Referenced_ Document,"取引契約と明細行出荷案内書に関するグループ
UN01009672＝＝「351」Despatch advice（出荷案内書）を指定",UN01009656,ASBIE,CIILB_ Supply Chain_ Trade Agreement. Additional_ Referenced. CI_ Referenced_ Document,An additional document referenced in this CIILB supply chain trade agreement.,Additional Document,SubordinateDocumentReferencedReferencedDocument,AdditionalReferencedCIReferencedDocument,/SMEConsolidatedSelfInvoice/CIIHSupplyChainTradeTransaction/IncludedCIILSupplyChainTradeLineItem/SubordinateCIILBSubordinateTradeLineItem/SpecifiedCIILBSupplyChainTradeAgreement/AdditionalReferencedCIReferencedDocument
v1/v3,560,3615,6,A,（明細行参照）出荷案内書ID,0..1,1..1,CI_ Referenced_ Document,1,PK,Issuer Assigned_ Identification,Identifier,,,,この明細行が参照する文書に記載の文書ID。,UN01005580,BBIE,CI_ Referenced_ Document. Issuer Assigned_ Identification. Identifier,The issuer assigned identifier for this CI referenced document.,Issuer Assigned ID,SubordinateDocumentReferencedDocumentIssuerAssignedID,IssuerAssignedID,/SMEConsolidatedSelfInvoice/CIIHSupplyChainTradeTransaction/IncludedCIILSupplyChainTradeLineItem/SubordinateCIILBSubordinateTradeLineItem/SpecifiedCIILBSupplyChainTradeAgreement/AdditionalReferencedCIReferencedDocument/IssuerAssignedID
