version,sequence,UNID,acronym,level,label_local,type,depth,name,multiplicity,definition_local,DEN,definition,code_list,xpath
v4.3,164,UN01013040,BBIE,5,鑑ヘッダ修正差額調整消費税合計額,field,2,FinanalAdjustmentDiscrepanvyRelatedTaxGrandTotalAmount,0..1,鑑ヘッダ修正差額調整税率別消費税額の合計額,CI_ Trade_ Tax. Grand Total. Amount,The monetary value of the grand total of the basis plus tax for this CI trade tax.,,"/SMECoreSelfInvoice/CIIHSupplyChainTradeTransaction/ApplicableCIIHSupplyChainTradeSettlement/SpecifiedCIFinancialAdjustment[not(ReasonCode=""26"")]/RelatedCITradeTax/GrandTotalAmount"
v4,165,UN01005931,ASBIE,3,インボイス文書決済／鑑ヘッダ調整グループ,,,,0..1,インボイス文書の鑑ヘッダ調整に関するグループ,CIIH_ Supply Chain_ Trade Settlement. Specified. CI_ Financial_ Adjustment,A Cross Industry (CI) financial adjustment specified for this CIIH supply chain trade settlement.,,
v4,167,UN01005488,BBIE,4,鑑ヘッダ調整理由コード（源泉徴収）,field,1,FinanalAdjustmentWithholdingTaxReasonCode,0..1,"鑑ヘッダ調整金額の内容を識別するコード
26（源泉所得税：デフォルト）",CI_ Financial_ Adjustment. Reason. Code,The code specifying a reason for this CI financial adjustment.,UNCL4465,"/SMECoreSelfInvoice/CIIHSupplyChainTradeTransaction/ApplicableCIIHSupplyChainTradeSettlement/SpecifiedCIFinancialAdjustment[ReasonCode=""26""]/ReasonCode"
v4,168,UN01005489,BBIE,4,鑑ヘッダ調整理由（源泉徴収）,field,1,FinanalAdjustmentWithholdingTaxReasonText,0..1,鑑ヘッダ調整の内容説明（源泉徴収）,CI_ Financial_ Adjustment. Reason. Text,"A reason, expressed as text, for this CI financial adjustment.",,"/SMECoreSelfInvoice/CIIHSupplyChainTradeTransaction/ApplicableCIIHSupplyChainTradeSettlement/SpecifiedCIFinancialAdjustment[ReasonCode=""26""]/Reason"
v4,169,UN01005490,BBIE,4,鑑ヘッダ調整金額（源泉徴収額）,field,1,FinanalAdjustmentWithholdingTaxActualAmount,0..1,"鑑ヘッダ調整金額（鑑ヘッダで減額処理）
＜鑑ヘッダ調整理由コード=26の場合＞
　源泉所得税金額",CI_ Financial_ Adjustment. Actual. Amount,An actual monetary value added or subtracted as a result of this CI financial adjustment.,,"/SMECoreSelfInvoice/CIIHSupplyChainTradeTransaction/ApplicableCIIHSupplyChainTradeSettlement/SpecifiedCIFinancialAdjustment[ReasonCode=""26""]/ActualAmount"
v4,170,UN01015492,ASBIE,3,インボイス文書決済／未決済合計金額グループ,,,,0..1,未決済合計金額に関するグループ,CIIH_ Supply Chain_ Trade Settlement. Outstanding_ Specified. CIIH_ Trade Settlement_ Monetary Summation,The monetary summation totals outstanding for this CIIH supply chain trade settlement.,,
v4,172,UN01005948,BBIE,4,前回インボイス総合計金額（税込み）,field,1,OutstandingMonetarySummationGrandTotalAmount,0..1,前回インボイス文書の総合計金額（税込み）,CIIH_ Trade Settlement_ Monetary Summation. Grand Total. Amount,"A monetary value of the grand total of this CIIH trade settlement monetary summation, including taxes and allowances and charges.",,/SMECoreSelfInvoice/CIIHSupplyChainTradeTransaction/ApplicableCIIHSupplyChainTradeSettlement/OutstandingSpecifiedCIIHTradeSettlementMonetarySummation/GrandTotalAmount
v4,173,UN01005950,BBIE,4,入金済金額（前回インボイス分）,field,1,OutstandingMonetarySummationTotalPrepaidAmount,0..1,前回インボイス文書総合計金額のうち、入金済合計金額,CIIH_ Trade Settlement_ Monetary Summation. Total Prepaid. Amount,A monetary value of a prepaid total reported in this CIIH trade settlement monetary summation.,,/SMECoreSelfInvoice/CIIHSupplyChainTradeTransaction/ApplicableCIIHSupplyChainTradeSettlement/OutstandingSpecifiedCIIHTradeSettlementMonetarySummation/TotalPrepaidAmount
v4,174,UN01008445,BBIE,4,未決済合計金額,field,1,OutstandingMonetarySummationDuePayableAmount,0..1,"未決済合計金額
前回インボイス総合計金額（税込み）ー入金済金額(前回インボイス分)",CIIH_ Trade Settlement_ Monetary Summation. Due Payable. Amount,"A monetary value that is an amount due and payable for this CIIH trade settlement monetary summation, such as the amount due to the creditor.",,/SMECoreSelfInvoice/CIIHSupplyChainTradeTransaction/ApplicableCIIHSupplyChainTradeSettlement/OutstandingSpecifiedCIIHTradeSettlementMonetarySummation/DuePayableAmount
v4.3,175,UN01015598,ASBIE,3,インボイス文書決済／前払グループ,dimension,1,dTransactionAdvancePayment,0..n,前払に関するグループ,CIIH_ Supply Chain_ Trade Settlement. Specified. CI_ Advance_ Payment,An advance payment specified for this CIIH supply chain trade settlement.,,/SMECoreSelfInvoice/CIIHSupplyChainTradeTransaction/ApplicableCIIHSupplyChainTradeSettlement/SpecifiedCIAdvancePayment
v4.2,177,UN01015591,BBIE,4,前払金額（税込み）,field,2,AdvancePaymentPaidAmount,0..1,税込みの前払金額,CI_ Advance_ Payment. Paid. Amount,The monetary value of the funds or securities paid in this CI advance payment.,,/SMECoreSelfInvoice/CIIHSupplyChainTradeTransaction/ApplicableCIIHSupplyChainTradeSettlement/SpecifiedCIAdvancePayment/PaidAmount
v4.2,178,UN01015592,BBIE,4,前払日,field,2,AdvancePaymentFormattedReceivedDateTime,0..1,前払金額の支払日,CI_ Advance_ Payment. Formatted_ Received. Date Time,The formatted date or date time value when this CI advance payment has been received.,,/SMECoreSelfInvoice/CIIHSupplyChainTradeTransaction/ApplicableCIIHSupplyChainTradeSettlement/SpecifiedCIAdvancePayment/FormattedReceivedDateTime
v4.2,179,UN01015593,BBIE,4,前払ID,field,2,AdvancePaymentID,0..1,前払者が付与した前払ID,CI_ Advance_ Payment. Identification. Identifier,The identifier for this CI advance payment.,,/SMECoreSelfInvoice/CIIHSupplyChainTradeTransaction/ApplicableCIIHSupplyChainTradeSettlement/SpecifiedCIAdvancePayment/ID
v4.3,180,UN01015595,ASBIE,4,前払／参照文書グループ,,,,0..1,インボイス文書が参照する前払文書の情報に関するグループ,CI_ Advance_ Payment. Invoice_ Specified. CI_ Referenced_ Document,An invoice document referenced by this CI advance payment.,,
v4.3,182,UN01005580,BBIE,5,（前払参照）文書ID,field,2,AdvancePaymentInvoiceReferencedDocumentIssuerAssignedID,0..1,インボイス文書が参照する前払文書の文書ID,CI_ Referenced_ Document. Issuer Assigned_ Identification. Identifier,The issuer assigned identifier for this CI referenced document.,,/SMECoreSelfInvoice/CIIHSupplyChainTradeTransaction/ApplicableCIIHSupplyChainTradeSettlement/SpecifiedCIAdvancePayment/InvoiceSpecifiedCIReferencedDocument/IssuerAssignedID
v4.2,183,UN01015596,ASBIE,4,前払／支払条件グループ,,,,0..1,前払の支払条件に関するグループ,CI_ Advance_ Payment. Identified. CI_ Trade_ Payment Terms,The trade payment terms identified for this CI advance payment.,,
v4.1,185,UN01008502,BBIE,5,前払条件タイプコード,field,2,AdvanceIdentifiedPaymentTermsTypeCode,0..1,前払い支払条件のタイプを指定するコード,CI_ Trade_ Payment Terms. Type. Code,The code specifying the type of these CI trade payment terms.,UNCL4279,/SMECoreSelfInvoice/CIIHSupplyChainTradeTransaction/ApplicableCIIHSupplyChainTradeSettlement/SpecifiedCIAdvancePayment/IdentifiedCITradePaymentTerms/TypeCode
v4,186,UN01005940,ASBIE,2,インボイス文書取引／明細文書ヘッダグループ,,,,1..1,インボイス文書に組み込まれる明細文書ヘッダのグループ,CIIH_ Supply Chain_ Trade Transaction. Included. CIIL_ Supply Chain_ Trade Line Item,A Cross Industry Invoice Line (CIIL) supply chain trade line item included in this CIIH supply chain trade transaction.,,
v4,188,UN01005989,ASBIE,3,明細文書ヘッダ／明細文書グループ,,,,1..1,明細文書ヘッダの明細文書グループ。,CIIL_ Supply Chain_ Trade Line Item. Associated. CIIL_ Document Line_ Document,The document line associated with this CIIL supply chain trade line item.,,
v4,190,UN01005954,BBIE,4,明細文書ID,field,1,ItemAssoatedDocumentDocumentDocumentDocumentID,1..1,明細文書を識別するID。デフォルト=1。プロバイダがセットする,CIIL_ Document Line_ Document. Line. Identifier,The unique identifier of the line of this CIIL document line.,,/SMECoreSelfInvoice/CIIHSupplyChainTradeTransaction/IncludedCIILSupplyChainTradeLineItem/AssociatedCIILDocumentLineDocument/LineID
v4,191,UN01014645,BBIE,4,明細文書類型コード,field,1,ItemAssoatedDocumentDocumentDocumentCategoryCode,0..1,この明細文書の取引類型（資産譲渡、補完、返金・追加請求等）を識別するコード。,CIIL_ Document Line_ Document. Category. Code,The code specifying the category of this CIIL document line.,JECxxxx,/SMECoreSelfInvoice/CIIHSupplyChainTradeTransaction/IncludedCIILSupplyChainTradeLineItem/AssociatedCIILDocumentLineDocument/CategoryCode
v4,192,UN01005957,ASBIE,4,明細文書／注釈グループ,dimension,1,dItemAssoatedDocumentDocumentDocumentNote,0..n,明細文書に関する注釈のグループ,CIIL_ Document Line_ Document. Included. CI_ Note,A Cross Industry (CI) note included in this CIIL document line.,,/SMECoreSelfInvoice/CIIHSupplyChainTradeTransaction/IncludedCIILSupplyChainTradeLineItem/AssociatedCIILDocumentLineDocument/IncludedCINote
v4,194,UN01005558,BBIE,5,明細文書注釈表題,field,2,ItemAssoatedDocumentDocumentNoteSubjectText,0..1,"明細文書の注釈内容の表題を示す。
一部に利用制限あり。標準仕様書３．３．５項参照。",CI_ Note. Subject. Text,"The subject, expressed as text, of this CI note.",,/SMECoreSelfInvoice/CIIHSupplyChainTradeTransaction/IncludedCIILSupplyChainTradeLineItem/AssociatedCIILDocumentLineDocument/IncludedCINote/Subject
v4,195,UN01005560,BBIE,5,明細文書注釈内容,field,2,ItemAssoatedDocumentDocumentNoteContentText,0..1,"明細文書の注釈表題毎の内容情報を入力するフリースペース。
一部に利用制限あり。標準仕様書３．３．５項参照",CI_ Note. Content. Text,"Content, expressed as text, of this CI note.",,/SMECoreSelfInvoice/CIIHSupplyChainTradeTransaction/IncludedCIILSupplyChainTradeLineItem/AssociatedCIILDocumentLineDocument/IncludedCINote/Content
v4,196,UN01005562,BBIE,5,明細文書注釈ID,field,2,ItemAssoatedDocumentDocumentNoteID,0..1,"明細文書注釈の識別ID
共通EDIプロバイダがシリアル番号をセット。標準仕様書３．３．５項参照",CI_ Note. Identification. Identifier,The unique identifier for this CI note.,,/SMECoreSelfInvoice/CIIHSupplyChainTradeTransaction/IncludedCIILSupplyChainTradeLineItem/AssociatedCIILDocumentLineDocument/IncludedCINote/ID
v4,197,UN01014895,ASBIE,4,明細文書／組込み文書グループ,,,,0..1,この明細文書の組込み文書に関するグループ。,CIIL_ Document Line_ Document. Reference. CI_ Referenced_ Document,A document referenced from this CIIL document line.,,
v4,199,UN01005580,BBIE,5,明細文書組込み文書ID,field,1,ItemAssoatedDocumentReferenceDocumentIssuerAssignedID,1..1,この明細文書に組込んだ文書のID,CI_ Referenced_ Document. Issuer Assigned_ Identification. Identifier,The issuer assigned identifier for this CI referenced document.,,/SMECoreSelfInvoice/CIIHSupplyChainTradeTransaction/IncludedCIILSupplyChainTradeLineItem/AssociatedCIILDocumentLineDocument/ReferenceCIReferencedDocument/IssuerAssignedID
v4,200,UN01005582,BBIE,5,明細文書組込み文書発行日,field,1,ItemAssoatedDocumentReferenceDocumentIssueDateTime,0..1,この明細文書に組込んだ文書の発行日,CI_ Referenced_ Document. Issue. Date Time,The date or date time for the issuance of this CI referenced document.,,/SMECoreSelfInvoice/CIIHSupplyChainTradeTransaction/IncludedCIILSupplyChainTradeLineItem/AssociatedCIILDocumentLineDocument/ReferenceCIReferencedDocument/IssueDateTime
v4,201,UN01005588,BBIE,5,明細文書組込み文書履歴ID,field,1,ItemAssoatedDocumentReferenceDocumentRevisionID,0..1,この明細文書に組込んだ文書の変更履歴を管理するID。,CI_ Referenced_ Document. Revision_ Identification. Identifier,The unique identifier for a revision of this CI referenced document.,,/SMECoreSelfInvoice/CIIHSupplyChainTradeTransaction/IncludedCIILSupplyChainTradeLineItem/AssociatedCIILDocumentLineDocument/ReferenceCIReferencedDocument/RevisionID
v4,202,UN01009672,BBIE,5,明細文書組込み文書タイプコード,field,1,ItemAssoatedDocumentReferenceDocumentTypeCode,0..1,この明細文書に組込んだ文書の文書タイプを識別するコード,CI_ Referenced_ Document. Type. Code,The code specifying the type of CI referenced document.,UNCL1001,/SMECoreSelfInvoice/CIIHSupplyChainTradeTransaction/IncludedCIILSupplyChainTradeLineItem/AssociatedCIILDocumentLineDocument/ReferenceCIReferencedDocument/TypeCode
v4,203,UN01014899,BBIE,5,明細文書組込み文書サブタイプコード,field,1,ItemAssoatedDocumentReferenceDocumentSubtypeCode,0..1,この明細文書に組込んだ文書の文書サブタイプを識別するコード,CI_ Referenced_ Document. Subtype. Code,A code specifying a subtype of this CI referenced document.,JECxxxx,/SMECoreSelfInvoice/CIIHSupplyChainTradeTransaction/IncludedCIILSupplyChainTradeLineItem/AssociatedCIILDocumentLineDocument/ReferenceCIReferencedDocument/SubtypeCode
v4,204,UN01005992,ASBIE,3,明細文書ヘッダ／決済グループ,,,,1..1,明細文書の決済に関するグループ。,CIIL_ Supply Chain_ Trade Line Item. Specified. CIIL_ Supply Chain_ Trade Settlement,The CIIL supply chain trade settlement specified for this CIIL supply chain trade line item.,,
v4,206,UN01014647,BBIE,4,明細文書ヘッダ取引方向コード,field,1,DocumentDirectionCode,0..1,：,CIIL_ Supply Chain_ Trade Settlement. Direction. Code,The code specifying whether this CIIL supply chain trade settlement is an addition or a subtraction.,JECxxxx,/SMECoreSelfInvoice/CIIHSupplyChainTradeTransaction/IncludedCIILSupplyChainTradeLineItem/SpecifiedCIILSupplyChainTradeSettlement/DirectionCode
v4,207,UN01005998,ASBIE,4,明細文書ヘッダ決済／明細文書ヘッダ返金グループ,dimension,1,dDocumentAllowance,0..n,明細文書ヘッダの返金グループ,CIIL_ Supply Chain_ Trade Settlement. Specified. CI_ Trade_ Allowance Charge,A Cross Industry (CI) allowance or charge specified for this CIIL supply chain trade settlement.,,/SMECoreSelfInvoice/CIIHSupplyChainTradeTransaction/IncludedCIILSupplyChainTradeLineItem/SpecifiedCIILSupplyChainTradeSettlement/SpecifiedCITradeAllowanceCharge[ChargeIndicator=false]
v4,209,UN01005707,BBIE,5,"明細文書ヘッダ返金・追加請求判別子
＝返金（Allowance）",field,2,DocumentAllowanceChargeIndicator,1..1,"明細文書ヘッダ返金と明細文書ヘッダ追加請求を識別する判別子
false(Allowance)",CI_ Trade_ Allowance Charge. Charge. Indicator,The indication of whether or not this CI trade allowance charge is a charge.,,/SMECoreSelfInvoice/CIIHSupplyChainTradeTransaction/IncludedCIILSupplyChainTradeLineItem/SpecifiedCIILSupplyChainTradeSettlement/SpecifiedCITradeAllowanceCharge[ChargeIndicator=false]/ChargeIndicator
v4.1,210,UN01005713,BBIE,5,明細文書ヘッダ返金金額,field,2,DocumentAllowanceActualAmount,0..1,"この明細文書の明細文書ヘッダに紐付く返金金額
（源泉所得税は含まず。鑑ヘッダで相殺）",CI_ Trade_ Allowance Charge. Actual. Amount,An actual monetary value of this CI trade allowance charge.,,/SMECoreSelfInvoice/CIIHSupplyChainTradeTransaction/IncludedCIILSupplyChainTradeLineItem/SpecifiedCIILSupplyChainTradeSettlement/SpecifiedCITradeAllowanceCharge[ChargeIndicator=false]/ActualAmount
v4.1,211,UN01005714,BBIE,5,明細文書ヘッダ返金理由コード,field,2,DocumentAllowanceReasonCode,0..1,この明細文書ヘッダ返金の理由を識別するコード,CI_ Trade_ Allowance Charge. Reason. Code,The code specifying the reason for this CI trade allowance charge.,UNCL446,/SMECoreSelfInvoice/CIIHSupplyChainTradeTransaction/IncludedCIILSupplyChainTradeLineItem/SpecifiedCIILSupplyChainTradeSettlement/SpecifiedCITradeAllowanceCharge[ChargeIndicator=false]/ReasonCode
v4.1,212,UN01005715,BBIE,5,明細文書ヘッダ返金理由,field,2,DocumentAllowanceReasonText,0..1,この明細文書ヘッダ返金理由（内容）の説明,CI_ Trade_ Allowance Charge. Reason. Text,"The reason, expressed as text, for this CI trade allowance charge.",,/SMECoreSelfInvoice/CIIHSupplyChainTradeTransaction/IncludedCIILSupplyChainTradeLineItem/SpecifiedCIILSupplyChainTradeSettlement/SpecifiedCITradeAllowanceCharge[ChargeIndicator=false]/Reason
v4,213,UN01005716,ASBIE,5,明細文書ヘッダ返金／明細文書ヘッダ返金税グループ,,,,0..1,明細文書ヘッダ返金の税に関するグループ,CI_ Trade_ Allowance Charge. Category. CI_ Trade_ Tax,A tax category of this CI trade allowance charge.,,
v4,215,UN01005841,BBIE,6,明細文書ヘッダ返金課税分類コード,field,2,DocumentAllowanceTaxCategoryCode,1..1,明細文書ヘッダ返金の課税分類コード,CI_ Trade_ Tax. Category. Code,"The code specifying the category to which this CI trade related tax, levy or duty applies, such as codes for ""Exempt from Tax"", ""Standard Rate"", ""Free Export Item - Tax Not Charged"" .",UNCL5305,/SMECoreSelfInvoice/CIIHSupplyChainTradeTransaction/IncludedCIILSupplyChainTradeLineItem/SpecifiedCIILSupplyChainTradeSettlement/SpecifiedCITradeAllowanceCharge[ChargeIndicator=false]/CategoryCITradeTax/CategoryCode
v4,216,UN01007174,BBIE,6,明細文書ヘッダ返金税率,field,2,DocumentAllowanceCategoryTaxRatePercent,0..1,明細文書ヘッダ返金の税率,CI_ Trade_ Tax. Rate_ Applicable. Percent,"The applicable rate of CI trade tax, expressed as a percentage.",,/SMECoreSelfInvoice/CIIHSupplyChainTradeTransaction/IncludedCIILSupplyChainTradeLineItem/SpecifiedCIILSupplyChainTradeSettlement/SpecifiedCITradeAllowanceCharge[ChargeIndicator=false]/CategoryCITradeTax/RateApplicablePercent
v4.1,217,UN01005998,ASBIE,4,明細文書ヘッダ文書決済／明細文書ヘッダ追加請求グループ,dimension,1,dDocumentCharge,0..n,明細文書ヘッダの明細文書ヘッダ追加請求のグループ,CIIL_ Supply Chain_ Trade Settlement. Specified. CI_ Trade_ Allowance Charge,A Cross Industry (CI) allowance or charge specified for this CIIL supply chain trade settlement.,,/SMECoreSelfInvoice/CIIHSupplyChainTradeTransaction/IncludedCIILSupplyChainTradeLineItem/SpecifiedCIILSupplyChainTradeSettlement/SpecifiedCITradeAllowanceCharge[ChargeIndicator=true]
v4.1,219,UN01005707,BBIE,5,"明細文書ヘッダ返金・追加請求判別子
＝追加請求（Charge）",field,2,DocumentChargeChargeIndicator,1..1,"明細文書ヘッダ返金と明細文書ヘッダ追加請求を識別する判別子
true(Charge)",CI_ Trade_ Allowance Charge. Charge. Indicator,The indication of whether or not this CI trade allowance charge is a charge.,,/SMECoreSelfInvoice/CIIHSupplyChainTradeTransaction/IncludedCIILSupplyChainTradeLineItem/SpecifiedCIILSupplyChainTradeSettlement/SpecifiedCITradeAllowanceCharge[ChargeIndicator=true]/ChargeIndicator
v4.1,220,UN01005713,BBIE,5,明細文書ヘッダ追加請求金額,field,2,DocumentChargeActualAmount,0..1,この明細文書ヘッダの明細文書ヘッダに紐付く追加請求金額,CI_ Trade_ Allowance Charge. Actual. Amount,An actual monetary value of this CI trade allowance charge.,,/SMECoreSelfInvoice/CIIHSupplyChainTradeTransaction/IncludedCIILSupplyChainTradeLineItem/SpecifiedCIILSupplyChainTradeSettlement/SpecifiedCITradeAllowanceCharge[ChargeIndicator=true]/ActualAmount
v4.1,221,UN01005714,BBIE,5,明細文書ヘッダ追加請求理由コード,field,2,DocumentChargeReasonCode,0..1,この明細文書ヘッダ追加請求の理由を識別するコード,CI_ Trade_ Allowance Charge. Reason. Code,The code specifying the reason for this CI trade allowance charge.,UNCL4465,/SMECoreSelfInvoice/CIIHSupplyChainTradeTransaction/IncludedCIILSupplyChainTradeLineItem/SpecifiedCIILSupplyChainTradeSettlement/SpecifiedCITradeAllowanceCharge[ChargeIndicator=true]/ReasonCode
v4.1,222,UN01005715,BBIE,5,明細文書ヘッダ追加請求理由,field,2,DocumentChargeReasonText,0..1,この明細文書ヘッダ追加請求の理由（内容）の説明,CI_ Trade_ Allowance Charge. Reason. Text,"The reason, expressed as text, for this CI trade allowance charge.",,/SMECoreSelfInvoice/CIIHSupplyChainTradeTransaction/IncludedCIILSupplyChainTradeLineItem/SpecifiedCIILSupplyChainTradeSettlement/SpecifiedCITradeAllowanceCharge[ChargeIndicator=true]/Reason
v4.1,223,UN01005716,ASBIE,5,明細文書ヘッダ返金／明細文書ヘッダ追加請求税グループ,,,,0..1,明細文書ヘッダ追加請求の税に関するグループ,CI_ Trade_ Allowance Charge. Category. CI_ Trade_ Tax,A tax category of this CI trade allowance charge.,,
v4.1,225,UN01005841,BBIE,6,明細文書ヘッダ追加請求課税分類コード,field,2,DocumentChargeTaxCategoryCode,1..1,明細文書ヘッダ追加請求の課税分類コード,CI_ Trade_ Tax. Category. Code,"The code specifying the category to which this CI trade related tax, levy or duty applies, such as codes for ""Exempt from Tax"", ""Standard Rate"", ""Free Export Item - Tax Not Charged"" .",UNCL5305,/SMECoreSelfInvoice/CIIHSupplyChainTradeTransaction/IncludedCIILSupplyChainTradeLineItem/SpecifiedCIILSupplyChainTradeSettlement/SpecifiedCITradeAllowanceCharge[ChargeIndicator=true]/CategoryCITradeTax/CategoryCode
v4.1,226,UN01007174,BBIE,6,明細文書ヘッダ追加請求税率,field,2,DocumentChargeCategoryTaxRatePercent,0..1,明細文書ヘッダ追加請求の税率,CI_ Trade_ Tax. Rate_ Applicable. Percent,"The applicable rate of CI trade tax, expressed as a percentage.",,/SMECoreSelfInvoice/CIIHSupplyChainTradeTransaction/IncludedCIILSupplyChainTradeLineItem/SpecifiedCIILSupplyChainTradeSettlement/SpecifiedCITradeAllowanceCharge[ChargeIndicator=true]/CategoryCITradeTax/RateApplicablePercent
v1,227,UN01005996,ASBIE,4,明細文書ヘッダ決済／明細文書ヘッダ税グループ,,,,1..1,明細文書ヘッダの税に関するグループ。,CIIL_ Supply Chain_ Trade Settlement. Applicable. CI_ Trade_ Tax,A Cross Industry (CI) tax applicable to this CIIL supply chain trade settlement.,,
v2,229,UN01005833,BBIE,5,明細文書ヘッダ課税分類税額,field,1,DocumentTaxCalculatedAmount,0..1,"明細文書ヘッダの課税分類毎に端数処理計算した税額。
算出した税額は切り上げ、切り捨て、四捨五入のいずれかで処理し、税額は整数とする
＜税抜きの場合＞明細文書ヘッダ課税分類課税対象合計金額×税率
＜税込みの場合＞明細文書ヘッダ課税分類課税対象合計金額×税率／(１＋税率)",CI_ Trade_ Tax. Calculated. Amount,"A monetary value resulting from the calculation of this CI trade related tax, levy or duty.",,/SMECoreSelfInvoice/CIIHSupplyChainTradeTransaction/IncludedCIILSupplyChainTradeLineItem/SpecifiedCIILSupplyChainTradeSettlement/ApplicableCITradeTax/CalculatedAmount
v1/v2,230,UN01005834,BBIE,5,明細文書ヘッダ税タイプコード,field,1,DocumentTaxTypeCode,0..1,"税の種類を識別するコード。デフォルトは消費税
消費税：VAT。源泉所得税：SWT",CI_ Trade_ Tax. Type. Code,"The code specifying the type of CI trade related tax, levy or duty, such as a code for a Value Added Tax (VAT).",UNCL5153,/SMECoreSelfInvoice/CIIHSupplyChainTradeTransaction/IncludedCIILSupplyChainTradeLineItem/SpecifiedCIILSupplyChainTradeSettlement/ApplicableCITradeTax/TypeCode
v1/v2,231,UN01005836,BBIE,5,明細文書ヘッダ税率,field,1,DocumentTaxCalculatedRate,0..1,明細文書ヘッダの課税分類毎の税額計算のための率。,CI_ Trade_ Tax. Calculated. Rate,"The rate used to calculate the amount of this CI trade related tax, levy or duty.",,/SMECoreSelfInvoice/CIIHSupplyChainTradeTransaction/IncludedCIILSupplyChainTradeLineItem/SpecifiedCIILSupplyChainTradeSettlement/ApplicableCITradeTax/CalculatedRate
v2/v4.3,232,UN01005839,BBIE,5,明細文書ヘッダ課税分類課税対象合計金額（税抜き）,field,1,DocumentTaxBasisAmount,0..1,"Σ明細行課税分類譲渡資産合計金額＋Σ明細文書ヘッダ追加請求金額ーΣ明細文書ヘッダ返金金額
「明細文書ヘッダ税計算方式」のコード値指定により税抜き、税込みを識別する",CI_ Trade_ Tax. Basis. Amount,"A monetary value used as the basis on which this CI trade related tax, levy or duty is calculated.",,/SMECoreSelfInvoice/CIIHSupplyChainTradeTransaction/IncludedCIILSupplyChainTradeLineItem/SpecifiedCIILSupplyChainTradeSettlement/ApplicableCITradeTax/BasisAmount
v3,233,UN01005841,BBIE,5,明細文書ヘッダ課税分類コード,field,1,DocumentTaxCategoryCode,1..1,"明細文書ヘッダの課税分類（標準税率、軽減税率、不課税、非課税、免税等）を識別するコード
課税分類ごとにクラスを設ける",CI_ Trade_ Tax. Category. Code,"The code specifying the category to which this CI trade related tax, levy or duty applies, such as codes for ""Exempt from Tax"", ""Standard Rate"", ""Free Export Item - Tax Not Charged"" .",UNCL5305,/SMECoreSelfInvoice/CIIHSupplyChainTradeTransaction/IncludedCIILSupplyChainTradeLineItem/SpecifiedCIILSupplyChainTradeSettlement/ApplicableCITradeTax/CategoryCode
