version,sequence,UNID,acronym,level,label_local,type,depth,name,multiplicity,definition_local,DEN,definition,code_list,xpath
v4.3,290,UN01005589,BBIE,6,（明細行参照）文書名,field,2,LineReferencedDocumentName,0..1,この明細行が参照する文書の名称,CI_ Referenced_ Document. Name. Text,"A name, expressed as text, for this CI referenced document.",,/SMECoreSelfInvoice/CIIHSupplyChainTradeTransaction/IncludedCIILSupplyChainTradeLineItem/SubordinateCIILBSubordinateTradeLineItem/SpecifiedCIILBSupplyChainTradeAgreement/AdditionalReferencedCIReferencedDocument/Name
v4.3,291,UN01006415,BBIE,6,（明細行参照）文書情報,field,2,LineReferencedDocumentInformationText,0..1,この明細行が参照する文書に記載の情報,CI_ Referenced_ Document. Information. Text,"Information, expressed as text, for this CI referenced document.",,/SMECoreSelfInvoice/CIIHSupplyChainTradeTransaction/IncludedCIILSupplyChainTradeLineItem/SubordinateCIILBSubordinateTradeLineItem/SpecifiedCIILBSupplyChainTradeAgreement/AdditionalReferencedCIReferencedDocument/Information
v4,292,UN01009672,BBIE,6,（明細行参照）文書タイプコード,field,2,LineReferencedDocumentTypeCode,0..1,この明細行が参照する文書の文書タイプを識別するコード。,CI_ Referenced_ Document. Type. Code,The code specifying the type of CI referenced document.,UNCL1001,/SMECoreSelfInvoice/CIIHSupplyChainTradeTransaction/IncludedCIILSupplyChainTradeLineItem/SubordinateCIILBSubordinateTradeLineItem/SpecifiedCIILBSupplyChainTradeAgreement/AdditionalReferencedCIReferencedDocument/TypeCode
v4,293,UN01013318,BBIE,6,（明細行参照）文書類型コード,field,2,LineReferencedDocumentCategoryCode,0..1,この明細行が参照する文書の類型タイプを識別するコード。,CI_ Referenced_ Document. Category. Code,The code specifying the category of this CI referenced document.,JECxxxx,/SMECoreSelfInvoice/CIIHSupplyChainTradeTransaction/IncludedCIILSupplyChainTradeLineItem/SubordinateCIILBSubordinateTradeLineItem/SpecifiedCIILBSupplyChainTradeAgreement/AdditionalReferencedCIReferencedDocument/CategoryCode
v4,294,UN01014899,BBIE,6,（明細行参照）文書サブタイプコード,field,2,LineReferencedDocumentSubtypeCode,0..1,この明細行が参照する文書の文書サブタイプを識別するコード。,CI_ Referenced_ Document. Subtype. Code,A code specifying a subtype of this CI referenced document.,JECxxxx,/SMECoreSelfInvoice/CIIHSupplyChainTradeTransaction/IncludedCIILSupplyChainTradeLineItem/SubordinateCIILBSubordinateTradeLineItem/SpecifiedCIILBSupplyChainTradeAgreement/AdditionalReferencedCIReferencedDocument/SubtypeCode
v1,295,UN01009658,ASBIE,5,明細行契約／契約単価グループ,,,,1..1,明細行の契約単価に関するグループ。,CIILB_ Supply Chain_ Trade Agreement. Net Price_ Product. CI_ Trade_ Price,A net product price in this CIILB supply chain trade agreement.,,
v1/v3,297,UN01005792,BBIE,6,契約単価,field,2,LineNetProductPriceChargeAmount,1..1,"発注者と受注者が合意した明細発注品の単価。単価基準数量と単価基準数量単位の指定に従う。
税込み、税抜きの識別はヘッダ部の「UN01013096：税計算方式」で指定（指定がない場合（デフォルト）は税抜き）。",CI_ Trade_ Price. Charge. Amount,A monetary value of this CI trade price charge.,,/SMECoreSelfInvoice/CIIHSupplyChainTradeTransaction/IncludedCIILSupplyChainTradeLineItem/SubordinateCIILBSubordinateTradeLineItem/SpecifiedCIILBSupplyChainTradeAgreement/NetPriceProductCITradePrice/ChargeAmount
v4,298,UN01005793,BBIE,6,単価基準数量,field,2,LineNetProductPriceBasisQuantity,0..1,"✔定貫品目の場合：空欄（デフォルト）、または単価基準数量=１
✔不定貫品目、ハイブリッド品目の場合：単価基準数量=単価の基準となる重量・容量",CI_ Trade_ Price. Basis. Quantity,The quantity on which this CI trade price is based.,"数量単位コード
UNECE Rec20",/SMECoreSelfInvoice/CIIHSupplyChainTradeTransaction/IncludedCIILSupplyChainTradeLineItem/SubordinateCIILBSubordinateTradeLineItem/SpecifiedCIILBSupplyChainTradeAgreement/NetPriceProductCITradePrice/BasisQuantity
v4.3,299,,SC,6,数量単位属性,field,2,LineNetPriceProductQuantityUnitCode,,単価基準数量の数量単位属性,Quantity. Unit. Code,,,
v1,300,UN01009650,ASBIE,4,明細行／配送グループ,,,,1..1,明細行の配送に関するグループ,CIILB_ Subordinate_ Trade Line Item. Specified. CIILB_ Supply Chain_ Trade Delivery,The supply chain trade delivery specified for this CIILB subordinate trade line item.,,
v４,302,UN01009661,BBIE,5,配送バラ数量,field,2,LineDeliveryProductUnitQuantity,0..1,"配送数量がセット数量単位属性を指定の場合に利用する。
配送バラ数量=配送数量（属性：セット）×セット単位数量（入り数）（属性：個、または不定貫品目量）",CIILB_ Supply Chain_ Trade Delivery. Product_ Unit. Quantity,The number of product units in this CIILB supply chain trade delivery.,,/SMECoreSelfInvoice/CIIHSupplyChainTradeTransaction/IncludedCIILSupplyChainTradeLineItem/SubordinateCIILBSubordinateTradeLineItem/SpecifiedCIILBSupplyChainTradeDelivery/ProductUnitQuantity
v4.3,303,,SC,5,数量単位属性,field,2,LineDeliveryProductUnitQuantityUnitCode,,配送バラ数量の数量単位属性,Quantity. Unit. Code,,"数量単位コード
UNECE Rec20",/SMECoreSelfInvoice/CIIHSupplyChainTradeTransaction/IncludedCIILSupplyChainTradeLineItem/SubordinateCIILBSubordinateTradeLineItem/SpecifiedCIILBSupplyChainTradeDelivery/ProductUnitQuantity/@UnitCode
v3/v4,304,UN01009662,BBIE,5,配送セット単位数量(入り数）,field,2,LineDeliveryPerPackageUnitQuantity,0..1,"✔ 配送数量の数量単位指定が定貫品目（セット）の場合：1セット当たりのバラ数量を入力。
✔配送数量がハイブリッド品目（セット）の場合：配送数量で指定したセット数量の1単位当たりの重量・容量（個数でカウントできない不定貫品目の数量単位属性）を入力
✔配送数量の 数量単位指定が定貫品目（個）の場合：利用しない
✔ 配送数量の数量単位指定が不定貫品目の場合：利用しない。",CIILB_ Supply Chain_ Trade Delivery. Per Package_ Unit. Quantity,The number of units per package in this CIILB supply chain trade delivery.,,/SMECoreSelfInvoice/CIIHSupplyChainTradeTransaction/IncludedCIILSupplyChainTradeLineItem/SubordinateCIILBSubordinateTradeLineItem/SpecifiedCIILBSupplyChainTradeDelivery/PerPackageUnitQuantity
v4.3,305,,SC,5,数量単位属性,field,2,LineDeliveryPerPackageUnitQuantityUnitCode,,配送セット単位数量（入り数）の数量単位属性,Quantity. Unit. Code,,"数量単位コード
UNECE Rec20",/SMECoreSelfInvoice/CIIHSupplyChainTradeTransaction/IncludedCIILSupplyChainTradeLineItem/SubordinateCIILBSubordinateTradeLineItem/SpecifiedCIILBSupplyChainTradeDelivery/PerPackageUnitQuantity/@UnitCode
v1,306,UN01014639,BBIE,5,配送数量,field,2,LineDeliveryBilledQuantity,1..1,"この情報項目はずべての品目の配送数量の指定に利用する。
この項目の数量単位属性は次のいずれかを選択：「個」、「セット」、「不定貫数量単位」",CIILB_ Supply Chain_ Trade Delivery. Billed. Quantity,The billed quantity of this CIILB supply chain trade delivery.,,/SMECoreSelfInvoice/CIIHSupplyChainTradeTransaction/IncludedCIILSupplyChainTradeLineItem/SubordinateCIILBSubordinateTradeLineItem/SpecifiedCIILBSupplyChainTradeDelivery/BilledQuantity
v4.3,307,,SC,5,数量単位属性,field,2,LineDeliveryBilledQuantityUnitCode,,配送数量の数量単位属性,Quantity. Unit. Code,,"数量単位コード
UNECE Rec20",/SMECoreSelfInvoice/CIIHSupplyChainTradeTransaction/IncludedCIILSupplyChainTradeLineItem/SubordinateCIILBSubordinateTradeLineItem/SpecifiedCIILBSupplyChainTradeDelivery/BilledQuantity/@UnitCode
v1,308,UN01009651,ASBIE,4,明細行／決裁グループ,dimension,2,dLine,0..n,明細行の決済に関するグループ,CIILB_ Subordinate_ Trade Line Item. Specified. CIILB_ Supply Chain_ Trade Settlement,The supply chain trade settlement specified for this CIILB subordinate trade line item.,,/SMECoreSelfInvoice/CIIHSupplyChainTradeTransaction/IncludedCIILSupplyChainTradeLineItem/SubordinateCIILBSubordinateTradeLineItem/SpecifiedCIILBSupplyChainTradeSettlement
v４,310,UN01014641,BBIE,5,明細行取引方向コード,field,3,LineDirectionCode,0..1,"明細行の取引方向を識別するコード
デフォルトは「プラス」
明細行取引類型コードが「調整」を指定場合に利用する。
金額の「プラス」「マイナス」表示を許容する場合は実装しない。",CIILB_ Supply Chain_ Trade Settlement. Direction. Code,The code specifying whether this CIILB supply chain trade settlement is an addition or a subtraction.,JECxxxx,/SMECoreSelfInvoice/CIIHSupplyChainTradeTransaction/IncludedCIILSupplyChainTradeLineItem/SubordinateCIILBSubordinateTradeLineItem/SpecifiedCIILBSupplyChainTradeSettlement/DirectionCode
v1,311,UN01009665,ASBIE,5,明細行決済／明細行税グループ,,,,1..1,明細行決済の税に関するグループ,CIILB_ Supply Chain_ Trade Settlement. Applicable. CI_ Trade_ Tax,The trade tax applicable to this CIILB supply chain trade settlement.,,
v1/v2,313,UN01005834,BBIE,6,明細行税タイプコード,field,3,LineTaxTypeCode,0..1,税の種類を識別するコード。デフォルトは消費税；VAT,CI_ Trade_ Tax. Type. Code,"The code specifying the type of CI trade related tax, levy or duty, such as a code for a Value Added Tax (VAT).",UNCL5153,/SMECoreSelfInvoice/CIIHSupplyChainTradeTransaction/IncludedCIILSupplyChainTradeLineItem/SubordinateCIILBSubordinateTradeLineItem/SpecifiedCIILBSupplyChainTradeSettlement/ApplicableCITradeTax/TypeCode
v2,314,UN01005839,BBIE,6,明細行譲渡資産金額（税抜き）,field,3,LineTaxBasisAmount,0..1,"この明細行の税抜き譲渡資産金額（契約単価×配送数量）
契約単価×数量で指定できない場合は金額",CI_ Trade_ Tax. Basis. Amount,"A monetary value used as the basis on which this CI trade related tax, levy or duty is calculated.",,/SMECoreSelfInvoice/CIIHSupplyChainTradeTransaction/IncludedCIILSupplyChainTradeLineItem/SubordinateCIILBSubordinateTradeLineItem/SpecifiedCIILBSupplyChainTradeSettlement/ApplicableCITradeTax/BasisAmount
v1/v2,315,UN01005841,BBIE,6,明細行課税分類コード,field,3,LineTaxCategoryCode,1..1,この明細行の消費税の課税分類（標準税率、軽減税率、不課税、非課税、免税等）を識別するコード,CI_ Trade_ Tax. Category. Code,"The code specifying the category to which this CI trade related tax, levy or duty applies, such as codes for ""Exempt from Tax"", ""Standard Rate"", ""Free Export Item - Tax Not Charged"" .",UNCL5305,/SMECoreSelfInvoice/CIIHSupplyChainTradeTransaction/IncludedCIILSupplyChainTradeLineItem/SubordinateCIILBSubordinateTradeLineItem/SpecifiedCIILBSupplyChainTradeSettlement/ApplicableCITradeTax/CategoryCode
v2,316,UN01005850,BBIE,6,明細行課税分類名,field,3,LineTaxCategoryName,0..1,消費税の計算属性(標準税率、軽減税率など)を識別するための分類名。または軽減税率対象品目に添付する※などの記号を表示,CI_ Trade_ Tax. Category Name. Text,"A category name, expressed as text, of this CI trade related tax, levy or duty.",,/SMECoreSelfInvoice/CIIHSupplyChainTradeTransaction/IncludedCIILSupplyChainTradeLineItem/SubordinateCIILBSubordinateTradeLineItem/SpecifiedCIILBSupplyChainTradeSettlement/ApplicableCITradeTax/CategoryName
v1/v2,317,UN01007174,BBIE,6,明細行税率,field,3,LineTaxRatePercent,0..1,"課税分類に対応する消費税率のパーセント表示
2014年度税制の場合は、明細行課税分類コードと組み合わせて利用する。",CI_ Trade_ Tax. Rate_ Applicable. Percent,"The applicable rate of CI trade tax, expressed as a percentage.",,/SMECoreSelfInvoice/CIIHSupplyChainTradeTransaction/IncludedCIILSupplyChainTradeLineItem/SubordinateCIILBSubordinateTradeLineItem/SpecifiedCIILBSupplyChainTradeSettlement/ApplicableCITradeTax/RateApplicablePercent
v2,318,UN01013040,BBIE,6,明細行譲渡資産金額(税込み),field,3,LineTaxGrandTotalAmount,0..1,この明細行の税額を含む譲渡資産金額（税込み）,CI_ Trade_ Tax. Grand Total. Amount,The monetary value of the grand total of the basis plus tax for this CI trade tax.,,/SMECoreSelfInvoice/CIIHSupplyChainTradeTransaction/IncludedCIILSupplyChainTradeLineItem/SubordinateCIILBSubordinateTradeLineItem/SpecifiedCIILBSupplyChainTradeSettlement/ApplicableCITradeTax/GrandTotalAmount
v4,319,UN01014650,BBIE,6,明細行適用税制ID,field,3,LineTaxLocalTaxSystemID,0..1,"この明細行取引の税制年度を識別するID
デフォルトは「2019」（2019年度税制）",CI_ Trade_ Tax. Local Tax System. Identifier,The identifier of the local tax system for this CI trade tax.,JECxxxx,/SMECoreSelfInvoice/CIIHSupplyChainTradeTransaction/IncludedCIILSupplyChainTradeLineItem/SubordinateCIILBSubordinateTradeLineItem/SpecifiedCIILBSupplyChainTradeSettlement/ApplicableCITradeTax/LocalTaxSystemID
v4.3,320,UN01014643,ASBIE,5,明細行決済／調整（修正差額調整）グループ,,,,0..1,明細行決済の調整（修正差額調整）に関するグループ,CIILB_ Supply Chain_ Trade Settlement. Specified. CI_ Financial_ Adjustment,A financial adjustment specified for this CIILB supply chain trade settlement.,,
v4.3,322,UN01005488,BBIE,6,明細行調整理由コード（修正差額調整）,field,3,LineFinanalAdjustmentDiscrepancyReasonCode,0..1,"この明細行の調整理由を示す識別コード
62(修正差額調整)",CI_ Financial_ Adjustment. Reason. Code,The code specifying a reason for this CI financial adjustment.,UNCL4465,"/SMECoreSelfInvoice/CIIHSupplyChainTradeTransaction/IncludedCIILSupplyChainTradeLineItem/SubordinateCIILBSubordinateTradeLineItem/SpecifiedCIILBSupplyChainTradeSettlement/SpecifiedCIFinancialAdjustment[ReasonCode=""62""]/ReasonCode"
v4.3,323,UN01005489,BBIE,6,明細行調整理由,field,3,LineFinanalAdjustmentDiscrepancyReasonText,0..1,この明細行の調整理由を文字で表現した内容,CI_ Financial_ Adjustment. Reason. Text,"A reason, expressed as text, for this CI financial adjustment.",,"/SMECoreSelfInvoice/CIIHSupplyChainTradeTransaction/IncludedCIILSupplyChainTradeLineItem/SubordinateCIILBSubordinateTradeLineItem/SpecifiedCIILBSupplyChainTradeSettlement/SpecifiedCIFinancialAdjustment[ReasonCode=""62""]/Reason"
v4.3,324,UN01005490,BBIE,6,明細行調整金額,field,3,LineFinanalAdjustmentDiscrepancyActualAmount,0..1,"この明細行の調整金額
＜調整理由コード=62＞
修正差額調整金額",CI_ Financial_ Adjustment. Actual. Amount,An actual monetary value added or subtracted as a result of this CI financial adjustment.,,"/SMECoreSelfInvoice/CIIHSupplyChainTradeTransaction/IncludedCIILSupplyChainTradeLineItem/SubordinateCIILBSubordinateTradeLineItem/SpecifiedCIILBSupplyChainTradeSettlement/SpecifiedCIFinancialAdjustment[ReasonCode=""62""]/ActualAmount"
v4.3,325,UN01014897,ASBIE,6,明細行調整／調整税グループ,,,,0..1,調整明細行の税率別税クラスに関するグループ,CI_ Financial_ Adjustment. Related. CI_ Trade_ Tax,A trade tax related to this CI financial adjustment.,,
v4.3,327,UN01005841,BBIE,7,明細行調整課税分類コード,field,3,LineFinanalAdjustmentDiscrepancyTaxCategoryCode,0..1,調整明細行の課税分類コード,CI_ Trade_ Tax. Category. Code,"The code specifying the category to which this CI trade related tax, levy or duty applies, such as codes for ""Exempt from Tax"", ""Standard Rate"", ""Free Export Item - Tax Not Charged"" .",UNCL5305,"/SMECoreSelfInvoice/CIIHSupplyChainTradeTransaction/IncludedCIILSupplyChainTradeLineItem/SubordinateCIILBSubordinateTradeLineItem/SpecifiedCIILBSupplyChainTradeSettlement/SpecifiedCIFinancialAdjustment[ReasonCode=""62""]/RelatedCITradeTax/CategoryCode"
v4.3,328,UN01007174,BBIE,7,明細行調整税率,field,3,LineFinanalAdjustmentDiscrepancyTaxRatePercent,0..1,調整明細行の税率,CI_ Trade_ Tax. Rate_ Applicable. Percent,"The applicable rate of CI trade tax, expressed as a percentage.",,"/SMECoreSelfInvoice/CIIHSupplyChainTradeTransaction/IncludedCIILSupplyChainTradeLineItem/SubordinateCIILBSubordinateTradeLineItem/SpecifiedCIILBSupplyChainTradeSettlement/SpecifiedCIFinancialAdjustment[ReasonCode=""62""]/RelatedCITradeTax/RateApplicablePercent"
v4.3,329,UN01014643,ASBIE,5,明細行決済／調整グループ,,,,0..1,明細行決済の調整に関するグループ,CIILB_ Supply Chain_ Trade Settlement. Specified. CI_ Financial_ Adjustment,A financial adjustment specified for this CIILB supply chain trade settlement.,,
v4.3,331,UN01005488,BBIE,6,明細行調整理由コード(源泉所得税),field,3,LineFinanalAdjustmentWithholdingTaxReasonCode,0..1,"この明細行の調整理由を示す識別コード
26(源泉所得税)",CI_ Financial_ Adjustment. Reason. Code,The code specifying a reason for this CI financial adjustment.,UNCL4465,"/SMECoreSelfInvoice/CIIHSupplyChainTradeTransaction/IncludedCIILSupplyChainTradeLineItem/SubordinateCIILBSubordinateTradeLineItem/SpecifiedCIILBSupplyChainTradeSettlement/SpecifiedCIFinancialAdjustment[ReasonCode=""26"" and RelatedCITradeTax/TypeCode=""SWT""]/ReasonCode"
v4.3,332,UN01005489,BBIE,6,明細行調整理由,field,3,LineFinanalAdjustmentWithholdingTaxReasonText,0..1,この明細行の調整理由を文字で表現した内容,CI_ Financial_ Adjustment. Reason. Text,"A reason, expressed as text, for this CI financial adjustment.",,"/SMECoreSelfInvoice/CIIHSupplyChainTradeTransaction/IncludedCIILSupplyChainTradeLineItem/SubordinateCIILBSubordinateTradeLineItem/SpecifiedCIILBSupplyChainTradeSettlement/SpecifiedCIFinancialAdjustment[ReasonCode=""26"" and RelatedCITradeTax/TypeCode=""SWT""]/Reason"
v4.3,333,UN01005490,BBIE,6,明細行調整金額,field,3,LineFinanalAdjustmentWithholdingTaxActualAmount,0..1,"この明細行の調整金額（鑑ヘッダ調整金額で相殺処理）
＜調整理由コード=26＞
源泉所得税",CI_ Financial_ Adjustment. Actual. Amount,An actual monetary value added or subtracted as a result of this CI financial adjustment.,,"/SMECoreSelfInvoice/CIIHSupplyChainTradeTransaction/IncludedCIILSupplyChainTradeLineItem/SubordinateCIILBSubordinateTradeLineItem/SpecifiedCIILBSupplyChainTradeSettlement/SpecifiedCIFinancialAdjustment[ReasonCode=""26"" and RelatedCITradeTax/TypeCode=""SWT""]/ActualAmount"
v4.3,334,UN01014897,ASBIE,6,明細行調整／調整税グループ,,,,0..1,調整明細行の税率別税クラスに関するグループ,CI_ Financial_ Adjustment. Related. CI_ Trade_ Tax,A trade tax related to this CI financial adjustment.,,
v4.3,336,UN01005834,BBIE,7,明細行調整税タイプコード,field,3,LineFinanalAdjustmentWithholdingTaxTaxTypeCode,0..1,"税の種類を識別するコード
SWT(源泉所得税 )",CI_ Trade_ Tax. Type. Code,"The code specifying the type of CI trade related tax, levy or duty, such as a code for a Value Added Tax (VAT).",UNCL5153,"/SMECoreSelfInvoice/CIIHSupplyChainTradeTransaction/IncludedCIILSupplyChainTradeLineItem/SubordinateCIILBSubordinateTradeLineItem/SpecifiedCIILBSupplyChainTradeSettlement/SpecifiedCIFinancialAdjustment[ReasonCode=""26"" and RelatedCITradeTax/TypeCode=""SWT""]/RelatedCITradeTax/TypeCode"
v4.3,337,UN01007174,BBIE,7,明細行調整税率,field,3,LineFinanalAdjustmentWithholdingTaxTaxRatePercent,0..1,調整明細行の税率,CI_ Trade_ Tax. Rate_ Applicable. Percent,"The applicable rate of CI trade tax, expressed as a percentage.",,"/SMECoreSelfInvoice/CIIHSupplyChainTradeTransaction/IncludedCIILSupplyChainTradeLineItem/SubordinateCIILBSubordinateTradeLineItem/SpecifiedCIILBSupplyChainTradeSettlement/SpecifiedCIFinancialAdjustment[ReasonCode=""26"" and RelatedCITradeTax/TypeCode=""SWT""]/RelatedCITradeTax/RateApplicablePercent"
v4.3,338,UN01014643,ASBIE,5,明細行決済／調整グループ,dimension,3,dLineFinanalAdjustment,0..n,明細行決済の調整に関するグループ,CIILB_ Supply Chain_ Trade Settlement. Specified. CI_ Financial_ Adjustment,A financial adjustment specified for this CIILB supply chain trade settlement.,,/SMECoreSelfInvoice/CIIHSupplyChainTradeTransaction/IncludedCIILSupplyChainTradeLineItem/SubordinateCIILBSubordinateTradeLineItem/SpecifiedCIILBSupplyChainTradeSettlement/SpecifiedCIFinancialAdjustment
v4.3,340,UN01005488,BBIE,6,明細行調整理由コード,field,4,LineFinanalAdjustmentReasonCode,0..1,30の場合（入金）,CI_ Financial_ Adjustment. Reason. Code,The code specifying a reason for this CI financial adjustment.,UNCL4465,/SMECoreSelfInvoice/CIIHSupplyChainTradeTransaction/IncludedCIILSupplyChainTradeLineItem/SubordinateCIILBSubordinateTradeLineItem/SpecifiedCIILBSupplyChainTradeSettlement/SpecifiedCIFinancialAdjustment/ReasonCode
v4.3,341,UN01005489,BBIE,6,明細行調整理由,field,4,LineFinanalAdjustmentReasonText,0..1,この明細行の調整理由を文字で表現した内容,CI_ Financial_ Adjustment. Reason. Text,"A reason, expressed as text, for this CI financial adjustment.",,/SMECoreSelfInvoice/CIIHSupplyChainTradeTransaction/IncludedCIILSupplyChainTradeLineItem/SubordinateCIILBSubordinateTradeLineItem/SpecifiedCIILBSupplyChainTradeSettlement/SpecifiedCIFinancialAdjustment/Reason
v4.3,342,UN01005490,BBIE,6,明細行調整金額,field,4,LineFinanalAdjustmentActualAmount,0..1,"この明細行の調整金額30の場合＞
入金",CI_ Financial_ Adjustment. Actual. Amount,An actual monetary value added or subtracted as a result of this CI financial adjustment.,,/SMECoreSelfInvoice/CIIHSupplyChainTradeTransaction/IncludedCIILSupplyChainTradeLineItem/SubordinateCIILBSubordinateTradeLineItem/SpecifiedCIILBSupplyChainTradeSettlement/SpecifiedCIFinancialAdjustment/ActualAmount
v4,343,UN01014644,ASBIE,5,明細行決裁／返金グループ,dimension,3,dLineAllowance,0..n,明細行の返金に関するグループ,CIILB_ Supply Chain_ Trade Settlement. Specified. CI_ Trade_ Allowance Charge,An allowance or charge specified for this CIILB supply chain trade settlement.,,/SMECoreSelfInvoice/CIIHSupplyChainTradeTransaction/IncludedCIILSupplyChainTradeLineItem/SubordinateCIILBSubordinateTradeLineItem/SpecifiedCIILBSupplyChainTradeSettlement/SpecifiedCITradeAllowanceCharge[ChargeIndicator=false]
v4,345,UN01005707,BBIE,6,"明細行返金・追加請求判別子
    =返金（Allowance）",field,4,LineAllowanceChargeIndicator,1..1,"明細行返金・追加請求判別子
false (Allowance）",CI_ Trade_ Allowance Charge. Charge. Indicator,The indication of whether or not this CI trade allowance charge is a charge.,JECxxxx,/SMECoreSelfInvoice/CIIHSupplyChainTradeTransaction/IncludedCIILSupplyChainTradeLineItem/SubordinateCIILBSubordinateTradeLineItem/SpecifiedCIILBSupplyChainTradeSettlement/SpecifiedCITradeAllowanceCharge[ChargeIndicator=false]/ChargeIndicator
v4,346,UN01005713,BBIE,6,明細行返金金額,field,4,LineAllowanceActualAmount,0..1,この明細行に紐付く返金金額,CI_ Trade_ Allowance Charge. Actual. Amount,An actual monetary value of this CI trade allowance charge.,,/SMECoreSelfInvoice/CIIHSupplyChainTradeTransaction/IncludedCIILSupplyChainTradeLineItem/SubordinateCIILBSubordinateTradeLineItem/SpecifiedCIILBSupplyChainTradeSettlement/SpecifiedCITradeAllowanceCharge[ChargeIndicator=false]/ActualAmount
v4,347,UN01005714,BBIE,6,明細行返金理由コード,field,4,LineAllowanceReasonCode,0..1,この明細行の返金理由を識別するコード,CI_ Trade_ Allowance Charge. Reason. Code,The code specifying the reason for this CI trade allowance charge.,UNCL4465,/SMECoreSelfInvoice/CIIHSupplyChainTradeTransaction/IncludedCIILSupplyChainTradeLineItem/SubordinateCIILBSubordinateTradeLineItem/SpecifiedCIILBSupplyChainTradeSettlement/SpecifiedCITradeAllowanceCharge[ChargeIndicator=false]/ReasonCode
v4,348,UN01005715,BBIE,6,明細行返金理由,field,4,LineAllowanceReasonText,0..1,"この明細行の返金理由（内容）の説明
軽減税率対象の場合は軽減符号を付記",CI_ Trade_ Allowance Charge. Reason. Text,"The reason, expressed as text, for this CI trade allowance charge.",,/SMECoreSelfInvoice/CIIHSupplyChainTradeTransaction/IncludedCIILSupplyChainTradeLineItem/SubordinateCIILBSubordinateTradeLineItem/SpecifiedCIILBSupplyChainTradeSettlement/SpecifiedCITradeAllowanceCharge[ChargeIndicator=false]/Reason
v4,349,UN01005716,ASBIE,6,明細行返金／明細行返金税グループ,,,,0..1,明細行返金の税に関するグループ,CI_ Trade_ Allowance Charge. Category. CI_ Trade_ Tax,A tax category of this CI trade allowance charge.,,
v4,351,UN01005841,BBIE,7,明細行返金課税分類コード,field,4,LineAllowanceTaxCategoryCode,1..1,明細行返金の課税分類コード,CI_ Trade_ Tax. Category. Code,"The code specifying the category to which this CI trade related tax, levy or duty applies, such as codes for ""Exempt from Tax"", ""Standard Rate"", ""Free Export Item - Tax Not Charged"" .",UNCL5305,/SMECoreSelfInvoice/CIIHSupplyChainTradeTransaction/IncludedCIILSupplyChainTradeLineItem/SubordinateCIILBSubordinateTradeLineItem/SpecifiedCIILBSupplyChainTradeSettlement/SpecifiedCITradeAllowanceCharge[ChargeIndicator=false]/CategoryCITradeTax/CategoryCode
