version,sme_nr,mbie_nr,level,UNID,acronym,label_local,multiplicity,multiplicity_SME,property_type,class_term,sequence,identifier,property_term,representation_term,associated_class,definition_local,code_list,attribute,DEN,definition,short_name,name,element,xpath
v4.1,528,2426,2,UN01006079,ASBIE,明細文書ヘッダ決済／会計アカウントグループ,0..n,0..1,Composition,CIIL_ Supply Chain_ Trade Settlement,13,,Receivable_ Specified,,CI_ Trade_ Accounting Account,この明細文書ヘッダの会計アカウントに関するグループ,,,CIIL_ Supply Chain_ Trade Settlement. Receivable_ Specified. CI_ Trade_ Accounting Account,A receivable Cross Industry (CI) accounting account specified for this CIIL supply chain trade settlement.,Accounts Receivable,DocumentReceivableAccountingAccount,ReceivableSpecifiedCITradeAccountingAccount,/SMEConsolidatedSelfInvoice/CIIHSupplyChainTradeTransaction/IncludedCIILSupplyChainTradeLineItem/SpecifiedCIILSupplyChainTradeSettlement/ReceivableSpecifiedCITradeAccountingAccount
v4.1,663,3848,1,UN01005706,ABIE,明細行追加請求クラス,,,Class,CI_ Trade_ Allowance Charge,0,,,,,明細行追加請求クラス,,,CI_ Trade_ Allowance Charge. Details,"A component of pricing, such as a service, promotion, allowance or charge, for Cross Industry (CI) trade purposes.",CI Trade Allowance/Charge,SubordinateDocumentAllowanceChargeDetails,CITradeAllowanceCharge,
v4.1,664,3849,2,UN01005707,BBIE,"明細行返金・追加請求判別子
    =追加請求（Charge）",0..1,1..1,Attribute,CI_ Trade_ Allowance Charge,1,,Charge,Indicator,,"明細行返金・追加請求判別子
    =True (Charge)",JECxxxx,,CI_ Trade_ Allowance Charge. Charge. Indicator,The indication of whether or not this CI trade allowance charge is a charge.,Charge Indicator,SubordinateDocumentAllowanceChargeChargeIndicator,ChargeIndicator,/SMEConsolidatedSelfInvoice/CIIHSupplyChainTradeTransaction/IncludedCIILSupplyChainTradeLineItem/SubordinateCIILBSubordinateTradeLineItem/SpecifiedCIILBSupplyChainTradeSettlement/SpecifiedCITradeAllowanceCharge/ChargeIndicator
v4.1,665,3852,2,UN01005710,BBIE,明細行追加請求計算率,0..1,0..1,Attribute,CI_ Trade_ Allowance Charge,4,,Calculation,Percent,,この明細行追加請求を計算するための率,,,CI_ Trade_ Allowance Charge. Calculation. Percent,The percentage applied to calculate this CI trade allowance charge.,Calculation Percent,SubordinateDocumentAllowanceChargeCalculationPercent,CalculationPercent,/SMEConsolidatedSelfInvoice/CIIHSupplyChainTradeTransaction/IncludedCIILSupplyChainTradeLineItem/SubordinateCIILBSubordinateTradeLineItem/SpecifiedCIILBSupplyChainTradeSettlement/SpecifiedCITradeAllowanceCharge/CalculationPercent
v4.1,666,3855,2,UN01005713,BBIE,明細行追加請求金額,0..n,0..1,Attribute,CI_ Trade_ Allowance Charge,7,,Actual,Amount,,この明細行に紐付く追加請求金額。,,,CI_ Trade_ Allowance Charge. Actual. Amount,An actual monetary value of this CI trade allowance charge.,Actual Amount,SubordinateDocumentAllowanceChargeActualAmount,ActualAmount,/SMEConsolidatedSelfInvoice/CIIHSupplyChainTradeTransaction/IncludedCIILSupplyChainTradeLineItem/SubordinateCIILBSubordinateTradeLineItem/SpecifiedCIILBSupplyChainTradeSettlement/SpecifiedCITradeAllowanceCharge/ActualAmount
v4.1,667,3856,2,UN01005714,BBIE,明細行追加請求理由コード,0..1,0..1,Attribute,CI_ Trade_ Allowance Charge,8,,Reason,Code,,この明細行の追加請求理由を識別するコード,UNCL4465,,CI_ Trade_ Allowance Charge. Reason. Code,The code specifying the reason for this CI trade allowance charge.,Reason Code,SubordinateDocumentAllowanceChargeReasonCode,ReasonCode,/SMEConsolidatedSelfInvoice/CIIHSupplyChainTradeTransaction/IncludedCIILSupplyChainTradeLineItem/SubordinateCIILBSubordinateTradeLineItem/SpecifiedCIILBSupplyChainTradeSettlement/SpecifiedCITradeAllowanceCharge/ReasonCode
v4.1,668,3857,2,UN01005715,BBIE,明細行追加請求理由,0..1,0..1,Attribute,CI_ Trade_ Allowance Charge,9,,Reason,Text,,この明細行の追加請求理由（内容）の説明,,,CI_ Trade_ Allowance Charge. Reason. Text,"The reason, expressed as text, for this CI trade allowance charge.",Reason Text,SubordinateDocumentAllowanceChargeReasonText,ReasonText,/SMEConsolidatedSelfInvoice/CIIHSupplyChainTradeTransaction/IncludedCIILSupplyChainTradeLineItem/SubordinateCIILBSubordinateTradeLineItem/SpecifiedCIILBSupplyChainTradeSettlement/SpecifiedCITradeAllowanceCharge/Reason
v4.1,669,3859,2,UN01008286,BBIE,明細行追加請求計算根拠金額,0..1,0..1,Attribute,CI_ Trade_ Allowance Charge,11,,Basis,Amount,,この明細行追加請求の計算根拠となる金額,,,CI_ Trade_ Allowance Charge. Basis. Amount,The monetary value that is the basis on which this CI trade allowance or charge is calculated.,Basis Amount,SubordinateDocumentAllowanceChargeBasisAmount,BasisAmount,/SMEConsolidatedSelfInvoice/CIIHSupplyChainTradeTransaction/IncludedCIILSupplyChainTradeLineItem/SubordinateCIILBSubordinateTradeLineItem/SpecifiedCIILBSupplyChainTradeSettlement/SpecifiedCITradeAllowanceCharge/BasisAmount
v4,670,3861,2,UN01005716,ASBIE,明細行追加請求税グループ,0..n,0..n,Composition,CI_ Trade_ Allowance Charge,1,,Category,,CI_ Trade_ Tax,明細行追加請求の税に関するグループ,,,CI_ Trade_ Allowance Charge. Category. CI_ Trade_ Tax,A tax category of this CI trade allowance charge.,Tax Category,SubordinateDocumentAllowanceChargeCategoryTax,CategoryCITradeTax,/SMEConsolidatedSelfInvoice/CIIHSupplyChainTradeTransaction/IncludedCIILSupplyChainTradeLineItem/SubordinateCIILBSubordinateTradeLineItem/SpecifiedCIILBSupplyChainTradeSettlement/SpecifiedCITradeAllowanceCharge/CategoryCITradeTax
v1,489,2429,1,UN01006006,ABIE,明細文書ヘッダ合計金額クラス,,,Class,CIIL_ Trade Settlement_ Monetary Summation,0,,,,,明細文書ヘッダ合計金額に関する情報からなるクラス,,,CIIL_ Trade Settlement_ Monetary Summation. Details,A collection of trade settlement monetary totals specified for this Cross Industry Invoice Line (CIIL).,CIIL Monetary Summation,DocumentMonetarySummationDetails,CIILTradeSettlementMonetarySummation,
v4,490,2431,2,UN01006008,BBIE,明細文書ヘッダ追加請求合計金額,0..n,0..1,Attribute,CIIL_ Trade Settlement_ Monetary Summation,2,,Charge Total,Amount,,"明細文書ヘッダレベルの追加請求合計金額
'=Σ明細文書ヘッダ追加請求金額",,,CIIL_ Trade Settlement_ Monetary Summation. Charge Total. Amount,A monetary value of the total of all charge amounts being reported in this CIIL trade settlement monetary summation.,Charge Total Amount,DocumentMonetarySummationChargeTotalAmount,ChargeTotalAmount,/SMEConsolidatedSelfInvoice/CIIHSupplyChainTradeTransaction/IncludedCIILSupplyChainTradeLineItem/SpecifiedCIILSupplyChainTradeSettlement/SpecifiedCIILTradeSettlementMonetarySummation/ChargeTotalAmount
v4,491,2432,2,UN01006009,BBIE,明細文書ヘッダ返金合計金額,0..n,0..1,Attribute,CIIL_ Trade Settlement_ Monetary Summation,3,,Allowance Total,Amount,,"明細文書ヘッダレベルの返金合計金額
'=Σ明細文書ヘッダ返金金額",,,CIIL_ Trade Settlement_ Monetary Summation. Allowance Total. Amount,A monetary value of the total of all allowance amounts being reported in this CIIL trade settlement monetary summation.,Allowance Total Amount,DocumentMonetarySummationAllowanceTotalAmount,AllowanceTotalAmount,/SMEConsolidatedSelfInvoice/CIIHSupplyChainTradeTransaction/IncludedCIILSupplyChainTradeLineItem/SpecifiedCIILSupplyChainTradeSettlement/SpecifiedCIILTradeSettlementMonetarySummation/AllowanceTotalAmount
v4.3,493,2434,2,UN01006011,BBIE,明細文書ヘッダ消費税合計額(外貨建て請求書の日本円金額),0..n,0..1,Attribute,CIIL_ Trade Settlement_ Monetary Summation,5,,Tax Total,Amount,,"外貨建て請求書の場合の日本円に換算した消費税額。
日本円請求書の場合は利用しない。","通貨コード
ISO4217",,CIIL_ Trade Settlement_ Monetary Summation. Tax Total. Amount,A monetary value of the total of all tax amounts being reported in this CIIL trade settlement monetary summation.,Tax Total Amount,DocumentMonetarySummationTaxTotalAmount,TaxTotalAmount,/SMEConsolidatedSelfInvoice/CIIHSupplyChainTradeTransaction/IncludedCIILSupplyChainTradeLineItem/SpecifiedCIILSupplyChainTradeSettlement/SpecifiedCIILTradeSettlementMonetarySummation/TaxTotalAmount
v1,494,2439,2,UN01008455,BBIE,明細文書ヘッダ総合計金額（税抜き）,0..n,0..1,Attribute,CIIL_ Trade Settlement_ Monetary Summation,10,,Gross_ Line Total,Amount,,"明細文書ヘッダ総合計金額（税抜き）
'=明細文書ヘッダ譲渡資産合計金額（税抜き）＋明細文書ヘッダ追加請求合計金額ー明細文書ヘッダ返金合計金額",,,CIIL_ Trade Settlement_ Monetary Summation. Gross_ Line Total. Amount,"A monetary value of the line amount total, excluding line level allowances and charges and taxes, being reported in this CIIL trade settlement monetary summation.",Gross Line Total Amount,ItemMonetarySummationGrossLineTotalAmount,GrossLineTotalAmount,/SMEConsolidatedSelfInvoice/CIIHSupplyChainTradeTransaction/IncludedCIILSupplyChainTradeLineItem/SpecifiedCIILSupplyChainTradeSettlement/SpecifiedCIILTradeSettlementMonetarySummation/GrossLineTotalAmount
v1,495,2440,2,UN01008456,BBIE,明細文書ヘッダ譲渡資産合計金額(税抜き),0..n,0..1,Attribute,CIIL_ Trade Settlement_ Monetary Summation,11,,Net_ Line Total,Amount,,=Σ明細行譲渡資産金額（税抜き）,,,CIIL_ Trade Settlement_ Monetary Summation. Net_ Line Total. Amount,"A monetary value of the line amount total, including line level allowances and charges and excluding line level taxes, being reported in this CIIL trade settlement monetary summation.",Net Line Total Amount,ItemMonetarySummationNetLineTotalAmount,NetLineTotalAmount,/SMEConsolidatedSelfInvoice/CIIHSupplyChainTradeTransaction/IncludedCIILSupplyChainTradeLineItem/SpecifiedCIILSupplyChainTradeSettlement/SpecifiedCIILTradeSettlementMonetarySummation/NetLineTotalAmount
v2,496,2441,2,UN01008457,BBIE,明細文書ヘッダ譲渡資産合計金額(税込み),0..n,0..1,Attribute,CIIL_ Trade Settlement_ Monetary Summation,12,,Net Including Taxes_ Line Total,Amount,,=Σ明細文書明細行譲渡資産金額（税込み）,,,CIIL_ Trade Settlement_ Monetary Summation. Net Including Taxes_ Line Total. Amount,"A monetary value of the line amount total, including line level allowances, charges, and taxes, being reported in this CIIL trade settlement monetary summation.",Net Line Total Amount Including Taxes,ItemMonetarySummationNetTaxesLineTotalAmount,NetIncludingTaxesLineTotalAmount,/SMEConsolidatedSelfInvoice/CIIHSupplyChainTradeTransaction/IncludedCIILSupplyChainTradeLineItem/SpecifiedCIILSupplyChainTradeSettlement/SpecifiedCIILTradeSettlementMonetarySummation/NetIncludingTaxesLineTotalAmount
v4,497,2442,2,UN01011519,BBIE,明細文書ヘッダ総合計金額（税込み）,0..1,0..1,Attribute,CIIL_ Trade Settlement_ Monetary Summation,13,,Grand Total,Amount,,"明細文書ヘッダ総合計金額（税込み）
'=明細文書ヘッダ譲渡資産合計金額（税抜き）＋明細文書ヘッダ追加請求合計金額ー明細文書ヘッダ返金合計金額＋明細文書ヘッダ消費税合計額",,,CIIL_ Trade Settlement_ Monetary Summation. Grand Total. Amount,The monetary value of the grand total amount of this CIIL trade settlement monetary summation.,Grand Total Amount,DocumentMonetarySummationGrandTotalAmount,GrandTotalAmount,/SMEConsolidatedSelfInvoice/CIIHSupplyChainTradeTransaction/IncludedCIILSupplyChainTradeLineItem/SpecifiedCIILSupplyChainTradeSettlement/SpecifiedCIILTradeSettlementMonetarySummation/GrandTotalAmount
v4.3,679,3818,1,UN01005680,ABIE,会計アカウントクラス,,,Class,CI_ Trade_ Accounting Account,0,,,,,会計アカウントに関するクラス,,,CI_ Trade_ Accounting Account. Details,"A specific Cross Industry (CI) trade account for recording debits and credits to general accounting, cost accounting or budget accounting.",CI Trade Accounting Account,SubordinateDocumentAccountingAccountDetails,CITradeAccountingAccount,
v4.3,680,3819,2,UN01005681,BBIE,明細行会計アカウントID,1..1,1..1,Attribute,CI_ Trade_ Accounting Account,1,PK,Identification,Identifier,,明細行会計アカウントのID,,,CI_ Trade_ Accounting Account. Identification. Identifier,The unique identifier for this CI trade accounting account.,ID,SubordinateDocumentReceivableAccountingAccountID,ID,/SMEConsolidatedSelfInvoice/CIIHSupplyChainTradeTransaction/IncludedCIILSupplyChainTradeLineItem/SubordinateCIILBSubordinateTradeLineItem/SpecifiedCIILBSupplyChainTradeSettlement/ReceivableSpecifiedCITradeAccountingAccount/ID
v4.3,681,3821,2,UN01005683,BBIE,明細行会計アカウントタイプコード,0..1,0..1,Attribute,CI_ Trade_ Accounting Account,3,,Type,Code,,明細行会計アカウントのタイプコード,,,CI_ Trade_ Accounting Account. Type. Code,"The code specifying the type of CI trade accounting account, such as general (main), secondary, cost accounting or budget account.",Type Code,SubordinateDocumentReceivableAccountingAccountTypeCode,TypeCode,/SMEConsolidatedSelfInvoice/CIIHSupplyChainTradeTransaction/IncludedCIILSupplyChainTradeLineItem/SubordinateCIILBSubordinateTradeLineItem/SpecifiedCIILBSupplyChainTradeSettlement/ReceivableSpecifiedCITradeAccountingAccount/TypeCode
v4.3,682,3823,2,UN01005685,BBIE,明細行会計アカウント名,0..1,0..1,Attribute,CI_ Trade_ Accounting Account,5,,Name,Text,,明細行会計アカウントの名称,,,CI_ Trade_ Accounting Account. Name. Text,"The name, expressed as text, of this CI trade accounting account.",Name,SubordinateDocumentReceivableAccountingAccountName,Name,/SMEConsolidatedSelfInvoice/CIIHSupplyChainTradeTransaction/IncludedCIILSupplyChainTradeLineItem/SubordinateCIILBSubordinateTradeLineItem/SpecifiedCIILBSupplyChainTradeSettlement/ReceivableSpecifiedCITradeAccountingAccount/Name
v1,534,2316,1,UN01009647,ABIE,明細行クラス,,,Class,CIILB_ Subordinate_ Trade Line Item,0,,,,,明細行に関する情報からなるクラス,,,CIILB_ Subordinate_ Trade Line Item. Details,A collection of information specific to a Cross Industry Invoice Line Breakdown (CIILB) item being used or reported on for trade purposes.,CIILB Subordinate Trade Line Item,TransactionSubordinateDocumentDetails,CIILBSubordinateTradeLineItem,
v1,535,2317,2,UN01009648,BBIE,明細行ID,0..n,1..1,Attribute,CIILB_ Subordinate_ Trade Line Item,1,PK,Identification,Identifier,,この文書の明細行に関する情報を特定するために付与した行ID。明細行をユニークに識別するために付番する場合は文書IDとの複合キーで明細行を特定する。,,,CIILB_ Subordinate_ Trade Line Item. Identification. Identifier,An identifier for this CIILB subordinate trade line item.,ID,SubordinateDocumentID,ID,/SMEConsolidatedSelfInvoice/CIIHSupplyChainTradeTransaction/IncludedCIILSupplyChainTradeLineItem/SubordinateCIILBSubordinateTradeLineItem/ID
v4,536,2318,2,UN01014637,BBIE,明細行類型コード,0..1,0..1,Attribute,CIILB_ Subordinate_ Trade Line Item,2,,Category,Code,,"この明細行の取引類型（資産譲渡、返金・追加請求、調整等）を識別するコード。
デフォルトは「資産譲渡」",JECxxxx,,CIILB_ Subordinate_ Trade Line Item. Category. Code,The code specifying the category of this CIILB subordinate trade line item.,Category Code,SubordinateDocumentCategoryCode,CategoryCode,/SMEConsolidatedSelfInvoice/CIIHSupplyChainTradeTransaction/IncludedCIILSupplyChainTradeLineItem/SubordinateCIILBSubordinateTradeLineItem/CategoryCode
v1,683,2322,2,UN01010016,ASBIE,明細行／取引品目グループ,0..n,1..1,Composition,CIILB_ Subordinate_ Trade Line Item,2,,Applicable,,CI_ Trade_ Product,明細行の取引品目に関するグループ,,,CIILB_ Subordinate_ Trade Line Item. Applicable. CI_ Trade_ Product,A product applicable for this CIILB subordinate trade line item.,Applicable Product,SubordinateDocumentProduct,ApplicableCITradeProduct,/SMEConsolidatedSelfInvoice/CIIHSupplyChainTradeTransaction/IncludedCIILSupplyChainTradeLineItem/SubordinateCIILBSubordinateTradeLineItem/ApplicableCITradeProduct
v1,542,2323,2,UN01009649,ASBIE,明細行／取引契約グループ,0..1,1..1,Composition,CIILB_ Subordinate_ Trade Line Item,3,,Specified,,CIILB_ Supply Chain_ Trade Agreement,明細行の取引契約に関するグループ,,,CIILB_ Subordinate_ Trade Line Item. Specified. CIILB_ Supply Chain_ Trade Agreement,The supply chain trade agreement specified for this CIILB subordinate trade line item.,Trade Agreement,SubordinateDocument,SpecifiedCIILBSupplyChainTradeAgreement,/SMEConsolidatedSelfInvoice/CIIHSupplyChainTradeTransaction/IncludedCIILSupplyChainTradeLineItem/SubordinateCIILBSubordinateTradeLineItem/SpecifiedCIILBSupplyChainTradeAgreement
v1,589,2324,2,UN01009650,ASBIE,明細行／配送グループ,0..1,1..1,Composition,CIILB_ Subordinate_ Trade Line Item,4,,Specified,,CIILB_ Supply Chain_ Trade Delivery,明細行の配送に関するグループ,,,CIILB_ Subordinate_ Trade Line Item. Specified. CIILB_ Supply Chain_ Trade Delivery,The supply chain trade delivery specified for this CIILB subordinate trade line item.,Trade Delivery,SubordinateDocumentDelivery,SpecifiedCIILBSupplyChainTradeDelivery,/SMEConsolidatedSelfInvoice/CIIHSupplyChainTradeTransaction/IncludedCIILSupplyChainTradeLineItem/SubordinateCIILBSubordinateTradeLineItem/SpecifiedCIILBSupplyChainTradeDelivery
v1,608,2325,2,UN01009651,ASBIE,明細行／決裁グループ,0..1,1..1,Composition,CIILB_ Subordinate_ Trade Line Item,5,,Specified,,CIILB_ Supply Chain_ Trade Settlement,明細行の決済に関するグループ,,,CIILB_ Subordinate_ Trade Line Item. Specified. CIILB_ Supply Chain_ Trade Settlement,The supply chain trade settlement specified for this CIILB subordinate trade line item.,Trade Settlement,SubordinateDocument,SpecifiedCIILBSupplyChainTradeSettlement,/SMEConsolidatedSelfInvoice/CIIHSupplyChainTradeTransaction/IncludedCIILSupplyChainTradeLineItem/SubordinateCIILBSubordinateTradeLineItem/SpecifiedCIILBSupplyChainTradeSettlement
v4.2,537,2326,2,UN01015533,ASBIE,明細行／注釈グループ,0..n,0..n,Composition,CIILB_ Subordinate_ Trade Line Item,6,,Included,,CI_ Note,明細行の注釈に関するグループ,,,CIILB_ Subordinate_ Trade Line Item. Included. CI_ Note,A note included in this CIILB subordinate trade line item.,Included Note,SubordinateDocumentNote,IncludedCINote,/SMEConsolidatedSelfInvoice/CIIHSupplyChainTradeTransaction/IncludedCIILSupplyChainTradeLineItem/SubordinateCIILBSubordinateTradeLineItem/IncludedCINote
v1,543,2327,1,UN01009653,ABIE,取引契約クラス,,,Class,CIILB_ Supply Chain_ Trade Agreement,0,,,,,取引契約に関する情報からなるクラス,,,CIILB_ Supply Chain_ Trade Agreement. Details,The contractual terms of a Cross Industry Invoice Line Breakdown (CIILB) supply chain trade agreement.,CIILB Trade Agreement,SubordinateDocumentDetails,CIILBSupplyChainTradeAgreement,
v1,544,2328,2,UN01009654,ASBIE,明細行契約／明細行参照受注書グループ,0..1,0..1,Composition,CIILB_ Supply Chain_ Trade Agreement,1,,Seller Order_ Referenced,,CI_ Referenced_ Document,取引契約と明細行参照受注書に関するグループ,,,CIILB_ Supply Chain_ Trade Agreement. Seller Order_ Referenced. CI_ Referenced_ Document,The seller order document referenced in this CIILB supply chain trade agreement.,Seller Order Document,SubordinateDocumentSellerOrderReferencedReferencedDocument,SellerOrderReferencedCIReferencedDocument,/SMEConsolidatedSelfInvoice/CIIHSupplyChainTradeTransaction/IncludedCIILSupplyChainTradeLineItem/SubordinateCIILBSubordinateTradeLineItem/SpecifiedCIILBSupplyChainTradeAgreement/SellerOrderReferencedCIReferencedDocument
v1,551,2329,2,UN01009655,ASBIE,明細行契約／明細行参照注文書グループ,0..1,0..1,Composition,CIILB_ Supply Chain_ Trade Agreement,2,,Buyer Order_ Referenced,,CI_ Referenced_ Document,取引契約と明細行参照注文書に関するグループ,,,CIILB_ Supply Chain_ Trade Agreement. Buyer Order_ Referenced. CI_ Referenced_ Document,The buyer order document referenced in this CIILB supply chain trade agreement.,Buyer Order Document,SubordinateDocumentBuyerOrderReferencedReferencedDocument,BuyerOrderReferencedCIReferencedDocument,/SMEConsolidatedSelfInvoice/CIIHSupplyChainTradeTransaction/IncludedCIILSupplyChainTradeLineItem/SubordinateCIILBSubordinateTradeLineItem/SpecifiedCIILBSupplyChainTradeAgreement/BuyerOrderReferencedCIReferencedDocument
v1,597,2330,2,UN01009656,ASBIE,明細行契約／明細行出荷案内書グループ,0..n,0..1,Composition,CIILB_ Supply Chain_ Trade Agreement,3,,Additional_ Referenced,,CI_ Referenced_ Document,"取引契約と明細行出荷案内書に関するグループ
UN01009672＝＝「351」Despatch advice（出荷案内書）を指定",,,CIILB_ Supply Chain_ Trade Agreement. Additional_ Referenced. CI_ Referenced_ Document,An additional document referenced in this CIILB supply chain trade agreement.,Additional Document,SubordinateDocumentDeliveryReferencedReferencedDocument,AdditionalReferencedCIReferencedDocument,/SMEConsolidatedSelfInvoice/CIIHSupplyChainTradeTransaction/IncludedCIILSupplyChainTradeLineItem/SubordinateCIILBSubordinateTradeLineItem/SpecifiedCIILBSupplyChainTradeDelivery/AdditionalReferencedCIReferencedDocument
v1,583,2332,2,UN01009658,ASBIE,明細行契約／契約単価グループ,0..n,1..1,Composition,CIILB_ Supply Chain_ Trade Agreement,5,,Net Price_ Product,,CI_ Trade_ Price,明細行の契約単価に関するグループ。,,,CIILB_ Supply Chain_ Trade Agreement. Net Price_ Product. CI_ Trade_ Price,A net product price in this CIILB supply chain trade agreement.,Product Net Price,SubordinateDocumentNetPriceProductPrice,NetPriceProductCITradePrice,/SMEConsolidatedSelfInvoice/CIIHSupplyChainTradeTransaction/IncludedCIILSupplyChainTradeLineItem/SubordinateCIILBSubordinateTradeLineItem/SpecifiedCIILBSupplyChainTradeAgreement/NetPriceProductCITradePrice
v1,584,3955,1,UN01005790,ABIE,契約単価クラス,,,Class,CI_ Trade_ Price,0,,,,,明細行の契約単価に関する情報からなるクラス。,,,CI_ Trade_ Price. Details,A sum of money for which something is or may be bought or sold for Cross Industry (CI) trade purposes.,CI Trade Price,SubordinateDocumentPriceDetails,CITradePrice,
v1,585,3956,2,UN01005791,BBIE,単価コード,0..1,0..1,Attribute,CI_ Trade_ Price,1,,Type,Code,,単価の区分（確定、仮単価等）を識別するコード,UNCL5375,,CI_ Trade_ Price. Type. Code,The code specifying the type of CI trade price.,Type Code,SubordinateDocumentNetProductPriceTypeCode,TypeCode,/SMEConsolidatedSelfInvoice/CIIHSupplyChainTradeTransaction/IncludedCIILSupplyChainTradeLineItem/SubordinateCIILBSubordinateTradeLineItem/SpecifiedCIILBSupplyChainTradeAgreement/NetPriceProductCITradePrice/TypeCode
v1/v3,586,3957,2,UN01005792,BBIE,契約単価,1..n,1..1,Attribute,CI_ Trade_ Price,2,,Charge,Amount,,"発注者と受注者が合意した明細発注品の単価。単価基準数量と単価基準数量単位の指定に従う。
税込み、税抜きの識別はヘッダ部の「UN01013096：税計算方式」で指定（指定がない場合（デフォルト）は税抜き）。",,,CI_ Trade_ Price. Charge. Amount,A monetary value of this CI trade price charge.,Charge Amount,SubordinateDocumentNetProductPriceChargeAmount,ChargeAmount,/SMEConsolidatedSelfInvoice/CIIHSupplyChainTradeTransaction/IncludedCIILSupplyChainTradeLineItem/SubordinateCIILBSubordinateTradeLineItem/SpecifiedCIILBSupplyChainTradeAgreement/NetPriceProductCITradePrice/ChargeAmount
v4,587,3958,2,UN01005793,BBIE,単価基準数量,0..1,0..1,Attribute,CI_ Trade_ Price,3,,Basis,Quantity,,"✔定貫品目の場合：空欄（デフォルト）、または単価基準数量＝１
✔不定貫品目、ハイブリッド品目の場合：単価基準数量＝単価の基準となる重量・容量","数量単位コード
UNECE Rec20",,CI_ Trade_ Price. Basis. Quantity,The quantity on which this CI trade price is based.,Basis Quantity,SubordinateDocumentNetProductPriceBasisQuantity,BasisQuantity,/SMEConsolidatedSelfInvoice/CIIHSupplyChainTradeTransaction/IncludedCIILSupplyChainTradeLineItem/SubordinateCIILBSubordinateTradeLineItem/SpecifiedCIILBSupplyChainTradeAgreement/NetPriceProductCITradePrice/BasisQuantity
v1,590,2333,1,UN01009659,ABIE,明細行納入クラス,,,Class,CIILB_ Supply Chain_ Trade Delivery,0,,,,,明細行の納入に関する情報からなるクラス,,,CIILB_ Supply Chain_ Trade Delivery. Details,Cross Industry Invoice Line Breakdown (CIILB) supply chain shipping arrangements and movement of products and or services including despatch and delivery.,CIILB Trade Delivery,SubordinateDocumentDeliveryDetails,CIILBSupplyChainTradeDelivery,
v４,591,2335,2,UN01009661,BBIE,配送バラ数量,0..1,0..1,Attribute,CIILB_ Supply Chain_ Trade Delivery,2,,Product_ Unit,Quantity,,"配送数量がセット数量単位属性を指定の場合に利用する。
配送バラ数量＝配送数量（属性：セット）×セット単位数量（入り数）（属性：個、または不定貫品目量）","数量単位コード
UNECE Rec20",,CIILB_ Supply Chain_ Trade Delivery. Product_ Unit. Quantity,The number of product units in this CIILB supply chain trade delivery.,Product Unit Quantity,SubordinateDocumentDeliveryProductUnitQuantity,ProductUnitQuantity,/SMEConsolidatedSelfInvoice/CIIHSupplyChainTradeTransaction/IncludedCIILSupplyChainTradeLineItem/SubordinateCIILBSubordinateTradeLineItem/SpecifiedCIILBSupplyChainTradeDelivery/ProductUnitQuantity
