sequence,level,property_type,identifier,class_term,property_term,representation_term,associated_class,multiplicity,definition,module,element,label_local,definition_local,id
90,1,Class,,btx:Adjustment,,,,0..*,"Abstract class representing a correction or modification made to reflect actual financial conditions. It supports adjustments expressed as additions or subtractions, with associated reason information, actual values (amount, quantity, and date/time), and references to related parties, invoices, and taxes.",btx,btx:adjustment,【調整】,実際の財務状況を反映するために行われる補正または修正を表す抽象クラス。加算または減算として表現される調整を、理由情報、実績値（金額・数量・日時）、および関連当事者・請求書参照・税参照とともに表現する。,BT13
91,2,Attribute,,btx:Adjustment,btx:Reason Code,Code,,0..1,Code specifying the reason for the adjustment. May use UNTDED 4465 (Adjustment reason description code),btx,btx:reasonCode,調整理由コード,調整の理由を示すコード。,BT13_01
92,2,Attribute,,btx:Adjustment,btx:Reason Text,String,,0..1,Text expressing the reason for the adjustment.,btx,btx:reasonText,調整理由テキスト,調整の理由を示すテキスト。,BT13_02
93,2,Attribute,,btx:Adjustment,btx:Actual Amount,Monetary,,0..1,Actual monetary value added or subtracted as a result of the adjustment.,btx,btx:actualAmount,調整実績金額,調整の結果として加算または減算される実績金額。,BT13_03
94,2,Attribute,,btx:Adjustment,btx:Actual Quantity,Decimal,,0..1,Actual quantity added or subtracted as a result of the adjustment.,btx,btx:actualQuantity,調整実績数量,調整の結果として加算または減算される実績数量。,BT13_04
95,2,Attribute,,btx:Adjustment,btx:Actual Date Time,Date Time,,0..1,"Actual date, time, dateTime, or other date/time value of the adjustment.",btx,btx:actualDateTime,調整実績日時,調整の実績日時（年月日、時刻、日時等）。,BT13_05
96,2,Attribute,,btx:Adjustment,btx:Direction Code,Code,,0..1,Code specifying whether the adjustment is an addition or a subtraction.,btx,btx:directionCode,調整方向コード（加算／減算）,当該調整が加算か減算かを示すコード。,BT13_06
97,2,Reference Association,,btx:Adjustment,,,taf:Originating_ Document,0..1,Referenced document associated with the adjustment.,btx,taf:originatingDocument,調整参照文書,当該調整に関連して参照される請求書文書。,BT13_TA08_07
98,2,Reference Association,,btx:Adjustment,,,cor:Party,0..1,Party related to a claim for the adjustment.,btx,cor:party,請求関連当事者,調整に関連する請求（クレーム）に関係する当事者。,BT13_CO21_08
99,2,Composition,,btx:Adjustment,,,taf:Tax,0..*,Trade tax related to the adjustment.,btx,taf:tax,調整関連取引税,当該調整に関連する取引税。,BT13_TA08_09
158,1,Class,,btx:Adjustment_ Tax,,,,0..*,"Tax information that is determined or applied as part of a financial adjustment, correction, or settlement process, rather than as a direct transaction tax. This class supports traceability between the tax and the underlying adjustment event.",btx,btx:adjustmentTax,【調整税】,取引税として直接発生するのではなく、調整・修正・精算などの処理に伴って決定または適用される税を表す抽象クラス。調整事象と税情報の対応関係を追跡可能にする。,BT19
160,2,Attribute,,btx:Adjustment_ Tax,btx:Tax Authority,String,,0..1,Name of the relevant tax authority,btx,btx:taxAuthority,課税庁,関係する課税庁の名前。,BT19_BT14_01
161,2,Attribute,,btx:Adjustment_ Tax,btx:Tax Table Code,String,,0..1,Tax table code used by the relevant tax authority,btx,btx:taxTableCode,税率表コード,関係する課税庁で使用される税率表のコード。,BT19_BT14_02
162,2,Attribute,,btx:Adjustment_ Tax,btx:Tax Description,String,,0..1,Description of tax authority,btx,btx:taxDescription,課税庁説明,課税庁の説明。,BT19_BT14_03
163,2,Attribute,,btx:Adjustment_ Tax,btx:Amount of Tax,Monetary,,0..1,Amount of taxes,btx,btx:amountOfTax,税額,税額。,BT19_BT14_04
164,2,Attribute,,btx:Adjustment_ Tax,btx:Basis for Taxation,Monetary,,0..1,Basis for taxation,btx,btx:basisForTaxation,課税基準,課税基準。,BT19_BT14_05
165,2,Attribute,,btx:Adjustment_ Tax,btx:Tax Percentage Rate,Pure,,0..1,Percent rate for VAT or other taxes normally a number between 0 and 1.0 - e.g. 50% is represented as 0.5,btx,btx:taxPercentageRate,税率,"VAT(物品税)またはその他の税のパーセント比率。
0から1.0の間の値。たとえば50%は0.5とあらわす。",BT19_BT14_06
166,2,Attribute,,btx:Adjustment_ Tax,btx:Tax Category,String,,0..1,A class or category of taxes,btx,btx:taxCategory,税区分,税のクラス又はカテゴリ。,BT19_BT14_07
167,2,Attribute,,btx:Adjustment_ Tax,btx:Tax Category Code,Code,,0..1,"UNTDED 5153 Duty or tax or fee category code. Code specifying the category of duty, tax, or fee.",btx,btx:taxCategoryCode,税・関税・手数料区分コード,税・関税・手数料の区分を指定するコード（UNTDED 5153）。,BT19_BT14_08
168,2,Attribute,,btx:Adjustment_ Tax,btx:Tax Comment/Exemption Reason,String,,0..1,Additional text/code for exemption reasons or other comments.,btx,btx:taxCommentExemptionReason,税コメント/免税理由,免税理由やその他のコメントのための、追加の文またはコード。,BT19_BT14_09
169,2,Composition,,btx:Adjustment_ Tax,,,taf:Tax_ Multicurrency,0..1,Class to provide additional information related to home currencies that differ from original currencies and related exchange rates - typically this will be used to record exchange rates and amounts in currencies and/or on dates other than those of the original transaction. This class allows recording of exchange rates using a third currency as a triangulation currency. This is often EUR but is not restricted to being so. This class may be repeated as many times as necessary to record amounts in foreign currencies on the same or different dates.,btx,taf:taxMulticurrency,【多通貨明細】,"原取引時の通貨と異なる、自国通貨と換算レートに関する追加情報のクラス。－現在および原取引時の、換算レートおよび金額の記録に使用される。
トライアンギュレーション通貨としての第三通貨の換算レートを記録できる。EURの場合が多いがそれに限らない。この構造は、同日または異なる日の外貨での金額を記録する必要がある限り、繰り返し指定可能。",BT19_TA14_10
45,1,Class,,btx:Allowance Charge,,,,0..*,"Abstract class representing an allowance or a charge applied to an amount, used to model reductions (allowances) or additions (charges) to a base amount, together with their calculation basis, rate, reason, and tax-related attributes.",btx,btx:allowanceCharge,【控除・加算】,"金額に対して適用される控除（Allowance）または加算（Charge）を表す抽象クラス。
基準額、割合、理由、税に関する属性とともに、金額の減額または増額を表現するために使用される。",BT08
46,2,Attribute,,btx:Allowance Charge,btx:Charge Indicator,Boolean,,1,Indicator specifying whether the allowance charge represents a charge (true) or an allowance (false).,btx,btx:chargeIndicator,控除・加算区分指示子,当該控除・加算が、加算（true）か控除（false）かを示す指示子。,BT08_01
47,2,Attribute,,btx:Allowance Charge,btx:Amount,Monetary,,1,The monetary amount of the allowance or charge applied.,btx,btx:amount,控除・加算金額,適用される控除額または加算額。,BT08_02
48,2,Attribute,,btx:Allowance Charge,btx:Base Amount,Monetary,,0..1,The base monetary amount to which the allowance or charge is applied.,btx,btx:baseAmount,控除・加算基準額,控除または加算が適用される基準となる金額。,BT08_03
49,2,Attribute,,btx:Allowance Charge,btx:Percentage,Pure,,0..1,The percentage rate used to calculate the allowance or charge based on the base amount.,btx,btx:percentage,控除・加算割合,基準額に対して控除または加算を計算するために使用される割合。,BT08_04
50,2,Attribute,,btx:Allowance Charge,btx:Reason Code,Code,,0..1,A code specifying the reason for applying the allowance or charge.,btx,btx:reasonCode,控除・加算理由コード,控除または加算を適用する理由を示すコード。,BT08_05
51,2,Attribute,,btx:Allowance Charge,btx:Tax Category Code,Code,,0..1,A code identifying the tax category applicable to the allowance or charge.,btx,btx:taxCategoryCode,控除・加算税区分コード,当該控除または加算に適用される税区分を示すコード。,BT08_06
52,2,Attribute,,btx:Allowance Charge,btx:Tax Ratio,Pure,,0..1,The tax ratio or rate applicable to the allowance or charge amount.,btx,btx:taxRatio,控除・加算税率,控除または加算額に適用される税率または税割合。,BT08_07
1,1,Class,,btx:Amount,,,,0..*,Structure combining a monetary amount with its currency and currency role information.,btx,btx:amount,【金額構造】,金額と、その通貨および通貨の役割に関する情報を組み合わせて表現する構造。,BT03
2,2,Attribute,,btx:Amount,btx:Amount Value,Monetary,,1,Numeric value of the monetary amount expressed in the specified currency.,btx,btx:amountValue,金額,指定された通貨で表現された金額の数値。,BT03_01
3,2,Attribute,,btx:Amount,btx:Amount Type,Token,,0..1,"Code or text specifying the type or role of the amount, such as tax amount, tax base amount, allowance amount, or charge amount.",btx,btx:amountType,金額種別,税額、課税標準額、値引金額、追加請求金額など、金額の種類または役割を指定するコードまたはテキスト。,BT03_02
4,2,Attribute,,btx:Amount,btx:Currency Code,Token,,0..1,"Code specifying the currency in which the amount is expressed, typically an ISO 4217 currency code.",btx,btx:currencyCode,通貨コード,金額が表現される通貨を指定するコード。通常は ISO 4217 通貨コードを用いる。,BT03_03
5,2,Attribute,,btx:Amount,btx:Currency Code Type,Token,,0..1,"Code specifying the role of the currency used for the amount, such as functional currency, local currency, reporting currency, or transaction currency.",btx,btx:currencyCodeType,通貨コード種別,金額に対する通貨の役割（機能通貨、ローカル通貨、報告通貨、取引通貨など）を指定するコード。,BT03_04
275,1,Class,,btx:Business Transactions,,,,1..*,"Economic event represented by one or more business documents and corresponding accounting entries, such as orders, shipments, invoices, and journal entries.",btx,btx:businessTransactions,【ビジネス取引】,XBRL GLのルート要素。 注文、出荷、請求書およびそれに対応する仕訳など、1つまたは複数の業務文書と会計仕訳によって表現される経済事象。,BT30
276,2,Composition,,btx:Business Transactions,,,bus:Document Information,1..1,Parent for descriptive information about the Transaction Entries Class in which it is contained.,btx,bus:documentInformation,【文書情報】,この取引文書に関する情報の親タグ。,BT30_BU39_01
277,2,Composition,,btx:Business Transactions,,,cor:Entity_ Party,0..1,Holder for entity information - information about the reporting organization.,btx,cor:entityParty,【事業体情報】,事業体情報（報告組織に関する情報）の入れ物。,BT30_CO27_02
278,2,Composition,,btx:Business Transactions,,,btx:Transaction_ Header,0..*,Parent class grouping transaction document header records.,btx,btx:transactionHeader,【取引ヘッダ】,取引文書のヘッダ・レコードをまとめて保持する親クラス。,BT30_BT27_03
111,1,Class,,btx:Detail_ Adjustment,,,,0..*,"Class representing an adjustment applied at the transaction detail (line) level. It is used to record corrections or modifications specific to a line item or detail record, including the adjustment direction (addition/subtraction), reason information, actual values (amount, quantity, and date/time), and references to related parties, invoices, and taxes.",btx,btx:detailAdjustment,【行調整】,文書または取引のヘッダレベルで適用される調整を表すクラス。文書全体または取引全体に適用される補正または修正を、加算／減算区分、理由情報、実績値（金額・数量・日時）、および関連当事者・請求書参照・税参照とともに記録するために使用される。,BT15
113,2,Attribute,,btx:Detail_ Adjustment,btx:Reason Code,Code,,0..1,Code specifying the reason for the adjustment. May use UNTDED 4465 (Adjustment reason description code),btx,btx:reasonCode,調整理由コード,調整の理由を示すコード。,BT15_01
114,2,Attribute,,btx:Detail_ Adjustment,btx:Reason Text,String,,0..1,Text expressing the reason for the adjustment.,btx,btx:reasonText,調整理由テキスト,調整の理由を示すテキスト。,BT15_02
115,2,Attribute,,btx:Detail_ Adjustment,btx:Actual Amount,Monetary,,0..1,Actual monetary value added or subtracted as a result of the adjustment.,btx,btx:actualAmount,調整実績金額,調整の結果として加算または減算される実績金額。,BT15_03
116,2,Attribute,,btx:Detail_ Adjustment,btx:Actual Quantity,Decimal,,0..1,Actual quantity added or subtracted as a result of the adjustment.,btx,btx:actualQuantity,調整実績数量,調整の結果として加算または減算される実績数量。,BT15_04
117,2,Attribute,,btx:Detail_ Adjustment,btx:Actual Date Time,Date Time,,0..1,"Actual date, time, dateTime, or other date/time value of the adjustment.",btx,btx:actualDateTime,調整実績日時,調整の実績日時（年月日、時刻、日時等）。,BT15_05
118,2,Attribute,,btx:Detail_ Adjustment,btx:Direction Code,Code,,0..1,Code specifying whether the adjustment is an addition or a subtraction.,btx,btx:directionCode,調整方向コード（加算／減算）,当該調整が加算か減算かを示すコード。,BT15_06
119,2,Reference Association,,btx:Detail_ Adjustment,,,taf:Originating_ Document,0..1,Referenced document associated with the adjustment.,btx,taf:originatingDocument,調整参照文書,当該調整に関連して参照される請求書文書。,BT15_TA10_07
120,2,Reference Association,,btx:Detail_ Adjustment,,,cor:Party,0..1,Party related to a claim for the adjustment.,btx,cor:party,請求関連当事者,調整に関連する請求（クレーム）に関係する当事者。,BT15_CO23_08
121,2,Composition,,btx:Detail_ Adjustment,,,taf:Tax,0..*,Trade tax related to the adjustment.,btx,taf:tax,調整関連取引税,当該調整に関連する取引税。,BT15_TA10_09
182,1,Class,,btx:Detail_ Adjustment_ Tax,,,,0..*,"Tax information that is determined or applied as part of a financial adjustment, correction, or settlement process, rather than as a direct transaction tax. This class supports traceability between the tax and the underlying adjustment event.",btx,btx:detailAdjustmentTax,【行調整税】,取引税として直接発生するのではなく、調整・修正・精算などの処理に伴って決定または適用される税を表す抽象クラス。調整事象と税情報の対応関係を追跡可能にする。,BT21
184,2,Attribute,,btx:Detail_ Adjustment_ Tax,btx:Tax Authority,String,,0..1,Name of the relevant tax authority,btx,btx:taxAuthority,課税庁,関係する課税庁の名前。,BT21_01
185,2,Attribute,,btx:Detail_ Adjustment_ Tax,btx:Tax Table Code,String,,0..1,Tax table code used by the relevant tax authority,btx,btx:taxTableCode,税率表コード,関係する課税庁で使用される税率表のコード。,BT21_02
186,2,Attribute,,btx:Detail_ Adjustment_ Tax,btx:Tax Description,String,,0..1,Description of tax authority,btx,btx:taxDescription,課税庁説明,課税庁の説明。,BT21_03
187,2,Attribute,,btx:Detail_ Adjustment_ Tax,btx:Amount of Tax,Monetary,,0..1,Amount of taxes,btx,btx:amountOfTax,税額,税額。,BT21_04
188,2,Attribute,,btx:Detail_ Adjustment_ Tax,btx:Basis for Taxation,Monetary,,0..1,Basis for taxation,btx,btx:basisForTaxation,課税基準,課税基準。,BT21_05
189,2,Attribute,,btx:Detail_ Adjustment_ Tax,btx:Tax Percentage Rate,Pure,,0..1,Percent rate for VAT or other taxes normally a number between 0 and 1.0 - e.g. 50% is represented as 0.5,btx,btx:taxPercentageRate,税率,"VAT(物品税)またはその他の税のパーセント比率。
0から1.0の間の値。たとえば50%は0.5とあらわす。",BT21_06
190,2,Attribute,,btx:Detail_ Adjustment_ Tax,btx:Tax Category,String,,0..1,A class or category of taxes,btx,btx:taxCategory,税区分,税のクラス又はカテゴリ。,BT21_07
191,2,Attribute,,btx:Detail_ Adjustment_ Tax,btx:Tax Category Code,Code,,0..1,"UNTDED 5153 Duty or tax or fee category code. Code specifying the category of duty, tax, or fee.",btx,btx:taxCategoryCode,税・関税・手数料区分コード,税・関税・手数料の区分を指定するコード（UNTDED 5153）。,BT21_08
192,2,Attribute,,btx:Detail_ Adjustment_ Tax,btx:Tax Comment/Exemption Reason,String,,0..1,Additional text/code for exemption reasons or other comments.,btx,btx:taxCommentExemptionReason,税コメント/免税理由,免税理由やその他のコメントのための、追加の文またはコード。,BT21_09
193,2,Composition,,btx:Detail_ Adjustment_ Tax,,,taf:Tax_ Multicurrency,0..1,Class to provide additional information related to home currencies that differ from original currencies and related exchange rates - typically this will be used to record exchange rates and amounts in currencies and/or on dates other than those of the original transaction. This class allows recording of exchange rates using a third currency as a triangulation currency. This is often EUR but is not restricted to being so. This class may be repeated as many times as necessary to record amounts in foreign currencies on the same or different dates.,btx,taf:taxMulticurrency,【多通貨明細】,"原取引時の通貨と異なる、自国通貨と換算レートに関する追加情報のクラス。－現在および原取引時の、換算レートおよび金額の記録に使用される。
トライアンギュレーション通貨としての第三通貨の換算レートを記録できる。EURの場合が多いがそれに限らない。この構造は、同日または異なる日の外貨での金額を記録する必要がある限り、繰り返し指定可能。",BT21_TA16_10
62,1,Class,,btx:Detail_ Allowance Charge,,,,0..*,"Class representing an allowance or a charge applied at the transaction detail (line) level.
It is used to model line-level reductions or additions, including their amount, calculation basis, percentage, reason, and applicable tax attributes.",btx,btx:detailAllowanceCharge,【行控除・加算】,"取引明細（ライン）レベルで適用される控除または加算を表すクラス。
明細単位での金額の減額または増額を、金額、基準額、割合、理由、適用税区分などの属性とともに表現するために使用される。",BT10
64,2,Attribute,,btx:Detail_ Allowance Charge,btx:Charge Indicator,Boolean,,1,Indicator specifying whether the allowance charge represents a charge (true) or an allowance (false).,btx,btx:chargeIndicator,控除・加算区分指示子,当該控除・加算が、加算（true）か控除（false）かを示す指示子。,BT10_01
65,2,Attribute,,btx:Detail_ Allowance Charge,btx:Amount,Monetary,,1,The monetary amount of the allowance or charge applied.,btx,btx:amount,控除・加算金額,適用される控除額または加算額。,BT10_02
66,2,Attribute,,btx:Detail_ Allowance Charge,btx:Base Amount,Monetary,,0..1,The base monetary amount to which the allowance or charge is applied.,btx,btx:baseAmount,控除・加算基準額,控除または加算が適用される基準となる金額。,BT10_03
67,2,Attribute,,btx:Detail_ Allowance Charge,btx:Percentage,Pure,,0..1,The percentage rate used to calculate the allowance or charge based on the base amount.,btx,btx:percentage,控除・加算割合,基準額に対して控除または加算を計算するために使用される割合。,BT10_04
68,2,Attribute,,btx:Detail_ Allowance Charge,btx:Reason Code,Code,,0..1,A code specifying the reason for applying the allowance or charge.,btx,btx:reasonCode,控除・加算理由コード,控除または加算を適用する理由を示すコード。,BT10_05
69,2,Attribute,,btx:Detail_ Allowance Charge,btx:Tax Category Code,Code,,0..1,A code identifying the tax category applicable to the allowance or charge.,btx,btx:taxCategoryCode,控除・加算税区分コード,当該控除または加算に適用される税区分を示すコード。,BT10_06
70,2,Attribute,,btx:Detail_ Allowance Charge,btx:Tax Ratio,Pure,,0..1,The tax ratio or rate applicable to the allowance or charge amount.,btx,btx:taxRatio,控除・加算税率,控除または加算額に適用される税率または税割合。,BT10_07
12,1,Class,,btx:Detail_ Amount,,,,0..*,"Structure representing monetary amounts and currency information applicable to an individual line, such as line-level net amounts, tax calculation bases, allowances, or charges.",btx,btx:detailAmount,【行金額構造】,個々の明細行に適用される金額や通貨情報（行レベルの正味金額、税計算基礎額、値引または追加請求など）を表現する構造。,BT05
14,2,Attribute,,btx:Detail_ Amount,btx:Amount Value,Monetary,,1,Numeric value of the monetary amount expressed in the specified currency.,btx,btx:amountValue,金額,指定された通貨で表現された金額の数値。,BT05_01
15,2,Attribute,,btx:Detail_ Amount,btx:Amount Type,String,,0..1,"Code or text specifying the type or role of the amount, such as tax amount, tax base amount, allowance amount, or charge amount.",btx,btx:amountType,金額種別,税額、課税標準額、値引金額、追加請求金額など、金額の種類または役割を指定するコードまたはテキスト。,BT05_02
16,2,Attribute,,btx:Detail_ Amount,btx:Currency Code,Token,,0..1,"Code specifying the currency in which the amount is expressed, typically an ISO 4217 currency code.",btx,btx:currencyCode,通貨コード,金額が表現される通貨を指定するコード。通常は ISO 4217 通貨コードを用いる。,BT05_03
17,2,Attribute,,btx:Detail_ Amount,btx:Currency Code Type,Token,,0..1,"Code specifying the role of the currency used for the amount, such as functional currency, local currency, reporting currency, or transaction currency.",btx,btx:currencyCodeType,通貨コード種別,金額に対する通貨の役割（機能通貨、ローカル通貨、報告通貨、取引通貨など）を指定するコード。,BT05_04
18,2,Attribute,,btx:Detail_ Amount,btx:Adjustment Reason Description Code,Code,,0..1,UNTDED 4465 Adjustment reason description code. Code specifying the reason for an adjustment.,btx,btx:adjustmentReasonDescriptionCode,調整理由説明コード,調整（値引・加算等）の理由を指定するコード（UNTDED 4465）。,BT05_05
225,1,Class,,btx:Detail_ Identifier_ Contact,,,,0..*,Identifier Contact Information Class,btx,btx:detailIdentifierContact,【CVE担当者情報】,CVE識別子の担当者情報の構造体。,BT26
227,2,Attribute,,btx:Detail_ Identifier_ Contact,btx:Prefix,String,,0..1,"Prefix (e.g. Dr., Mr., Mrs.)",btx,btx:prefix,敬称,敬称(Dr.、Mr.、Mrs.など),BT26_BT37_01
228,2,Attribute,,btx:Detail_ Identifier_ Contact,btx:Last Name,String,,0..1,Last or family name,btx,btx:lastName,姓,姓,BT26_BT37_02
229,2,Attribute,,btx:Detail_ Identifier_ Contact,btx:First Name,String,,0..1,First or given name,btx,btx:firstName,名,名、クリスチャンネーム,BT26_BT37_03
230,2,Attribute,,btx:Detail_ Identifier_ Contact,btx:Suffix,String,,0..1,"Suffix (e.g. MD, CPA, Jr.)",btx,btx:suffix,付加名称,付加名称(MD、CPA、Jr.など),BT26_BT37_04
231,2,Attribute,,btx:Detail_ Identifier_ Contact,btx:Attention Line,String,,0..1,Attention Line,btx,btx:attentionLine,アテンションライン,アテンションライン,BT26_BT37_05
232,2,Attribute,,btx:Detail_ Identifier_ Contact,btx:Position Role,String,,0..1,Position or role,btx,btx:positionRole,地位/役職,地位や役職。,BT26_BT37_06
233,2,Attribute,,btx:Detail_ Identifier_ Contact,btx:Type,String,,0..1,"Role of contact. Examples include: Source Service, Sender, Recipient, Invoicer, Auditor, Accountant",btx,btx:type,担当者役割,担当者の役割。例：ソースサービス、送付元、受取人、請求先、監査人、会計事務所。,BT26_BT37_07
234,2,Attribute,,btx:Detail_ Identifier_ Contact,btx:Location ID cross reference,String,,0..1,This code is used to associate the contact with a specific location for the Entity. Its value should be the same as that of the organizationAddressLocationIdentifier,btx,btx:locationIdCrossReference,所在地相互参照情報,担当者と事業体の位置情報を関係付けるためのコード。organizationAddressLocationIdentifierと同じ値であるべき。,BT26_BT37_08
235,2,Attribute,,btx:Detail_ Identifier_ Contact,btx:Active,Boolean,,0..1,"Boolean to indicate whether the contact is active (=""true"") or inactive (=""false"")",btx,btx:active,担当者有効性,担当者が有効か無効かを示すブール値。,BT26_BT37_09
