sequence,level,property_type,identifier,class_term,property_term,representation_term,associated_class,multiplicity,definition,module,element,label_local,definition_local,id
45,2,Attribute,PK,bus:Document Information,bus:Type,Token,,1..1,"account: information to fill in a chart of accounts file.  
balance: the results of accumulation of a complete and validated list of entries for an account (or a list of account) in a specific period - sometimes called general ledger  
entries: a list of individual accounting entries, which might be posted/validated or nonposted/validated   
journal: a self-balancing (Dr = Cr) list of entries for a specific period including beginning balance for that period.  
ledger: a complete list of entries for a specific account (or list of accounts) for a specific period; note - debits do not have to equal credits.   
assets: a listing of open receivables, payables, inventory, fixed assets or other information that can be extracted from but are not necessarily included as part of a journal entry.  
trialBalance: the self-balancing (Dr = Cr) result of accumulation of a complete and validated list of entries for the entity in a complete list of accounts in a specific period. 
taxtables: aids automated interpretation of instances that represent tax tables; Tax table are defined by using multiple [taxes] classs to gather the population of codes, authorities and rates; through [taxTableCode] cross-references in the [taxes] class, these ""master file"" tax tables can be referenced. 
mapping: a collection of mappings between interrelated data sets, such as a local and related corporate standard chart of accounts or detail data mapped to summarized end reporting concepts.   
versioning: a collection of changes between two versions of the same class of information, such as updates to a master file like a chart of accounts.   
master_file: a collection of master files, such as the customer or inventory master file.   
trade_documents: a collection of trade/transactional documents, such as vendor invoices or customer orders.   
profile_compliant: the meaning of this collection of information can be determined by understanding an established profile and especially an XBRL GL Profile. Profiles are determined through namespace declarations, schemaRef and conventions of those profiles.   
other: for all other types of representations.

Often sorted by date or by account, these terms have specific, and sometimes different, meanings in different areas. Common practice will drive accounting method/term matches.",bus,bus:type,文書種別,"・科目:科目体系ファイルの情報。 ・残高:特定の期間について、勘定科目(または勘定科目リスト)の、完了し検証された仕訳リストの累算結果。時に総勘定元帳と呼ばれる。 ・仕訳:個々の勘定記入のリスト。転記/検証されていることもあり、されていないこともある。 ・仕訳帳:特定の期間における、その期間の開始残高を含む貸借が一致(Dr=Cr)した仕訳のリスト 。 ・元帳:特定の期間における特定の勘定科目(または勘定科目リスト)についての、仕訳の全リスト 。注意－貸借が一致する必要はない。 ・資産:仕訳記入の一部として必ずしも含まれていないが、そこから抽出可能な売掛金、買掛金、在庫、固定資産、その他の情報のリスト。 ・試算表:事業体に対する、特定期間の全勘定科目リストでの、完了し検証された仕訳リストの、貸借が一致（Dr=Cr)した累算結果。 ・税率表:税率表をあらわすデータを自動的に解釈できるようにする。税率表は、コード、税務当局情報、レートをあらわす複数のtaxes構造データを使って定義される。taxTableCodeはtaxes構造データ内で相互に参照されるが、これらのマスタファイルが参照可能。 ・マッピング情報:互いに関係があるデータセットの間の対応関係を集めたもの。例えば、企業グループ内の各会社で使用する勘定科目と全社勘定科目との対応付け、または明細データと最終的な報告書上の要約された科目への対応付け。 ・差分情報:同じクラス（種類）で異なるバージョンを持つ項目の変更・差分情報。例えば、勘定科目一覧のようなマスタファイルの特定科目の更新情報など。  ・マスターファイル:マスタファイルの一覧。例えば、顧客マスタ又は在庫/棚卸マスタなど。  ・取引伝票:取引に用いる情報の集合。例えば、納入業者からのインボイス 又は顧客からの受注情報など。  ・プロファイル情報:確立された文書説明情報及び特にXBRL GLプロファイルを理解し決定するこの情報の集合の意味を示す。説明情報は、名前空間宣言、スキーマ参照及びこれらの規約を通して決定する。  ・その他：その他のすべての表現形式  多くの場合、日付または科目によりソートされる。会計処理方法や用語は慣行により適合させる。 [設定値のリスト] (account：科目)、(balance：残高)、(entries：仕訳)、(journal：仕訳帳)、(ledger：元帳)、(assets：資産)、(trialbalance：試算表)、(taxtables：税率表)、(other：その他)、(Mapping：マッピング情報)、(versioning：差分情報)、(master_file：マスターファイル)、(trade_documents：取引伝票)、(profile_compliant：プロファイル情報)、(other：その他)",BU07_02
46,2,Attribute,,bus:Document Information,bus:Entry Date,Date Time,,0..1,Date/time file was created.,bus,bus:entryDate,作成日付,ファイルが作成された日付/時間。,BU07_03
47,2,Attribute,,bus:Document Information,bus:Revises Audit Number,String,,0..1,"If this batch of information revises a previous batch of information, this field identifies the previous batch that is being revised. 'uniqueID' of the previous batch goes here. Developers should consider exception reporting.",bus,bus:revisesAuditNumber,改訂前監査番号,この仕訳の束が以前の仕訳の束を改訂する場合に、以前の束を示す。元の文書のuniqueIDが指定される。開発者は、例外報告を考慮すべきである。,BU07_04
48,2,Attribute,,bus:Document Information,bus:Action to Take with Previous Data,Token,,0..1,Provides guidance on action to take with previous set of data: supersedes - old data should be considered as obsolete/overwritten; supplements - belongs with that data as if it was included with it.,bus,bus:actionToTakeWithPreviousData,改訂前データ処置,"以前のデータの束に対する操作のガイダンス。 取替え-古いデータを無効にし上書きする。
補完-元々含まれていたかのように、そのデータに所属させる。
[設定値のリスト]
(supplement：補完)、(supersede：取替え)",BU07_05
49,2,Attribute,,bus:Document Information,bus:Language,QName,,0..1,"Primary language of the intellectual content. Where practical, the content of this field should coincide with ISO 639-1988 language codes.",bus,bus:language,言語,主要言語。 実用的には、このフィールドの内容はISO639-1988言語コードに一致すべきである。,BU07_06
50,2,Attribute,,bus:Document Information,bus:Creator,String,,0..1,Identifies the creator of the XBRL instance.,bus,bus:creator,作成者,ファイルの作成者の識別子。,BU07_07
51,2,Attribute,,bus:Document Information,bus:Comment,String,,0..1,Text for entire document.,bus,bus:comment,文書コメント,文書全体に対する説明文。,BU07_08
52,2,Attribute,,bus:Document Information,bus:Period Covered Start,Date Time,,0..1,"Start of date range for contents. Used as basis for many assumptions about data, including the date as of which open balances are open.",bus,bus:periodCoveredStart,対象期間開始日付,内容の日付範囲の開始日。 残高の開始日付などの、データに関する多くの仮定の基礎として使用される。,BU07_09
53,2,Attribute,,bus:Document Information,bus:Period Covered End,Date Time,,0..1,"End of date range for contents. Used as basis for many assumptions about data, including the date as of which open balances are open.",bus,bus:periodCoveredEnd,対象期間終了日付,内容の日付範囲の終了日。 残高の開始日付などの、データに関する多くの仮定の基礎として使用される。,BU07_10
54,2,Attribute,,bus:Document Information,bus:Period Count,Decimal,,0..1,"Number of periods or buckets, used by postingCode. Used to interpret posting date. It may be preferable to limit entries by period covered to be by individual reporting period.",bus,bus:periodCount,期間数,postingCodeで使用される期間又はバケットの数。 転記日付を説明するために使用される。対象期間の仕訳を個々の報告期間に限定することが望ましいかもしれない。,BU07_11
55,2,Attribute,,bus:Document Information,bus:Period Unit,Token,,0..1,"Type of periods covered by periodCount. Enumerated as: daily, weekly, bi-weekly, semi-monthly, monthly, quarterly, thirdly, semiannual, annual, ad-hoc, current-period-only, other.",bus,bus:periodUnit,期間単位,"periodCountで対象とする期間の種別。
[設定値のリスト]
(daily：日次)、(weekly：週次)、(bi-weekly：隔週)、(semi-monthly：半月ごと)、(monthly：月次)、(quarterly：四半期ごと)、(thirdly：年3回)、(semiannual：半年ごと)、(annual：年次)、(ad-hoc：随時)、(current-period-only：当期)、(other：その他)",BU07_12
56,2,Attribute,,bus:Document Information,bus:Period Unit Description,String,,0..1,Free format description of the period unit,bus,bus:periodUnitDescription,期間単位説明,対象期間単位の説明。,BU07_13
57,2,Attribute,,bus:Document Information,bus:Source Application,String,,0..1,"Product or service that produced this file. Used by many systems (e.g., VAT). Version number can be included or extended.",bus,bus:sourceApplication,作成元アプリケーション,このファイルを作り出した製品又はサービス。 多くのシステム(例えば、VATなど)で、使用される。 バージョン番号を含むことも可能。,BU07_14
58,2,Attribute,,bus:Document Information,bus:Target Application,String,,0..1,Particular use for which file was generated.,bus,bus:targetApplication,対象アプリケーション,ファイルが作成された用途。,BU07_15
59,2,Attribute,,bus:Document Information,bus:Default Currency,QName,,0..1,"The default currency related to the amount can be entered here instead of the XBRL instance specified way, especially important in multi-currency situations. Recommend ISO 4217 coding",bus,bus:defaultCurrency,既定通貨,XBRLインスタンス内に指定する方法のかわりに、金額の既定の通貨を指定可能。多通貨環境で特に重要。ISO4217コード体系を推奨。,BU07_16
60,2,Composition,,bus:Document Information,,,lnk:Summary Reporting Taxonomies,0..*,Identifies and provides information about one or more target reporting taxonomies to which the data represented in the document rolls up to.,bus,lnk:summaryReportingTaxonomies,【集約報告タクソノミ】,この文書で示されたデータのロールアップ先となる、1つ以上の報告タクソノミの情報を、識別し提供する。,BU07_LK01_17
18,1,Class,,bus:Email,,,,0..*,Email address information.,bus,bus:email,【Eメールアドレス】,Eメールアドレス情報。,BU04
20,2,Attribute,,bus:Email,bus:URI Identifier,String,,0..1,"The Uniform Resource Identifier (URI), such as a web or an email address, for this communication.",bus,bus:uriIdentifier,URI,メールアドレスやWebアドレス等のURI。,BU04_01
21,2,Attribute,,bus:Email,bus:Channel Code,String,,0..1,"A code specifying the communication channel or medium through which contact information is provided or used.
This code identifies the type of communication mechanism associated with a contact point, in accordance with UN/EDIFACT Data Element 3155 – Communication means type code. It enables consistent interpretation of contact details across systems and jurisdictions.
Examples (non-exhaustive):
TE (Telephone) Voice or data communication via a telephone network.
FX (Telefax) Transmission of documents via facsimile equipment.
EM (Electronic mail) Communication using electronic mail (email). 
The Channel Code is used in conjunction with the corresponding communication identifier (e.g. phone number, fax number, or email address) and supports extensibility for additional communication types as defined by applicable code lists or jurisdictional requirements.",bus,bus:channelCode,通信チャネルコード,"連絡先情報が提供または使用される通信チャネルまたは媒体を指定するコード。
このコードは、UN/EDIFACTデータ要素3155「通信手段種別コード」に基づき、連絡先に関連付けられた通信手段の種類を識別する。これにより、システムや管轄区域をまたいで連絡先情報を一貫して解釈できる。
例（これらに限定されません）：
TE(電話)　電話網を介した音声またはデータ通信。
FX(テレファックス)　ファクシミリ機器を介した文書の送信。
EM(電子メール)　電子メール（Eメール）を使用した通信。
チャネルコードは、対応する通信識別子（電話番号、FAX番号、Eメールアドレスなど）と組み合わせて使用​​され、該当するコードリストまたは管轄区域の要件で定義されている追加の通信種別への拡張性をサポートする。",BU04_02
22,2,Attribute,,bus:Email,bus:Complete Number,String,,0..1,The text string of characters that make up the complete number for this communication.,bus,bus:completeNumber,通信番号（完全）,国番号・市外局番等を含む完全な番号文字列（電話番号、FAX番号等）。,BU04_03
23,2,Attribute,,bus:Email,bus:Use Code,String,,0..1,"The code specifying the usage or purpose of this communication, such as main, investor-relations, direct. Enumerated as: bookkeeper, controller, direct, fax, investor-relations, main, switchboard, other.",bus,bus:useCode,通信用途コード,"代表、IR用などの通信用途コード。
[設定値のリスト]
(bookkeeper：記帳係)、(controller：会計責任者)、(direct：直通)、(fax：FAX)、(investor-relations：IR窓口)、(main：代表)、(switchboard：交換台)、(other：その他)",BU04_04
12,1,Class,,bus:Fax,,,,0..*,Fax number information.,bus,bus:fax,【FAX番号】,FAX番号情報。,BU03
14,2,Attribute,,bus:Fax,bus:URI Identifier,String,,0..1,"The Uniform Resource Identifier (URI), such as a web or an email address, for this communication.",bus,bus:uriIdentifier,URI,メールアドレスやWebアドレス等のURI。,BU03_01
15,2,Attribute,,bus:Fax,bus:Channel Code,String,,0..1,"A code specifying the communication channel or medium through which contact information is provided or used.
This code identifies the type of communication mechanism associated with a contact point, in accordance with UN/EDIFACT Data Element 3155 – Communication means type code. It enables consistent interpretation of contact details across systems and jurisdictions.
Examples (non-exhaustive):
TE (Telephone) Voice or data communication via a telephone network.
FX (Telefax) Transmission of documents via facsimile equipment.
EM (Electronic mail) Communication using electronic mail (email). 
The Channel Code is used in conjunction with the corresponding communication identifier (e.g. phone number, fax number, or email address) and supports extensibility for additional communication types as defined by applicable code lists or jurisdictional requirements.",bus,bus:channelCode,通信チャネルコード,"連絡先情報が提供または使用される通信チャネルまたは媒体を指定するコード。
このコードは、UN/EDIFACTデータ要素3155「通信手段種別コード」に基づき、連絡先に関連付けられた通信手段の種類を識別する。これにより、システムや管轄区域をまたいで連絡先情報を一貫して解釈できる。
例（これらに限定されません）：
TE(電話)　電話網を介した音声またはデータ通信。
FX(テレファックス)　ファクシミリ機器を介した文書の送信。
EM(電子メール)　電子メール（Eメール）を使用した通信。
チャネルコードは、対応する通信識別子（電話番号、FAX番号、Eメールアドレスなど）と組み合わせて使用​​され、該当するコードリストまたは管轄区域の要件で定義されている追加の通信種別への拡張性をサポートする。",BU03_02
16,2,Attribute,,bus:Fax,bus:Complete Number,String,,0..1,The text string of characters that make up the complete number for this communication.,bus,bus:completeNumber,通信番号（完全）,国番号・市外局番等を含む完全な番号文字列（電話番号、FAX番号等）。,BU03_03
17,2,Attribute,,bus:Fax,bus:Use Code,String,,0..1,"The code specifying the usage or purpose of this communication, such as main, investor-relations, direct. Enumerated as: bookkeeper, controller, direct, fax, investor-relations, main, switchboard, other.",bus,bus:useCode,通信用途コード,"代表、IR用などの通信用途コード。
[設定値のリスト]
(bookkeeper：記帳係)、(controller：会計責任者)、(direct：直通)、(fax：FAX)、(investor-relations：IR窓口)、(main：代表)、(switchboard：交換台)、(other：その他)",BU03_04
87,1,Class,,bus:Period,,,,0..*,A tool to collect a specific set of periods used to summarize results from transactions.,bus,bus:period,【報告カレンダー期間】,取引の結果をまとめるための特定の期間を集めるもの。,BU11
88,2,Attribute,PK,bus:Period,bus:ID,String,,0..1,An identifier for this period in this calendar,bus,bus:id,報告期間識別子,このカレンダーにおけるこの期間の識別子。,BU11_01
89,2,Attribute,,bus:Period,bus:Description,String,,0..1,A description of this specific reporting period in this calendar.,bus,bus:description,期間説明,このカレンダーにおけるこの特定の期間の説明。,BU11_02
90,2,Attribute,,bus:Period,bus:Start Date,Date Time,,0..1,The beginning date/time of a period,bus,bus:startDate,期間開始日付,期間の開始日付/時刻,BU11_03
91,2,Attribute,,bus:Period,bus:End Date,Date Time,,0..1,The ending date/time of a period,bus,bus:endDate,期間終了日付,期間の終了日付/時刻,BU11_04
6,1,Class,,bus:Phone,,,,0..*,"Phone number information, as a specialisation of Communication.",bus,bus:phone,【電話番号】,電話番号情報（通信手段の特化）。,BU02
8,2,Attribute,,bus:Phone,bus:URI Identifier,String,,0..1,"The Uniform Resource Identifier (URI), such as a web or an email address, for this communication.",bus,bus:uriIdentifier,URI,メールアドレスやWebアドレス等のURI。,BU02_01
9,2,Attribute,,bus:Phone,bus:Channel Code,String,,0..1,"A code specifying the communication channel or medium through which contact information is provided or used.
This code identifies the type of communication mechanism associated with a contact point, in accordance with UN/EDIFACT Data Element 3155 – Communication means type code. It enables consistent interpretation of contact details across systems and jurisdictions.
Examples (non-exhaustive):
TE (Telephone) Voice or data communication via a telephone network.
FX (Telefax) Transmission of documents via facsimile equipment.
EM (Electronic mail) Communication using electronic mail (email). 
The Channel Code is used in conjunction with the corresponding communication identifier (e.g. phone number, fax number, or email address) and supports extensibility for additional communication types as defined by applicable code lists or jurisdictional requirements.",bus,bus:channelCode,通信チャネルコード,"連絡先情報が提供または使用される通信チャネルまたは媒体を指定するコード。
このコードは、UN/EDIFACTデータ要素3155「通信手段種別コード」に基づき、連絡先に関連付けられた通信手段の種類を識別する。これにより、システムや管轄区域をまたいで連絡先情報を一貫して解釈できる。
例（これらに限定されません）：
TE(電話)　電話網を介した音声またはデータ通信。
FX(テレファックス)　ファクシミリ機器を介した文書の送信。
EM(電子メール)　電子メール（Eメール）を使用した通信。
チャネルコードは、対応する通信識別子（電話番号、FAX番号、Eメールアドレスなど）と組み合わせて使用​​され、該当するコードリストまたは管轄区域の要件で定義されている追加の通信種別への拡張性をサポートする。",BU02_02
10,2,Attribute,,bus:Phone,bus:Complete Number,String,,0..1,The text string of characters that make up the complete number for this communication.,bus,bus:completeNumber,通信番号（完全）,国番号・市外局番等を含む完全な番号文字列（電話番号、FAX番号等）。,BU02_03
11,2,Attribute,,bus:Phone,bus:Use Code,String,,0..1,"The code specifying the usage or purpose of this communication, such as main, investor-relations, direct. Enumerated as: bookkeeper, controller, direct, fax, investor-relations, main, switchboard, other.",bus,bus:useCode,通信用途コード,"代表、IR用などの通信用途コード。
[設定値のリスト]
(bookkeeper：記帳係)、(controller：会計責任者)、(direct：直通)、(fax：FAX)、(investor-relations：IR窓口)、(main：代表)、(switchboard：交換台)、(other：その他)",BU02_04
99,1,Class,,bus:Reporting Calendar,,,,0..*,A tool to collect the periods used to summarise results from transactions.,bus,bus:reportingCalendar,【報告カレンダー】,取引の結果をまとめるための期間を集めるもの。,BU13
100,2,Attribute,,bus:Reporting Calendar,bus:Code,String,,0..1,"The code used to identify this specific reporting calendar, unique across periods",bus,bus:code,報告カレンダーコード,この報告カレンダーを識別するコード。複数期間にわたって一意。,BU13_01
101,2,Attribute,,bus:Reporting Calendar,bus:Description,String,,0..1,A description of the reporting calendar (associated with the reportingCalendarCode given),bus,bus:description,報告カレンダー説明,報告カレンダーの説明（reportingCalendarCodeと関係付けられる）。,BU13_02
102,2,Attribute,,bus:Reporting Calendar,bus:Title,String,,0..1,A description of the reporting period. The actual beginning and ending dates are found within the 'reportingCalendarPeriod' class,bus,bus:title,報告カレンダータイトル,報告期間の説明。実際の開始日及び終了日はreportingCalendarPeriodに記述する。,BU13_03
103,2,Attribute,,bus:Reporting Calendar,bus:Type Code,Token,,0..1,"A code for the type of period involved. Enumerated as: monthly, quarterly, semi-annually, 4-5-4, ad-hoc, other.",bus,bus:typeCode,期間種別コード,"報告期間の種別コード。月次、四半期ごと、半期ごと、4-5-4、随時、その他
[設定値のリスト]
(monthly：月次)、(quarterly：四半期ごと)、(semi-annually：半期ごと)、(4-5-4：4-5-4)、(ad-hoc：随時)、(other：その他)",BU13_04
104,2,Attribute,,bus:Reporting Calendar,bus:Type Code Description,String,,0..1,A description of the type of period involved.,bus,bus:typeCodeDescription,期間種別説明,報告期間の種別の説明。,BU13_05
105,2,Attribute,,bus:Reporting Calendar,bus:Closed Status,Token,,0..1,"An identifier on whether the reporting calendar is still open for activity. enumerated, ""open"", ""closed"", ""pending""",bus,bus:closedStatus,締状態,"報告カレンダーがオープンかどうかを示す識別子。オープン、締切り済み、保留中
[設定値のリスト]
(open：オープン)、(closed：締切り済み)、(pending：保留中)",BU13_06
106,2,Attribute,,bus:Reporting Calendar,bus:Purpose,Token,,0..1,A description of the accounting set of books involved. Uses enumeration from accounting method purpose.,bus,bus:purpose,報告目的,"帳簿の集合の説明。会計処理方法の目的の列挙値を使用する。
[設定値のリスト]
(book：帳簿)、(tax：税)、(management：管理)、(statutory：スタチュトリ)、(other：その他)",BU13_07
107,2,Attribute,,bus:Reporting Calendar,bus:Purpose Description,String,,0..1,Free format description of the reporting purpose,bus,bus:purposeDescription,報告目的説明,報告目的の説明。,BU13_08
108,2,Composition,,bus:Reporting Calendar,,,bus:Reporting Calendar_ Period,0..*,A tool to collect a specific set of periods used to summarize results from transactions.,bus,bus:reportingCalendarPeriod,【報告カレンダー期間】,取引の結果をまとめるための特定の期間を集めるもの。,BU13_09
92,1,Class,,bus:Reporting Calendar_ Period,,,,0..*,A tool to collect a specific set of periods used to summarize results from transactions.,bus,bus:reportingCalendarPeriod,【報告カレンダー期間】,取引の結果をまとめるための特定の期間を集めるもの。,BU12
