sequence,level,property_type,identifier,class_term,property_term,representation_term,associated_class,multiplicity,definition,module,element,label_local,definition_local,id
267,2,Attribute,,cor:Detail_ XBRL,cor:Detail Matching Element,QName,,0..1,Associated XBRL element in XBRL-GL instance.,cor,cor:detailMatchingElement,明細対応エレメント,関係付けられた、XBRL-GLインスタンス中のXBRL要素。,CO11_03
268,2,Attribute,,cor:Detail_ XBRL,lnk:Summary Tuple Path,String,,0..1,Specific filter for parent class class. This value must be valid XPath. And the result of the XPath must be resolved to a node.,cor,lnk:summaryTuplePath,集約タプルパス,親タグ構造を特定するフィルタ。妥当なXPath記述でなければならない。XPathの結果はノードでなければならない。,CO11_LK03_04
269,2,Attribute,,cor:Detail_ XBRL,lnk:Detailed Content Filter,String,,0..1,"Filtering mechanism. This value must be valid XPath. And the result of the XPath must be resolved to boolean. If the resulting value is false, the entry  must not mapped into specified facts in F/S.",cor,lnk:detailedContentFilter,明細コンテントフィルタ,フィルタリング手段。妥当なXPath記述でなければならない。XPathの結果はブール値でなければならない。結果がfalseの場合は、仕訳はF/S内の特定のfactsにマッピングされてはならない。,CO11_LK03_05
270,2,Attribute,,cor:Detail_ XBRL,lnk:Reporting Date Selector,Token,,0..1,This holds the concepts in GL data to create FS contexts.  The value must be a list of QName. Each QName must be resolved to GL items. Order of the items defines priority to access.,cor,lnk:reportingDateSelector,報告日付セレクタ,F/Sのコンテキストを生成するためのGLデータの概念を示す。QNameのリストでなければならない。個々のQNameはGL項目を示さなければならない。項目の並びはアクセスの優先度を示す。,CO11_LK03_06
271,2,Attribute,,cor:Detail_ XBRL,lnk:Summary Operator,String,,0..1,The operator applied to the amount or quantity when it is rolled up to a summary reporting element.,cor,lnk:summaryOperator,,,CO11_LK03_07
272,2,Attribute,,cor:Detail_ XBRL,lnk:Summary Unit Numerator,Token,,1..1,This holds the list of measure information for unit numerator. The value must be a list of QName. Each QName must be resolved to be measure information such as iso4217:usd.,cor,lnk:summaryUnitNumerator,集約ユニット分子,集約のユニットの分子の測定情報のリスト。QNameのリストでなければならない。QNameはiso4217:usdのような、解決される測定情報でなければならない。,CO11_LK03_08
273,2,Attribute,,cor:Detail_ XBRL,lnk:Summary Unit Denominator,Token,,0..1,This holds the list of measure information for unit denominator. The value must be a list of QName. Each QName must be resolved to be measure information such as iso4217:usd.,cor,lnk:summaryUnitDenominator,集約ユニット分母,集約のユニットの分母の測定情報のリスト。QNameのリストでなければならない。QNameはiso4217:usdのような、解決される測定情報でなければならない。,CO11_LK03_09
274,2,Attribute,,cor:Detail_ XBRL,lnk:Summary Reporting Taxonomy ID Reference,String,,0..1,"Reference to the ID of the relevant target reporting taxonomy, defined in the [summaryReportingTaxonomies] class at [documentInfo] level. Allows consuming applications to identify sets of [xbrlInfo] classs that point to a specific taxonomy.",cor,lnk:summaryReportingTaxonomyIdReference,集約報告タクソノミ識別子参照情報,関連する報告タクソノミの識別子への参照情報。documentInfo内のsummaryReportingTaxonomiesクラスで定義される。特定のタクソノミを示すxbrlInfoクラスの集合を、アプリケーションが識別できるようにする。,CO11_LK03_10
157,1,Class,,cor:Entity_ Party,,,,0..1,Holder for entity information - information about the reporting organization.,cor,cor:entityParty,【事業体情報】,事業体情報（報告組織に関する情報）の入れ物。,CO05
159,2,Attribute,PK,cor:Entity_ Party,cor:ID,String,,0..1,ID Number of the party,cor,cor:id,,,CO05_01
160,2,Attribute,,cor:Entity_ Party,cor:Name,String,,0..1,Name of the party,cor,cor:name,,,CO05_02
161,2,Attribute,,cor:Entity_ Party,cor:Business Description,String,,0..1,Description of the nature of the business of the party.,cor,cor:businessDescription,業種説明,事業体の事業の種類についての説明。,CO05_03
169,2,Attribute,,cor:Entity_ Party,bus:Default Accounting Method Purpose,Token,,0..1,"If not stated explicitly at the line level, the default reporting purpose - from book, tax, management, statutory, other",cor,bus:defaultAccountingMethodPurpose,既定会計処理方法目的,"明細レベルで明確に指定しない場合の、既定の報告目的を表す。帳簿、税、管理、スタチュトリ、その他から選択する。
[設定値のリスト]
(book：帳簿)、(tax：税)、(management：管理)、(statutory：スタチュトリ)、(other：その他)",CO05_BU17_11
170,2,Attribute,,cor:Entity_ Party,bus:Default Accounting Method Purpose Description,String,,0..1,Free format description of the default accounting method purpose,cor,bus:defaultAccountingMethodPurposeDescription,既定会計処理方法目的説明,既定の会計処理方法目的の説明。,CO05_BU17_12
171,2,Attribute,,cor:Entity_ Party,bus:Fiscal Year Start,Date,,0..1,"Start of fiscal year. Where appropriate, corporate year period representation permits non-365 or 366 day years (more appropriate for internal sharing than data from external sources), In Europe, some jurisdictions allow 2 year minus 1 day fiscal years.",cor,bus:fiscalYearStart,会計年度開始日付,会計年度の開始日。妥当であれば、企業の会計年度表示において、366日や365日でない年も許可する（外部ソースからのデータより内部共有のための方が適している）。ヨーロッパでは、2年マイナス1日の会計年度を許可するところもある。,CO05_BU17_13
172,2,Attribute,,cor:Entity_ Party,bus:Fiscal Year End,Date,,0..1,"End of fiscal year. Where appropriate, corporate year period representation permits non-365 or 366 day years (more appropriate for internal sharing than data from external sources), In Europe, some jurisdictions allow 2 year minus 1 day fiscal years.",cor,bus:fiscalYearEnd,会計年度終了日付,会計年度の終了日。妥当であれば、企業の会計年度表示において、366日や365日でない年も許可する（外部ソースからのデータより内部共有のための方が適している）。ヨーロッパでは、2年マイナス1日の会計年度を許可するところもある。,CO05_BU17_14
162,2,Reference Association,,cor:Entity_ Party,,,cor:Authority Registered Identifier,0..*,Class which contains various identifiers for theparty.,cor,cor:authorityRegisteredIdentifier,【事業体識別子】,組織に関する様々な識別子を含むクラス。,CO05_04
163,2,Composition,,cor:Entity_ Party,,,bus:Phone,0..*,Primary phone number of the party.,cor,bus:phone,【事業体電話番号】,事業体の主要電話番号情報。,CO05_BU17_05
164,2,Composition,,cor:Entity_ Party,,,bus:Fax,0..*,Class for holding company fax information.,cor,bus:fax,【事業体FAX番号】,事業体のFAX番号情報のクラス。,CO05_BU17_06
165,2,Composition,,cor:Entity_ Party,,,bus:Email,0..*,Class for holding company email information.,cor,bus:email,【事業体Eメールアドレス】,事業体のEメールアドレス情報のクラス。,CO05_BU17_07
166,2,Composition,,cor:Entity_ Party,,,bus:Address,0..*,Address class for the party,cor,bus:address,【住所】,報告事業体の住所クラス。,CO05_BU17_08
167,2,Composition,,cor:Entity_ Party,,,bus:Web Site,0..*,Primary web site of the party.,cor,bus:webSite,【事業体Webサイト】,事業体の代表ウェブサイト。,CO05_BU17_09
168,2,Composition,,cor:Entity_ Party,,,bus:Contact,0..*,Information about contacts.,cor,bus:contact,【担当者情報】,担当者に関する情報。,CO05_BU17_10
173,2,Composition,,cor:Entity_ Party,,,bus:Accounting Method,0..*,Class for identifying the methods of accounting used by the entity for different reporting purposes,cor,bus:accountingMethod,【会計処理方法】,異なる報告目的に応じて事業体が使用する会計処理方法を識別するためのクラス。,CO05_BU17_15
174,2,Composition,,cor:Entity_ Party,,,bus:Accountant,0..*,Information about the relevant external accountant,cor,bus:accountant,【会計事務所情報】,関連する外部会計事務所に関する情報。,CO05_BU17_16
175,2,Composition,,cor:Entity_ Party,,,bus:Reporting Calendar,0..*,A tool to collect the periods used to summarise results from transactions.,cor,bus:reportingCalendar,【報告カレンダー】,取引の結果をまとめるための期間を集めるもの。,CO05_BU17_17
483,1,Class,,cor:Entry_ Detail,,,,0..*,Parent for entry detail,cor,cor:entryDetail,【仕訳明細】,仕訳明細の親タグ。,CO14
485,2,Attribute,PK,cor:Entry_ Detail,cor:Line Number Counter,Decimal,,0..1,Unique reference for the line - a numeric counter,cor,cor:lineNumberCounter,明細行番号カウンタ,明細行の一意なリファレンス　　カウンタ,CO14_01
486,2,Attribute,,cor:Entry_ Detail,cor:Line Number,String,,0..1,Identifier for a particular entry detail,cor,cor:lineNumber,明細行番号,仕訳明細の識別子。,CO14_02
487,2,Attribute,,cor:Entry_ Detail,cor:Posting Date,Date Time,,0..1,"At the detail level, this represents the accounting significance date. No matter what date the document is received, entered, or posted, this signifies the accounting date of the entry. If you want to see the financial results for March 5, 2002 and this entry is given that date, the entry will be part of the results for March 5, 2002. This is different from the postedDate found at the entryHeader level. If you want the accounting significance to be a particular date, it goes here. A single entry could represent multiple dates, but would only be posted on one date.",cor,cor:postingDate,転記日付,明細レベルで、会計上意義のある日付を示す。ドキュメントの受領、入力、転記の日付に関わらず、仕訳が会計処理された日付を示す。2002.03.05の財務結果を見たいときに、ここにその日付がある場合は、この明細は2002.03.05の結果の一部である。これは、entryHeaderにあるpostedDateとは異なる。特定の日付を会計上意義のある日付にしたいなら、ここに記述する。ひとつの仕訳が複数の日付をあらわせるが、ひとつの日でのみ転記される。,CO14_03
488,2,Attribute,,cor:Entry_ Detail,bus:Memo Line,Boolean,,0..1,A boolean like entry that indicates whether an entryDetail line has been provided solely to provide additional details and that tools should not consider the amount in postings.,cor,bus:memoLine,メモ行フラグ,明細行が単に追加の詳細を与えるものであり、転記金額に含めるべきでないことを示すブール値。,CO14_BU30_04
489,2,Attribute,,cor:Entry_ Detail,cor:Document Type,Token,,0..1,"An enumerated field describing the original source document, with check, debit-memo, credit-memo, finance-charge, invoice, order-customer, order-vendor, payment-other, reminder, tegata, voucher, shipment, receipt, manual-adjustment, other.",cor,cor:documentType,元文書種別,"小切手、借方メモ、貸方メモ、財務費用、顧客への請求書、顧客オーダー、仕入先オーダー、その他支払い、督促状、手形、ベンダからの請求書、出荷票、受領票、手修正、その他の列挙値による、元文書の説明。[設定値のリスト] (check：小切手)、(debit-memo：借方メモ)、(credit-memo：貸方メモ)、(finance-charge：財務費用)、(invoice：顧客への請求書)、(order-customer：顧客オーダ)、(order-vendor：仕入先オーダ)、(payment-other：その他支払い)、(reminder：督促状)、(tegata：手形)、(voucher：ベンダからの請求書)、(shipment：出荷票)、(receipt：受領票)、(manual-adjustment：手修正)、(other：その他)",CO14_CO30_05
490,2,Attribute,,cor:Entry_ Detail,cor:Document Type Description,String,,0..1,Free format description of the document type,cor,cor:documentTypeDescription,元文書種別説明,元文書の種別の説明。,CO14_CO30_06
491,2,Attribute,,cor:Entry_ Detail,cor:Document Number,String,,0..1,"Invoice, check, voucher, or other source document identifier",cor,cor:documentNumber,元文書番号,請求書、小切手、証憑、その他の元文書の識別子。,CO14_CO30_07
492,2,Attribute,,cor:Entry_ Detail,cor:Apply To Number,String,,0..1,"Document number of primary invoice number, used to offset payments, debits and credits; for an invoice, usually the same as the documentNumber. When calculating open balance on an invoice, or open amount on payments in advance or not fully applied, this permits calculation of the open item.",cor,cor:applyToNumber,適用先番号,"支払、借方、貸方の相殺に使用される、一次請求書の文書番号。請求書では通常documentNumberと等しい。
未決済の請求書残高や、未決済の支払金額の計算時に、利用できる。",CO14_CO30_08
493,2,Attribute,,cor:Entry_ Detail,cor:Document Reference,String,,0..1,Internal reference for the document above; number assigned internally to track the document,cor,cor:documentReference,元文書参照情報,上の文書のための内部参照情報。文書を追跡するために内部的に割り当てた番号。,CO14_CO30_09
494,2,Attribute,,cor:Entry_ Detail,cor:Document Date,Date Time,,0..1,"Date (and less likely in the paper world but possible in the e-world, time) on actual document (invoice, voucher, check date). Other dates control posting information.",cor,cor:documentDate,元文書日付,実際の文書（請求書、証憑、小切手）の日付（および、紙の世界ではありそうにないが、電子的には時刻）。 転記の情報は別の日付で管理する。,CO14_CO30_10
495,2,Attribute,,cor:Entry_ Detail,bus:Received Date,Date Time,,0..1,Date/time document was noted as received (if necessary). Represents actual date received. Posting dates are maintained separately.,cor,bus:receivedDate,元文書受領日付,（必要であれば）文書の受領が記録された日付/時刻。実際に受領された日付をあらわす。転記日付は別に管理される。,CO14_BU30_11
496,2,Attribute,,cor:Entry_ Detail,bus:Document Location,String,,0..1,"Document location as URI, file name or other reference. Alternatively, text of document can be placed here.",cor,bus:documentLocation,元文書格納場所,文書の格納場所である、URI、ファイル名またはその他の参照情報。代わりに、文書のテキストも記述可能。,CO14_BU30_12
497,2,Attribute,,cor:Entry_ Detail,cor:Posting Status,Token,,0..1,"deferred: although entered, it cannot be posted until a later time
posted: already posted
proposed: a proposed item that must be approved
simulated: a simulated item, for what-if
tax: a tax-specific entry
unposted:entered but not yet posted or validated
cancelled:entered and later cancelled
other:other status - should be described in postingStatusDescription",cor,cor:postingStatus,転記状態,"・据置：入力されたが、まだ転記できない。
・転記済：転記済み。
・提案済：検証が必要な項目。
・シミュレーション：仮定のためにシミュレートされた項目。
・税：税項目。
・未転記：入力されたが、まだ検証も転記もされていない。
・取消済：入力されたが、取り消された。
・その他：その他の状態。postingStatusDescriptionで説明されるべき。
[設定値のリスト]
(deferred：据置)、(posted：転記済)、(proposed：提案済)、(simulated：シミュレーション)、(tax：税)、(unposted：未転記)、(cancelled：取消済)、(other：その他)",CO14_CO30_13
498,2,Attribute,,cor:Entry_ Detail,cor:Posting Status Description,String,,0..1,Free format description of the posting status,cor,cor:postingStatusDescription,転記状態説明,転記状態の説明。,CO14_CO30_14
499,2,Attribute,,cor:Entry_ Detail,cor:Description,String,,0..1,Description of this line of detail only,cor,cor:description,説明,この明細行のみに対する説明。,CO14_CO30_15
500,2,Attribute,,cor:Entry_ Detail,cor:Acknowledgement Date,Date Time,,0..1,Date of acknowledgement of goods/services shipped/received.,cor,cor:acknowledgementDate,承認日付,出荷/受領済みの物品/サービスを承認した日付。,CO14_CO30_16
501,2,Attribute,,cor:Entry_ Detail,cor:Confirmation Date,Date Time,,0..1,Date of confirmation of shipment/receipt.,cor,cor:confirmationDate,確認日付,出荷/受領を確認した日付。,CO14_CO30_17
502,2,Attribute,,cor:Entry_ Detail,ehm:Measurable Class ID,Token,,0..1,"An enumerated code to identify the inventory, fixed asset or other measurable class. Enumerated as: raw material, work-in-process, finished goods, assemblies, supplies, land, building, machinery, furniture, vehicles, other.",cor,ehm:measurableClassId,測定可能分類コード,在庫、固定資産、その他の測定可能な分類を識別するための列挙コード。列挙例：原材料、仕掛品、製品、組立品、備品、土地、建物、機械、家具、車両、その他。,CO14_EH04_18
503,2,Attribute,,cor:Entry_ Detail,ehm:Measurable Class Description,String,,0..1,Free format description associated with gl-ehm:measurableClassID to provide specialization or clarification for the enumerated value of other.,cor,ehm:measurableClassDescription,測定可能分類の説明,「その他」の列挙値を補足・特定するための自由記述形式の説明。,CO14_EH04_19
504,2,Attribute,,cor:Entry_ Detail,ehm:Geospatial Coordinate,String,,0..1,"Enter a relevant location for this item. Format can be either:
- Degrees, minutes, and seconds (DMS): 41°24'12.2""N 2°10'26.5""E
- Degrees and decimal minutes (DMM): 41 24.2028, 2 10.4418
- Decimal degrees (DD): 41.40338, 2.17403",cor,ehm:geospatialCoordinate,地理座標,"本項目の関連位置を入力。形式は以下のいずれか：
・度分秒 (DMS): 41°24'12.2""N 2°10'26.5""E
・度と小数分 (DMM): 41 24.2028, 2 10.4418
・10進度 (DD): 41.40338, 2.17403",CO14_EH04_20
516,2,Attribute,,cor:Entry_ Detail,cor:Monetary Amount,Monetary,,0..1,"This field (amount) represents the primary monetary amount related to the  subject of the entryDetail line. There is one primary monetary amount per entryDetail class. It may, for example, represent the amount of one line of a journal entry, the balance on a document, or the extended amount of a line item on an invoice. Amount is not required if detailed entry is used for non-financial work and other elements are populated, in particular measurableQuantity. The amount field is a signed number (either positive or negative itself) and used in conjunction with a separate signOfAmount and a separate debitCreditCode, which together are considered for understanding the monetary amount. The unit of measure is determined by amountCurrency if present, and by the default or home currency if amountCurrency is not present.",cor,cor:monetaryAmount,金額,entryDetailの代表的な金額を示す。entryDetailごとにひとつの値を持つ。たとえば、仕訳帳の行、残高、請求書の行の金額。明細が会計業務用でなく、measurableQuantityなどの他の要素が設定されている場合は不要。符号付数値であり、金額を解釈するために用意されたsignOfAmountおよびdebitCreditCodeとあわせて使用される。通貨単位はamountCurrencyで決定される。amountCurrencyが指定されない場合は、既定または自国の通貨単位となる。,CO14_CO07_32
517,2,Attribute,,cor:Entry_ Detail,muc:Currency,QName,,0..1,"The currency related to the amount can be entered here instead of the XBRL instance specified way, especially important in multi-currency situations. Recommend ISO 4217 coding.",cor,muc:currency,通貨,XBRLインスタンス内に指定する方法のかわりに、金額の通貨を指定可能。多通貨環境で特に重要。ISO4217コード体系を推奨。,CO14_MC05_33
518,2,Attribute,,cor:Entry_ Detail,cor:Sign Indication for Amount,Token,,0..1,Sign of amount; provides 4 possible fields only when used in conjunction with debitCreditCode; primarily used for correcting entries so total debits and credits after an entry error are not inflated. D + increase DebitsD - decrease debitsC + decreases creditC - increases credit,cor,cor:signIndicationForAmount,金額符号,"金額の符号。貸借識別子と関連して使用される場合にだけ、4つの可能なフィールドを提供する。記入エラー後の総貸借が膨張しないように、おもに仕訳の訂正に使用される。 D+は借方を増加させる。D-は借方を減少させる。C+は貸方を減少させる。C-は貸方を増加させる。
[設定値のリスト]
(+)、(-)、(plus：プラス)、(minus：マイナス)",CO14_CO05_34
519,2,Attribute,,cor:Entry_ Detail,cor:Debit/Credit Indicator,Token,,0..1,"Optional identifier of whether the amount is a (D)ebit, a (C)redit or Undefined",cor,cor:debitcreditIndicator,貸借区分コード,"金額が借方か貸方か不定かを示す識別子。
[設定値のリスト]
(D)、(C)、(debit：借方)、(credit：貸方)、(undefined：不定)",CO14_CO05_35
520,2,Attribute,,cor:Entry_ Detail,bus:Allocation Code,String,,0..1,A code that is tied to the Enterprise's allocation system.,cor,bus:allocationCode,配分コード,配賦システムに結びつけるコード。,CO14_BU30_36
521,2,Attribute,,cor:Entry_ Detail,cor:Invoice Type,Token,,0..1,"Invoice Type  (self-billed, ePoS enumerated values)",cor,cor:invoiceType,請求書種別,"請求書の種別。(self-billed、ePoS)
[設定値のリスト]
(ePos：POSシステムからの発行)、(self-billed：手動発行)",CO14_CO30_37
522,2,Attribute,,cor:Entry_ Detail,bus:Chargeable or Reimbursable,String,,0..1,"Is this entry chargeable to client, reimbursable? Used by some systems to indicate that account on posting/validation should be posted to a customer or vendor's account.",cor,bus:chargeableOrReimbursable,請求支払可能フラグ,この仕訳は顧客に請求、支払可能か。いくつかのシステムでは転記/検証対象の科目が顧客や仕入先の科目に転記されるべきかどうかを示すために使用される。,CO14_BU30_38
523,2,Attribute,,cor:Entry_ Detail,bus:Payment Method,String,,0..1,Method used or to be used to make the payment,cor,bus:paymentMethod,支払方法,支払いのために使用された、または使用される方法。,CO14_BU30_39
524,2,Attribute,,cor:Entry_ Detail,cor:Ship From,String,,0..1,References organizationAddressLocationIdentifier where used. Otherwise freeform.,cor,cor:shipFrom,出荷元,organizationAddressLocationIdentifierの参照情報。または自由記述。,CO14_CO30_40
525,2,Attribute,,cor:Entry_ Detail,cor:Date Shipped/Received,Date Time,,0..1,Date goods/services are shipped/received.,cor,cor:dateShippedReceived,出荷/受領日付,物品/サービスを出荷/受領した日付。,CO14_CO30_41
526,2,Attribute,,cor:Entry_ Detail,cor:Maturity Date or Date Due,Date Time,,0..1,Due date or other maturity date.,cor,cor:maturityDateOrDateDue,支払期日,支払期日やその他の期日。,CO14_CO30_42
527,2,Attribute,,cor:Entry_ Detail,cor:Payment Terms,String,,0..1,Discount/payment terms.,cor,cor:paymentTerms,支払条件,割引/支払い条件。,CO14_CO30_43
528,2,Attribute,,cor:Entry_ Detail,ehm:Costing Method Code,Token,,0..1,"An enumerated code for the inventory (or other measurable) costing method. Enumerated as: LIFO, FIFO, average, weighted-average, standard-cost, tax-basis, book-basis, other.",cor,ehm:costingMethodCode,原価計算方法コード,在庫または他の測定可能な対象の原価計算方法を示す列挙コード。列挙例：LIFO、FIFO、平均法、加重平均法、標準原価法、税基準、帳簿基準、その他。,CO14_EH04_44
529,2,Attribute,,cor:Entry_ Detail,ehm:Costing Method Description,String,,0..1,Free format description associated with gl-ehm:costingMethodCode to provide specialization of clarification for the enumerated value of other.,cor,ehm:costingMethodDescription,原価計算方法の説明,「その他」の列挙値に関する補足説明または特定のための自由記述形式。,CO14_EH04_45
530,2,Attribute,,cor:Entry_ Detail,taf:Ticking Field,Boolean,,0..1,"Signifies that an item has been cleared, finished, finalized. When checking accounts are called for, the tick or letter showing this was done appears in this field. Can also be used for identifying that the
original document against which a payment or DR/CR memo applies has been reconciled.",cor,taf:tickingField,チェック欄,項目が消去または完了されたことを示す。勘定のチェックが要求される場合、処理済を示すチェックマークまたは文字が指定される。支払またはDR/CRのメモに対する元文書が、消し込まれたことを確認するためにも使用可能。,CO14_TA07_46
