No.,Level,Property type,Identifier,Class,Property Term,Representation Term,Associate Object Class Term,Multiplicity,Description,Module,Table,Value Domain,XBRL-GL
1666,1,Class,,Activity,,,,0..1,,Core,75,,
1667,2,Reference Association,,Activity,By,,User,0..1,User ID (from User Listing file) for person who did this activity.,Core,75,TEXT100,gl-cor:identifierCode with gl-cor:identifierCategory = 'systemUser'
1668,2,Attribute,,Activity,Date,Date,,0..1,"The date the activity was recorded into the system. This is sometimes referred to as the creation date. This should be a system- generated date (rather than user-entered date), when possible. This date does not necessarily correspond with the date of the transaction itself.",Core,75,DATE,gl-cor:enteredDate
1669,2,Attribute,,Activity,Time,Time,,0..1,"The time the activity was recorded into the system. ISO 8601 representing time in 24-hour time (hhmm) (for example, 1:00 PM = 1300).",Core,75,TIME,"(This is included in the ISO 8601 representation of gl-cor:enteredDate, mentioned previously.)"
1666,1,Class,,Activity Records,,,,0..1,,Core,75,,
1667,2,Composition,,Activity Records,Entered,,Activity,0..1,User ID (from User Listing file) for person who created the record.,Core,75,TEXT100,gl-cor:identifierCode with gl-cor:identifierCategory = 'systemUser'
1670,2,Composition,,Activity Records,Approved,,Activity,0..1,User ID (from User Listing file) for person who approved the entry.,Core,75,TEXT100,gl-cor:entryResponsiblePerson
1673,2,Composition,,Activity Records,Last Modified,,Activity,0..1,User ID (from User Listing file) for the last person modifying this entry.,Core,75,TEXT100,gl-bus:enteredByModified
1676,1,Class,,Address,,,,0..1,,Core,76,,
1677,2,Attribute,,Address,Street Address1,Text,,0..1,The street address line 1.,Core,76,TEXT100,gl-bus:identifierStreet (*) with gl-bus:identifierAddressPurpose = 'physical' or 'billing'
1678,2,Attribute,,Address,Street Address2,Text,,0..1,The street address line 2.,Core,76,TEXT100,gl-bus:identifierAddressStreet2*
1679,2,Attribute,,Address,City,Text,,0..1,The city where located.,Core,76,TEXT100,gl-bus:identifierCity*
1680,2,Attribute,,Address,State Province,Text,,0..1,The state or province where located. Recommend ISO 3166-2.,Core,76,TEXT6,gl-bus:identifierStateOrProvince*
1681,2,Attribute,,Address,ZipPostalCode,Code,,0..1,The zip code of the city where located.,Core,76,TEXT20,gl-bus:identifierZipOrPostalCode*
1682,2,Attribute,,Address,Country,Code,,0..1,The country code where located. Recommend ISO 3166-1 Alpha 2 or ISO 3166-1 Alpha 3 format (XX or XXX).,Core,76,TEXT3,gl-bus:identifierCountry*
1683,1,Class,,Contact,,,,0..1,,Core,77,,
1684,2,Attribute,,Contact,Name,Text,,0..1,,Core,77,TEXT100,gl-cor:identifierContactAttentionLine
1685,2,Attribute,,Contact,Phone,Code,,0..1,,Core,77,NUMERIC,gl-cor:identifierContactPhoneNumber
1686,2,Attribute,,Contact,Email,Code,,0..1,,Core,77,TEXT100,gl-cor:identifierContactEmailAddress
1687,1,Class,,Charged TaxN,,,,0..1,,Core,78,,
1688,2,Composition,,Charged TaxN,Tax1,,Charged Tax,0..1,,Core,78,,
1689,2,Composition,,Charged TaxN,Tax2,,Charged Tax,0..1,,Core,78,,
1690,2,Composition,,Charged TaxN,Tax3,,Charged Tax,0..1,,Core,78,,
1691,1,Class,,Charged Tax,,,,,,Core,79,,
1692,2,Reference Association,,Charged Tax,,,Tax,1,"Code for Tax1 type (for example, Sales, VAT). This field should agree with the Regulator Code field in the Tax Table YYYYMMDD",Core,79,TEXT25,gl-cor:taxCode (Note that XBRL GL permits an unlimited number of tax codes and amounts with the gl-cor:taxes structure.)
1693,2,Attribute,,Charged Tax,Tax Type Description,Text,,1,"Description of Tax1 type (for example, authority tax is paid to and other information to identify tax).",Core,79,TEXT100,gl-cor:taxDescription (Note that XBRL GL formalizes the tax authority with gl-cor:taxAuthority and provides other standard fields as well.)
1694,2,Composition,,Charged Tax,Tax Local,,Local Amount,0..1,The amount of Tax1 Type included in the transaction. Recorded in local currency.,Core,79,NUMERIC,gl-cor:taxAmount
1695,2,Reference Association,,Charged Tax,Debit,,Ledger Account Number,1,GL account number on which the debit side of the Tax1 transaction has been posted.,Core,79,TEXT100,"XBRL GL does not have fields explicitly associating GL accounts to tax, although it does permit specification of accounts as tax accounts (gl-cor:accountPurposeCode); it associates tax detail in the gl-cor:taxes structure with specific accounts by including them within the same gl-cor:entryDetail if the gl-cor:amount is the same, or within the same gl-cor:entryHeader if amounts differ. As with the previous GL lines, the account numbers would be mapped to gl-cor:accountMainID."
1696,2,Reference Association,,Charged Tax,Credit,,Ledger Account Number,1,GL account number on which the credit side of the Tax1 transaction has been posted.,Core,79,TEXT100,Same as above
1697,1,Class,,Amount,,,,,,Core,88,,gl-muc:multicurrencyDetail
1698,2,Attribute,,Amount,Value,Numeric,,1,Monetary amount value,Core,88,NUMERIC,gl-cor:amount
1699,2,Attribute,,Amount,Currency,Code,,1,Currency code related to the amount. See ISO 4217 coding.,Core,88,TEXT3,gl-muc:amountCurrency
1697,1,Class,,Multi Currency Amount,,,,,,Core,88,,gl-muc:multicurrencyDetail
1698,2,Composition,,Multi Currency Amount,Functional,,Amount,1,Transaction monetary amount recorded in the functional or group currency. No multicurrency translation should need to be performed on this amount because all transactions should be recorded in a single currency.,Core,88,NUMERIC,gl-cor:amount
1700,2,Composition,,Multi Currency Amount,Reporting,,Amount,0..1,Transaction monetary amount recorded in the reporting currency.,Core,88,NUMERIC,gl-muc:amountTriangulationAmount
1702,2,Composition,,Multi Currency Amount,Local,,Amount,0..1,Transaction monetary amount in local currency.,Core,88,NUMERIC,gl-muc:amountOriginalAmount
1704,1,Class,,Unit Price Amount,,,,,,Core,90,,
1705,2,Composition,,Unit Price Amount,,,Amount,1,Transaction monetary amount recorded in the functional or group currency.,Core,90,NUMERIC,gl-muc:amountOriginalAmount
1704,1,Class,,Local Currency Amount,,,,,,Core,90,,
1705,2,Composition,,Local Currency Amount,Local,,Amount,1,Transaction monetary amount recorded in the functional or group currency. No multicurrency translation should need to be performed on this amount because all transactions should be recorded in a single currency.,Core,90,NUMERIC,gl-muc:amountOriginalAmount
1697,1,Class,,Quantity,,,,,,Core,88,,gl-muc:multicurrencyDetail
1698,2,Composition,,Quantity,Value,,Amount,1,Monetary amount value,Core,88,NUMERIC,gl-cor:amount
1699,2,Attribute,,Quantity,Unit of Measure,Code,,1,Currency code related to the amount. See ISO 4217 coding.,Core,88,TEXT3,gl-muc:amountCurrency
1707,1,Class,,Product,,,,,,Core,91,,
1708,2,Reference Association,,Product,,,Inventory Product,1,"Unique identifier for each sales product. This ID may need to be created by concatenating fields (for example, business unit, product number, year, and so on) to uniquely identify each product.",Core,91,TEXT25,gl-bus:measurableIDOther
1709,2,Attribute,,Product,Product Code,Code,,1,The local product item number code appearing on the trade document.,Core,91,TEXT25,gl-bus:measurableID
1710,2,Attribute,,Product,Product Description,Text,,1,Product description (plain English) to indicate the name or other identifying characteristics of the product.,Core,91,TEXT100,gl-bus:measurableDescription
1711,2,Attribute,,Product,Product Group 01,Code,,0..1,"Product descriptor #1, for example, tires or accessories.",Core,91,TEXT25,gl-bus:measurableCodeDescription
1712,2,Attribute,,Product,Product Group 02,Code,,0..1,"Product descriptor #2, for example, brand.",Core,91,TEXT25,gl-bus:measurableCategory
1000,1,Class,,Business Unit,,,,,The business unit listing includes a description of business units and the definition of any business unit hierarchy.,Base,1,,"The preceding design assumes a single hierarchy in which Business_Unit_Hierarchy_(n+1) is a further breakdown of Business_Unit_Hierarchy_(n). XBRL GL can track an unlimited number of breakdowns and hierarchies, with proportionate allocation of subunits to units.<br>gl-cor:entriesType value = 'other' [entriesType] is a mandatory field; [other] is an enumerated value.<br>gl-cor:entriesComment value = 'ads:Business_Unit_Listing' [entriesComment] is the descriptive field describing what is common in the collection of information; introducing audit data standard namespace and qualifier for type of collection ties it to this representation."
1001,2,Attribute,PK,Business Unit,Business Unit Code,Identifier,,1,"Used to identify the business unit, region, branch, and so on at the level that financial statements are being audited and for which the trial balance is generated. For example, you may use a code aligned with the concept of a reportable segment as defined in FASB Accounting Standards Codification (ASC) 280, Segment Reporting.",Base,1,TEXT25,"XBRL GL tracks hierarchy ID, hierarchy description, and hierarchy type, so it can track code 'NA,' description 'N. America,' and type 'global area' using gl-cor:accountSubID, gl-cor:accountSubDescription, and gl-cor:accountSubType, respectively. Interrelations and hierarchies are captured by gl-cor:parentSubAccountType (What is the hierarchy type this unit rolls up to?)."
1002,2,Attribute,,Business Unit,Business Unit Description,Text,,1,Business unit (plain English) description to indicate the name or other identifying characteristics of the business unit.,Base,1,TEXT100,See above; an unlimited number of units and structures are permitted.
1003,2,Attribute,,Business Unit,Business Unit Hierarchy1,Name,,0..1,"If a hierarchy exists in the business unit structure, use the field to capture the highest level of the hierarchy (for example, global area with values such as North America, South America, Europe, the Middle East, Africa, the Far East, and so on).",Base,1,TEXT100,"Rather than duplicate fixed relationships between higher-level hierarchies, they are captured once per Business_Unit."
1004,2,Attribute,,Business Unit,Business Unit Hierarchy2,Name,,0..1,"If a hierarchy exists in the business unit structure, use the field to capture the next lower level of the hierarchy (for example, regions with values such as East Coast, West Coast, Central-Western Europe, and so on).",Base,1,TEXT100,See above; an unlimited number of units and structures are permitted.
1005,2,Attribute,,Business Unit,Business Unit Hierarchy3,Name,,0..1,"If a hierarchy exists in the business unit structure, use the field to capture the next lower level of the hierarchy (for example, cities with values such as Los Angeles, Boston, Frankfurt, and so on).",Base,1,TEXT100,See above; an unlimited number of units and structures are permitted.
1006,2,Attribute,,Business Unit,Business Unit Hierarchy4,Name,,0..1,"If a hierarchy exists in the business unit structure, use the field to capture the next lower level of the hierarchy.",Base,1,TEXT100,See above; an unlimited number of units and structures are permitted.
1007,2,Attribute,,Business Unit,Business Unit Hierarchy5,Name,,0..1,"If a hierarchy exists in the business unit structure, use the field to capture the next lower level of the hierarchy.",Base,1,TEXT100,See above; an unlimited number of units and structures are permitted.
1008,1,Class,,Segment,,,,,"It is often useful to analyze financial data by different dimensions (for example - profit center, division, branch, product, geographic region). This standard includes up to 5 such dimensions, referred to as segments. The (up to) 5-segment listing tables map the values of each of the 5 segments to a text description of that value. The purpose of (optional) segments 1 - 5 is captured in the Base Standards questionnaire, question 10.<br>XBRL GL provides more explicit context for the segments, and therefore does not require an implicit representation and an order to be associated with each segment grouping. Should it be deemed important to maintain the presentation order of the segments, the following fields can be used. All of the value and description pairs can be included in a single XBRL GL instance.",Base,2,,"gl-cor:entriesType value = 'other' [entriesType] is a mandatory field; [other] is an enumerated value.<br>gl-cor:entriesComment value = 'ads:Segment0X_Listing' if provided as individual files, or 'ads:Segment_Listing' if combined as one [entriesComment] is the descriptive field describing what is common in the collection of information; introducing audit data standard namespace and qualifier for type of collection ties it to this representation."
1009,2,Attribute,PK,Segment,Segment0X Value,Name,,0..1,Value of Segment0X (X may equal 1 to 5).,Base,2,TEXT25,gl-cor:accountSubID; the explicit definition of the broad purpose for the segment or the numeric value (1.5) can be put in gl-cor:accountSubType
1010,2,Attribute,,Segment,Segment0X Description,Text,,0..1,Segment description to indicate the name or other identifying characteristics of Segment0X Value (X may equal 1 to 5).,Base,2,TEXT100,gl-cor:accountSubDescription
1011,1,Class,,SegmentX,,,,,"Reserved segment field that can be used for profit center, division, fund, program, branch, project, and so on.",Core,3,,
1012,2,Reference Association,,SegmentX,Segment01,,Segment,0..1,"Reserved segment field that can be used for profit center, division, fund, program, branch, project, and so on.",Core,3,TEXT25,"gl-cor:accountSubID with associated gl-cor:accountSubType (Note: XBRL GL tracks hierarchy ID, hierarchy description, and hierarchy type, so it can track code NA, description N. America, and type global area using gl-cor:accountSubID, gl-cor:accountSubDescription, and gl-cor:accountSubType, respectively.)"
1013,2,Reference Association,,SegmentX,Segment02,,Segment,0..1,See above,Core,3,TEXT25,See above
1014,2,Reference Association,,SegmentX,Segment03,,Segment,0..1,See above,Core,3,TEXT25,See above
1015,2,Reference Association,,SegmentX,Segment04,,Segment,0..1,See above,Core,3,TEXT25,See above
1016,2,Reference Association,,SegmentX,Segment05,,Segment,0..1,See above,Core,3,TEXT25,See above
1017,1,Class,,User,,,,,"This table holds an identifier and information about each user within the system. Each user should have a full name, title, and role (if available) within the system.",Base,4,,
1018,2,Attribute,PK,User,User ID,Identifier,,1,"A unique identifier of individuals entering transactions into the ERP system. This field is used to join information in this table to other tables based on the fields Entered By, Last Modified By, and Approved By.",Base,4,TEXT25,gl-cor:identifierCode with gl-cor:identifierCategory = 'systemUser'
1019,2,Attribute,,User,User Active Status,Indicator,,0..1,"The status of users (for identification of transactions by inactive users). The value of this field should be either 'Active' or 'Inactive' for flat file data; for XBRL GL, this is a Boolean, in which active is 'true' and inactive is 'false.'",Base,4,TEXT10,gl-cor:identifierActive
1020,2,Attribute,,User,User Active Modified Date,Date,,0..1,The date of user activation or termination.,Base,4,DATE,gl-cor:dateAcknowledged
1021,2,Attribute,,User,First Name,Name,,1,The first (given) name of the person.,Base,4,TEXT100,gl-cor:identifierContactFirstName
1022,2,Attribute,,User,Last Name,Name,,1,The last (family) name of the person.,Base,4,TEXT100,gl-cor:identifierContactLastName
1023,2,Attribute,,User,Title,Name,,0..1,"The title of the person (for example, accounting manager).",Base,4,TEXT100,gl-cor:identifierContactPrefix
1024,2,Attribute,,User,Department,Name,,0..1,"The department the person is part of (for example, accounting).",Base,4,TEXT100,gl-cor:identifierContactAttentionLine
1025,2,Attribute,,User,Role Responsibility,Name,,0..1,"The person's functional role or primary responsibility (for example, accounts payable).",Base,4,TEXT100,gl-cor:identifierContactPositionRole
1026,1,Class,,Customer,,,,,The Customer Master YYYYMMDD file may be requested to be generated more than once for the period under review to accommodate changes occurring during the period under review. The date the file is generated is recorded as part of the file name.,O2C,6,,gl-cor:entriesType value = 'account' [entriesType] is a mandatory field; [other] is an enumerated value.<br>gl-cor: entriesComment value = 'ads:Customer_Master_Listing_YYYYMMDD' [entriesComment] is the descriptive field describing what is common in the collection of information; introducing audit data standard namespace and qualifier for type of collection ties it to this representation.
1027,2,Attribute,PK,Customer,Customer Account ID,Identifier,,1,Identifier of the customer from whom payment is expected or to whom unused credits have been applied.,O2C,6,TEXT100,gl-cor:identifierCode for internal # with gl-cor:identifierType = 'customer'
1028,2,Attribute,,Customer,Customer Account Name,Text,,1,The name of the customer.,O2C,6,TEXT100,gl-cor:identifierDescription
1029,2,Attribute,,Customer,Customer Group,Text,,0..1,"If the organization segments customers into groups, the group to which this customer is assigned.",O2C,6,TEXT100,gl-cor:identifierCategory
1030,2,Attribute,,Customer,Customer TIN,Code,,1,The customer's tax identification number.,O2C,6,TEXT100,gl-cor:identifierAuthorityCode for tax #
1031,2,Composition,,Customer,Physical,,Address,0..1,The billing address of the customer.,O2C,6,,
1032,2,Attribute,,Customer,Active Date,Date,,0..1,Date the customer declared active.,O2C,6,DATE,XBRL GL uses gl-cor:identifierActive to note that the customer is currently active or inactive. gl-cor:dateAcknowledged
1033,2,Attribute,,Customer,Inactive Date,Date,,0..1,Date the customer was declared inactive.,O2C,6,DATE,gl-cor:confirmedDate
1034,2,Composition,,Customer,Transaction Credit Limit,,Amount,0..1,The per invoice credit limit established for this customer.,O2C,6,NUMERIC,gl-muc:amountRestatedAmount
1035,2,Composition,,Customer,Overall Credit Limit,,Amount,0..1,The credit limit for this customer's total outstanding balance.,O2C,6,NUMERIC,gl-cor:amount
1036,2,Attribute,,Customer,Terms Discount Percentage,Percentage,,0..1,"The discount percentage the customer may take if an invoice is paid before a certain number of days. In the flat file, terms are represented as digits to one decimal place (for example, 10% would be represented as 10.0). In extensible business reporting language global ledger taxonomy framework (XBRL GL), the three fields Terms Discount Percentage, Terms Discount Days and Terms Due Days would be entered in the form 'xx.x% dd Net dd,' such as 2% 10 Net 30 for 2% discount if paid within 10 days, with the net due in 30 days.",O2C,6,NUMERIC,gl-cor:terms
1037,2,Attribute,,Customer,Terms Discount Days,Numeric,,0..1,"The number of days from the invoice date the customer has to take advantage of discounted terms. Terms are represented as digits with no decimal places (for example, nnn).",O2C,6,NUMERIC,See description for field # 8
1038,2,Attribute,,Customer,Terms Due Days,Numeric,,0..1,The number of days allowed to meet the obligation before an invoice becomes overdue.,O2C,6,NUMERIC,See description for field # 8; explicit in gl-cor:maturityDate
1039,2,Composition,,Customer,,,Activity Records,0..1,,O2C,6,,
1040,2,Composition,,Customer,,,Contact,0..1,,O2C,6,,
1041,2,Composition,,Customer,Billing,,Address,0..1,The physical address of the customer.,O2C,6,,
1042,1,Class,,Supplier,,,,,The Supplier Listing YYYYMMDD file may be requested to be generated more than once for the period under review to accommodate changes occurring during the period under review. The date the file is generated is recorded as part of the file name.,P2P,8,,gl-cor:entriesType value = 'account' [entriesType] is a mandatory field; [other] is an enumerated value.<br>gl-cor: entriesComment value = 'ads: Supplier_Listing_YYYYMMDD' [entriesComment] is the descriptive field describing what is common in the collection of information; introducing audit data standard namespace and qualifier for type of collection ties it to this representation.
1043,2,Attribute,PK,Supplier,Supplier Account ID,Identifier,,1,Identifier of the supplier to whom payment is due or from whom unused credits have been applied.,P2P,8,TEXT100,gl-cor:identifierCode for internal # with gl-cor:identifierType = 'vendor'
1044,2,Attribute,,Supplier,Supplier Account Name,Name,,1,The name of the supplier.,P2P,8,TEXT100,gl-cor:identifierDescription
1045,2,Attribute,,Supplier,Supplier Group,Text,,0..1,"If the organization segments suppliers into groups, the group to which this supplier is assigned.",P2P,8,TEXT100,gl-cor:identifierCategory
1046,2,Composition,,Supplier,Physical,,Address,0..1,The physical address of the supplier.,P2P,8,,
1047,2,Attribute,,Supplier,Supplier TIN,Code,,1,The supplier's tax identification number.,P2P,8,TEXT100,gl-cor:identifierAuthorityCode for tax #
1048,2,Composition,,Supplier,Billing,,Address,0..1,The billing address of the supplier.,P2P,8,,
1048.5,2,Composition,,Supplier,,,Contact,0..1,,O2C,41,,
1049,2,Attribute,,Supplier,Active Date,Date,,0..1,Date the supplier declared active.,P2P,8,DATE,XBRL GL uses gl-cor:identifierActive to note that the supplier is currently active or inactive. gl-cor:dateAcknowledged
1050,2,Attribute,,Supplier,Inactive Date,Date,,0..1,Date the supplier was declared inactive.,P2P,8,DATE,gl-cor:confirmedDate
1051,2,Composition,,Supplier,Transaction Credit Limit,,Amount,0..1,The per invoice credit limit established with this supplier.,P2P,8,NUMERIC,gl-muc:amountRestatedAmount
1052,2,Composition,,Supplier,Overall Credit Limit,,Amount,0..1,The credit limit for the total outstanding balance approved for the supplier.,P2P,8,NUMERIC,gl-cor:amount
1053,2,Attribute,,Supplier,Terms Discount Percentage,Percentage,,0..1,"The discount percentage the supplier may provide if an invoice is paid before a certain number of days. In the flat file, terms are represented as digits to one decimal place (for example, 10% would be represented as 10.0). In extensible business reporting language global ledger taxonomy framework (XBRL GL), the three fields Terms Discount Percentage, Terms Discount Days and Terms Due Days would be entered in the form 'xx.x% dd Net dd,' such as 2% 10 Net 30 for 2% discount if paid within 10 days, with the net due in 30 days.",P2P,8,NUMERIC,gl-cor:terms
1054,2,Attribute,,Supplier,Terms Discount Days,Numeric,,0..1,"The number of days from the invoice date the supplier allows to take advantage of discounted terms. Terms are represented as digits with no decimal places (for example, nnn).",P2P,8,NUMERIC,See description for field number 8
1055,2,Attribute,,Supplier,Terms Due Days,Numeric,,0..1,The number of days allowed to meet the obligation before an invoice becomes overdue.,P2P,8,NUMERIC,See description for field number 8; explicit in gl-cor:maturityDate
1056,2,Composition,,Supplier,,,Activity Records,0..1,,P2P,8,,
1057,1,Class,,Ledger Account Number,,,,,"The chart of accounts table is used to store the information about all the GL accounts - including name, description, and mapping to the financial statement captions. If different charts of accounts are needed for different business units, business unit fields should be utilized to distinguish between the local and consolidating sets of accounts.",GL,9,,"gl-cor:entriesType value = 'account' Explicitly defines this as a listing of accounts, as per XBRL GL's enumerations.<br>gl-cor: entriesComment value = 'ads:Chart_Of_Accounts' [entriesComment] is the descriptive field describing what is common in the collection of information; introducing audit data standard namespace and qualifier for type of collection ties it to this representation."
1058,2,Attribute,PK,Ledger Account Number,GL Account Number,Identifier,,1,Identifier for the GL financial account. The GL Account Number in this file must match the GL Account Number used in the GL Detail and Trial Balance files.,GL,9,TEXT100,gl-cor:accountMainID
1059,2,Attribute,,Ledger Account Number,GL Account Name,Name,,1,Name for the GL account.,GL,9,TEXT100,gl-cor:accountMainDescription
1060,2,Attribute,,Ledger Account Number,Account Type,Code,,1,"Grouping for high-level category on the financial statements. Values should be assets, liabilities, equity, revenue, expenses, and so on.",GL,9,TEXT25,gl-cor:mainAccountType
1061,2,Attribute,,Ledger Account Number,Account Subtype,Code,,1,"Grouping for lower-level categories on the financial statements. Examples include reserve account, suspense account, intercompany account, and so on.",GL,9,TEXT25,gl-cor:mainAccountTypeDescription
1062,2,Attribute,,Ledger Account Number,FS Caption,Text,,1,"Financial statement caption. Grouping for the caption the GL account rolls up to on the financial statements (for example, cash and cash equivalents, accounts payable, cost of sales, and so on). Sometimes may prefer to be at the trial balance level.",GL,9,TEXT100,gl-cor:summaryReportingElement
1063,2,Attribute,,Ledger Account Number,GL Account Description,Text,,0..1,Label or description associated with GL Account Number.,GL,9,TEXT256,gl-cor:accountTypeDescription
1064,2,Reference Association,,Ledger Account Number,,,Business Unit,1,"Used to identify the business unit, region, branch, and so on at the level that financial statements are being audited and for which the trial balance is generated. For example, you may use a description aligned with the concept of a reportable segment as defined in FASB ASC 280.",GL,9,TEXT25,gl-cor:accountSubID with gl-cor:accountSubType of 'Business_Unit'
1065,2,Reference Association,,Ledger Account Number,Parent,,Ledger Account Number,0..1,A reference to the GL Account Number that is the parent in an account hierarchy. Provided to allow more than the predefined levels of hierarchy in the chart of accounts table.,GL,9,TEXT100,gl-cor:parentAccountMainID
1066,2,Composition,,Ledger Account Number,,,Segment,0..*,,GL,9,,
