No.,Level,Property type,Identifier,Class,Property term,Representation term,Associated class,Mult.,Definition,ISO 21378 Module,ISO 21378 Table,Value Domain,Action,,,,,,,,,
139,2,Specialization,,Sales Invoice AICPA,,,Invoice AICPA,1,,AICPA,,,,,,,,,,,,
140,2,Reference Association,,Sales Invoice AICPA,Customer_Account_ID,Identifier,Supplier,0,"Identifier of the customer from whom payment is expected or to whom unused credits have been applied. Must match a
Customer_Account_ID in the
Customer_Master_Listing_YYYYMMDD file.",AICPA,,Identifier Long,gl-cor:identifierCode with gl- identifierType = “customer”,,,,,,,,,
141,2,Reference Association,,Sales Invoice AICPA,,,Sales Order,1,"Sales order ID for invoiced items. Must match Sales_Order_ID in the Sales_Orders_YYYYMMDD_YYYYMMDD file. If no sales order, leave blank.",AICPA,,Identifier Long,gl-taf:originatingDocumentNumber with gl- taf:originatingDocumentType = “order-customer”*,,,,,,,,,
142,1,Class,,Purchase Invoice AICPA,,,,,,AICPA,,,,,,,,,,,,
143,2,Specialization,,Purchase Invoice AICPA,,,Invoice AICPA,1,,AICPA,,,,,,,,,,,,
144,2,Reference Association,,Purchase Invoice AICPA,Customer_Account_ID,Identifier,Customer,0,"Identifier of the customer from whom payment is expected or to whom unused credits have been applied. Must match a
Customer_Account_ID in the
Customer_Master_Listing_YYYYMMDD file.",AICPA,,Identifier Long,gl-cor:identifierCode with gl- identifierType = “customer”,,,,,,,,,
145,2,Reference Association,,Purchase Invoice AICPA,,,Purchase Order,1,"Sales order ID for invoiced items. Must match Sales_Order_ID in the Sales_Orders_YYYYMMDD_YYYYMMDD file. If no sales order, leave blank.",AICPA,,Identifier Long,gl-taf:originatingDocumentNumber with gl- taf:originatingDocumentType = “order-customer”*,,,,,,,,,
146,1,Abstract Class,,Invoice Line AICPA,,,,,,AICPA,,,,,,,,,,,,
147,2,Specialization,,Invoice Line AICPA,,,Invoice Line,1,An abstract class that details individual charges or items on an invoice.,AICPA,,,,,,,,,,,,
148,2,Attribute,,Invoice Line AICPA,Number,Char,,0,The number for a particular line of an invoice.,AICPA,,Char Short,,,,,,,,,,
149,2,Composition,,Invoice Line AICPA,Tax Exclude,,Amount,0,"The monetary amount of an invoice line item before tax inclusion, recorded in the transaction currency.",AICPA,,,,,,,,,,,,
150,2,Composition,,Invoice Line AICPA,Tax Exclude Unit Price,,Amount,0,"The unit price of an invoice line item before tax, recorded in the transaction currency.",AICPA,,,,,,,,,,,,
151,2,Composition,,Invoice Line AICPA,Tax Include,,Amount,0,"The monetary amount of an invoice line item with tax included, recorded in the transaction currency.",AICPA,,,,,,,,,,,,
152,2,Composition,,Invoice Line AICPA,Tax Include Unit Price,,Amount,0,"The unit price for an invoice line item with tax, recorded in the transaction currency.",AICPA,,,,,,,,,,,,
153,2,Composition,,Invoice Line AICPA,Transaction,,Amount,0,"The monetary amount of a single item within an invoice, representing the transaction amount for that specific line.",AICPA,,,,,,,,,,,,
154,2,Composition,,Invoice Line AICPA,,,Amounts AICPA,1,,AICPA,,,,,,,,,,,,
155,2,Composition,,Invoice Line AICPA,Basic UOM,,Quantity,0..1,The quantity of items on an invoice line as measured by the basic unit of measure.,AICPA,,,,,,,,,,,,
156,2,Composition,,Invoice Line AICPA,Invoice,,Quantity,0..1,The quantity of items listed on an invoice line.,AICPA,,,,,,,,,,,,
157,2,Composition,,Invoice Line AICPA,,,Tax,0,"A class maintaining records of tax implications and obligations, essential for legal compliance and financial planning.",AICPA,,,,,,,,,,,,
158,2,Composition,,Invoice Line AICPA,,,Tax Line AICPA,0..*,"A class maintaining records of tax implications and obligations, essential for legal compliance and financial planning.",AICPA,,,,,,,,,,,,
159,2,Reference Association,,Invoice Line AICPA,,,Business Segment,0..*,A class signifies the structural units depicted within an organizational chart. It serves to illustrate relationships with business partners and conveys various business contexts.,AICPA,,,,,,,,,,,,
160,2,Reference Association,,Invoice Line AICPA,,,Inventory Product,0,The inventory product detailed in an invoice line item.,AICPA,,,,,,,,,,,,
161,2,Composition,,Invoice Line AICPA,,,Product AICPA,0..1,A product related to the business document.,AICPA,,,gl-bus:measurable,,,,,,,,,
162,1,Class,,Sales Invoice Line AICPA,,,,,,AICPA,,,,,,,,,,,,
163,2,Specialization,,Sales Invoice Line AICPA,,,Invoice Line AICPA,1,,AICPA,,,,,,,,,,,,
164,2,Reference Association,,Sales Invoice Line AICPA,,,Sales Order AICPA,0..1,"Sales order ID for invoiced items. Must match Sales_Order_ID in the
Sales_Orders_YYYYMMDD_YYYYMM
DD file. If no sales order, leave blank.",AICPA,,Identifier Long,"gl-taf:originatingDocumentNumber with gl-taf:originatingDocumentType
= “order-customer”*",,,,,,,,,
165,2,Reference Association,,Sales Invoice Line AICPA,,,Sales Order Line AICPA,0..1,"Identifier for sales order line number. Must match Sales_Order_Line_ID used in
Sales_Orders_Lines_YYYYMMDD_YY YYMMDD file. If no sales order, leave blank.",AICPA,,Identifier Medium,gl-cor:lineNumber*,,,,,,,,,
166,1,Class,,Purchase Invoice Line AICPA,,,,,A class representing detailed charges for individual goods or services provided as listed on a purchase invoice.,AICPA,,,,,,,,,,,,
167,2,Specialization,,Purchase Invoice Line AICPA,,,Invoice Line AICPA,1..1,The inventory product line item on a purchase invoice.,AICPA,,,,,,,,,,,,
168,2,Reference Association,,Purchase Invoice Line AICPA,,,Purchase Order AICPA,0..1,"A class capturing purchase orders placed during the period under review, serving as a control point in the three-way matching process for accounts payable, ensuring orders are matched with invoices and received goods.",AICPA,,,,,,,,,,,,
169,2,Reference Association,,Purchase Invoice Line AICPA,,,Purchase Order Line AICPA,0..1,"A class containing details of each purchase order line placed during the period under review, fundamental for the three-way matching process that compares these details against invoices and goods receipt documentation.",AICPA,,,,,,,,,,,,
