No.,Level,Property type,Identifier,Class,Property term,Representation term,Associated class,Mult.,Definition,ISO 21378 Module,ISO 21378 Table,Value Domain,Action,要素名,要素定義,xpath
234,2,Composition,,Measurable,,,Unit Price,0..1,"Per unit price of the measurable. Although one might expect that Quantity * Cost Per Unit = amount, this is not mandated except by external rules sets.",gl-bus,,,,単価,計測可能物の単価。measurableQuantity * measurableCostPerUnit = amountであることを期待するかもしれないが、外部規則がなければ必須ではない。,
235,2,Attribute,,Measurable,Start Time,DateTime,,0..1,Start time of the duration being measured,gl-bus,,,,開始日時,計量期間の開始時刻。,gl-bus:measurableStartDateTime
236,2,Attribute,,Measurable,End Time,DateTime,,0..1,End time of the duration being measured,gl-bus,,,,終了日時,計量期間の終了時刻。,gl-bus:measurableEndDateTime
237,2,Attribute,,Measurable,Active,Boolean,,0..1,"Boolean to indicate whether the measurable is active (=""true"") or inactive (=""false"")",gl-bus,,,,計測可能物有効性,計測可能物が有効か無効かを示すブール値。,
238,2,Attribute,,Measurable,Measurable Class ID,Char,,0..1,"An enumerated code to identify the inventory, fixed asset or other measurable class. Enumerated as: raw material, work-in-process, finished goods, assemblies, supplies, land, building, machinery, furniture, vehicles, other.",gl-ehm,,,,測定可能なクラスID,在庫、固定資産、またはその他の測定可能なクラスを識別するための列挙されたコード。列挙：原材料、仕掛品、完成品、組立品、消耗品、土地、建物、機械、家具、車両、その他。,gl-ehm:measurableClassID
239,2,Attribute,,Measurable,Measurable Class Description,Text,,0..1,Free format description associated with gl-ehm:measurableClassID to provide specialization or clarification for the enumerated value of other.,gl-ehm,,,,測定可能なクラスの説明,gl-ehm：measurableClassIDに関連付けられた自由形式の説明で、他の列挙値の特殊化または明確化を提供します。,gl-ehm:measurableClassDescription
240,2,Attribute,,Measurable,Costing Method Code,Char,,0..1,"An enumerated code for the inventory (or other measurable) costing method. Enumerated as: LIFO, FIFO, average, weighted-average, standard-cost, tax-basis, book-basis, other.",gl-ehm,,,,原価計算方法コード,在庫（または他の測定可能な）原価計算方法の列挙されたコード。列挙：LIFO、FIFO、平均、加重平均、標準コスト、税ベース、帳簿ベース、その他。,gl-ehm:costingMethodCode
241,2,Attribute,,Measurable,Costing Method Description,Text,,0..1,Free format description associated with gl-ehm:costingMethodCode to provide specialization of clarification for the enumerated value of other.,gl-ehm,,,,原価計算方法の説明,gl-ehm：costingMethodCodeに関連付けられた自由形式の説明。他の列挙値の明確化を専門化します。,gl-ehm:costingMethodDescription
242,2,Attribute,,Measurable,Geospatial Coordinate,Char,,0..1,"Enter a relevant location for this item. Format can be either:
- Degrees, minutes, and seconds (DMS): 41°24'12.2""N 2°10'26.5""E
- Degrees and decimal minutes (DMM): 41 24.2028, 2 10.4418
- Decimal degrees (DD): 41.40338, 2.17403",gl-ehm,,,,地理空間座標,"このアイテムに関連する場所を入力します。形式は次のいずれかになります。
-度、分、秒（DMS）：41°24'12.2""N2°10'26.5""E
-度と小数分（DMM）：41 24.2028、2 10.4418
-10度（DD）：41.40338、2.17403",gl-ehm:geospatialCoordinate
243,2,Composition,,Measurable,,,Serial Lot,0..*,"Tuple for holding information about serial numbers or lots (batches). As a tuple, this permits multiple serial numbers or multiple lot number batches within a single gl-gl-cor:measurable structure.",gl-ehm,,,,シリアルロット,シリアル番号またはロット（バッチ）に関する情報を保持するためのタプル。タプルとして、これにより、単一のgl-gl-cor：measurable構造内で複数のシリアル番号または複数のロット番号のバッチが許可されます。,gl-ehm:serialLot
244,1,Class,,Job,,,,,"Tuple for holding job related information, separate from jobs represented in account identifier. Would probably only have one jobinfo tuple for each entry line, but there may be a need to express more than one.",gl-bus,,,,【ジョブ情報】,科目識別子で表現されるジョブとは別の、ジョブに関係する情報のタプル。個々の明細行に対してひとつだけ存在すると思われるが、複数必要かもしれない。,gl-bus:jobInfo
245,2,Attribute,,Job,Job Identifier,Char,,0..1,"Associated job number or code. This could be built into the account, but many systems maintain a separate job coding system. Use primarily if job identification is a separate system, and not considered part of the chart of accounts.",gl-usk,,,,ジョブ識別子,関連するジョブ番号かジョブコード。 科目に組み込めるかもしれないが、多くのシステムでは独立したジョブコードシステムを持っている。おもに、ジョブの識別が別システムであり、科目体系に含まれないときに使用される。,gl-usk:jobCode
246,2,Attribute,,Job,Job Description,Text,,0..1,Description of job,gl-usk,,,,ジョブ説明,ジョブの説明。,gl-usk:jobDescription
247,2,Attribute,,Job,Job Phase,Char,,0..1,"Job code, phase, activity. Allows greater granularity than a simple job number. Although the gl-core only reaches down from job to phases, this can be customized to extend down to cost codes.",gl-usk,,,,ジョブフェーズ,ジョブコード、フェーズ、活動。 簡単なジョブ番号より詳細な定義が可能。基本的には、ジョブからフェーズを導くのみだが、コストコードにまでいたるように拡張可能。,gl-usk:jobPhaseCode
248,2,Attribute,,Job,Job Phase Description,Text,,0..1,"Description of Job code, phase, activity",gl-usk,,,,ジョブフェーズ説明,ジョブコード、フェーズ、活動の説明。,gl-usk:jobPhaseDescription
249,2,Attribute,,Job,Active,Boolean,,0..1,"Boolean to indicate whether the job is active (=""true"") or inactive (=""false"")",gl-usk,,,,ジョブ有効性,ジョブが有効か無効かを示すブール値。,
250,1,Class,,Depreciation Mortgage,,,,,"Parent for information related to depreciation, mortgages, etc.",gl-bus,,,,【減価償却/抵当債務情報】,減価償却、抵当債務等に関連する情報の親タグ。,gl-bus:depreciationMortgage
251,2,Attribute,,Depreciation Mortgage,Mortgage Jurisdiction,Name,,0..1,"Jurisdiction (e.g. federal, state, local): e.g. US Federal, Province of Québec, other identifier",gl-bus,,,,抵当債務管轄,"管轄地区。（連邦、州、ローカル、等）。たとえば、米国連邦政府、ケベック州、その他の識別子。
[設定値のリスト]
(F)、(federal：連邦)、(S)、(state：州)、(L)、(local：地域)、(other：その他)",gl-bus:dmJurisdiction
252,2,Attribute,,Depreciation Mortgage,Depreciation Method,Char,,0..1,"Type of depreciation method: used for information about the loan percentage for loan or the depreciation method. This is used for informational purposes only. Examples of entries are ""20%"", ""5 year DDB"" (Double Declining Balance).",gl-bus,,,,減価償却方法,減価償却方法のタイプ。ローンのパーセンテージや減価償却方法に関する情報を含む。単なる情報提供を目的とする。たとえば、20%、5年、DDB(倍額定率)。,gl-bus:dmMethodType
253,2,Attribute,,Depreciation Mortgage,Mortgage Life,Decimal,,0..1,Length of life in number of periods.,gl-bus,,,,抵当債務期間,存在する期間数。,gl-bus:dmLifeLength
254,2,Attribute,,Depreciation Mortgage,Description,Text,,0..1,"Description of each item related to depreciation, mortgage, loan, credit facility, etc.",gl-bus,,,,債務説明,減価償却や債権債務、ローン、信用供与等に関する項目の説明。,gl-bus:dmComment
255,2,Attribute,,Depreciation Mortgage,Start Date,Date,,0..1,"Start of the applicable period of each item related to depreciation, mortgage, loan, credit facility, etc.",gl-bus,,,,開始日付,減価償却や債権債務、ローン、信用供与等に関する項目の、適用期間の開始日。,gl-bus:dmStartDate
256,2,Attribute,,Depreciation Mortgage,End Date,Date,,0..1,"End of the applicable period of each item related to depreciation, mortgage, loan, credit facility, etc.",gl-bus,,,,終了日付,減価償却や債権債務、ローン、信用供与等に関する項目の、適用期間の終了日。,gl-bus:dmEndDate
257,2,Composition,,Depreciation Mortgage,,,Amount,0..1,"Amount of a cost or fee charged for a mortgage, loan, credit facility, etc.",gl-bus,,,,手数料,減価償却や債権債務、ローン、信用供与等で請求されるコストや手数料。,
258,1,Class,,Tax,,,,,Tuple for holding tax related information,gl-cor,,,,【税情報】,税関連の情報のタプル。,gl-cor:taxes
259,2,Attribute,,Tax,Tax Authority,Char,,0..1,Name of the relevant tax authority,gl-cor,,,,課税庁,関係する課税庁の名前。,gl-cor:taxAuthority
260,2,Attribute,,Tax,Tax Table Code,Char,,0..1,Tax table code used by the relevant tax authority,gl-cor,,,,税率表コード,関係する課税庁で使用される税率表のコード。,gl-cor:taxTableCode
261,2,Attribute,,Tax,Tax Description,Text,,0..1,Description of tax authority,gl-cor,,,,課税庁説明,課税庁の説明。,gl-cor:taxDescription
262,2,Composition,,Tax,Tax,,Amount,0..1,Amount of taxes,gl-cor,,,,税額,税額。,
263,2,Composition,,Tax,Taxable,,Amount,0..1,Basis for taxation,gl-cor,,,,課税基準,課税基準。,
264,2,Attribute,,Tax,Tax Exchange Rate,,,0,"If the tax is in a foreign currency, the exchange rate used expressed as national currency divided by foreign currency",gl-cor,,,,[非推奨] 税額換算用レート,税が外貨建ての場合の、換算レート。自国通貨を外貨で割った値。,
265,2,Attribute,,Tax,Tax Percentage Rate,Decimal,,0..1,Percent rate for VAT or other taxes normally a number between 0 and 1.0 - e.g. 50% is represented as 0.5,gl-cor,,,,税率,VAT(物品税)またはその他の税のパーセント比率。0から1.0の間の値。たとえば50%は0.5とあらわす。,gl-cor:taxPercentageRate
266,2,Attribute,,Tax,Tax Category,Char,,0..1,A class or category of taxes,gl-cor,,,,税区分,税のクラス又はカテゴリ。,gl-cor:taxCode
267,2,Attribute,,Tax,Tax Comment/Exemption Reason,Text,,0..1,Additional text/code for exemption reasons or other comments.,gl-cor,,,,税コメント/免税理由,免税理由やその他のコメントのための、追加の文またはコード。,gl-cor:taxCommentExemption
268,2,Composition,,Tax,,,Multicurrency Amount,0..1,,gl-muc,,,,税,税,
269,1,Class,,Originating Document,,,,,"A tool to capture the flow of related documents in the gl-business process. Some needs of end users require a greater history of the documents that are associated with a transaction, especially in the VAT audit area. Contains a repetitive structure of related documents.",gl-taf,,,,【発生元文書情報】,業務プロセス上の、関連文書の流れを捕捉するためのもの。特にVAT監査では、エンドユーザの要求として、取引に関係する文書の履歴が必要とされる。関連文書情報の構造の繰り返しを含む。,
270,2,Attribute,PK,Originating Document,Number,Identifier,,0..1,Originating document number,gl-taf,,,,発生元文書番号,発生元文書の番号。,gl-cor:documentNumber
271,2,Attribute,,Originating Document,Type,Char,,0..1,"Originating document type - order, acknowledgement, confirmation, shipment, delivery/receipt, invoice, payment, etc.",gl-taf,,,,発生元文書種別,発生元文書の種別。発注、通知、確認、出荷、配送/受領、請求、支払、など。,gl-taf:originatingDocumentType
272,2,Attribute,,Originating Document,Date,Date,,0..1,Originating document date,gl-taf,,,,発生元文書日付,発生元文書の日付。,gl-taf:originatingDocumentDate
273,2,Attribute,,Originating Document,Identifier Type,Char,,0..1,"Originating document identifier type: e.g. Customer, Vendor, Employee, Other",gl-taf,,,,発生元文書対象CVE種別,"発生元文書の対象となるCVEの種別。例えば、顧客、仕入先、従業員、その他。
[設定値のリスト]
(C)、(customer：顧客)、(E)、(employee：従業員)、(V)、(vendor：仕入先)、(O)、(other：その他)、(I)、(salesperson-internal：店舗内販売員)、(X)、(salesperson-external：外交販売員)、(N)、(contractor：請負者) ",gl-taf:originatingDocumentIdentifierType
274,2,Attribute,,Originating Document,Identifier Code,Char,,0..1,Originating document identifier code,gl-taf,,,,発生元文書対象CVEコード,発生元文書の対象となるCVEのコード。,gl-taf:originatingDocumentIdentifierCode
275,2,Attribute,,Originating Document,Identifier Tax Code,Char,,0..1,Originating document identifier tax code,gl-taf,,,,発生元文書対象CVE納税者コード,発生元文書の対象となるCVEの納税者コード。,gl-taf:originatingDocumentIdentifierTaxCode
276,1,Class,,Entry Detail,,,,,Parent for entry detail,gl-cor,,,,【仕訳明細】,仕訳明細の親タグ。,gl-cor:entryDetail
277,2,Attribute,,Entry Detail,Line Number,Char,,0..1,Identifier for a particular entry detail,gl-cor,,,,明細行番号,仕訳明細の識別子。,gl-cor:lineNumber
278,2,Attribute,,Entry Detail,Line Number Counter,Char,,0..1,Unique reference for the line - a numeric counter,gl-cor,,,,明細行番号カウンタ,明細行の一意なリファレンス　　カウンタ,gl-cor:lineNumberCounter
279,2,Composition,,Entry Detail,,,Amount,0..1,"This field (amount) represents the primary monetary amount related to the  subject of the entryDetail line. There is one primary monetary amount per entryDetail structure. It may, for example, represent the amount of one line of a journal entry, the balance on a document, or the extended amount of a line item on an invoice. Amount is not required if detailed entry is used for non-financial work and other elements are populated, in particular measurableQuantity. The amount field is a signed number (either positive or negative itself) and used in conjunction with a separate signOfAmount and a separate debitCreditCode, which together are considered for understanding the monetary amount. The unit of measure is determined by amountCurrency if present, and by the default or home currency if amountCurrency is not present.",gl-cor,,,,金額,entryDetailの代表的な金額を示す。entryDetailごとにひとつの値を持つ。たとえば、仕訳帳の行、残高、請求書の行の金額。明細が会計業務用でなく、measurableQuantityなどの他の要素が設定されている場合は不要。符号付数値であり、金額を解釈するために用意されたsignOfAmountおよびdebitCreditCodeとあわせて使用される。通貨単位はamountCurrencyで決定される。amountCurrencyが指定されない場合は、既定または自国の通貨単位となる。,
280,2,Attribute,,Entry Detail,Original Exchange Rate Date,Date,,0..1,Date of exchange rate used to regl-cord the original transaction.,gl-muc,,,,原取引通貨換算レート日付,原取引の記録に使われた通貨換算レートの日付。,gl-muc:amountOriginalExchangeRateDate
281,2,Composition,,Entry Detail,Original Currency,,Amount,0..1,"Amount in original (as opposed to home) currency, for multi-currency tracking.",gl-muc,,,,原取引通貨換算額,多通貨取引のための、(自国通貨に対する)原取引通貨での金額。,
282,2,Attribute,,Entry Detail,Sign Indication for Amount,Char,,0..1,Sign of amount; provides 4 possible fields only when used in conjunction with debitCreditCode; primarily used for gl-correcting entries so total debits and credits after an entry error are not inflated. D + increase DebitsD - decrease debitsC + decreases creditC - increases credit,gl-cor,,,,金額符号,"金額の符号。貸借識別子と関連して使用される場合にだけ、4つの可能なフィールドを提供する。記入エラー後の総貸借が膨張しないように、おもに仕訳の訂正に使用される。 D+は借方を増加させる。D-は借方を減少させる。C+は貸方を減少させる。C-は貸方を増加させる。
[設定値のリスト]
(+)、(-)、(plus：プラス)、(minus：マイナス) ",gl-cor:signOfAmount
283,2,Attribute,,Entry Detail,Debit/Credit Identifier,Char,,0..1,"Optional identifier of whether the amount is a (D)ebit, a (C)redit or Undefined",gl-cor,,,,貸借区分コード,"金額が借方か貸方か不定かを示す識別子。
[設定値のリスト]
(D)、(C)、(debit：借方)、(credit：貸方)、(undefined：不定) ",gl-cor:debitCreditCode
284,2,Attribute,,Entry Detail,Posting Date,Date,,0..1,"At the detail level, this represents the accounting significance date. No matter what date the document is received, entered, or posted, this signifies the accounting date of the entry. If you want to see the financial results for March 5, 2002 and this entry is given that date, the entry will be part of the results for March 5, 2002. This is different from the postedDate found at the entryHeader level. If you want the accounting significance to be a particular date, it goes here. A single entry could represent multiple dates, but would only be posted on one date.",gl-cor,,,,転記日付,明細レベルで、会計上意義のある日付を示す。ドキュメントの受領、入力、転記の日付に関わらず、仕訳が会計処理された日付を示す。2002.03.05の財務結果を見たいときに、ここにその日付がある場合は、この明細は2002.03.05の結果の一部である。これは、entryHeaderにあるpostedDateとは異なる。特定の日付を会計上意義のある日付にしたいなら、ここに記述する。ひとつの仕訳が複数の日付をあらわせるが、ひとつの日でのみ転記される。,gl-cor:postingDate
285,2,Attribute,,Entry Detail,Memo Line,Char,,0..1,A boolean like entry that indicates whether an entryDetail line has been provided solely to provide additional details and that tools should not consider the amount in postings.,gl-bus,,,,メモ行フラグ,明細行が単に追加の詳細を与えるものであり、転記金額に含めるべきでないことを示すブール値。,gl-bus:amountMemo
286,2,Attribute,,Entry Detail,Allocation Code,Char,,0..1,"Code associated with the calculation formula: e.g. (D)ivide by number of periods, (T)otal for period given",gl-bus,,,,配分コード,計算方式に関するコード。例えば、(D)期間数で分割、(T)与えられた期間の合計。,gl-bus:budgetAllocationCode
287,2,Attribute,,Entry Detail,Document Type,Char,,0..1,"An enumerated field describing the original source document, with invoice, voucher, check and other enumerated entries",gl-cor,,,,元文書種別,"顧客への請求書、ベンダからの請求書、小切手、その他の列挙値による、元文書の説明。
[設定値のリスト]
(check：小切手)、(debit-memo：借方メモ)、(credit-memo：貸方メモ)、(finance-charge：財務費用)、(invoice：顧客への請求書)、(order-customer：顧客オーダ)、(order-vendor：仕入先オーダ)、(payment-other：その他支払い)、(reminder：督促状)、(tegata：手形)、(voucher：ベンダからの請求書)、(shipment：出荷票)、(receipt：受領票)、(manual-adjustment：手修正)、(other：その他)",gl-cor:entriesType
288,2,Attribute,,Entry Detail,Document Type Description,Text,,0..1,Free format description of the document type,gl-cor,,,,元文書種別説明,元文書の種別の説明。,gl-cor:documentTypeDescription
289,2,Attribute,,Entry Detail,Invoice Type,Char,,0..1,"Invoice Type  (self-billed, ePoS enumerated values)",gl-cor,,,,請求書種別,"請求書の種別。(self-billed、ePoS)
[設定値のリスト]
(ePos：POSシステムからの発行)、(self-billed：買い手が発行)",gl-cor:invoiceType
290,2,Attribute,,Entry Detail,Document Date,Date,,0..1,"Date (and less likely in the paper world but possible in the e-world, time) on actual document (invoice, voucher, check date). Other dates control posting information.",gl-cor,,,,元文書日付,実際の文書（請求書、証憑、小切手）の日付（および、紙の世界ではありそうにないが、電子的には時刻）。 転記の情報は別の日付で管理する。,gl-cor:documentDate
291,2,Attribute,,Entry Detail,Received Date,Date,,0..1,Date/time document was noted as received (if necessary). Represents actual date received. Posting dates are maintained separately.,gl-bus,,,,元文書受領日付,（必要であれば）文書の受領が記録された日付/時刻。実際に受領された日付をあらわす。転記日付は別に管理される。,gl-bus:documentReceivedDate
292,2,Attribute,,Entry Detail,Chargeable or Reimbursable,Char,,0..1,"Is this entry chargeable to client, reimbursable? Used by some systems to indicate that account on posting/validation should be posted to a customer or vendor's account.",gl-bus,,,,請求支払可能フラグ,この仕訳は顧客に請求、支払可能か。いくつかのシステムでは転記/検証対象の科目が顧客や仕入先の科目に転記されるべきかどうかを示すために使用される。,gl-bus:documentChargeReimb
293,2,Attribute,,Entry Detail,Payment Method,Text,,0..1,Method used or to be used to make the payment,gl-bus,,,,支払方法,支払いのために使用された、または使用される方法。,gl-bus:paymentMethod
294,2,Attribute,,Entry Detail,Posting Status,Char,,0..1,"deferred: although entered, it cannot be posted until a later time
posted: already posted
proposed: a proposed item that must be approved
simulated: a simulated item, for what-if
tax: a tax-specific entry
unposted:entered but not yet posted or validated
cancelled:entered and later cancelled
nother:other status - should be described in postingStatusDescription",gl-cor,,,,転記状態,"・据置：入力されたが、まだ転記できない。
・転記済：転記済み。
・提案済：検証が必要な項目。
・シミュレーション：仮定のためにシミュレートされた項目。
・税：税項目。
・未転記：入力されたが、まだ検証も転記もされていない。
・取消済：入力されたが、取り消された。
・その他：その他の状態。postingStatusDescriptionで説明されるべき。
[設定値のリスト]
(deferred：据置)、(posted：転記済)、(proposed：提案済)、(simulated：シミュレーション)、(tax：税)、(unposted：未転記)、(cancelled：取消済)、(other：その他)",gl-cor:postingStatus
295,2,Attribute,,Entry Detail,Posting Status Description,Text,,0..1,Free format description of the posting status,gl-cor,,,,転記状態説明,転記状態の説明。,gl-cor:postingStatusDescription
296,2,Attribute,,Entry Detail,Description,Text,,0..1,Description of this line of detail only,gl-cor,,,,説明,この明細行のみに対する説明。,gl-cor:detailComment
297,2,Attribute,,Entry Detail,Acknowledgement Date,Date,,0..1,Date of acknowledgement of goods/services shipped/received.,gl-cor,,,,承認日付,出荷/受領済みの物品/サービスを承認した日付。,gl-cor:dateAcknowledged
298,2,Attribute,,Entry Detail,Confirmation Date,Date,,0..1,Date of confirmation of shipment/receipt.,gl-cor,,,,確認日付,出荷/受領を確認した日付。,gl-cor:confirmedDate
299,2,Attribute,,Entry Detail,Ship From,Name,,0..1,References organizationAddressLocationIdentifier where used. Otherwise freeform.,gl-cor,,,,出荷元,organizationAddressLocationIdentifierの参照情報。または自由記述。,gl-cor:shipFrom
300,2,Attribute,,Entry Detail,Date Shipped/Received,Date,,0..1,Date goods/services are shipped/received.,gl-cor,,,,出荷/受領日付,物品/サービスを出荷/受領した日付。,gl-cor:shipReceivedDate
301,2,Attribute,,Entry Detail,Maturity Date or Date Due,Date,,0..1,Due date or other maturity date.,gl-cor,,,,支払期日,支払期日やその他の期日。,gl-cor:maturityDate
302,2,Attribute,,Entry Detail,Payment Terms,Name,,0..1,Discount/payment terms.,gl-cor,,,,支払条件,割引/支払い条件。,gl-cor:terms
303,2,Attribute,,Entry Detail,Ticking Field,Name,,0..1,"Signifies that an item has been cleared, finished, finalized. When checking accounts are called for, the tick or letter showing this was done appears in this field. Can also be used for identifying that the
original document against which a payment or DR/CR memo applies has been reconciled.",gl-taf,,,,チェック欄,項目が消去または完了されたことを示す。勘定のチェックが要求される場合、処理済を示すチェックマークまたは文字が指定される。支払またはDR/CRのメモに対する元文書が、消し込まれたことを確認するためにも使用可能。,gl-taf:tickingField
