No.,Level,Property type,Identifier,Class,Property term,Representation term,Associated class,Mult.,Definition,ISO 21378 Module,ISO 21378 Table,Value Domain,Action,要素名,要素定義,xpath
169,2,Attribute,,Account,Purpose Description,Text,,0..1,Description of usage for aggregate account,gl-cor,,,,勘定科目目的説明,勘定科目群の使用法の説明。,gl-bus:entryAccountingMethodPurposeDescription
170,2,Attribute,,Account,Type,Char,,0..1,Type of account,gl-cor,,,,科目種別,"科目の種別。
[設定値のリスト]
(account：勘定科目)、(bank：銀行)、(employee：従業員)、(customer：顧客)、(job：ジョブ)、(vendor：仕入先)、(measurable：計測可能物)、(statistical：統計)、(other：その他) ",gl-cor:accountType
171,2,Attribute,,Account,Type Description,Text,,0..1,Free format description of the account type,gl-cor,,,,科目種別説明,科目の種別の説明。,gl-cor:accountTypeDescription
172,2,Composition,,Account,,,Accounting Method,0..1,"For this entry, the method of accounting",gl-bus,,,,仕訳会計処理方法,"この仕訳の会計処理方法を表す。発生基準、現金基準、修正現金基準、修正発生基準、債務基準、特別な方法、混合方法、その他
[設定値のリスト]
(accrual：発生基準)、(cash：現金基準)、(modified cash：修正現金基準)、(modified accrual：修正発生基準)、(encumbrance：債務基準)、(special methods：特別な方法)、(hybrid methods：混合方法)、(other：その他)",
173,2,Composition,,Account,,,Subaccount,0..*,Tuple to hold multiple accountSubIDs and Descriptions,gl-cor,,,,サブ科目情報,複数のaccountSubIDと説明文を含むタプル。,gl-cor:accountSub
174,1,Class,,Currency Exchange,,,,,"A value at which one currency, referred to as the Base Currency, can be exchanged for another currency, referred to as the Target Currency. It indicates how many units of the Target Currency are equivalent to one unit of the Base Currency at a specific point in time.",gl-muc,,,,【換算レート】,基準通貨と呼ばれる1つの通貨が、対象通貨と呼ばれる別の通貨と交換できるレートの値を表します。この値は、特定の時点で1単位の基準通貨が対象通貨の何単位に相当するかを示す。,
175,2,Attribute,,Currency Exchange,Rate,Decimal,,1,The numeric value representing how many units of the Target currency are equivalent to one unit of the Base currency.,gl-muc,,,,レート,外貨金額の算出に用いられた、ExchangeRateDate時点の換算レート。（自国通貨を外貨通貨で割った値）,gl-muc:amountRestatedExchangeRate
176,2,Attribute,,Currency Exchange,Base Currency,Code,,1,The currency from which the exchange rate is applied.,gl-muc,,ISO4217,,換算元通貨,為替レートを適用する元の通貨（基準通貨）。,gl-muc:amountCurrency
177,2,Attribute,,Currency Exchange,Target Currency,Code,,1,The currency to which the exchange rate is applied.,gl-muc,,ISO4217,,換算先通貨,為替レートが適用して両替される通貨（対象通貨）。,gl-muc:amountRestatedCurrency
178,2,Attribute,,Currency Exchange,Source,Name,,0..1,"The source or provider of the exchange rate (e.g., a central bank or market e.g. Reuters, Bloomberg ).",gl-muc,,,,換算レート情報源,"外貨換算額の換算レートの情報源。たとえば、Reuters, Bloomberg。",
179,2,Attribute,,Currency Exchange,Type,Name,,0..1,"Type of Exchange Rate for restated amount - for example, spot rate, forward contract etc.",gl-muc,,,,換算レート種別,外貨換算額の換算レートの種別。たとえば、スポット・レート、先物など。,
180,2,Attribute,,Currency Exchange,Effective Date,Date,,0..1,Date of exchange rate (other than original transaction date) on which amount is expressed as target Amount,gl-muc,,,,換算レート日付,（原取引の日付ではなく）、amountRestatedAmountまたはamountTriangulationAmountが示された換算レートの日付。,
181,1,Class,,Triangulated Currency Conversion,,,,,"An exchange rate between two currencies that is calculated using a third intermediary currency, known as the triangulation currency. It represents the derived value of how many units of the Target Currency are equivalent to one unit of the Base Currency through the exchange rates involving the triangulation currency",gl-muc,,,,【三角通貨換算】,2つの通貨間の為替レートで、三角換算通貨と呼ばれる第3の仲介通貨を使用して計算されるもの。これは、三角換算通貨を介した為替レートを用いて、基準通貨1単位が対象通貨の何単位に相当するかを示す。,
182,2,Attribute,,Triangulated Currency Conversion,Base Currency,Code,,1,The currency from which the triangulated exchange rate calculation starts.,gl-muc,,ISO4217,,基準通貨,三角換算為替レート計算の出発点となる通貨,gl-muc:amountOriginalCurrency
183,2,Attribute,,Triangulated Currency Conversion,Target Currency,Code,,1,The final currency to which the exchange rate applies after triangulation.,gl-muc,,ISO4217,,対象通貨,三角換算後に為替レートが適用される最終的な通貨,gl-muc:amountRestatedCurrency
184,2,Attribute,,Triangulated Currency Conversion,Triangulation Currency,Code,,1,The intermediary currency used for calculating the exchange rate between the Base and Target currencies.,gl-muc,,ISO4217,,三角換算通貨,基準通貨と対象通貨間の為替レートを計算するために使用される仲介通貨,gl-muc:amountTriangulationCurrency
185,2,Attribute,,Triangulated Currency Conversion,Base to Triangulation Rate,Decimal,,1,The exchange rate from the Base currency to the Triangulation currency.,gl-muc,,,,基準通貨から三角換算通貨への為替レート,基準通貨から三角換算通貨への為替レート,gl-muc:amountTriangulationExchangeRate
186,2,Attribute,,Triangulated Currency Conversion,Triangulation to Target Rate,Decimal,,1,The exchange rate from the Triangulation currency to the Target currency.,gl-muc,,,,三角換算通貨から対象通貨への為替レート,三角換算通貨から対象通貨への為替レート,gl-muc:restatedTriangulationExchangeRate
187,2,Attribute,,Triangulated Currency Conversion,Derived Rate,Decimal,,1,The calculated exchange rate directly from Base currency to Target currency using the triangulation.,gl-muc,,,,派生レート,三角換算を使用して基準通貨から対象通貨への直接的な為替レートを計算したもの,
188,2,Attribute,,Triangulated Currency Conversion,Source,Name,,0..1,"The source or provider of the individual exchange rates or triangulated rates (e.g., central bank, Reuters).",gl-muc,,,,情報源,個々の為替レートまたは三角換算レートの提供元 (例: 中央銀行、ロイター),gl-muc:amountRestatedExchangeRateSource / gl-muc:amountTriangulationExchangeRateSource
189,2,Attribute,,Triangulated Currency Conversion,Type,Name,,0..1,"Type of Exchange Rate, for example, spot rate or forward contract, used in triangulation.",gl-muc,,,,レートの種類,三角換算に使用される為替レートの種類 (例: スポットレート、先物契約)。,gl-muc:amountRestatedExchangeRateType / gl-muc:amountTriangulationExchangeRateType
190,2,Attribute,,Triangulated Currency Conversion,Effective Date,Date,,0..1,The date on which the triangulated exchange rate is effective.,gl-muc,,,,適用日,（原取引の日付ではなく）、三角換算の金額が有効となる日付。,
191,1,Class,,Multicurrency Amount,,,,,Section to provide additional information related to base currencies that differ from original currencies and related exchange rates - typically this will be used to regl-cord exchange rates and amounts in currencies and/or on dates other than those of the original transaction. This structure allows regl-cording of exchange rates using a third currency as a triangulation currency. This is often EUR but is not restricted to being so. This structure may be repeated as many times as necessary to regl-cord amounts in foreign currencies on the same or different dates.,gl-muc,,,,【多通貨明細】,"原取引時の通貨と異なる、自国通貨と換算レートに関する追加情報のセクション。－現在および原取引時の、換算レートおよび金額の記録に使用される。
トライアンギュレーション通貨としての第三通貨の換算レートを記録できる。EURの場合が多いがそれに限らない。この構造は、同日または異なる日の外貨での金額を記録する必要がある限り、繰り返し指定可能。",
192,2,Attribute,,Multicurrency Amount,Date of Exchange Rate,Date,,0..1,Date of exchange rate (other than original transaction date) on which amount is expressed as amountRestatedAmount or amountTriangulationAmount,gl-muc,,,,換算レート日付,（原取引の日付ではなく）、amountRestatedAmountまたはamountTriangulationAmountが示された換算レートの日付。,gl-muc:multicurrencyDetailExchangeRateDate
193,2,Composition,,Multicurrency Amount,Foreign Currency,,Amount,0..1,The amount in the foreign currency as of Exchange Rate Effective Date.,gl-muc,,,,換算額,amountRestatedCurrencyで指定された外貨での、multicurrencyDetailExchangeRateDate時点の、換算額。,
194,2,Composition,,Multicurrency Amount,,,Currency Exchange,0..1,"A value at which one currency, referred to as the Base Currency, can be exchanged for another currency, referred to as the Target Currency. It indicates how many units of the Target Currency are equivalent to one unit of the Base Currency at a specific point in time.",gl-muc,,,,換算レート,基準通貨と呼ばれる1つの通貨が、対象通貨と呼ばれる別の通貨と交換できるレートの値を表します。この値は、特定の時点で1単位の基準通貨が対象通貨の何単位に相当するかを示す。,
195,2,Composition,,Multicurrency Amount,Triangulation Currency,,Amount,0..1,The amount in the triangulation currency identified by amountTriangulationCurrency as of multicurrencyDetailExchangeRateDate.,gl-muc,,,,トライアンギュレーション通貨換算額,amountTriangulationCurrencyで指定されたトライアンギュレーション通貨での、multicurrencyDetailExchangeRateDate時点の換算額。,
196,2,Composition,,Multicurrency Amount,,,Triangulated Currency Conversion,0..1,"An exchange rate between two currencies calculated using a third intermediary currency, referred to as the triangulation currency (e.g., EUR in Europe). It determines the equivalent value of one unit of the Base Currency in terms of the Target Currency by leveraging exchange rates involving the triangulation currency.",gl-muc,,,,三角通貨換算,2つの通貨間の為替レートで、三角換算通貨と呼ばれる第3の仲介通貨を使用して計算されるもの。これは、三角換算通貨を介した為替レートを用いて、基準通貨1単位が対象通貨の何単位に相当するかを示す。,
197,2,Attribute,,Multicurrency Amount,Multicurrency Detail Comment,Text,,0..1,Comment describing the enclosing multicurrencyDetail tuple's contents. May include reason for regl-cording additional exchange rates other than that used at the time of the original transaction.,gl-muc,,,,多通貨明細コメント,multicurrencyDetailの内容のコメント。原取引時以外の、追加の換算レートを記録する理由などを記述。,gl-muc:multicurrencyDetailComment
198,1,Class,,XBRL Information,,,,,This will roll up to XBRL reporting information - this is a parent - repeatable so that the same item can be reported through many taxonomies. Care should be taken to consider what happens if people post to the same account but different XBRL elements.,gl-cor,,,,【XBRL情報】,XBRLレポート情報へのロールアップ情報。親タグであり、同じ項目が複数のタクソノミを通じて報告されうるように繰り返し可能。同一の勘定科目を異なるXBRL要素に転記した場合にどうなるか、注意深く考慮すべきである。,gl-cor:xbrlInfo
199,2,Attribute,,XBRL Information,XBRL Allocation,Char,,0..1,"Indicates that the information being given is beginning_balance, ending_balance, period_change.",gl-cor,,,,XBRL割当,"与えられた情報が、期首残高、期末残高、期中増減のいずれであるかを示す。
[設定値のリスト]
(beginning_balance：期首残高)、(ending_balance：期末残高)、(period_change：期中増減)",gl-cor:xbrlInclude
200,2,Attribute,,XBRL Information,Summary Reporting Element,Char,,0..1,Associated XBRL element or XML element within an XML taxonomy - mapping to an XBRL concept.,gl-cor,,,,集約報告エレメント,関係付けられた、XMLタクソノミ中のXBRL要素または、XML要素。XBRLコンセプトへのマッピング。,gl-cor:summaryReportingElement
201,2,Attribute,,XBRL Information,Detail Matching Element,Char,,0..1,Associated XBRL element in XBRL-GL instance.,gl-cor,,,,明細対応エレメント,関係付けられた、XBRL-GLインスタンス中のXBRL要素。,gl-cor:detailMatchingElement
202,1,Class,,Warranty,,,,,warranty covering the items.,gl-ehm,,,,【保証】,アイテムの保証,
203,2,Attribute,,Warranty,Warranty Start Date,Date,,0..1,"If the items are covered by warranty, when that warranty covered will begin or has begun.",gl-ehm,,,,シリアルロット保証開始日,アイテムが保証の対象である場合、その保証の対象となる時期が開始または開始されます。,gl-ehm:serialLotWarrantyStartDate
204,2,Attribute,,Warranty,Warranty End Date,Date,,0..1,"If the items are covered by warranty, when that warranty covered will end or ended.",gl-ehm,,,,シリアルロット保証終了日,アイテムが保証の対象である場合、その保証の対象となる時期は終了または終了します。,gl-ehm:serialLotWarrantyEndDate
205,2,Attribute,,Warranty,Warranty Period,Decimal,,0..1,"Warranty period – numeric portion; for a 30 day warranty period, the 30 would go here, and the day would Serial Lot Warranty Period Unit.",gl-ehm,,,,シリアルロット保証期間,保証期間–数値部分。 30日間の保証期間の場合、30はここに移動し、その日はgl-ehm：serialLotWarrantyPeriodUnitに移動します。,gl-ehm:serialLotWarrantyPeriod
206,2,Attribute,,Warranty,Warranty Period Unit,Char,,0..1,"Warrant period – time or cycle unit portion. Values from the XBRL Unit Registry (www.xbrl.org/utr/utr.xml) are suggested where possible. Examples might include: H (hours), D (days), M (months), Y (years), machine cycles, km (kilometers).",gl-ehm,,,,シリアルロット保証期間単位,保証期間–時間またはサイクル単位の部分。可能な場合は、XBRLユニットレジストリ（www.xbrl.org/utr/utr.xml）の値が推奨されます。例としては、H（時間）、D（日）、M（月）、Y（年）、マシンサイクル、km（キロメートル）などがあります。,gl-ehm:serialLotWarrantyPeriodUnit
207,2,Attribute,,Warranty,Warranty Vendor,Name,,0..1,The vendor providing warranty; this may differ from the manufacturer.,gl-ehm,,,,シリアルロット保証ベンダー,保証を提供するベンダー。これはメーカーとは異なる場合があります。,gl-ehm:serialLotWarrantyVendor
208,2,Attribute,,Warranty,Warranty Contract,Text,,0..1,"Contract or document information related to the warranty, such as a contract number and date or a URL with more information.",gl-ehm,,,,シリアルロット保証契約,契約番号と日付、または詳細情報を含むURLなど、保証に関連する契約または文書情報。,gl-ehm:serialLotWarrantyContract
209,1,Class,,Serial Lot,,,,,"Tuple for holding information about serial numbers or lots (batches). As a tuple, this permits multiple serial numbers or multiple lot number batches within a single gl-gl-cor:measurable structure.",gl-ehm,,,,【シリアルロット】,シリアル番号またはロット（バッチ）に関する情報を保持するためのタプル。タプルとして、これにより、単一のgl-gl-cor：measurable構造内で複数のシリアル番号または複数のロット番号のバッチが許可されます。,gl-ehm:serialLot
210,2,Attribute,,Serial Lot,Code,Char,,0..1,"Is this item tracked by serial numbers or lot numbers? A serial number is usually a unique number assigned to a single; a lot or batch number is provided when a batch of items is fungible but must be differentiated from similar items from other batches. Enumerated indicator for serial or lot items. Enumeration are: serial, lot, other, neither. If not included within the tuple, neither is assumed.",gl-ehm,,,,シリアルロットコード,このアイテムはシリアル番号またはロット番号で追跡されていますか？シリアル番号は通常、単一に割り当てられた一意の番号です。アイテムのバッチがファンジブルであるが、他のバッチの同様のアイテムと区別する必要がある場合は、ロット番号またはバッチ番号が提供されます。シリアルまたはロットアイテムの列挙型インジケーター。列挙は、シリアル、ロット、その他、どちらでもありません。タプルに含まれていない場合、どちらも想定されません。,gl-ehm:serialLotCode
211,2,Attribute,,Serial Lot,Description,Text,,0..1,Free format description associated with gl-ehm:serialLotCode to provide specialization and especially to provide clarification for the enumerated value of other in serialLotCode. Examples might be “batch” or “group”.,gl-ehm,,,,シリアルロットの説明,gl-ehm：serialLotCodeに関連付けられた自由形式の説明。特殊化を提供し、特にserialLotCode内の他の列挙値を明確にします。例としては、「バッチ」や「グループ」などがあります。,gl-ehm:serialLotDescription
212,2,Attribute,,Serial Lot,Number,Char,,0..1,The holder for that actual serial number or lot (batch) number/code assigned to an item or a batch of items.,gl-ehm,,,,シリアルロット番号,アイテムまたはアイテムのバッチに割り当てられた実際のシリアル番号またはロット（バッチ）番号/コードの所有者。,gl-ehm:serialLotNumber
213,2,Attribute,,Serial Lot,Next Number,Char,,0..1,"A field for holding the next expected serial or lot number to be given to future assignments, or for chaining between already assigned items.",gl-ehm,,,,次のシリアルロット番号,将来の割り当てに与えられる次の予想されるシリアル番号またはロット番号を保持するためのフィールド、またはすでに割り当てられたアイテム間のチェーンのためのフィールド。,gl-ehm:nextSerialLotNumber
214,2,Attribute,,Serial Lot,Origination,Date,,0..1,Date of manufacture or creation.,gl-ehm,,,,シリアルロットオリジネーション,製造日または作成日。,gl-ehm:serialLotOrigination
215,2,Attribute,,Serial Lot,Expiration,Date,,0..1,Expiration date of the batch.,gl-ehm,,,,シリアルロットの有効期限,バッチの有効期限。,gl-ehm:serialLotExpiration
216,2,Attribute,,Serial Lot,Manufacturer,Name,,0..1,Manufacturer of the item (serial) or items (lot/batch).,gl-ehm,,,,シリアルロットメーカー,アイテム（シリアル）またはアイテム（ロット/バッチ）のメーカー。,gl-ehm:serialLotManufacturer
217,2,Attribute,,Serial Lot,Batch Description,Text,,0..1,A name or description of the items in the lot or batch.,gl-ehm,,,,シリアルロットバッチの説明,ロットまたはバッチ内のアイテムの名前または説明。,gl-ehm:serialLotBatchDescription
218,2,Attribute,,Serial Lot,Comment,Text,,0..1,Free format text related to the serial number or lot.,gl-ehm,,,,シリアルロットコメント,シリアル番号またはロットに関連するフリーフォーマットのテキスト。,gl-ehm:serialLotComment
219,2,Composition,,Serial Lot,,,Quantity,0..1,The quantity of units in this particular batch. Unit of measure is the gl-gl-bus:measurableUnitofMeasure.,gl-ehm,,,,シリアルロット数量,この特定のバッチのユニット数。測定単位はgl-gl-bus：measurableUnitofMeasureです。,
220,2,Composition,,Serial Lot,Original,,Quantity,0..1,The quantity of units in this batch on inception.,gl-ehm,,,,シリアルロット元の数量,開始時のこのバッチのユニット数。,
221,2,Composition,,Serial Lot,Remaining,,Quantity,0..1,The remaining quantity of units from the original batch; may be the same as the quantity in this batch or include other batches from the same original batch.,gl-ehm,,,,シリアルロット残量,元のバッチの残りのユニット数。このバッチの数量と同じであるか、同じ元のバッチの他のバッチが含まれている可能性があります。,
222,2,Composition,,Serial Lot,,,Warranty,0..1,warranty covering the items.,gl-ehm,,,,保証,アイテムの保証,
223,1,Class,,Measurable,,,,,"Parent for information regarding measurable items associated with the enclosing entryDetail line. Primary area used for holding performance measures. Based on needs for tracking inventory transactional detail, but suitable for anything assigned to an ""account"", ""reporting bucket"" or ""code"". Can be used to track any movements.",gl-bus,,,,【計測可能物情報】,明細行に関係付けられた、計測可能物の情報の親タグ。おもにパフォーマンス測定のために使用される。在庫移動の詳細の追跡の必要性に基づき、「科目」、「報告バケット」、「コード」に関係付けられるあらゆるものに適する。あらゆる活動を追跡するために使用可能。,gl-bus:measurable
224,2,Attribute,,Measurable,Code,Char,,0..1,"Code for measurable item including BP - gl-business process, FA - Fixed asset/Capitalized item, IN - Inventory, KPI - Metric, NT - Intangible, SP - Supplies, SV-P - Service by employee, vendor or contractor, SV-M - Service by equipment/machinery, OT - Other",gl-bus,,,,計測可能物コード,"計測可能物のコード。ビジネスプロセス、固定資産/資産化項目、在庫、測定基準、無形資産、貯蔵品、従業員/提供元/請負者によるサービス、装置/機械によるサービス、その他
[設定値のリスト]
(BP：ビジネスプロセス)、(FA：固定資産/資産化項目)、(IN：在庫)、(KPI：測定基準)、(NT：無形資産)、(SP：貯蔵品)、(SV-P：従業員/提供元/請負者によるサービス)、(SV-M：装置/機械によるサービス)、(OT：その他)",gl-bus:measurableCode
225,2,Attribute,,Measurable,Code Description,Text,,0..1,Free format description of the measurable code,gl-bus,,,,計測可能物コード説明,計測可能物のコードの説明。,gl-bus:measurableCodeDescription
226,2,Attribute,,Measurable,Measurable Category,Char,,0..1,Category of the measurable,gl-bus,,,,計測可能物カテゴリ,計測可能物のカテゴリ。,gl-bus:measurableCategory
227,2,Attribute,,Measurable,Measurable Identification,Char,,0..1,Internal inventory part or SKU number or other code identifier for the measurable.,gl-bus,,,,計測可能物識別子,計測可能物の社内在庫部分またはSKU番号またはその他のコード識別子。,gl-bus:measurableID
228,2,Attribute,,Measurable,Schema for Measurable Identification,Char,,0..1,URI or other identifier for schema with which measurable ID can be validated,gl-bus,,,,計測可能物識別子スキーマ,計測可能物のIDを検証するスキーマの、URIまたはその他の識別子。,gl-bus:measurableIDSchema
229,2,Attribute,,Measurable,Secondary Measurable Identifier,Char,,0..1,Second identifier (such as vendor's item number),gl-bus,,,,計測可能物第二識別子,第二識別子。（例えば、ベンダーでの品目番号）。,gl-bus:measurableIDOther
230,2,Attribute,,Measurable,Schema for Secondary Measurable Identification,Char,,0..1,URI or other identifier for schema with which measurable ID Other can be validated,gl-bus,,,,計測可能物第二識別子スキーマ,計測可能物の第二IDを検証するスキーマの、URIまたはその他の識別子。,gl-bus:measurableIDOtherSchema
231,2,Attribute,,Measurable,Measurable Description,Text,,0..1,Text description of measurable (e.g. inventory item or other identifier),gl-bus,,,,計測可能物説明,計測可能物の説明。（たとえば、在庫やその他の識別子）,gl-bus:measurableDescription
232,2,Composition,,Measurable,,,Quantity,0..1,"Number of units in this transaction; for non-monetary calculations; can be square footage, number of people, etc.",gl-bus,,,,数量,この取引における、単位数量。金額計算用ではない。平方フィート、人数など。,
233,2,Attribute,,Measurable,Qualifier,Char,,0..1,"Field that can represent grading, inspection codes, ratings and other qualifiers to properly capture PKI/Balanced Sgl-corecard information",gl-bus,,,,修飾子,PKI又はバランススコアカード情報を適正に把握するための、等級付け、検査コード、格付けその他の修飾子を示す。,gl-bus:measurableQualifier
