No.,Level,Property type,Identifier,Class,Property term,Representation term,Associated class,Mult.,Definition,ISO 21378 Module,ISO 21378 Table,Value Domain,Action,要素名,要素定義,xpath
111,2,Attribute,PK,Organization,ID,Identifier,,1,"Code representing the company or organization whose data this file represents: used for situations where one user (e.g., a CPA) needs to keep track of multiple organizations' files (e.g., multiple clients). Can be EIN#, client #, internal/external identifier, SIC code. Codes which identifies the entity. Includes the code identifier of the authority issuing the code, a colon, and the code itself. For example, CIK:01234567 for the CIK number issued by SEC EDGAR.",gl-bus,,,,事業体識別子,このファイルでデータを表現している会社や組織のコード。ひとりのユーザ(例えば、公認会計士)が複数の組織(例えば、複数の顧客)のファイルを把握する必要がある場合に使用される。 EIN番号、顧客番号、内部/外部識別子、SICコードであってよい。事業体の識別子をコード化する。コードを発行する権威ある組織のコード識別子、コロン、およびコードそのものを含む。 例えば、SEC　EDGARが発行したCIK番号　CIK: 01234567。,gl-bus:organizationIdentifier
112,2,Attribute,,Organization,Description,Text,,0..1,Text for organization identified by organizationIdentifier. Any descriptive information about the code.,gl-bus,,,,事業体説明,organizationIdentifierによって特定された組織の説明文。 コードに関するなんらかの記述情報。,gl-bus:organizationDescription
113,1,Class,,Entity Information,,,,,Holder for entity information - information about the reporting organization.,gl-cor,,,,【事業体情報】,事業体情報（報告組織に関する情報）の入れ物。,gl-cor:entityInformation
114,2,Attribute,,Entity Information,Business Description,Text,,0..1,Description of the nature of the gl-business of the entity.,gl-cor,,,,業種説明,事業体の事業の種類についての説明。,
115,2,Attribute,,Entity Information,Fiscal Year Start,Date,,0..1,"Start of fiscal year. Where appropriate, gl-corporate year period representation permits non-365 or 366 day years (more appropriate for internal sharing than data from external sources), In Europe, some jurisdictions allow 2 year minus 1 day fiscal years.",gl-bus,,,,会計年度開始日付,会計年度の開始日。妥当であれば、企業の会計年度表示において、366日や365日でない年も許可する（外部ソースからのデータより内部共有のための方が適している）。ヨーロッパでは、2年マイナス1日の会計年度を許可するところもある。,gl-bus:fiscalYearStart
116,2,Attribute,,Entity Information,Fiscal Year End,Date,,0..1,"End of fiscal year. Where appropriate, gl-corporate year period representation permits non-365 or 366 day years (more appropriate for internal sharing than data from external sources), In Europe, some jurisdictions allow 2 year minus 1 day fiscal years.",gl-bus,,,,会計年度終了日付,会計年度の終了日。妥当であれば、企業の会計年度表示において、366日や365日でない年も許可する（外部ソースからのデータより内部共有のための方が適している）。ヨーロッパでは、2年マイナス1日の会計年度を許可するところもある。,gl-bus:fiscalYearEnd
117,2,Composition,,Entity Information,,,Registered Entity Identifier,0..*,Structure containing references to an external authority associated with identifier,gl-bus,,,,,,
118,2,Composition,,Entity Information,,,Accounting Method,0..1,"The default reporting purpose - from book, tax, management, statutory, other",gl-bus,,,,（既定）会計処理方法目的,"明細レベルで明確に指定しない場合の、既定の報告目的を表す。帳簿、税、管理、スタチュトリ、その他から選択する。
[設定値のリスト]
(book：帳簿)、(tax：税)、(management：管理)、(statutory：スタチュトリ)、(other：その他)",
119,2,Composition,,Entity Information,,,Organization,0..*,Section which contains various identifiers for the company.,gl-bus,,,,識別子,組織に関する様々な識別子を含むセクション。,gl-bus:organizationIdentifiers
120,2,Composition,,Entity Information,,,Phone Number,0..*,Primary phone number of the entity.,gl-bus,,,,事業体電話番号,事業体の主要電話番号情報。,
121,2,Composition,,Entity Information,,,Fax Number,0..*,Tuple for holding company fax information.,gl-bus,,,,事業体FAX番号,事業体のFAX番号情報のタプル。,
122,2,Composition,,Entity Information,,,Email Address,0..*,Tuple for holding company email information.,gl-bus,,,,事業体Eメールアドレス,事業体のEメールアドレス情報のタプル。,
123,2,Composition,,Entity Information,,,Web Site,0..*,Primary web site of the entity.,gl-bus,,,,事業体Webサイト,事業体の代表ウェブサイト。,gl-bus:entityWebSite
124,2,Composition,,Entity Information,,,Address,0..*,Address structure for the reporting entity,gl-bus,,,,住所,報告事業体の住所構造体。,
125,2,Composition,,Entity Information,,,Contact,0..*,Information about contacts.,gl-bus,,,,担当者情報,担当者に関する情報。,
126,2,Composition,,Entity Information,,,Accounting Method,0..*,Section for identifying the methods of accounting used by the entity for different reporting purposes,gl-bus,,,,会計処理方法,異なる報告目的に応じて事業体が使用する会計処理方法を識別するためのセクション。,gl-bus:organizationAccountingMethodStructure
127,2,Aggregation,,Entity Information,,,Accountant,0..*,Information about the relevant external accountant,gl-bus,,,,会計士情報,関連する外部会計士に関する情報。,
128,2,Aggregation,,Entity Information,,,Reporting Calendar,0..*,A tool to collect the periods used to summarise results from transactions.,gl-bus,,,,報告カレンダー,取引の結果をまとめるための期間を集めるもの。,gl-bus:reportingCalendar
129,1,Class,,Summary Reporting Taxonomies,,,,,,gl-srcd,,,,【集約報告タクソノミ】,この文書で示されたデータのロールアップ先となる、1つ以上の報告タクソノミの情報を、識別し提供する。,gl-srcd:summaryReportingTaxonomies
130,2,Attribute,PK,Summary Reporting Taxonomies,ID,Identifier,,0..1,"Identifies a target reporting taxonomy so that, for example, it can be referenced in the [summaryReportingTaxonomyIDRef] data field at [xbrlInfo] level.",gl-srcd,,,,集約報告タクソノミ識別子,たとえばxbrlInfo内のsummaryReportingTaxonomyIDRefで参照できるように、報告タクソノミを識別する。,
131,2,Attribute,,Summary Reporting Taxonomies,SchemaRefHref,Char,,0..1,Value of the href attribute of schemaRef in the target reporting taxonomy.,gl-srcd,,,,集約報告タクソノミスキーマ参照情報,報告タクソノミ内の、schemaRef要素のhref属性の値。,
132,2,Attribute,,Summary Reporting Taxonomies,Header,Text,,0..1,An all-purpose data field where all the information necessary when it is too complex to be defined otherwise.,gl-srcd,,,,集約報告タクソノミヘッダ,必要なすべての情報が、複雑すぎて他の方法では定義できないときに、それらを記述する汎用的なデータ域。,
133,2,Attribute,,Summary Reporting Taxonomies,Description,Text,,0..1,A description of the taxonomy for human use.,gl-srcd,,,,集約報告タクソノミ説明,人が利用するための、タクソノミの説明文。,
134,1,Class,,Document Information,,,,,Parent for descriptive information about the accountingEntries section in which it is contained.,gl-cor,,,,【文書情報】,この会計仕訳に関する情報の親タグ。,gl-cor:documentInfo
135,2,Attribute,,Document Information,Document Type,Char,,0..1,"account: information to fill in a chart of accounts file. 
balance: the results of accumulation of a complete and validated list of entries for an account (or a list of account) in a specific period - sometimes called general ledger 
entries:  a list of individual accounting entries, which might be posted/validated or nonposted/validated  
journal: a self-balancing (Dr = Cr) list of entries for a specific period including beginning balance for that period.  
ledger: a complete list of entries for a specific account (or list of accounts) for a specific period; note - debits do not have to equal credits.   
assets: a listing of open receivables, payables, inventory, fixed assets or other information that can be extracted from but are not necessarily included as part of a journal entry.  
trialBalance: the self-balancing (Dr = Cr) result of accumulation of a complete and validated list of entries for the entity in a complete list of accounts in a specific period. 
taxtables:  aids automated interpretation of instances that represent tax tables; 
Tax table are defined by using multiple [taxes] structures to gather the population of codes, authorities and rates; through [taxTableCode] cross-references in the [taxes] structure, these ""master file"" tax tables can be referenced. 
Often sorted by date or by account, these terms have specific, and sometimes different, meanings in different areas. Common practice will drive accounting method/term matches.",gl-cor,,,,文書種別,"・科目:科目体系ファイルの情報。
・残高:特定の期間について、勘定科目(または勘定科目リスト)の、完了し検証された仕訳リストの累算結果。時に総勘定元帳と呼ばれる。
・仕訳:個々の勘定記入のリスト。転記/検証されていることもあり、されていないこともある。
・仕訳帳:特定の期間における、その期間の開始残高を含む貸借が一致(Dr=Cr)した仕訳のリスト 。
・元帳:特定の期間における特定の勘定科目(または勘定科目リスト)についての、仕訳の全リスト 。注意－貸借が一致する必要はない。
・資産:仕訳記入の一部として必ずしも含まれていないが、そこから抽出可能な売掛金、買掛金、在庫、固定資産、その他の情報のリスト。
・試算表:事業体に対する、特定期間の全勘定科目リストでの、完了し検証された仕訳リストの、貸借が一致（Dr=Cr)した累算結果。
・税率表:税率表をあらわすデータを自動的に解釈できるようにする。税率表は、コード、税務当局情報、レートをあらわす複数のtaxes構造データを使って定義される。taxTableCodeはtaxes構造データ内で相互に参照されるが、これらのマスタファイルが参照可能。
多くの場合、日付または科目によりソートされる。会計処理方法や用語は慣行により適合させる。
[設定値のリスト]
(account：科目)、(balance：残高)、(entries：仕訳)、(journal：仕訳帳)、(ledger：元帳)、(assets：資産)、(trialbalance：試算表)、(taxtables：税率表)、(other：その他)",gl-cor:entriesType
136,2,Attribute,,Document Information,Audit Number,Char,,0..1,Unique identifier for this file.,gl-cor,,,,監査番号,このファイルの一意識別子。,gl-cor:uniqueID
137,2,Attribute,,Document Information,Revises Audit Number,Char,,0..1,"If this batch of information revises a previous batch of information, this field identifies the previous batch that is being revised. 'uniqueID' of the previous batch goes here. Developers should consider exception reporting.",gl-cor,,,,改訂前監査番号,この仕訳の束が以前の仕訳の束を改訂する場合に、以前の束を示す。元の文書のuniqueIDが指定される。開発者は、例外報告を考慮すべきである。,gl-cor:revisesUniqueID
138,2,Attribute,,Document Information,Action to Take with Previous Data,Char,,0..1,Provides guidance on action to take with previous set of data: supersedes - old data should be considered as obsolete/overwritten; supplements - belongs with that data as if it was included with it.,gl-cor,,,,改訂前データ処置,"以前のデータの束に対する操作のガイダンス。 取替え-古いデータを無効にし上書きする。
補完-元々含まれていたかのように、そのデータに所属させる。
[設定値のリスト]
(supplement：補完)、(supersede：取替え)",gl-cor:revisesUniqueIDAction
139,2,Attribute,,Document Information,Language,Code,,0..1,"Primary language of the intellectual content. Where practical, the content of this field should coincide with ISO 639-1988 language codes.",gl-cor,,ISO639,,言語,主要言語。 実用的には、このフィールドの内容はISO639-1988言語コードに一致すべきである。,gl-cor:language
140,2,Attribute,,Document Information,Creation Date,Date,,0..1,Date/time file was created.,gl-cor,,,,作成日付,ファイルが作成された日付/時間。,gl-cor:creationDate
141,2,Attribute,,Document Information,Document Comment,Text,,0..1,Text for entire document.,gl-cor,,,,文書コメント,文書全体に対する説明文。,gl-cor:entriesComment
142,2,Attribute,,Document Information,Period Covered Start,Date,,0..1,"Start of date range for contents. Used as basis for many assumptions about data, including the date as of which open balances are open.",gl-cor,,,,対象期間開始日付,内容の日付範囲の開始日。 残高の開始日付などの、データに関する多くの仮定の基礎として使用される。,gl-cor:periodCoveredStart
143,2,Attribute,,Document Information,Period Covered End,Date,,0..1,"End of date range for contents. Used as basis for many assumptions about data, including the date as of which open balances are open.",gl-cor,,,,対象期間終了日付,内容の日付範囲の終了日。 残高の開始日付などの、データに関する多くの仮定の基礎として使用される。,gl-cor:periodCoveredEnd
144,2,Attribute,,Document Information,Creator,Name,,0..1,Identifies the creator of the XBRL instance.,gl-bus,,,,作成者,ファイルの作成者の識別子。,gl-bus:creator
145,2,Attribute,,Document Information,Period Count,Integer,,0..1,"Number of periods or buckets, used by postingCode. Used to interpret posting date. It may be preferable to limit entries by period covered to be by individual reporting period.",gl-bus,,,,期間数,postingCodeで使用される期間又はバケットの数。 転記日付を説明するために使用される。対象期間の仕訳を個々の報告期間に限定することが望ましいかもしれない。,gl-bus:periodCount
146,2,Attribute,,Document Information,Period Unit,Char,,0..1,Type of periods covered by periodCount,gl-bus,,,,期間単位,"periodCountで対象とする期間の種別。
[設定値のリスト]
(daily：日次)、(weekly：週次)、(bi-weekly：隔週)、(semi-monthly：半月ごと)、(monthly：月次)、(quarterly：四半期ごと)、(thirdly：年3回)、(semiannual：半年ごと)、(annual：年次)、(ad-hoc：随時)、(current-period-only：当期)、(other：その他) ",gl-bus:periodUnit
147,2,Attribute,,Document Information,Period Unit Description,Text,,0..1,Free format description of the period unit,gl-bus,,,,期間単位説明,対象期間単位の説明。,gl-bus:periodUnitDescription
148,2,Attribute,,Document Information,Source Application,Name,,0..1,"Product or service that produced this file. Used by many systems (e.g., VAT). Version number can be included or extended.",gl-bus,,,,作成元アプリケーション,このファイルを作り出した製品又はサービス。 多くのシステム(例えば、VATなど)で、使用される。 バージョン番号を含むことも可能。,gl-bus:sourceApplication
149,2,Attribute,,Document Information,Target Application,Name,,0..1,Particular use for which file was generated.,gl-bus,,,,対象アプリケーション,ファイルが作成された用途。,gl-bus:targetApplication
150,2,Reference Association,,Document Information,Default Currency,,Currency,0..1,"The default currency related to the amount can be entered here instead of the XBRL instance specified way, especially important in multi-currency situations. Recommend ISO 4217 coding",gl-muc,,,,既定通貨,XBRLインスタンス内に指定する方法のかわりに、金額の既定の通貨を指定可能。多通貨環境で特に重要。ISO4217コード体系を推奨。,gl-cor:defaultCurrency
151,2,Composition,,Document Information,,,Summary Reporting Taxonomies,0..*,Identifies and provides information about one or more target reporting taxonomies to which the data represented in the document rolls up to.,gl-srcd,,,,集約報告タクソノミ,この文書で示されたデータのロールアップ先となる、1つ以上の報告タクソノミの情報を、識別し提供する。,
152,1,Class,,Segment Parent Information,,,,,Tuple for showing the detail necessary to roll up from one segment (type of subaccount) to another.),gl-cor,,,,【親セグメント情報】,セグメント（小勘定科目の種別）間のロールアップ時に必要な詳細情報を示すタプル。,gl-cor:segmentParentTuple
153,2,Attribute,,Segment Parent Information,Parent Subaccount Code,Char,,0..1,Subaccount NUMBER this subaccount rolls up to - see also subaccount type it rolls up to.,gl-cor,,,,親サブ科目コード,この小勘定科目のロールアップ先の小勘定科目の番号-ロールアップ先の小勘定科目の種別も参照。,gl-cor:parentSubaccountCode
154,2,Attribute,,Segment Parent Information,Parent Subaccount Type,Char,,0..1,The describer of the segment this subaccount rolls up to.,gl-cor,,,,親サブ科目種別,この小勘定科目のロールアップ先のセグメントの説明。,gl-cor:parentSubaccountType
155,2,Attribute,,Segment Parent Information,Reporting Tree Identifier,Char,,0..1,Used for representing descriptions of reporting trees.,gl-cor,,,,報告系統識別子,報告系統の説明に使用される。,gl-cor:reportingTreeIdentifier
156,2,Attribute,,Segment Parent Information,Parent Subaccount Percentage,Char,,0..1,"For partial allocations of amounts to different parents, the percentage of a child that will be allocated to a parent.",gl-cor,,,,親サブ科目配分パーセンテージ,異なる親科目に配分する場合に、親科目に割り当てるパーセンテージ。,gl-cor:parentSubaccountProportion
157,1,Class,,Subaccount,,,,,Tuple to hold multiple accountSubIDs and Descriptions,gl-cor,,,,【サブ科目情報】,複数のaccountSubIDと説明文を含むタプル。,gl-cor:accountSub
158,2,Attribute,PK,Subaccount,Code,Identifier,,0..1,"Where the primary account was placed in accountMainID, the code used for each profit center, division, gl-business unit, fund, program, branch, project, class, su-class or other modifier is placed here.",gl-cor,,,,サブ科目コード,主勘定科目をaccountMainIDに指定したときに、各プロフィットセンタ、事業部、事業体、基金、プログラム、支店、プロジェクト、クラス、su-クラス又は他の修飾子に使用されるコードはここに指定する。,gl-cor:accountSubID
159,2,Attribute,,Subaccount,Description,Text,,0..1,The description that accompanies accountSubID belongs here.,gl-cor,,,,サブ科目説明,accountSubIDに関する説明。,gl-cor:accountSubDescription
160,2,Attribute,,Subaccount,Type,Char,,0..1,"Type of sub-account - profit center, division, gl-business unit, fund, program, branch, project, class, su-class or other modifier is placed here. For example:: Accountability center: gl-business unit: Class:Department: Project: Fund: Program:Job: Profit center: Branch: Setup class: Division: Unit",gl-cor,,,,サブ科目種別,小勘定科目の種別。プロフィットセンタ、事業部、事業体、基金、プログラム、支店、プロジェクト、クラス、su-クラス又は他の修飾子がここに配置される。 例えば、責任単位、事業単位、クラス、部、プロジェクト、基金、プログラム、ジョブ、プロフィットセンター、支店、セットアップクラス、部門、ユニット,gl-cor:accountSubType
161,2,Composition,,Subaccount,,,Segment Parent Information,0..*,Tuple for showing the detail necessary to roll up from one segment (type of subaccount) to another.),gl-cor,,,,親セグメント情報,セグメント（小勘定科目の種別）間のロールアップ時に必要な詳細情報を示すタプル。,gl-cor:segmentParentTuple
162,1,Class,,Account,,,,,"Tuple: parent container for account numbers and identifiers. No entry is made here, but each detail line may have multiple accounts assigned to it for reporting in different GAAPs, offsetting accounts in Japan, passing along information to consolidation systems about local versus consolidating accounts, etc. For example, the account 4783HG-QOWI-192837-1000 may be expressed so:
/account/accountMainID 1000  
/account/accountMainDescription Cash  
/account/accountSub/accountSubID 4783HG  
/account/accountSub/accountSubDescription Department 
/account/accountSub/accountSubID QOWI  
/account/accountSub/accountSubDescription Branch  
/account/accountSub/accountSubID 192837  
/account/accountSub/accountSubDescription Division",gl-cor,,,,【科目識別子】,"勘定科目番号と識別子の親コンテナ。 ここには記入されないが、個々の明細行は、異なるGAAPでの報告や、日本の見返勘定や、連結勘定科目に対する個別情報の連結会計システムへの伝達などのための、複数の勘定科目を持ちうる。例えば、勘定科目4783HG-QOWI-192837-1000は、次のように表現されうる。
/account/accountMainID 1000
/account/accountMainDescription Cash
/account/accountSub/accountSubID 4783HG
/account/accountSub/accountSubDescription Department
/account/accountSub/accountSubID QOWI
/account/accountSub/accountSubDescription Branch
/account/accountSub/accountSubID 192837
/account/accountSub/accountSubDescription Division",gl-cor:account
163,2,Attribute,PK,Account,Account Number,Identifier,,0..1,"Main account - the code used to identify the accounting bucket the entry has been assigned to. Examples might be 1000 for Cash, 567GAAZ for Sales Expense or Z for tax payments. Identifiers such as department, branch, division, manager, or other modifiers are noted in the Subaccount area. Before needing to post, account is not necessary. Posting to the general ledger almost always requires an entry here.",gl-cor,,,,主勘定科目コード,"主勘定科目。仕訳が関連する会計バケットを特定するためのコード。例えば、現金を表す1000、販売費を表す567GAAZ、税を表すZ。
部門、支店、事業部、マネージャ、その他の識別子は、Subaccount領域に記述される。転記の必要がなければ、勘定科目は必要ではない。総勘定元帳に転記するにはほとんどの場合必要。",gl-cor:accountMainID
164,2,Attribute,,Account,Description,Text,,0..1,Description of accountMainID - the human readable describer that accompanies the code used in accountMainID,gl-cor,,,,主勘定科目説明,主勘定科目コードの説明。主勘定科目コードとして使用されるコードについての、人が読める記述。,gl-cor:accountMainDescription
165,2,Attribute,,Account,Classification,Char,,0..1,"Account type - FASB Concepts 6 and similar international designs. When xbrlInfo is used to associate other XBRL reporting items, this field is more suited to representing existing systems (audit) than data interchange.",gl-cor,,,,主勘定科目区分,"主勘定科目の種別。FASB Concepts 6および、同様の国際的な様式。xbrlInfoが他のXBRL項目と関係付けられる場合、データ交換より現存システム(audit)を示すべき。
[設定値のリスト]
(asset：資産)、(liability：負債)、(equity：資本)、(income：収益)、(gain：利得)、(expense：費用)、(loss：損失)、(contr-to-equity：資本増加)、(distr-from-equity：資本減少)、(comprehensive-income：包括利益)、(other：その他) ",gl-cor:mainAccountType
166,2,Attribute,,Account,Classification Description,Text,,0..1,Free format description of the account classification,gl-cor,,,,主勘定科目区分説明,主勘定科目の区分の説明。,gl-cor:mainAccountTypeDescription
167,2,Attribute,,Account,Parent Account,Char,,0..1,Roll up item from child natural account to parent natural account.,gl-cor,,,,親勘定科目コード,子勘定科目から親勘定科目に包み込む科目。,gl-cor:parentAccountMainID
168,2,Attribute,,Account,Purpose,Char,,0..1,"Code related to usage for account aggregate - Consolidating, European, IFRS, Offsetting, Primary, Tax, USGAAP, Japanese, Other. Japanese companies will use this for the tax required offsetting entry. If left blank, assumes default accounting method for company.",gl-cor,,,,勘定科目目的,"勘定科目群の使用法を示すコード。連結、European, IFRS, 見返、プライマリ, 税, USGAAP, Japanese,その他。日本企業では、見返仕訳で要求される税務処理に利用するかもしれない。空白の場合、企業の既定の勘定方法とみなす。
[設定値のリスト]
(consolidating：連結)、(european：ヨーロッパ)、(ifrs：IFRS)、(offsetting：見返)、(primary：プライマリ)、(tax：税)、(usgaap：US GAAP)、(japanese：日本)、(other：その他)",gl-bus:entryAccountingMethodPurpose
